{
  "resolution_no": "1299",
  "year": "2000",
  "theme": [
    "Peacekeeping",
    "Sierra Leone"
  ],
  "chapter": "Chapter VII",
  "charter_articles": [
    "Article 42"
  ],
  "entities": [
    "UNAMSIL",
    "Security Council",
    "Secretary-General"
  ],
  "reporting_cycle": "",
  "operative_authority": "Chapter VII",
  "summary": "The Security Council,\n \nRecalling its previous resolutions and statements on Sierra Leone,\nConsidering the Secretary-General's letter of 17 May (S/2000/446),\nConvinced that security deterioration requires rapid reinforcement of UNAMSIL,\n\n1. Decides to expand UNAMSIL's military component to 13,000 personnel, including 260 military observers;\n2. Appreciates States that have accelerated troop deployment and offers of assistance, and calls for further support;\n3. Acting under Chapter VII, exempts from resolution 1171 (1998) restrictions, sales or supplies of arms for States cooperating with UNAMSIL and the Government of Sierra Leone;\n4. Decides to remain seized of the matter.",
  "url": "https://storage.googleapis.com/bluelines-rag-bucket/2000/S_RES_1299_2000_EN.pdf"
}