{
  "resolution_no": "2776",
  "year": "2025",
  "theme": [
    "Somalia",
    "Al-Shabaab",
    "Terrorism",
    "Sanctions",
    "Arms Embargo",
    "Maritime Security",
    "Human Rights"
  ],
  "chapter": "Chapter VII",
  "charter_articles": [
    "Article 24",
    "Article 25",
    "Article 27",
    "Article 39",
    "Article 41",
    "Article 42"
  ],
  "entities": [
    "Al-Shabaab",
    "GFRS",
    "FMS",
    "Somalia",
    "UN",
    "AUSSOM",
    "UNODC",
    "CTED",
    "Panel of Experts",
    "Security Council Committee"
  ],
  "reporting_cycle": "The GFRS, following consultation through the structures of the National Security Architecture and Somali Security Development Plan, and in accordance with paragraph 9 of resolution 2182 (2014) and as requested in paragraph 7 of resolution 2244 (2015), to provide to the Security Council, by 1 May 2025 and then by 1 October 2025, reports",
  "operative_authority": "Chapter VII",
  "summary": "Here is a concise summary of the Security Council document:\n\nThe Security Council:\n\nRecalling previous resolutions on Somalia, reaffirms respect for Somalia's sovereignty, territorial integrity, and unity. \n\nCommends progress made in Somalia, particularly in the fight against Al-Shabaab, and emphasizes the purpose of this resolution is to degrade the threat posed by Al-Shabaab.\n\nExpresses grave concern over Al-Shabaab's threat to Somalia's peace, security, and stability, and condemns its terrorist attacks, radicalization, and exploitation.\n\nCondemns Al-Shabaab's targeting of civilians, indiscriminate use of explosive weapons, and violations of international humanitarian law.\n\nCalls for compliance with international law and expresses concern over arms flow from Yemen to Somalia in violation of the arms embargo.\n\nUrges the Government of Somalia and Federal Member States to prevent and end grave violations against children.\n\nEmphasizes a holistic approach to counter terrorism and violent extremism, including women's participation and regional and international cooperation.\n\nReiterating that terrorism cannot be associated with any religion, nationality, civilization, or ethnic group.\n\nEncourages Member States to prevent Al-Shabaab's use of social media for terrorist purposes.\n\nExpresses concern over the humanitarian situation and calls for full, safe, rapid, and unhindered humanitarian access.\n\nRecognizes the contribution of Somali, African Union, and other forces in combating Al-Shabaab.\nHere is a clear and concise summary of the Security Council document:\n\nThe Security Council urges Somalia to develop a coordinated approach to maritime governance, commending the role of the GFRS, member states, and regional organizations in maritime security.\n\nThe Council notes with concern smuggling and trafficking of weapons, military equipment, and ammunition, and urges the GFRS, FMS, and Member States to take measures to identify and hold accountable those responsible.\n\nThe Council expresses concern about the violation of the charcoal ban by the vessel MV Fox and commends the Panel of Experts' investigations.\n\nThe Council emphasizes its objective to update its consolidated framework to strengthen state- and peace-building, defeat Al-Shabaab, and complement the mandates of UNTMIS, UNSOS, and AUSSOM.\n\nThe Council stresses the primary role of the Central Monitoring Department (CMD) in coordinating weapons and ammunition management across Somalia.\n\nThe Council welcomes progress made by the GFRS in developing the firearms bill and counter-improvised explosive device strategy, and calls on the GFRS to finalize the establishment of a centralized licensing authority for weapons.\n\nThe Council recognizes the threat posed by Al-Shabaab and underscores the need to degrade it through targeted sanctions, preventing access to weapons and ammunition, disrupting its finances, and improving maritime domain awareness.\n\nThe Council determines that Al-Shabaab's attempts to undermine peace and security in Somalia and the region constitute a threat to international peace and security.\n\nActing under Chapter VII of the Charter, the Council:\n\nA. Imposes targeted sanctions, recalling its previous decisions and expressing its intention to support fair and clear procedures for delisting individuals and entities.\n\nB. Imposes an arms embargo targeting Al-Shabaab, prohibiting deliveries of weapons, ammunition, and military equipment to Somalia, with exemptions for the GFRS, SNA, NISA, SNPF, and Somali Custodial Corps.\n\nThe Council also calls on Member States to prevent smuggling of weapons and ammunition into Somalia and share data on captured weapons and ammunition.\nHere is a summarized version of the Security Council document:\n\n**Disrupting Al-Shabaab's finances**\n\n8. The Security Council notes with concern Al-Shabaab's ability to generate revenue and launder resources to carry out terrorism, and requests the Federal Government of Somalia (FGS) to develop and implement a plan to disrupt Al-Shabaab's financial operations.\n\n9. The Council calls upon the FGS to work with international partners to: \n- identify and mitigate money laundering and terrorist financing risks;\n- strengthen supervision of anti-money laundering (AML) and countering the financing of terrorism (CFT) regulations;\n- engage with the Middle East and North Africa Financial Action Task Force Mutual Evaluation process;\n- develop a national identification system to improve financial access while countering terrorism financing;\n- improve monitoring, reporting, and investigations into money laundering and terrorist financing;\n- develop a plan to mitigate risks posed by Al-Shabaab to personnel working in AML and CFT roles.\n\n10. The Council calls upon the FGS to improve collaboration and coordination among regulatory and law enforcement agencies to disrupt Al-Shabaab's financial operations.\n\n11. The Council requests the FGS, UNODC, and the Panel to exchange information and implement a plan to disrupt Al-Shabaab's operations and exploitation of the licit financial system.\n\n**Charcoal Ban**\n\n14. The Council reaffirms its decision to ban the import and export of Somali charcoal.\n\n15. The Council welcomes measures taken to reduce charcoal export and requests AUSSOM to support Somalia in implementing the charcoal ban.\n\n16. The Council recalls its decision to dispose of charcoal stockpiles in and around Kismayo and encourages Somalia to ensure sustainable management of domestic charcoal production.\n\n17. The Council requests the Panel and UNODC to monitor charcoal stockpiles and their movement and the FGS to engage with the Committee throughout the disposal process.\n\n**Reducing the threat posed by Improvised Explosive Devices (IEDs)**\n\n18. The Council reaffirms that all States shall prevent the sale, supply, or transfer of items in Part I of Annex B to Somalia if they will be used to manufacture IEDs.\n\n19. The Council decides that:\n- Member States should notify the FGS before transferring items in Part I of Annex B to Somalia;\n- supplying States shall notify the FGS and the Committee of the sale, supply, or transfer of items in Part I of Annex B to Somalia within 15 working days.\nHere is a concise summary of the Security Council document 2776 (2025):\n\n20. Encourages the Federal Government of Somalia (GFRS) to regulate and monitor import and transit of items listed in Parts I and II of Annex B.\n\n21. Calls on Member States to ensure vigilance in sale, supply, or transfer of explosive precursors and materials to Somalia, and to share information on suspicious transactions.\n\n22. Encourages international partners to provide training and equipment to Somali Explosive Ordnance Disposal teams.\n\nF. Maritime interdiction and maritime domain awareness\n\n23. Renews provisions for maritime interdiction and maritime domain awareness until 13 December 2025.\n\n24. Encourages UNODC to support GFRS in countering Al-Shabaab through regional cooperation, maritime domain awareness, and law enforcement.\n\nG. Panel of Experts and Security Council Committee\n\n25. Renews the Panel of Experts until 13 January 2026 with a mandate to monitor implementation of measures and report on violations.\n\n26. Requests the Secretary-General to include dedicated sexual violence and gender expertise on the Panel.\n\n27. Emphasizes the Panel's activities shall support the Council in degrading the threat posed by Al-Shabaab.\n\n28. Requests full cooperation between Member States and the Panel, and access to interviews and information.\n\n29. Reiterates requests for GFRS, Member States, and AUSSOM to provide information to the Panel and assist in investigations, including access to armouries and captured weaponry.\nHere is a concise summary of the Security Council document:\n\nThe Security Council:\n\n**Urges and Encourages**\n\n* The GFRS to facilitate engagement between the Panel and relevant authorities (para 29(e))\n* Somalia, Member States, and regional organizations to provide regular inputs to the Committee on sanctions regime implementation (para 30)\n* The Special Representatives of the Secretary-General to share relevant information with the GFRS and Committee (para 31)\n\n**Requests**\n\n* The Panel to provide regular updates, a comprehensive mid-term update, and a final report to the Committee (para 32)\n* UNODC to update the Committee on its work related to this resolution by 13 November 2025 (para 33)\n* Briefings from the Chair of the Committee to the Security Council on an annual basis (para 34)\n\n**Decides**\n\n* To review the mandate of the Panel and take action regarding any extension and modification by 13 December 2025 (para 35)\n* To allow certain entities to import weapons, ammunition, and military equipment (paras 36-38)\n* To regulate deliveries of items to FMS and licenced private security companies operating in Somalia (paras 39-42)\n* To prevent Al-Shabaab from obtaining weapons and ammunition (para 43)\nThe Security Council:\n\n Requests the Committee to share notifications on arms exports to Somalia with the Federal Government of Somalia (GFRS) and the Office of National Security.\n\n Requests the Secretariat to support GFRS' dissemination efforts on arms control in local languages.\n\n Exempts certain supplies and deliveries from the arms embargo, including protective clothing, non-lethal military equipment for humanitarian use, and vessels carrying defensive equipment.\n\n Requests GFRS to provide reports to the Security Council by 1 May and 1 October 2025 on:\n\n- Infrastructure for safe storage and distribution of arms\n- Procedures for registration and use of arms\n- Consolidated list of imported arms\n- Joint Verification Team reports\n- Suspicious financial activities and actions to counter terrorism financing\n\n Requests states and organizations to provide updates on support to Somalia and consolidated lists of imported arms by 13 November 2025.\n\n Affirms commitment to adjust measures to degrade Al-Shabaab threat and requests a technical assessment on the arms embargo by 1 November 2025.\n\n Expresses intention to review measures and make adjustments based on the technical assessment.\n\n Encourages Counterterrorism Committee Executive Directorate to support GFRS on analyzing Al-Shabaab's online activities.\n\n Decides to remain seized of the matter.\nAnnex A – Items subject to a no-objection process\n\n1. Surface to air missiles, including Man-Portable Air-Defence Systems (MANPADS);\n2. Weapons with a calibre greater than 12.7 mm, and components specially designed for these, and associated ammunition; \n   (a) Note: This does not include shoulder fired anti-tank rocket launchers, recoilless rifles, rifle grenades, or grenade launchers.\n3. Mortars with a calibre greater than 82 mm and associated ammunition;\n4. Anti-tank guided weapons, including Anti-tank Guided Missiles (ATGMs) and ammunition and components specially designed for these items;\n5. Charges and devices specifically designed or modified for military use; mines and related materiel; and fuses;\n6. Weapon sights with a night vision capability, including thermal and infrared, and accessories;\n7. Fixed wing, swivel wing, tilt rotor or tilt wing aircraft, specifically designed or modified for military use;\n8. ‘Vessels’ and amphibious vehicles specifically designed or modified for military use; \n   (a) Note: ‘Vessel’ includes any ship, surface effect vehicle, vessel of small waterplane area or hydrofoil and the hull or part of the hull of a vessel;\n9. Uncrewed combat aerial vehicles (listed as Category IV in the UN Register of Conventional Arms).\n\nAnnex B – Improvised Explosive Devices (IED) Components \n\nExplosive materials, explosives precursors, explosive-related equipment, and related technology \n\nPart I \n1. Explosive materials and precursors: \n   (a) Nitrocellulose (containing more than 12.5% nitrogen w/w); \n   (b) Trinitrophenylmethylnitramine (tetryl); \n   (c) Nitroglycerin (except when packaged/prepared in individual medicinal doses); \n   (d) Nitric acid; \n   (e) Sulphuric acid; \n2. Explosive-related goods: \n   (a) Equipment and devices specially designed to initiate explosives; \n   (b) “Technology” required for the “production” or “use” of the items listed;\n\nPart II \n1. Explosive materials: \n   (a) Ammonium Nitrate Fuel Oil (ANFO); \n   (b) Nitroglycol; \n   (c) Pentaerythritol tetranitrate (PETN); \n   (d) Picryl chloride; \n   (e) 2,4,6-Trinitrotoluene (TNT); \n2. Explosives precursors: \n   (a) Ammonium nitrate; \n   (b) Potassium nitrate; \n   (c) Sodium chlorate; \n3. Dual use items: \n   (a) Alarm systems with disturbance sensors; \n   (b) Learning code receivers.",
  "url": "https://storage.googleapis.com/bluelines-rag-bucket/2025/S_RES_2776_(2025)-EN.pdf"
}