{
  "resolution_no": "1932",
  "year": "2010",
  "theme": [
    "International Criminal Tribunal for Rwanda",
    "Justice",
    "War Crimes"
  ],
  "chapter": "Chapter VII",
  "charter_articles": [
    "Article 41"
  ],
  "entities": [
    "International Criminal Tribunal for Rwanda",
    "Security Council",
    "Secretariat"
  ],
  "reporting_cycle": "",
  "operative_authority": "Chapter VII",
  "summary": "The Security Council,\n\nRecalling its previous resolutions on the International Criminal Tribunal for Rwanda (ICTR), particularly 955 (1994), 1503 (2003), and 1901 (2009),\n\nNoting the ICTR's Completion Strategy Report indicating that it will not complete its work by 2010,\n\nConcerned about staff retention and its impact on the timely completion of the ICTR's work,\n\nActing under Chapter VII of the UN Charter,\n\n1. Reaffirms the necessity of trials for ICTR indictees and calls on states, particularly in the Great Lakes region, to cooperate with and assist the ICTR, specifically in bringing Felicien Kabuga, Augustin Bizimana, and Protais Mpiranya to justice.\n\n2. Emphasizes the importance of adequate staffing for the ICTR to complete its work expeditiously and calls on the Secretariat and relevant UN bodies to work with the ICTR Registrar to address staffing issues.\n\n3. Extends the terms of office of the following judges in the Appeals Chamber until 31 December 2012 or until completion of their assigned cases:\n\n- Mehmet Güney (Turkey)\n- Andrésia Vaz (Senegal)\n\n4. Extends the terms of office of the following judges in the Trial Chamber until 31 December 2011 or until completion of their assigned cases:\n\n- Charles Michael Dennis Byron (Saint Kitts and Nevis)\n- Khalida Rachid Khan (Pakistan)\n- Arlette Ramaroson (Madagascar)\n- William H. Sekule (United Republic of Tanzania)\n- Bakhtiyar Tuzmukhamedov (Russian Federation)\nThe Security Council:\n\n1. Decides to extend the term of office of 10 ad litem judges at the International Tribunal, members of the Trial Chamber, until 31 December 2011 or until completion of assigned cases, if sooner: \nAydin Sefa Akay (Turkey), \nFlorence Rita Arrey (Cameroon), \nSolomy Balungi Bossa (Uganda), \nVagn Joensen (Denmark), \nGberdao Gustave Kam (Burkina Faso), \nLee Gacuiga Muthoga (Kenya), \nSeon Ki Park (Republic of Korea), \nMparany Mamy Richard Rajohnson (Madagascar), \nEmile Francis Short (Ghana).\n\n2. Amends article 12 ter of the Statute of the International Tribunal as set out in the annex.\n\n Article 12 ter: \nIf no ad litem judges are on the roster or available, and no serving judge can be assigned, \nthe Secretary-General, at the President's request, may appoint a former permanent or ad litem judge \nof either Tribunal to serve as an ad litem judge in the Trial Chambers.\n\n3. Urges the International Tribunal to complete its work expeditiously.\n\n4. Decides to remain seized of the matter.",
  "url": "https://storage.googleapis.com/bluelines-rag-bucket/2010/S_RES_1932_2010_EN.pdf"
}