{
  "resolution_no": "1962",
  "year": "2010",
  "theme": [
    "Peacekeeping",
    "Elections",
    "Human Rights",
    "Security Sector Reform"
  ],
  "chapter": "Chapter VII",
  "charter_articles": [
    "Article 41"
  ],
  "entities": [
    "UNOCI",
    "French Forces",
    "ECOWAS",
    "African Union"
  ],
  "reporting_cycle": "Secretary-General reports every 90 days, with a midterm report by 31 March 2011 and a full report by 31 May 2011",
  "operative_authority": "Chapter VII",
  "summary": "The Security Council, recalling previous resolutions on Côte d'Ivoire, reaffirms its commitment to the country's sovereignty, independence, territorial integrity, and unity. It congratulates the Ivorian people on the peaceful presidential elections, condemns attempts to undermine the electoral process, and expresses concern at the risk of violence. The Council welcomes regional decisions, including ECOWAS' suspension of Côte d'Ivoire from decision-making bodies and the African Union's suspension of Côte d'Ivoire's participation in AU activities. It urges Ivorian parties to respect the election outcome, recognizing Alassane Dramane Ouattara as President-elect, and reiterates support for the Secretary-General's Special Representative and regional efforts to promote peace and stability. The Council, acting under Chapter VII, demands maximum restraint to prevent violence, ensure civilian protection, and pursue a rigorous approach to peacekeeping deployments.\nHere is a concise summary of the Security Council document 1962 (2010):\n\n2. The Secretary-General is requested to facilitate political dialogue between Ivorian stakeholders to ensure peace and respect the outcome of the Presidential election.\n\n3. The mandate of UNOCI is renewed until 30 June 2011, as set out in resolution 1933 (2010).\n\n4. UNOCI's authorized strength will remain at 8,650 personnel, including 7,200 troops and staff officers, 192 military observers, 1,250 police personnel, and 8 seconded customs officers.\n\n5. The Secretary-General is authorized to extend the temporary deployment of up to 500 additional personnel until 31 March 2011.\n\n6. The temporary redeployment from UNMIL to UNOCI of a maximum of three infantry companies and one aviation unit is extended by up to four weeks.\n\n7. The Council intends to consider authorizing further troop redeployments between UNMIL and UNOCI.\n\n8. UNOCI's continued support to the Ivorian peace process is stressed, including completion of unfinished tasks such as legislative elections and disarmament.\n\n9. Human rights and humanitarian law violations are condemned, and all parties are called upon to protect civilians, especially women, children, and displaced persons.\n\n10. All parties are urged to cooperate fully with UNOCI and French Forces operations.\n\n11. UNOCI is requested to support the provision of security for the Government and key political stakeholders.",
  "url": "https://storage.googleapis.com/bluelines-rag-bucket/2010/S_RES_1962_2010_EN.pdf"
}