{
  "resolution_no": "2153",
  "year": 2014,
  "theme": [
    "Peacekeeping",
    "Sanctions",
    "Security Sector Reform",
    "Disarmament Demobilization and Reintegration (DDR)",
    "Human Rights",
    "International Cooperation"
  ],
  "chapter": "Chapter VII",
  "charter_articles": [
    "Article 39",
    "Article 41",
    "Article 42"
  ],
  "entities": [
    "UNOCI",
    "French forces",
    "Group of Experts",
    "International Criminal Court",
    "Kimberley Process Certification Scheme (KPCS)",
    "OECD"
  ],
  "reporting_cycle": "The Group of Experts to submit a midterm report to the Committee by 15 October 2014 and a final report by 15 April 2015; Ivoirian authorities to submit biannual reports to the Committee by 30 September 2015 and by 30 March 2015",
  "operative_authority": "Chapter VII",
  "summary": "Here is a clear and concise summary of the Security Council document:\n\nThe Security Council:\n\nRecalling previous resolutions on Côte d’Ivoire, reaffirms its commitment to the country’s sovereignty, independence, territorial integrity, and unity.\n\nWelcomes progress towards peace and stability, commends the Government’s efforts to stabilize security and accelerate economic recovery, and calls on national stakeholders to consolidate progress and address underlying causes of tension.\n\nRecognizes the contribution of measures imposed by previous resolutions to stability, including countering illicit transfer of small arms and light weapons, and supporting post-conflict peacebuilding, disarmament, demobilization, and reintegration (DDR) and security sector reform (SSR).\n\nWelcomes completion of the electoral cycle, and encourages the Government and opposition to work towards political reconciliation and electoral reform.\n\nExpresses concern about delays in security sector reform and DDR, and urges acceleration of efforts to reform the security sector.\n\nWelcomes progress in combating illegal taxation systems, but notes insufficient capacity and resources to control borders.\n\nNoting Côte d’Ivoire’s fulfillment of Kimberley Process (KP) Certification Scheme minimum requirements, encourages full implementation of its Action Plan, and welcomes its invitation to host a KP review visit.\n\nRecalling resolutions on women, peace, and security, and children and armed conflict.\nThe Security Council, recalling previous resolutions on children and armed conflict, civilians in armed conflicts, and Côte d'Ivoire, condemns all human rights and international humanitarian law violations in Côte d'Ivoire, and stresses that perpetrators must be brought to justice. The Council welcomes efforts to bring alleged perpetrators to justice, including the transfer of Charles Blé Goudé to the International Criminal Court.\n\nThe situation in Côte d'Ivoire remains a threat to international peace and security. Acting under Chapter VII, the Council:\n\n1. Imposes an arms embargo on Côte d'Ivoire until 30 April 2015, prohibiting the supply, sale, or transfer of arms and lethal material.\n\n2. Exempts supplies of non-lethal equipment and technical assistance to Ivorian security forces from notification to the Committee.\n\n3. Notes that the embargo does not apply to supplies for the United Nations Operation in Côte d'Ivoire (UNOCI) and French forces, or to non-lethal material.\n\n4. Allows exemptions for:\n    (a) Supplies for UNOCI and French forces.\n    (b) Temporary exports for evacuating nationals.\n    (c) Supplies of arms and lethal material for security sector reform (SSR), subject to Committee approval.\n\n5. Directs the Committee to review and update the list of arms and lethal material.\n\n6. Requires Ivorian authorities to notify or request approval for shipments.\n\n7. Requests Ivorian authorities to provide detailed information on notifications and approval requests.\n\n8. Mandates biannual reports from Ivorian authorities on disarmament, demobilization, and reintegration (DDR) and SSR progress.\n\n9. Encourages Ivorian authorities to consult with UNOCI.\n\n10. Urges the Government of Côte d'Ivoire to allow access to exempted arms and maintain a registry of national security forces' arms.\n\n11. Decides to review measures by the end of the period, based on progress in stabilization, DDR, SSR, national reconciliation, and the fight against impunity.\n\n12. Renews financial and travel measures imposed by previous resolutions until 30 April 2015.\nHere is a summarized version of the Security Council document:\n\nThe Security Council:\n\n Reiterates its intention to review the continued listing of individuals subject to sanctions who engage in actions that further national reconciliation.\n\n Terminates measures preventing the importation of rough diamonds from Côte d’Ivoire, given progress made towards Kimberley Process Certification Scheme (KPCS) implementation.\n\n Requests Côte d’Ivoire to update the Security Council on its progress in implementing its Action Plan for diamonds, including enforcement activities and financial flows from diamonds.\n\n Invites the KPCS to communicate information on Côte d’Ivoire’s compliance to the Security Council.\n\n Calls upon the Government of Côte d’Ivoire to enforce measures imposed, including incorporating relevant provisions in its national legal framework.\n\n Calls upon all Member States to fully implement the measures mentioned.\n\n Expresses concern about instability in western Côte d’Ivoire and welcomes coordinated action by neighbouring countries.\n\n Encourages UNOCI and UNMIL to coordinate closely in assisting the Governments of Côte d’Ivoire and Liberia in monitoring their border.\n\n Urges all illegal Ivorian armed combatants to lay down their arms immediately.\n\n Recalls that UNOCI is mandated to collect and dispose of arms brought into Côte d’Ivoire in violation of the embargo.\n\n Reiterates the necessity for Ivorian authorities to provide unhindered access to the Group of Experts and UNOCI.\n\n Requests all States to cooperate fully with the Committee.\n\n Extends the mandate of the Group of Experts for 13 months until 30 May 2015.\n\n Requests the Group of Experts to submit a midterm report by 15 October 2014 and a final report by 15 April 2015.\nHere is a clear and concise summary of the Security Council document:\n\n29. The Secretary-General and French Government are requested to communicate to the Security Council, through the Committee, information on the supply of arms and related materiel to Côte d’Ivoire.\n\n30. The Ivorian authorities are encouraged to participate in the OECD-hosted implementation program on due diligence guidelines for responsible supply chains of minerals.\n\n31. The Ivorian authorities are called upon to dismantle illegal taxation networks, reduce checkpoints, and prevent racketeering.\n\n32. The Group of Experts is asked to assess the effectiveness of border measures and control.\n\n33. All States, UN bodies, and organizations are urged to cooperate fully with the Committee, Group of Experts, UNOCI, and French forces.\n\n34. The Special Representatives of the Secretary-General for Children and Armed Conflict and Sexual Violence in Conflict are requested to share relevant information with the Committee.\n\n35. All Ivorian parties and States are urged to ensure the safety of the Group of Experts and provide unhindered access to execute their mandate.\n\n36. The Security Council decides to remain actively seized of the matter.\nThe Security Council document 2153 (2014) lists prohibited items, which are:\n\n1. Weapons, direct and indirect fire artillery, and guns with a calibre bigger than 12.7 mm, their ammunition and components.\n2. Rocket propelled grenades, rockets, light anti-tank weapons, rifle grenades and grenade-launchers.\n3. Surface-to-air Missiles, including man portable air defence systems (Manpads); surface-to-surface missiles; and air-to-surface missiles.\n4. Mortars with a calibre bigger than 82 mm.\n5. Guided anti-tank weapons, especially guided anti-tank missiles, their ammunition and components.\n6. Armed aircraft, including rotary wing or fixed wing.\n7. Military armed vehicles or Military vehicles equipped with weapon mounts.\n8. Explosive charges and devices containing explosive materials, designed for military purpose, mines and related material.\n9. Night observation and night shooting devices.",
  "url": "https://storage.googleapis.com/bluelines-rag-bucket/2014/S_RES_2153_2014_EN.pdf"
}