{
  "resolution_no": "2155",
  "year": "2014",
  "theme": [
    "Peacekeeping",
    "Humanitarian",
    "WPS/CAAC",
    "Human Rights"
  ],
  "chapter": "Chapter VII",
  "charter_articles": [
    "Article 24",
    "Article 25"
  ],
  "entities": [
    "UNMISS",
    "IGAD",
    "African Union"
  ],
  "reporting_cycle": "every 60 days",
  "operative_authority": "Chapter VII",
  "summary": "The Security Council adopted Resolution 2155 (2014) on 27 May 2014, recalling previous resolutions on South Sudan and reaffirming its commitment to the country's sovereignty, independence, territorial integrity, and national unity. The Council expressed grave alarm at the deteriorating crisis in South Sudan, caused by internal Sudan People's Liberation Movement (SPLM) disputes and subsequent violence. It strongly condemned human rights violations and abuses, including extrajudicial killings, ethnically targeted violence, and sexual violence, and emphasized that those responsible must be held accountable. The Council also expressed deep concern over the large-scale displacement of persons and deepening humanitarian crisis, stressing the responsibility of all parties to ensure the basic needs of the population are met. It commended the Intergovernmental Authority on Development (IGAD) initiative and the UN Mission in South Sudan (UNMISS) for their efforts to stabilize the security situation and protect civilians. The Council welcomed the IGAD-mediated Cessation of Hostilities and Status of Detainees Agreements, but condemned repeated violations of the agreements. It expressed grave concern that war crimes and crimes against humanity may have been committed by all parties and stressed the urgent need to end impunity in South Sudan. The Council also welcomed the African Union Commission of Inquiry's work and strongly condemned the use of radio to broadcast hate speech and transmit messages instigating sexual violence.\nHere is a concise summary of the Security Council document:\n\nThe Security Council expresses concern over the situation in South Sudan, urging parties to desist from actions that undermine peace and reconciliation. The Council emphasizes the importance of women's empowerment, participation, and human rights.\n\nThe Council condemns attacks on UN personnel and facilities, including the downing of a UN helicopter, and calls for swift investigations and accountability. It also expresses concern over threats to oil installations, illicit transfer of small arms, and the use of cluster munitions.\n\nThe Council reaffirms its resolutions on the protection of civilians, children, and women in armed conflict. It welcomes the IGAD initiative for the deployment of the Monitoring and Verification Mechanism (MVM) and calls for the redeployment of armed groups.\n\nThe Council determines that the situation in South Sudan continues to threaten international peace and security. Acting under Chapter VII, it:\n\n1. Endorses the Cessation of Hostilities Agreement and the Agreement to Resolve the Crisis in South Sudan, calling for their immediate and full implementation.\n\n2. Urges parties to engage in an inclusive national dialogue, seeking lasting peace, reconciliation, and good governance.\n\n3. Extends the mandate of UNMISS until 30 November 2014, with a component of three battalions to protect IGAD's MVM and implement the mission's mandate.\n\n4. Authorizes UNMISS to use necessary means to:\n- Protect civilians, including women and children.\n- Deter violence against civilians.\n- Implement an early warning strategy.\n- Maintain public safety and security within UNMISS protection sites.\n- Exercise good offices, confidence-building, and facilitation in support of the mission's protection strategy.\nHere is a concise summary of the Security Council document:\n\n**Mandate of UNMISS**\n\nThe Security Council authorizes the United Nations Mission in South Sudan (UNMISS) to:\n\n* Protect civilians, including facilitating inter-communal reconciliation and ensuring a secure environment for the return of internally-displaced persons (IDPs) and refugees\n* Monitor and investigate human rights abuses and violations, including those against children and women\n* Create conditions for delivery of humanitarian assistance\n* Support implementation of the Cessation of Hostilities Agreement\n\n**Prioritization and Resource Allocation**\n\n* Emphasizes priority for protection of civilians in decisions on resource allocation\n* Requests the Secretary-General to direct UNMISS operations and coordinate UN activities in South Sudan\n\n**Force Levels and Composition**\n\n* Endorses increasing UNMISS force levels to support its restructured mandate\n* Decides on a military component of up to 12,500 troops and a police component of up to 1,323 personnel\n* Requests detailed information on force generation, restructuring, and logistical support\n\n**Implementation and Review**\n\n* Requests UNMISS to focus and streamline activities to achieve progress on mandated tasks\n* Requests a full personnel review and updated assessment of force operations and requirements\n* Expresses intention to review and adjust the mandate and composition of UNMISS components as necessary\n* Authorizes the Secretary-General to take steps to expedite force and asset generation\n\n**Accountability and Compliance**\n\n* Requests UNMISS to ensure compliance with the UN's zero-tolerance policy on sexual exploitation and abuse\n* Urges Troop Contributing Countries to take preventive action and ensure accountability for such conduct involving their personnel.\nHere is a summarized version of the Security Council document:\n\n14. Encourages UNMISS to implement the Human Rights Division Deployment Plan (HRDDP) and requests the Secretary-General to report on progress.\n\n15. Condemns attacks on UNMISS personnel and facilities, demands respect for UN premises, and stresses that such attacks may constitute war crimes.\n\n16. Demands cooperation from the Government of South Sudan and other parties for UNMISS deployment, operations, and monitoring.\n\n17. Demands full, safe, and unhindered access for relief personnel and supplies to those in need.\n\n18. Demands an immediate ceasefire, an end to human rights violations, and abuses, including gender-based violence and child recruitment.\n\n19. Calls on the Government of South Sudan to investigate human rights violations, hold perpetrators accountable, and ensure justice for victims.\n\n20. Emphasizes the importance of women's participation in conflict resolution and peacebuilding.\n\n21. Condemns attacks on oil installations and urges parties to ensure security of economic infrastructure.\n\n22. Requests the Secretary-General to report to the Security Council on UNMISS mandate implementation every 60 days.\n\n23. Decides to remain seized of the matter.",
  "url": "https://storage.googleapis.com/bluelines-rag-bucket/2014/S_RES_2155_2014_EN.pdf"
}