{
  "resolution_no": "2149",
  "year": "2014",
  "theme": [
    "Peacekeeping",
    "Humanitarian",
    "WPS/CAAC",
    "Sanctions",
    "Political"
  ],
  "chapter": "Chapter VII",
  "charter_articles": [
    "Article 41",
    "Article 42"
  ],
  "entities": [
    "MINUSCA",
    "MISCA",
    "EUFOR RCA",
    "French Forces",
    "AU",
    "ECCAS"
  ],
  "reporting_cycle": "The Secretary-General reports every four months from August 2014",
  "operative_authority": "Chapter VII",
  "summary": "The Security Council,\n\nRecalling previous resolutions and statements on the Central African Republic (CAR), particularly resolutions 2121 (2013), 2127 (2013), and 2134 (2014),\n\nReaffirms its commitment to the sovereignty, independence, unity, and territorial integrity of the CAR, and recalls the importance of non-interference, good-neighbourliness, and regional cooperation.\n\nReaffirms the basic principles of peacekeeping, including consent of parties, impartiality, and non-use of force, except in self-defence and defence of mandate.\n\nExpresses deep concern at the security situation in the CAR and recalls that Transitional Authorities have primary responsibility to protect the population.\n\nEmphasizes that a sustainable solution to the crisis should be CAR-owned, including the political process, and should include restructuring of Central African security forces.\n\nWelcomes the positive impact of MISCA's actions on the ground in protecting civilians and preventing serious violations of international law.\n\nCondemns in strongest terms attacks and provocations against MISCA contingents by armed groups and urges CAR Transitional Authorities to ensure arrest and prosecution of perpetrators.\n\nStresses the urgent need to end impunity in the CAR and bring to justice perpetrators of violations of international humanitarian law and human rights abuses.\n\nReiterates that all perpetrators must be held accountable and that some acts may amount to crimes under the Rome Statute of the International Criminal Court (ICC).\n\nEmphasizes the risk of the situation in the CAR providing a conducive environment for transnational criminal activity.\n\nAcknowledges the important contribution of the Council-mandated arms embargo in countering illicit transfer of arms.\n\nRecalling its decision to establish a sanctions regime and emphasizing targeted sanctions aim at individuals and entities undermining peace, stability, or security of the CAR.\n\n Reiterating its serious concern at the dire humanitarian situation, with over 760,000 internally displaced persons and over 300,000 refugees in neighbouring countries.\nThe Security Council,\n\nExpressing concern at the collapse of the already fragile administration in the Central African Republic (CAR), which limits the ability of the new Transitional Authorities to govern,\n\nUrges all parties to ensure the safety and security of humanitarian personnel, UN and associated personnel, and UN installations, equipment, and goods;\n\nReiterates appreciation for the efforts of the Economic Community of Central African States (ECCAS), the African Union, and the International Contact Group on the CAR;\n\nReaffirms deep appreciation for the critical role of MISCA, its troop- and police-contributing countries, and the French Forces in protecting civilians and improving the security situation;\n\nWelcomes the decision of the European Union to launch a temporary operation, EUFOR RCA, to support MISCA;\n\nExpresses the need to accelerate the implementation of the political process, including reconciliation and free, fair, and inclusive elections by February 2015;\n\nWelcomes joint action by domestic religious leaders to pacify relations and prevent violence between communities;\n\nRecalls the need for an inclusive and effective disarmament, demobilization, and reintegration process (DDR) and repatriation (DDRR) for foreign fighters;\n\nRecalls resolutions on the protection of civilians in armed conflict, children and armed conflict, and women, peace, and security;\n\nAcknowledges partnerships between the African Union Commission and the UN Office of the Special Representative of the Secretary-General for Children and Armed Conflict and on Sexual Violence in Conflict;\n\nWelcomes strong engagement by the European Union, the United States, and Member States to support MISCA;\n\nWelcomes pledges made at the High-Level Meeting on Humanitarian Action and the Addis Ababa Donors’ Conference;\n\nCalls on international partners to assist the Transitional Authorities in building institutional capacity of national police and customs authorities;\n\nWelcomes the World Bank’s plan for 2014 and encourages international financial institutions to engage with the Transitional Authorities;\n\nTakes note of the report of the Chair of the CAR Configuration and the Peacebuilding Fund;\n\nCalls on international partners to provide financial contributions to support DDR, DDRR, and electoral processes;\n\nTakes note of the letters from the Minister of Foreign Affairs of the CAR and the Chairperson of the African Union Commission.\nThe Security Council adopted resolution 2149 (2014) on the situation in the Central African Republic (CAR). \nThe Council welcomed the Secretary-General's report and noted the situation in CAR warrants a unified and integrated approach. \nIt determined that the situation in CAR constitutes a threat to international peace and security in the region. \nActing under Chapter VII of the Charter, the Council made the following decisions:\n\n**Political Process**\n\n1. Welcomed the designation of Catherine Samba-Panza as Transitional Head of State and Andre Nzapayeke as Transitional Prime Minister.\n2. Welcomed ECCAS' role in supporting the political transition in CAR.\n3. Reiterated support for the Libreville Agreements, N'Djamena Declaration, and Constitutional Charter for the Transition.\n4. Commended initial measures taken by AU and ECCAS to restore peace and stability.\n\n**Security and Stability**\n\n5. Underlined the importance of preserving CAR's unity and territorial integrity.\n6. Demanded that all militias and armed groups cease violence and destabilizing activities.\n7. Called for the revitalization and acceleration of the political and reconciliation process.\n\n**Elections and Transition**\n\n8. Urged Transitional Authorities to accelerate preparations for free, fair, and inclusive presidential and legislative elections by February 2015.\n9. Called on Member States and international organizations to provide rapid support to Transitional Authorities.\n\n**Accountability and Reconciliation**\n\n10. Encouraged Transitional Authorities to take measures to revitalize the political process with international support.\n11. Encouraged the establishment of mechanisms to strengthen public financial management and accountability.\n12. Reiterated that perpetrators of human rights violations and abuses must be held accountable.\n13. Called upon all parties to armed conflict to prohibit violations and abuses against children.\nHere is a summarized version of the Security Council document:\n\n14. Demands protection for children released or separated from armed forces and groups, emphasizing their reintegration.\n\n15. Calls on parties in the Central African Republic (CAR) to prevent sexual and gender-based violence, investigate abuses, and hold perpetrators accountable.\n\n16. Notes the Secretary-General's call for increased support to MISCA, including air and ground mobility, intelligence, and medical facilities.\n\n17. Welcomes increased troop deployment by France, the African Union (AU), and European Union (EU) to support stabilization efforts.\n\n18. Establishes the United Nations Multidimensional Integrated Stabilization Mission in the CAR (MINUSCA) until 30 April 2015.\n\n19. Requests the Secretary-General to integrate the United Nations Integrated Peacebuilding Office in the CAR (BINUCA) into MINUSCA.\n\n20. Decides MINUSCA's initial composition: up to 10,000 military personnel, 1,800 police personnel, and 20 corrections officers.\n\n21. Transfers authority from MISCA to MINUSCA on 15 September 2014.\n\n22. Requests the Secretary-General to include MISCA personnel in MINUSCA, adhering to UN standards.\n\n23. Authorizes the Secretary-General to deploy military enablers to MINUSCA before 15 September 2014.\n\n24. Requests accelerated deployment of MINUSCA's capabilities to respond to the CAR population's needs.\n\n25. Transfers the Guard Unit from BINUCA to MINUSCA.\n\n26. Requests a transition team to set up MINUSCA and facilitate a seamless transition from MISCA.\n\n27. Requests a progress update on the transition by 15 August 2014.\n\n28. Requests the appointment of a Special Representative for the CAR and Head of Mission of MINUSCA.\nThe Security Council adopted Resolution 2149 (2014) on the Central African Republic. \n29. Authorizes MINUSCA to take all necessary means to carry out its mandate. \n30. Decides that the mandate of MINUSCA shall focus on: \n\n(a) Protection of civilians: \n- Protect civilian population from physical violence \n- Provide specific protection for women and children \n- Identify and record threats and attacks \n- Design a mission-wide protection strategy \n\n(b) Support for the implementation of the transition process: \n- Assist Transitional Authorities \n- Provide good offices and political support \n- Support security for key national stakeholders \n- Assist in mediation and reconciliation \n- Support electoral process \n\n(c) Facilitate humanitarian assistance \n- Create a secure environment for humanitarian assistance \n- Ensure voluntary return of IDPs and refugees \n\n(d) Protection of the United Nations \n- Protect UN personnel, installations, equipment and goods \n\n(e) Promotion and protection of human rights \n- Monitor and report on human rights abuses \n- Support International Commission of Inquiry \n\n(f) Support for national and international justice \n- Support Transitional Authorities to arrest those responsible \n- Help build capacities of national judicial system\nHere is a concise summary of the Security Council document:\n\nThe Security Council:\n\n Authorizes MINUSCA to support the police, justice, and correctional institutions to reinstate the criminal justice system, with a focus on civilian oversight, impartiality, and human rights protection.\n\n Mandates MINUSCA to support Disarmament, Demobilization, Reintegration (DDR) and Repatriation (DDRR) of former combatants and armed elements, including children associated with armed forces and groups.\n\n Assigns MINUSCA additional tasks, including:\n\n* Supporting security sector reform and vetting processes\n* Coordinating international assistance\n* Assisting the Committee and Panel of Experts established by resolution 2127 (2013)\n* Monitoring the implementation of measures imposed by paragraph 54 of resolution 2127 (2013)\n* Seizing and collecting arms and related materiel that violate these measures\n\n Requests MINUSCA to:\n\n* Coordinate with the African Union Regional Task Force on the Lord’s Resistance Army\n* Address the illicit transfer and misuse of small arms and light weapons\n* Ensure child protection and gender considerations throughout its mandate\n* Assist the Transitional Authorities in ensuring the protection of children’s rights and the full and effective participation of women\n\n Decides that MINUSCA, EUFOR RCA, and French forces operating in the CAR are exempt from measures imposed in paragraph 54 of resolution 2127 (2013) for the implementation of their mandates.\n\n Requests the Secretary-General to ensure MINUSCA’s compliance with the UN zero-tolerance policy on sexual exploitation and abuses and to keep the Council informed.\n\n Requests MINUSCA to ensure that any support provided to non-UN security forces is provided in strict compliance with the Human Rights Due Diligence Policy.\nHere is a concise summary of the Security Council document 2149 (2014):\n\nThe Security Council:\n\n Authorizes MINUSCA to maintain basic law and order and fight impunity, within limited scope and time-bound, and report measures to the Council.\n\n Requests the Secretary-General to conclude a status-of-forces agreement with the Transitional Authorities of the Central African Republic within 30 days.\n\n Emphasizes the need for MISCA, EUFOR RCA, and French forces to respect the sovereignty, territorial integrity, and unity of CAR, and comply with international humanitarian law, human rights law, and refugee law.\n\n Urges cooperation with MINUSCA's deployment and activities, ensuring safety, security, and freedom of movement.\n\n Calls for unhindered access for humanitarian assistance to populations in need.\n\n Welcomes the Humanitarian appeal, regrets insufficient funding, and calls for swift response.\n\n Authorizes French forces to provide operational support to MINUSCA.\n\n Requests regular reports from the Secretary-General on the situation in CAR and MINUSCA's mandate implementation.\n\n Decides to remain actively seized of the matter.",
  "url": "https://storage.googleapis.com/bluelines-rag-bucket/2014/S_RES_2149_2014_EN.pdf"
}