{
  "resolution_no": "2659",
  "year": "2022",
  "theme": [
    "Peacekeeping",
    "Protection of Civilians",
    "Humanitarian Access",
    "Security Sector Reform"
  ],
  "chapter": "Chapter VII",
  "charter_articles": [
    "Article 39",
    "Article 41",
    "Article 42"
  ],
  "entities": [
    "MINUSCA",
    "UNCT",
    "African Union",
    "EUTM-RCA",
    "EUAM-RCA"
  ],
  "reporting_cycle": "The Secretary-General reports to the Council on 15 February 2023, 15 June 2023, and 13 October 2023",
  "operative_authority": "Chapter VII",
  "summary": "Here is a summarized version of the Security Council document:\n\nThe Security Council:\n\nRecalling previous resolutions on the Central African Republic (CAR), reaffirms its commitment to the country's sovereignty, independence, unity, and territorial integrity.\n\nReaffirms the basic principles of peacekeeping and the mandate of the peacekeeping mission in the CAR.\n\nNotes the primary responsibility of the CAR authorities to protect all populations, and the need for national efforts to restore State authority and overcome threats from armed groups.\n\nEmphasizes the need for a CAR-owned solution to the crisis, prioritizing reconciliation through an inclusive process.\n\nRecalls the signing of the Political Agreement on Peace and Reconciliation (APPR) in 2019 and stresses its centrality and the need for further progress in its implementation.\n\nCondemns in the strongest terms violations of the APPR and violence perpetrated by all parties, particularly armed groups.\n\nTakes note of the joint report on human rights and international humanitarian law violations and welcomes the CAR authorities' response to address the report's findings.\n\nStresses the urgent need to end impunity in the CAR and calls on the authorities to investigate allegations of crimes and bring perpetrators to justice.\n\nNotes that a sustainable solution requires an integrated regional strategy and strong political commitment from the CAR authorities and regional countries.\n\nWelcomes the strategic review meeting and the roadmap adopted by the International Conference of the Great Lakes Region (ICGLR) and urges all parties to respect the ceasefire.\n\nUnderlines the need to support national efforts towards the extension of State authority, security sector reform, and capacity building of security institutions.\n\nEmphasizes that lasting peace and security will not be achieved without a combination of political, security, peacebuilding, and sustainable development efforts.\n\nWelcomes the work carried out by MINUSCA, MOUACA, EUTM-RCA, and EUAM-RCA.\nHere is a concise summary of the Security Council document 2659 (2022):\n\nThe Security Council:\n\n Condemns cross-border criminal activities, including arms trafficking and exploitation of natural resources, and urges the Government of CAR to work with neighboring countries to secure borders.\n\n Calls for the implementation of the recommendations of the Republican Dialogue held in March 2022 to resolve arising issues and conclude the electoral process.\n\n Emphasizes the need for inclusive, free, and fair local elections in 2023, and encourages international partners to support the efforts of the CAR authorities.\n\n Expresses concern about the humanitarian situation, condemns attacks on humanitarian personnel, and emphasizes the need for humanitarian access.\n\n Welcomes the development of interministerial plans to implement the Child Protection Code and urges the government to work with the UN to develop a national strategy to prevent and eliminate grave violations against children.\n\n Condemns attacks on MINUSCA and other international forces, and urges the CAR authorities to work with MINUSCA to enhance the safety and security of its personnel.\n\n Recognizes the importance of effective strategic communications and the need to continue to enhance MINUSCA's capabilities in this regard.\n\n Welcomes the independent strategic review on responses to explosive ordnance devices and notes its recommendations.\n\n Recalls peacekeeping performance requirements and takes note of the Report of the Secretary-General of 13 October 2022.\nHere is a concise summary of the Security Council document 2659 (2022):\n\nThe Security Council determines that the situation in the Central African Republic (CAR) continues to threaten international peace and security. Acting under Chapter VII of the UN Charter:\n\n1. Encourages President Touad√©ra to promote lasting peace and stability through a comprehensive political and peace process, including the implementation of the African Peace and Reconciliation Plan (APPR).\n\n2. Urges all parties to respect the ceasefire, implement the APPR, and ensure full participation of women in peace processes.\n\n3. Demands an immediate end to violence against civilians, UN peacekeepers, and humanitarian personnel.\n\n4. Condemns violations of international humanitarian law and human rights abuses, and expresses readiness to consider targeted measures against those who undermine peace.\n\n5. Welcomes regional engagement in support of the peace process and calls on neighbouring states, regional organisations, and international partners to provide coherent and coordinated support.\n\n6. Calls for cooperation to investigate and combat transnational criminal networks and armed groups involved in arms trafficking and exploitation of natural resources.\n\n7. Encourages national awareness and ownership of the peace process, including sensitisation campaigns and participation of women and youth.\n\n8. Urges the CAR authorities to implement an inclusive process to support reconciliation by addressing root causes of the conflict.\n\n9. Urges the CAR authorities to ensure inclusive, free, and fair local elections in 2023, with full participation of women and youth.\n\n10. Calls upon all parties to respect the civilian and humanitarian character of camps and settlements for internally displaced persons (IDPs) and refugees.\n\n11. Urges the CAR authorities to address the presence and activity of armed groups through a comprehensive strategy prioritising dialogue and implementation of the APPR.\nHere is a concise summary of the Security Council document:\n\nThe Security Council:\n\n1. Urges the Central African Republic (CAR) authorities and armed groups to accelerate the implementation of the interim security measures and the disarmament, demobilization, repatriation, and reintegration (DDRR) process, including for foreign fighters and children associated with armed forces and groups.\n\n2. Calls on the CAR authorities to implement the National Security Policy, National Strategy on Security Sector Reform (SSR), and National Defence Plan, with international support, to establish professional and ethnically representative defence and security forces.\n\n3. Expresses concern about the parallel recruitment of disarmed fighters by defence and security forces and calls on the CAR authorities to ensure the security of demobilized combatants throughout the DDRR process.\n\n4. Calls on the CAR authorities to ensure sustainable redeployment of defence and security forces, bring all elements of the CAR armed forces under a single chain of command, and provide budgetary support.\n\n5. Expresses serious concerns about human rights violations and abuses by CAR defence and security forces, and calls on international partners to insist on respect for international human rights law and accountability.\n\n6. Calls on the CAR authorities to strengthen justice institutions, fight impunity, and contribute to stabilization and reconciliation, including through the establishment of transitional justice mechanisms.\n\n7. Encourages the CAR authorities to restore State authority over the whole territory, including by redeploying and strengthening State administration and providing basic services.\n\n8. Stresses the valuable role of the Peacebuilding Commission (PBC) in supporting CAR's long-term peacebuilding needs.\n\n9. Encourages the CAR authorities to improve public financial management and accountability, with international support, to meet State expenses and revitalize the economy.\n\n10. Calls on Member States and international organizations to disburse pledges made at the international conference in Brussels in support of the CAR's peacebuilding priorities and socioeconomic development.\n\n11. Reiterates the urgent need to hold accountable those responsible for human rights violations and abuses, and recalls that some acts may amount to crimes under the Rome Statute of the International Criminal Court.\nHere is a clear and concise summary of the Security Council document:\n\nThe Security Council:\n\n Condemns attacks on schools, medical centers, humanitarian premises, and civilian infrastructure.\n\n Urges CAR authorities to follow up on recommendations of the Mapping Project report on human rights and humanitarian law violations.\n\n Calls on CAR authorities to protect children, investigate and prosecute those responsible for abuses, and implement the child protection code.\n\n Demands an end to sexual and gender-based violence, and for perpetrators to be prosecuted.\n\n Supports the Special Representative of the Secretary-General and extends MINUSCA's mandate until November 15, 2023.\n\n Decides MINUSCA's composition: up to 14,400 military personnel, 3,020 police personnel, and 108 corrections officers.\n\n Mandates MINUSCA to create conditions for national reconciliation and durable peace through implementation of the APPR.\n\n Requests MINUSCA to prioritize tasks, improve communication, and raise awareness on its mandate.\n\n Authorizes MINUSCA to take necessary means to carry out its mandate.\n\n Priority tasks:\n\n- Protect civilians under threat of physical violence.\n\n- Implement protection of civilians strategy in coordination with CAR authorities and partners.\n\n- Anticipate, deter, and respond to threats to civilians through a comprehensive approach.\n\n- Ensure effective protection of civilians, and support and protect children and victims of sexual violence.\nThe Security Council demands that the UN Multidimensional Integrated Stabilization Mission in the Central African Republic (MINUSCA) undertake the following tasks:\n\n**Protection of Civilians**\n\n* Undertake local mediation efforts to prevent escalation of violence\n* Enhance interaction with civilians, strengthen early warning mechanism, and monitor and document human rights abuses\n* Maintain a proactive deployment and mobile posture, including active patrolling in high-risk areas\n* Mitigate risk to civilians before, during, and after military or police operations\n* Work with CAR authorities to identify and report threats to civilians and implement prevention and response plans\n* Support CAR authorities in preventing, mitigating, and responding to explosive ordnance threats\n\n**Specific Protection and Assistance**\n\n* Provide specific protection and assistance to women and children affected by armed conflict\n* Take concrete measures to mitigate and avoid the use of schools by armed forces\n* Support implementation of the UN and Government of CAR joint communiqu√© to prevent and respond to sexual violence in conflict\n\n**Good Offices and Support to the Peace Process**\n\n* Continue to support the peace process, including implementation and monitoring of the ceasefire and the African Peace and Reconciliation Plan (APPR)\n* Coordinate regional and international support and assistance to the peace process\n* Ensure that the Mission's strategies promote a coherent peace process and connect local and national peace efforts\n\n**Facilitate Humanitarian Assistance**\n\n* Improve coordination with humanitarian actors and facilitate a secure environment for humanitarian assistance\n* Contribute to alleviating the consequences of the COVID-19 pandemic\n\n**Protection of the United Nations**\n\n* Protect UN personnel, installations, equipment, and goods and ensure their security and freedom of movement.\nThe Security Council authorizes MINUSCA to pursue tasks in close coordination with the UN Country Team. \n\n36. Further authorises MINUSCA to pursue the following tasks of its mandate:\n\n**(a) Support for the extension of State authority, deployment of security forces, and preservation of territorial integrity**\n\n* (i) Support CAR authorities in safeguarding State institutions and implementing strategy for extension of State authority\n* (ii) Support rapid extension of State authority over entire territory, including deployment of vetted and trained national security forces\n* (iii) Provide planning, technical assistance, and logistical support for redeployment of vetted Central African Armed Forces (FACA) or Internal Security Forces (ISF)\n* (iv) Support gradual handover of security of key officials and static guard duties to CAR security forces\n\n**(b) Promotion and protection of human rights**\n\n* (i) Monitor, investigate, report on, and follow up on violations of international humanitarian law and human rights\n* (ii) Monitor, investigate, and report on violations and abuses against children and women\n* (iii) Assist CAR authorities in protecting and promoting human rights and preventing violations and abuses\n\n**(c) Republican Dialogue and 2023 elections**\n\n* Assist CAR authorities in follow-up of inclusive Republican Dialogue and preparation and delivery of peaceful local elections\n\n**(d) Security Sector Reform (SSR)**\n\n* (i) Provide strategic and technical advice to implement National Strategy on SSR and National Defence Plan\n* (ii) Support development of approach to vetting of defence and security elements\n* (iii) Enhance capacities of Internal Security Forces (ISF) and coordinate provision of technical assistance and training\n* (iv) Continue to support training of police and gendarmerie and selection, recruitment, and vetting of police and gendarmerie elements\n\n**(e) Disarmament, Demobilisation, Reintegration (DDR) and Repatriation (DDRR)**\n\n* Support CAR authorities in implementing inclusive, gender-sensitive, and progressive programme for DDR and repatriation of members of armed groups.\nHere is a summarized version of the Security Council document:\n\n**Support for DDRR and Reintegration**\n\n* Support the Central African Republic (CAR) authorities and civil society organizations in developing and implementing disarmament, demobilization, rehabilitation, and reintegration (DDRR) programs, including gender-sensitive programs.\n* Provide technical assistance to the CAR authorities in implementing a national plan for the integration of eligible demobilized members of armed groups into the security and defense forces.\n* Coordinate support from multilateral and bilateral partners to the CAR authorities' efforts on DDRR programs.\n\n**Support for National and International Justice, the Fight Against Impunity, and the Rule of Law**\n\n* Help reinforce the independence of the judiciary, build the capacities, and enhance the effectiveness of the national judicial system.\n* Provide technical assistance to the CAR authorities to identify, investigate, and prosecute those responsible for crimes involving violations of international humanitarian law and human rights.\n* Support the operationalization and functioning of the Special Criminal Court (SCC), including investigations, arrests, detention, and prosecution.\n\n**Urgent Temporary Measures**\n\n* Adopt urgent temporary measures, on an exceptional basis, to arrest and detain those engaging in or providing support for acts that undermine the peace, stability, or security of the CAR.\n\n**Additional Tasks**\n\n* Assist the Committee established pursuant to paragraph 57 of resolution 2127 (2013) and the Panel of Experts.\n* Monitor the implementation of measures related to arms and related materiel.\n* Support the Panel of Experts in collecting information about acts of incitement to violence.\n\n**Mission Effectiveness**\n\n* Requests the Secretary-General to deploy and allocate personnel and expertise within MINUSCA to reflect the priorities identified.\nHere is a concise summary of the document:\n\n39. The Security Council recalls its decision to increase the authorized size of MINUSCA's military and police components, welcomes the deployment of some reinforcements, and stresses the need for the rest to be deployed quickly, especially quick reaction forces.\n\n40. The Council reiterates its concern at MINUSCA's lack of key capabilities and urges troop and police contributing countries to provide troops and police with adequate capabilities, equipment, and pre-deployment training.\n\n41. The Council emphasizes that effective mandate implementation is the responsibility of all stakeholders and requires well-defined mandates, political will, leadership, and adequate resources, and calls on Member States to provide troops and police with adequate capabilities and mindset.\n\n42. The Council requests the Secretary-General, Member States, and the CAR authorities to ensure the safety, security, and freedom of movement of MINUSCA's personnel, and to implement measures to establish accountability for crimes against peacekeepers.\n\n43. The Council requests the Secretary-General to fully implement the following capacities and existing obligations:\n- strengthen early warning and response strategy\n- encourage confidence-building and community engagement\n- prioritize enhanced mission mobility and active patrolling\n- improve intelligence and analysis capacities\n- verify that contingents are trained and equipped to counter explosive devices\n- implement effective casualty and medical evacuation procedures\n- improve safety and security facilities and arrangements\n- secure long-term rotation schemes for critical capabilities\n- ensure support to non-United Nations security forces is provided in strict compliance with HRDDP\n- prioritize mandated protection activities\n- strengthen sexual and gender-based violence prevention and response activities\n- implement resolution 1325 (2000) and all resolutions addressing women, peace, and security.\nHere is a summarized version of the Security Council document:\n\nThe Security Council:\n\n- Requests MINUSCA to consider gender considerations, child protection, and youth, peace, and security throughout its mandate.\n\n- Urges troop- and police-contributing countries to prevent sexual exploitation and abuse, including vetting of personnel and predeployment awareness training.\n\n- Requests MINUSCA to manage environmental impacts and implement the UN's zero-tolerance policy on serious misconduct.\n\n- Encourages the Secretary-General to implement an integrated strategic framework to sustain peace in CAR.\n\n- Requests MINUSCA to assist CAR authorities in protecting children's rights and ensuring the full participation of women in all spheres.\n\n- Requests MINUSCA to seize and dispose of weapons and ammunition from disarmed combatants and armed groups.\n\n- Urges all parties in CAR to cooperate with MINUSCA's deployment and activities, ensuring its safety, security, and freedom of movement.\n\n- Demands that all parties allow and facilitate humanitarian access to populations in need.\n\n- Calls upon Member States to ensure the free and unhindered movement of MINUSCA personnel, equipment, and supplies.\n\n- Requests MINUSCA to provide support to CAR authorities in achieving progress on key benchmarks for the review of arms embargo measures.\nHere is a summarized version of the Security Council document:\n\nThe Security Council:\n\n Demands respect and protection for medical personnel, humanitarian personnel, hospitals, and medical facilities.\n\n Strongly condemns attacks on schools and civilians connected to schools, and urges parties to cease such attacks.\n\n Calls on Member States and organizations to respond swiftly to humanitarian needs.\n\n Requests the Secretary-General to provide integrated analysis, strategic assessments, and advice to the Security Council.\n\n Requests the Secretary-General to report to the Council on:\n\n     - The situation in the Central African Republic (CAR), including security, ceasefire, and human rights.\n\n     - Violations of the Status of Forces Agreement and efforts to hold perpetrators accountable.\n\n     - MINUSCA's mandated tasks, including protection of civilians.\n\n     - Force and police generation and deployment.\n\n     - Overall Mission performance.\n\n Requests the Secretary-General to provide:\n\n     - An evaluation of logistical support to CAR defence and security forces.\n\n     - A mid-report on MINUSCA's effectiveness and configuration.\n\n Intends to request an independent strategic review of MINUSCA.\n\n Decides to remain actively seized of the matter.",
  "url": "https://storage.googleapis.com/bluelines-rag-bucket/2022/S_RES_2659_2022_EN.pdf"
}