{
  "resolution_no": "2295",
  "year": "2016",
  "theme": [
    "Peacekeeping",
    "Security",
    "Reconciliation",
    "Humanitarian",
    "Counter-terrorism"
  ],
  "chapter": "Chapter VII",
  "charter_articles": [
    "Article 24",
    "Article 25"
  ],
  "entities": [
    "MINUSMA",
    "UNMIL",
    "UNOCI",
    "1267/1989/2253 ISIL (Da’esh) and Al-Qaida Sanctions Committee"
  ],
  "reporting_cycle": "every three months",
  "operative_authority": "Chapter VII",
  "summary": "Here is a clear and concise summary of the Security Council document:\n\nThe Security Council adopted Resolution 2295 (2016) on June 29, 2016, recalling previous resolutions on Mali, reaffirming its commitment to the country's sovereignty, unity, and territorial integrity. The Council welcomed the Agreement on Peace and Reconciliation in Mali, signed in 2015, as a historic opportunity for lasting peace, and emphasized the responsibility of the Government of Mali, the Plateforme, and Coordination armed groups to implement the Agreement. \n\nThe Council expressed concern at delays in implementation, but welcomed positive steps, including the signing of an Entente on interim authorities and the appointment of a High Representative. It also welcomed progress on women's participation, including a law requiring a 30% quota for women in national institutions. \n\nThe Council affirmed its intention to facilitate and support the implementation of the Agreement and commended the role of Algeria and other members of the international mediation team. It expressed concern about the volatile security situation, particularly the expansion of terrorist activities, and strongly condemned terrorist organizations, including Al-Qaida in the Islamic Maghreb (AQIM) and affiliates. \n\nThe Council also condemned attacks against MINUSMA, Malian Defence and Security Forces, EUTM Mali, and French forces, and stressed that terrorism can only be defeated by a sustained and comprehensive approach involving all parties. \n\nThe Council called for inclusive processes, including communal elections on September 25, 2016, a constitutional referendum in November 2016, and regional elections in the first semester of 2017.\nThe Security Council,\n\nRecalling previous resolutions and reaffirming that terrorism cannot be associated with any religion, nationality or civilization,\n\n Condemns terrorist entities, and recalls listing of MUJAO, Al-Qaida in the Islamic Maghreb, Ansar Eddine, Iyad Ag Ghali, and Al Mourabitoune on the Al-Qaida sanctions list,\n\nWelcomes French forces' actions to deter terrorist threats in Mali, and emphasizes security and stability in Mali are linked to the Sahel and West Africa regions,\n\nExpresses concern over the transnational terrorist threat and organized crime in the Sahel, welcomes efforts of the Group of Five for the Sahel (G5) and African Union Nouakchott process,\n\nCondemns kidnapping and hostage-taking, and recalls resolutions 2133 (2014) and 2253 (2015), \n\nCondemns human rights abuses and violations of international humanitarian law, \n\n Reiterates perpetrators must be held accountable, and notes the International Criminal Court's investigation into crimes committed in Mali,\n\nUnderscores Malian civilian control and oversight, and commends the European Union Training Mission (EUTM Mali) and European Union Capacity Building Mission (EUCAP Sahel Mali),\n\nEmphasizes humanitarian principles, \n\nRemains concerned over the food and humanitarian crisis, insecurity, and illicit proliferation of weapons,\n\nExpresses support for the Special Representative of the Secretary-General and the United Nations Multidimensional Integrated Stabilization Mission in Mali (MINUSMA), \n\nCommends troop and police contributing countries, and condemns attacks against peacekeepers.\nThe Security Council,\n\nExpressing concern at MINUSMA's lacking capabilities, stresses the need to strengthen it to fulfil its mandate in a complex security environment, and emphasizes ensuring personnel security.\n\nThe situation in Mali continues to threaten international peace and security.\n\nActing under Chapter VII,\n\n**Implementation of the Agreement on Peace and Reconciliation in Mali**\n\n1. Urges Malian parties to engage constructively to accelerate Agreement implementation for concrete peace dividends.\n2. Urges prioritizing steps to advance implementation of Agreement provisions, notably:\n    - Political and institutional aspects (decentralization, interim administrations, elections).\n    - Defence and security aspects (joint patrols, cantonment, disarmament, demobilization).\n3. Urges upholding the ceasefire agreements.\n4. Expresses readiness to consider targeted sanctions against those obstructing Agreement implementation.\n5. Demands armed groups cease hostilities, reject violence, and recognize Mali's unity and territorial integrity.\n6. Urges cooperation with MINUSMA's deployment and activities.\n7. Urges coordination with the Special Representative and MINUSMA.\n8. Requests the Special Representative to support Agreement implementation.\n9. Calls on international partners to sustain support to Agreement implementation.\n10. Affirms gradual restoration of State authority and reformed Malian Defence and Security Forces will contribute to stability.\n11. Calls on the Government of Mali to finalize its strategy for the North and disburse received funds.\n12. Urges establishing benchmarks and timelines to assess Agreement implementation progress.\nThe Security Council:\n\nEncourages UN agencies and partners to support Mali's implementation of the Agreement on Peace and Reconciliation, particularly socioeconomic and cultural development provisions.\n\n**MINUSMA's Mandate**\n\n* Extends MINUSMA's mandate until 30 June 2017.\n* Increases force levels to 13,289 military personnel and 1,920 police personnel.\n* Sets MINUSMA's strategic priority as supporting the Agreement's implementation, particularly restoring and extending State authority.\n\n**MINUSMA's Tasks**\n\n* Support implementation of the Agreement, including:\n\t+ Political and institutional reforms.\n\t+ Defence and security measures.\n\t+ Reconciliation and justice measures.\n* Exercise good offices and reconciliation efforts.\n* Protect civilians and stabilize areas, including against asymmetric threats.\n\n**Specific Tasks**\n\n* Support effective establishment of interim administrations in Northern Mali.\n* Monitor and supervise ceasefire.\n* Support redeployment of Malian Defence and Security Forces.\n* Support cantonment, disarmament, demobilization, and reintegration of armed groups.\n* Ensure coherence of international efforts to rebuild the Malian security sector.\n* Support inclusive, free, fair, and transparent local elections and a constitutional referendum.\n* Provide specific protection for women and children affected by armed conflict.\nHere is a summarized version of the Security Council document:\n\nThe Security Council authorizes MINUSMA to:\n\n* Anticipate and deter threats, and take robust steps to counter asymmetric attacks against civilians and UN personnel (para 19(d))\n* Protect UN personnel, installations, and equipment, and ensure their safety and security (para 19(e))\n* Assist Malian authorities in promoting and protecting human rights, including supporting efforts to bring to justice those responsible for human rights abuses (para 19(f)(i))\n* Monitor, investigate, and report on human rights violations and abuses, including sexual and gender-based violence (para 19(f)(ii))\n* Contribute to a secure environment for humanitarian assistance and the return of internally displaced persons and refugees (para 19(g))\n\nMINUSMA is also authorized to:\n\n* Assist in implementing projects for stabilization, including quick impact projects (para 20(a))\n* Assist Malian authorities with weapons and ammunition management (para 20(b))\n* Assist in protecting cultural and historical sites in Mali (para 20(c))\n* Cooperate with the 1267/1989/2253 ISIL (Da’esh) and Al-Qaida Sanctions Committee (para 20(d))\n\nThe Secretary-General is requested to:\n\n* Utilize personnel and expertise within MINUSMA’s existing resources to prioritize tasks (para 21)\n* Continuously adjust MINUSMA’s deployment according to progress made in implementing its mandate\n\nMINUSMA is requested to:\n\n* Update its protection of civilians strategy (para 22)\n* Enhance interaction with the civilian population and cooperation with Malian Defence and Security Forces (para 23)\n* Ensure that any support provided to non-UN security forces complies with the Human Rights Due Diligence Policy (para 25)\n* Take into account gender considerations throughout its mandate (para 26)\nHere is a concise summary of the Security Council document:\n\nThe Security Council:\n\n**Implementation and Reporting**\n\n* Requests enhanced reporting by MINUSMA on the implementation of the Agreement\n* Requests the Secretary-General to ensure full compliance of MINUSMA with the UN zero-tolerance policy on sexual exploitation and abuses\n\n**Capacities of MINUSMA, Safety and Security**\n\n* Requests the Secretary-General to enable MINUSMA to reach full operational capacity\n* Urges troop and police contributing countries to expedite procurement and deployment of necessary equipment\n* Requests measures to enhance safety and security of MINUSMA's personnel, including improving intelligence capacities and providing training and equipment\n\n**French Forces Mandate**\n\n* Authorizes French forces to use necessary means to intervene in support of MINUSMA elements under imminent threat\n\n**Obligations under International Humanitarian and Human Rights Law**\n\n* Urges Malian authorities to combat impunity and hold perpetrators of human rights abuses accountable\n* Urges parties to comply with obligations under international humanitarian law to respect and protect humanitarian personnel and relief consignments\n* Reiterates Malian authorities' primary responsibility to protect civilians and recalls relevant resolutions on protection of civilians, children, and women\n\n**Logistical Support**\n\n* Calls upon Member States to ensure free and unhindered movement of personnel, equipment, and supplies for MINUSMA\n* Requests the Secretary-General to facilitate logistical supply of MINUSMA and consolidate supply routes\n\n**Accountability and Reporting**\n\n* Requests the Secretary-General to report on measures to enhance safety and security of MINUSMA's personnel\n* Requests France to report on implementation of its mandate and coordinate with the Secretary-General's reporting.\nHere is a summarized version of the Security Council document:\n\n39. MINUSMA is requested to consider the environmental impacts of its operations and manage them in accordance with applicable UN rules and regulations, operating mindfully near cultural and historical sites.\n\n40. The Secretary-General is authorized to ensure inter-mission cooperation between MINUSMA, UNMIL, and UNOCI, including transferring troops and assets, subject to Council approval, troop-contributing countries' agreement, and the security situation.\n\n41. The Secretary-General's proposal to transfer a quick reaction force and aviation unit from UNOCI to MINUSMA by March 31, 2017, is endorsed to enhance MINUSMA's operations and potentially operate in Liberia if needed.\n\n42. Member States, particularly Sahel, West Africa, and Maghreb States, are called upon to enhance coordination to combat terrorist groups, prevent their expansion, and limit arms proliferation and transnational organized crime.\n\n43. Regional strategies, including the UN integrated strategy for the Sahel, are to be rapidly and effectively implemented, and the Special Representative of the Secretary-General for West Africa and the Sahel is encouraged to support Member States and regional organizations.\n\n44. The European Union is called upon to coordinate closely with MINUSMA and other bilateral partners to assist Malian authorities in Security Sector Reform.\n\n45. The Malian authorities, with MINUSMA's assistance, are to address the proliferation and illicit trafficking of small arms and light weapons, consistent with ECOWAS and UN frameworks.\n\n46. The Secretary-General is requested to report to the Security Council every three months on the implementation of this resolution, focusing on progress in implementing the Agreement on Peace and Reconciliation in Mali.\n\n47. The Security Council decides to remain actively seized of the matter.",
  "url": "https://storage.googleapis.com/bluelines-rag-bucket/2016/S_RES_2295_2016_EN.pdf"
}