{
  "resolution_no": "2305",
  "year": "2016",
  "theme": [
    "Peacekeeping",
    "Lebanon",
    "UNIFIL"
  ],
  "chapter": "Chapter VI",
  "charter_articles": [
    "Article 24",
    "Article 25"
  ],
  "entities": [
    "UNIFIL",
    "Lebanese Armed Forces",
    "Security Council"
  ],
  "reporting_cycle": "every four months",
  "operative_authority": "Chapter VI",
  "summary": "The Security Council, recalling its previous resolutions on Lebanon, adopted Resolution 2305 (2016) on 30 August 2016, extending the mandate of the United Nations Interim Force in Lebanon (UNIFIL) for one year without amendment. The Council reiterated its strong support for Lebanon's territorial integrity, sovereignty, and political independence. It reaffirmed its commitment to the full implementation of Resolution 1701 (2006), expressing concern at limited progress made towards a permanent ceasefire and other key provisions. The Council called upon all parties to strengthen efforts to implement Resolution 1701 (2006) without delay, and to refrain from actions or rhetoric that could jeopardize the cessation of hostilities or destabilize the region. It emphasized the importance of full compliance with the prohibition on sales and supply of arms and related materiel, and the respect for the Blue Line. The Council condemned attempts to threaten Lebanon's security and stability, and reaffirmed its determination to ensure UNIFIL's mandate is implemented without intimidation. It commended UNIFIL's personnel and expressed appreciation to contributing Member States. The Council welcomed the Lebanese Armed Forces' role in extending and sustaining the Government's authority, and the strong international commitment to support them. It also welcomed the Secretary-General's efforts to review peacekeeping operations, including UNIFIL.\nThe Security Council:\n\n1. Extends the mandate of UNIFIL until 31 August 2017.\n\n2. Commends UNIFIL's positive role in establishing a new strategic environment in southern Lebanon, and calls for further enhancement of cooperation between UNIFIL and the Lebanese Armed Forces.\n\n3. Welcomes the continued engagement of UNIFIL and the Lebanese Armed Forces in the Strategic Dialogue to identify Lebanese Armed Forces requirements.\n\n4. Requests the Secretary-General to conduct a strategic review of UNIFIL by February 2017.\n\n5. Urges international support for the Lebanese Armed Forces, particularly in areas of counter-terrorism and border protection.\n\n6. Calls upon all parties to respect the cessation of hostilities and the Blue Line.\n\n7. Welcomes the constructive role of the Tripartite Mechanism in facilitating coordination and de-escalating tensions.\n\n8. Urges all parties to respect the safety of UNIFIL personnel and ensure their freedom of movement.\n\n9. Urges all parties to cooperate towards a permanent ceasefire and long-term solution.\n\n10. Urges Israel to expedite the withdrawal of its army from northern Ghajar.\n\n11. Reaffirms its call for an area free of armed personnel, assets, and weapons between the Blue Line and the Litani River.\n\n12. Welcomes efforts to implement the zero-tolerance policy on sexual exploitation and abuse.\n\n13. Requests the Secretary-General to report on the implementation of resolution 1701 (2006) every four months.\n\n14. Stresses the importance of a comprehensive, just, and lasting peace in the Middle East.\n\n15. Decides to remain actively seized of the matter.",
  "url": "https://storage.googleapis.com/bluelines-rag-bucket/2016/S_RES_2305_2016_EN.pdf"
}