{
  "resolution_no": "2327",
  "year": "2016",
  "theme": [
    "Peacekeeping",
    "Humanitarian",
    "WPS/CAAC",
    "Conflict Prevention"
  ],
  "chapter": "Chapter VII",
  "charter_articles": [
    "Article 24",
    "Article 25",
    "Article 42"
  ],
  "entities": [
    "UNMISS",
    "IGAD",
    "SPLA",
    "SPLA-IO",
    "JMEC",
    "AU"
  ],
  "reporting_cycle": "every 90 days",
  "operative_authority": "Chapter VII",
  "summary": "Here is a concise summary of the Security Council document:\n\nThe Security Council:\n\nRecalling previous resolutions on South Sudan, reaffirms its commitment to the country's sovereignty, independence, and territorial integrity.\n\nExpresses grave alarm at the political, security, economic, and humanitarian crisis in South Sudan, caused by the internal Sudan People's Liberation Movement (SPLM) dispute and subsequent violence since December 2013.\n\nEmphasizes that there can be no military solution to the situation and notes the \"Agreement on the Resolution of the Conflict in the Republic of South Sudan\" as the framework for durable peace.\n\nCondemns ethnic violence, attacks against civilians, and hate speech, and expresses deep concern at the possibility of an outright ethnic war.\n\nCalls upon all stakeholders to re-affirm their commitment to the full and timely implementation of the Agreement.\n\nCondemns fighting in Juba and Malakal, and reminds all parties of the civilian character of Protection of Civilians sites.\n\nRecalling that individuals responsible for threatening peace, security, or stability in South Sudan may be designated for targeted sanctions.\n\nTakes note of IGAD's decisions, including the deployment of a Regional Protection Force, and urges the Transitional Government of National Unity to implement its commitments.\n\nStresses the primacy of the political process and looks forward to its reinvigoration, with the support of the UN Secretary-General, African Union, and IGAD.\n\nWelcomes the commitment of countries in the region to continue engaging with South Sudanese leaders to address the current political crisis.\n\nCommends the work of UNMISS and stresses the importance of effective engagement with local communities and humanitarian actors to fulfil UNMISS's Protection of Civilians mandate.\nHere is a concise summary of the Security Council document:\n\nThe Security Council:\n\n* Recognizes the importance of unarmed civilian protection in deterring sexual and gender-based violence and encourages UNMISS to explore civilian protection techniques.\n* Strongly condemns the obstruction of UNMISS by the Transitional Government of National Unity (TGNU) and restrictions on its freedom of movement.\n* Condemns human rights violations and abuses, including extrajudicial killings, ethnically targeted violence, rape, and recruitment of children, by all parties.\n* Expresses grave concern at the systematic and widespread use of sexual violence against civilians, particularly women and girls.\n* Stresses the need to end impunity and bring perpetrators to justice, and emphasizes the importance of accountability, reconciliation, and healing.\n* Condemns the use of media to broadcast hate speech and instigate violence, and calls on the Government to condemn and counter hate speech.\n* Expresses concern at the humanitarian crisis, including 2.94 million displaced persons and 4.8 million facing severe food insecurity.\n* Condemns attacks against humanitarian personnel and facilities, and recalls the need for safe and unhindered access to relief personnel and supplies.\n* Appreciates the actions taken by UNMISS peacekeepers to protect civilians and stabilize the security situation.\n* Emphasizes the importance of the rule of law, women's empowerment, and participation in conflict prevention, peacekeeping, and peacebuilding.\nHere is a concise summary of the Security Council document 2327 (2016):\n\nThe Security Council expresses grave concern over threats to oil installations, petroleum companies, and their employees in South Sudan, and urges all parties to ensure the security of economic infrastructure.\n\nThe Council recalls its resolution 2117 (2013) and expresses concern at the threat to peace and security in South Sudan arising from the illicit transfer, accumulation, and misuse of small arms and light weapons.\n\nThe Council strongly condemns attacks on United Nations and IGAD personnel and facilities, including the downing of a UN helicopter, attacks on UNMISS camps, and detention and kidnappings of UN personnel.\n\nThe Council demands that all parties immediately end fighting throughout South Sudan, implement a permanent ceasefire, and ensure that commanders control their forces and protect civilians.\n\nThe Council demands that the Transitional Government of National Unity (TGNU) comply with the Status of Forces Agreement (SOFA) with the UN, cease obstructing UNMISS, and facilitate freedom of movement for the Ceasefire and Transitional Security Arrangements Monitoring Mechanism (CTSAMM).\n\nThe Council expresses its intention to consider measures against those who undermine peace, stability, and security in South Sudan, and underscores that individuals or entities responsible for attacks on UNMISS personnel and premises may meet designation criteria.\n\nThe Council takes note of the TGNU's announcement to conduct an inclusive national dialogue, and urges all parties to engage in an open and inclusive national political dialogue.\n\nThe Council decides to extend the mandate of UNMISS until 15 December 2017, and increases the overall force levels of UNMISS to 17,000 troops and 2,101 police personnel.\n\nThe Council authorizes UNMISS to use all necessary means to perform its tasks, including protecting civilians, deterring violence, and implementing a mission-wide early warning strategy.\nThe Security Council has adopted resolution 2327 (2016) on the United Nations Mission in South Sudan (UNMISS). The resolution outlines the mandate of UNMISS, which includes:\n\n**Protection of Civilians**\n\n* To protect civilians from threats and attacks, including violations and abuses of human rights and international humanitarian law\n* To maintain public safety and security within UNMISS protection of civilians sites\n* To deter and prevent sexual and gender-based violence\n* To exercise good offices to support the mission's protection strategy, especially for women and children\n* To foster a secure environment for the safe and voluntary return of IDPs and refugees\n\n**Monitoring and Investigating Human Rights**\n\n* To monitor, investigate, verify, and report on abuses and violations of human rights and international humanitarian law\n* To monitor and report on violations and abuses against children and women, including sexual and gender-based violence\n* To monitor and report on incidents of hate speech and incitement to violence\n* To coordinate with international, regional, and national mechanisms on human rights\n\n**Creating Conditions for Humanitarian Assistance**\n\n* To contribute to the creation of security conditions conducive to humanitarian assistance\n* To ensure the security and freedom of movement of UN personnel and installations\n\n**Supporting Implementation of the Agreement**\n\n* To support the planning and establishment of transitional security arrangements\n* To support the work of the National Constitutional Amendment Committee and the incorporation of the Agreement into the Transitional Constitution\n* To support the permanent constitution-making process\n* To assist the parties in developing a strategy for disarmament, demobilization, reintegration, and security sector reform\n* To participate in and support the CTSAMM and JMEC\n* To advise and assist the National Elections Commission\n* To support the establishment and operationalization of an inclusive Joint Integrated Police. \n\n8. Recalls its resolution 2086 (2013) and reaffirms the basic principles of peacekeeping, including consent of the parties, impartiality, and non-use of force, except in self-defence.\nHere is a summarized version of the Security Council document 2327 (2016):\n\nThe Security Council:\n\n9. Decides that UNMISS shall continue to include a Regional Protection Force (RPF) to advance the safety and security of the people of South Sudan, and authorizes the RPF to use all necessary means to:\n- Facilitate safe and free movement in Juba\n- Protect the airport and key facilities in Juba\n- Engage actors preparing or engaging in attacks on UN protection sites, personnel, and civilians\n\n10. Intends to consider measures to address the evolving situation in South Sudan, including those described in the Annex of resolution 2304 (2016), in case of impediments to the RPF or UNMISS.\n\n11. Emphasizes the priority of protecting civilians and authorizes UNMISS to use all necessary means to protect civilians, UN personnel, and installations.\n\n12. Requests the Special Representative of the Secretary-General to direct UNMISS operations and coordinate UN activities in South Sudan to implement the Agreement.\n\n13. Requests the Secretary-General to prioritize the complete deployment of UNMISS personnel.\n\n14. Requests UNMISS to take into account gender considerations throughout its mandate.\n\n15. Requests UNMISS to intensify its presence and patrolling in high-risk areas.\n\n16. Recalls resolution 2272 (2016) and requests the Secretary-General to ensure UNMISS compliance with the UN zero-tolerance policy on sexual exploitation and abuse.\n\n17. Encourages UNMISS to provide support to non-UN security forces in strict compliance with the Human Rights Due Diligence Policy.\n\n18. Requests UNMISS to assist the Committee and Panel of Experts established by resolution 2206 (2015).\n\n19. Condemns attacks on UNMISS personnel and facilities, demands respect for the inviolability of UN premises, and reiterates the TGNU's obligations under the SOFA.\nHere is a summarized version of the Security Council document 2327 (2016):\n\nThe Security Council:\n\n1. Demands the immediate and safe release of detained and kidnapped UN and associated personnel.\n\n2. Condemns clashes in Malakal and Juba, urging the UN to incorporate lessons learned to reform UNMISS, improve protection of civilians, and enhance safety and security of personnel.\n\n3. Requests UNMISS to ensure security of air operations and report to the Council.\n\n4. Condemns attacks on and looting of humanitarian aid, premises, and demands all parties allow rapid, safe, and unhindered access to relief personnel and supplies.\n\n5. Demands all parties cease violence, human rights violations, and abuses, and hold perpetrators accountable.\n\n6. Condemns violations of international law, including against children, and urges parties to implement commitments to end violations.\n\n7. Urges the SPLA, SPLA-IO, and other armed groups to prevent sexual violence and hold perpetrators accountable.\n\n8. Stresses truth-seeking and reconciliation are essential for peace in South Sudan.\n\n9. Takes note of steps towards setting up the Hybrid Court for South Sudan and requests technical assistance.\n\n10. Calls on the Government of South Sudan to complete investigations of human rights violations and abuses and hold perpetrators accountable.\n\n11. Condemns attacks on oil installations and urges all parties to ensure security of economic infrastructure.\n\n12. Requests the Secretary-General to provide detailed information on force generation, restructuring of UNMISS, and report on implementation of the UNMISS mandate.\nThe Security Council:\n\n- Requests the Secretary-General to submit a comprehensive written report on UNMISS's mandate implementation within 90 days, and every 90 days thereafter.\n\n- Recalls paragraph 6 of resolution 2304 (2016), and requests the Secretary-General to: \n  - Continue consulting with Troop- and Police-contributing countries to enhance UNMISS personnel's safety and security.\n  - Report on steps taken to enhance safety and security, and on reforms to enable UNMISS to implement its mandate effectively.\n\n- Requests the Secretary-General to:\n  - Provide a review within 6 months on progress made by parties in ceasing hostilities, returning to dialogue, and achieving inclusiveness in government.\n  - Recommend adjustments to the UNMISS mandate.\n\n- Requests the Secretary-General to report on technical assistance provided, and invites the African Union to share information on the Hybrid Court for South Sudan's establishment.\n\n- Expresses the Security Council's intention to assess the work done in establishing the Hybrid Court.\n\n- Decides to remain seized of the matter.",
  "url": "https://storage.googleapis.com/bluelines-rag-bucket/2016/S_RES_2327_2016_EN.pdf"
}