{
  "resolution_no": "2284",
  "year": "2016",
  "theme": [
    "Peacekeeping",
    "Security Sector Reform",
    "Human Rights",
    "Reconciliation"
  ],
  "chapter": "Chapter VII",
  "charter_articles": [
    "Article 24",
    "Article 25"
  ],
  "entities": [
    "UNOCI",
    "MINUSMA",
    "UNMIL",
    "French Forces"
  ],
  "reporting_cycle": "The Secretary-General reports by 31 January 2017 and oral briefing by 30 June 2017",
  "operative_authority": "Chapter VII",
  "summary": "Here is a clear and concise summary of the Security Council document:\n\nThe Security Council:\n\nRecalling previous resolutions on Côte d’Ivoire, Liberia, and Mali, and taking note of the Secretary-General’s reports, \n\nReaffirms its commitment to Côte d’Ivoire’s sovereignty, independence, territorial integrity, and unity.\n\nNotes progress made towards lasting peace and stability, commending the Government and people of Côte d’Ivoire for their efforts.\n\nWelcomes the successful presidential election and enhanced political dialogue among parties.\n\nEmphasizes progress towards national reconciliation and social cohesion.\n\nCommends the Ivorian security services for improvements in the security situation.\n\nStrongly condemns the terrorist attack in Grand Bassam on 13 March 2016.\n\nRecognizes improvement in the humanitarian situation and welcomes the return of refugees.\n\nNotes progress in disarmament and demobilization of former combatants.\n\nCommends national security institutions for performing their statutory functions.\n\nReiterates the vital role of women in conflict resolution and peacebuilding.\n\nWelcomes improvement in the human rights situation but expresses concern about continued reports of human rights violations.\n\nWelcomes efforts to bring alleged perpetrators to justice.\nThe Security Council,\n\nCommending the African Union, ECOWAS, and the Mano River Union for their efforts to consolidate peace and stability in Côte d'Ivoire and the subregion, \n\nWelcoming Côte d'Ivoire's ratification of the 1954 and 1961 Conventions on Statelessness and steps to revise its nationality laws,\n\nExpressing appreciation for the work of UNOCI and its contribution to maintaining peace and security in Côte d'Ivoire since 2004,\n\nMindful of its primary responsibility for maintaining international peace and security,\n\nActing under Chapter VII of the Charter,\n\n1. Commends progress in national reconciliation and social cohesion, stresses the importance of the constitutional review referendum, and calls for inclusiveness and cooperation among Ivorian stakeholders;\n\n2. Commends political stakeholders for creating a normalized political environment and calls for continued political inclusion;\n\n3. Reaffirms the importance of preventing and mitigating violence, including inter-communal tensions, by addressing national identity and land tenure issues;\n\n4. Calls on the Government of Côte d'Ivoire to prioritize the implementation of its national security sector reform strategy, and encourages international assistance;\n\n5. Underscores the importance of enhancing the role of the police and gendarmerie in public order tasks;\n\n6. Reiterates the need for sustainable reintegration opportunities for former Ivorian combatants;\n\n7. Welcomes cooperation between UNOCI and Ivorian defence and security forces, and reiterates the importance of strict adherence to international humanitarian, human rights, and refugee laws;\n\n8. Reiterates its call on the Government of Côte d'Ivoire to bring to justice those responsible for serious human rights violations and abuses;\n\n9. Calls on the Government of Côte d'Ivoire to combat impunity and ensure equitable and independent justice;\n\n10. Emphasizes the importance of the work conducted by the National Commission of Inquiry, the CDVR, and the CONARIV, and encourages the Government to publish the final report and recommendations of the CDVR.\nHere is a summarized version of the document:\n\n11. Welcomes the work of the National Human Rights Commission, underscores its independence, and calls on the Government of Côte d’Ivoire to strengthen it.\n\n12. Calls on those responsible to cease committing acts of sexual and gender-based violence and for the Government to strengthen its 2014 national strategy to combat such violence.\n\n13. Endorses the Secretary-General’s withdrawal plan for UNOCI, including phased force reductions, and requests its implementation.\n\n14. Extends UNOCI’s mandate until 30 June 2017.\n\n15. Until 30 April 2017, UNOCI’s mandate includes:\n- Protecting civilians\n- Providing political support\n- Supporting security institutions and border-related challenges\n- Supporting compliance with international humanitarian and human rights law\n- Supporting humanitarian assistance\n- Public information\n- Protecting United Nations personnel\n\n16. Authorizes UNOCI to use all necessary means to carry out its mandate.\n\n17. Requests the Secretary-General to complete the withdrawal of all uniformed and civilian UNOCI components by 30 April 2017.\n\n18. From 1 May to 30 June 2017, UNOCI’s mandate will focus on completing its closure and transitioning to the Government of Côte d’Ivoire and the United Nations Country Team.\nHere is a summarized version of the Security Council document:\n\n19. Encourages mapping of international support to Côte d'Ivoire, particularly regarding residual functions currently provided by UNOCI.\n\n20. Requests UNOCI to work closely with UNCT to accelerate preparations for its closure, scaling up activities to support the Government of Côte d'Ivoire in peace consolidation, refugee returns, security reforms, human rights, and social cohesion.\n\n21. Requests UNOCI to ensure support to non-UN security forces is provided in strict compliance with the Human Rights Due Diligence Policy.\n\n22-23. Decides to decrease UNOCI's military and police components, with a view to complete withdrawal by 30 April 2017.\n\n24. Expresses support for UNOCI's mobile concept of operations, focusing on high-risk areas.\n\n25. Extends until 30 June 2017 the authorization for French Forces to support UNOCI.\n\n26. Urges all parties to cooperate with UNOCI and French Forces, ensuring their safety and freedom of movement.\n\n27. Welcomes resumption of regular meetings between Côte d'Ivoire and Liberia, and calls for reinforced cooperation on border challenges.\n\n28. Affirms inter-mission cooperation arrangements between UNMIL and UNOCI, and reaffirms the framework set out in resolution 1609 (2005).\n\n29. Commends inter-mission cooperation between UNOCI and MINUSMA.\n\n30. Welcomes the operationalization of the quick reaction force, and requests its maintenance for a period of one year.\n\n31. Authorizes deployment of the quick reaction force to Liberia in case of a serious deterioration of the security situation.\n\n32. Requests the Secretary-General to inform the Security Council of any deployment of the quick reaction force to Liberia.\n\n33. Welcomes the Secretary-General's intention to develop recommendations for the quick reaction force unit beyond UNOCI's lifecycle.\n\n34. Calls upon UN entities in Côte d'Ivoire and Liberia to enhance support for stabilization of the border area, including through inter-mission cooperation.\nThe Security Council:\n\n35. Calls on all Member States, particularly West Africa, Sahel, and Maghreb States, as well as regional, bilateral, and multilateral partners, to enhance coordination to develop inclusive and effective strategies to combat terrorist groups in the region comprehensively;\n\n36. Requests the Secretary-General to regularly inform the Council of the situation in Côte d’Ivoire, provide a report by 31 January 2017 on UNOCI's mandate implementation and phased drawdown, including the transition of security responsibilities to the Government, and an oral briefing by 30 June 2017 on UNOCI's mandate completion and closure;\n\n37. Decides to remain seized of the matter.",
  "url": "https://storage.googleapis.com/bluelines-rag-bucket/2016/S_RES_2284_2016_EN.pdf"
}