{
  "resolution_no": "1443",
  "year": "2002",
  "theme": [
    "Humanitarian",
    "Iraq"
  ],
  "chapter": "Chapter VII",
  "charter_articles": [
    "Article 39"
  ],
  "entities": [
    "Iraq",
    "Security Council"
  ],
  "reporting_cycle": "",
  "operative_authority": "Chapter VII",
  "summary": "The Security Council,\nRecalling previous relevant resolutions on Iraq, including 986 (1995), 1284 (1999), 1352 (2001), 1360 (2001), 1382 (2001), and 1409 (2002), \nConvinced of the need to continue providing for the civilian needs of the Iraqi people as a temporary measure, \nNoting the Secretary-General's report S/2002/1239 of 12 November 2002, \nDetermined to improve the humanitarian situation in Iraq, \nReaffirming commitment to Iraq's sovereignty and territorial integrity, \nActing under Chapter VII of the Charter, \nDecides to extend the provisions of resolution 1409 (2002) until 4 December 2002; \nDecides to remain seized of the matter.",
  "url": "https://storage.googleapis.com/bluelines-rag-bucket/2002/S_RES_1443_2002_EN.pdf"
}