{
  "resolution_no": "2718",
  "year": "2023",
  "theme": [
    "Peacekeeping",
    "Middle East"
  ],
  "chapter": "Chapter VI",
  "charter_articles": [
    "Article 24",
    "Article 25"
  ],
  "entities": [
    "UNDOF",
    "UN",
    "Syrian Arab Republic",
    "Israel"
  ],
  "reporting_cycle": "every 90 days",
  "operative_authority": "Chapter VI",
  "summary": "Here is a concise summary of the Security Council document:\n\nThe Security Council:\n\n- Notes with concern the tense situation in the Middle East and the need for a comprehensive settlement.\n- Considers reports on the United Nations Disengagement Observer Force (UNDOF) and reaffirms resolution 1308 (2000).\n- Stresses the need for Israel and the Syrian Arab Republic to abide by the 1974 Disengagement of Forces Agreement and observe the ceasefire.\n- Expresses concern over ongoing military activities in the area of separation and their potential to escalate tensions.\n- Appreciates UNDOF's liaison efforts to prevent escalation.\n- Expresses alarm at the risk of a serious conflagration of the conflict in the region.\n- Calls for all parties to cease military actions and respect international humanitarian law.\n- Notes the threat to UN personnel from unexploded ordnance and emphasizes the need for demining operations.\n- Reaffirms readiness to consider listing individuals and entities supporting ISIL (Da'esh) and Al-Nusra Front.\n- Recognizes the need for UNDOF to adjust its posture to minimize security risks.\n- Emphasizes the importance of access to reports and information related to UNDOF's redeployment configuration.\n- Underscores the need for UNDOF to have necessary means and resources to carry out its mandate safely.\n- Expresses appreciation to UNDOF personnel and stresses the need for continued vigilance to ensure their safety.\n- Strongly condemns incidents threatening the safety of United Nations personnel.\n- Welcomes steps to enhance UNDOF's safety and security and progress towards expanding its presence. \n- Takes note of the Secretary-General's plan for UNDOF to return to the Bravo side based on a continuous assessment of security. \n- Recalls that UNDOF's deployment and the 1974 Disengagement of Forces Agreement are steps toward a just and durable peace. \n- Recalls resolutions 2378 (2017) and 2436 (2018) regarding peacekeeping operations.\nHere is a concise summary of the Security Council document 2718 (2023):\n\nThe Security Council:\n\n1. Calls for immediate implementation of resolution 338 (1973).\n2. Stresses the obligation to respect the 1974 Disengagement of Forces Agreement and calls for maximum restraint to prevent breaches of the ceasefire.\n3. Urges parties to cooperate with UNDOF and ensure its freedom of movement and security.\n4. Supports Major General Nirmal Kumar Thapa as Head of Mission and Force Commander.\n5. Calls on all groups to abandon UNDOF positions and return equipment.\n6. Requests cooperation to facilitate UNDOF's operations, including access and troop rotation.\n7. Encourages parties to facilitate UNDOF's return to the area of separation.\n8. Requests measures to protect UNDOF personnel, including technology deployment and addressing staffing needs.\n9. Welcomes UNDOF's efforts to consolidate its presence and intensify operations.\n10. Encourages constructive engagement between parties to facilitate UNDOF's return.\n11. Encourages discussions on improving mission performance.\n12. Welcomes initiatives to standardize a culture of performance in UN peacekeeping.\n13. Requests the Secretary-General to ensure compliance with the UN's zero-tolerance policy on sexual exploitation and abuse.\n14. Renews UNDOF's mandate for six months, until 30 June 2024.\n15. Requests the Secretary-General to report every 90 days on developments and implementation of resolution 338 (1973).",
  "url": "https://storage.googleapis.com/bluelines-rag-bucket/2023/S_RES_2718_2023_EN.pdf"
}