{
  "resolution_no": "2677",
  "year": "2023",
  "theme": [
    "Peacekeeping",
    "Humanitarian",
    "WPS/CAAC",
    "Climate"
  ],
  "chapter": "Chapter VII",
  "charter_articles": [
    "Article 24",
    "Article 25",
    "Article 42"
  ],
  "entities": [
    "UNMISS",
    "IGAD",
    "AU",
    "RJMEC",
    "CTSAMVM"
  ],
  "reporting_cycle": "every 90 days",
  "operative_authority": "Chapter VII",
  "summary": "The Security Council:\n\nRecalling previous resolutions and statements on South Sudan, reaffirms its commitment to the country's sovereignty, independence, territorial integrity, and national unity.\n\nSupports the 2018 Revitalised Agreement on the Resolution of the Conflict in South Sudan (Revitalised Agreement) and stresses its full implementation without delay.\n\nNotes with concern the delayed implementation of the Revitalised Agreement, which led to a two-year extension of transitional political arrangements.\n\nWelcomes some progress in implementing priority measures, including security provided to civilian sites, a permanent constitution-making process, and graduation of unified forces.\n\nExpresses deep concern over intensification of violence, intercommunal violence, and corruption, and encourages UNMISS to support community-led peace dialogue processes.\n\nRecognizes the Secretary-General's report and requests the Government to facilitate unhindered humanitarian access along the Nile River corridor.\n\nAppreciates the leadership of IGAD in advancing the peace process and welcomes the commitment of IGAD, the African Union, and the United Nations to continue engaging with South Sudanese leaders.\n\nEncourages the Government to engage with the United Nations Peacebuilding Commission to enhance international support for peacebuilding objectives.\n\nStresses the need for rapid and transparent assessment of violations by CTSAMVM and encourages IGAD to take action on reports.\n\nExpresses grave concern over ongoing reports of sexual and gender-based violence and urges timely investigations and accountability.\n\nExpresses serious concern over the humanitarian crisis, with over 2.2 million internally displaced persons and 9.4 million in need of assistance.\nThe Security Council,\n\nCondemns the humanitarian situation in South Sudan, where 7.7 million people face severe food insecurity and likely famine in some areas, and recalls resolution 2417 (2018) on the need to break the cycle of conflict, displacement, and food insecurity.\n\nStrongly condemns attacks on humanitarian personnel and facilities, which resulted in 14 deaths in 2022 and 2023, and obstructions by all parties to civilians and humanitarian actors seeking to reach those in need.\n\nCondemns all human rights violations and abuses, including those in Tambura, Jonglei, Unity, and Upper Nile States, and emphasizes the primary responsibility of the government to protect its population from genocide, war crimes, and crimes against humanity.\n\nReiterates the need to end impunity in South Sudan and bring to justice those responsible for international humanitarian law and human rights violations.\n\nStresses the importance of transitional justice measures, including the Hybrid Court for South Sudan, to end impunity and promote accountability.\n\nUnderlines that any obstruction of UNMISS is unacceptable, including restrictions on freedom of movement and mission operations.\n\nExpresses concern at the threat to peace and security arising from the illicit transfer and misuse of small arms and light weapons.\n\nNotes measures adopted to impose targeted sanctions on individuals and entities responsible for threatening peace and security in South Sudan.\n\nEmphasizes the importance of women's empowerment, participation, and human rights.\n\nAcknowledges the significance of South Sudan's ratification of the Optional Protocol to the Convention on the Rights of the Child and welcomes the extension of the Comprehensive Action Plan to End and Prevent All Grave Violations Against Children.\n\nWelcomes South Sudan's accession to four international conventions and passage of laws on the rights of persons with disabilities.\n\nExpresses concern about the dire situation of persons with disabilities in South Sudan, including abandonment, violence, and lack of access to basic services.\nHere is a concise summary of the Security Council document 2677 (2023):\n\nThe Security Council:\n\n* Recognizes the adverse effects of climate change, ecological changes, land degradation, food insecurity, and natural disasters on the humanitarian situation and stability in South Sudan.\n* Urges the Government of South Sudan (GoSS) to engage with local communities to address these challenges and emphasizes the need for comprehensive risk assessments and risk management strategies.\n* Welcomes the commitment of the Secretary-General to enforce strictly his zero-tolerance policy on sexual exploitation and abuse.\n\nThe Council extends the mandate of the United Nations Mission in South Sudan (UNMISS) until 15 March 2024, with the following objectives:\n\n* Prevent a return to civil war in South Sudan\n* Build durable peace at the local and national levels\n* Support inclusive and accountable governance and free, fair, and peaceful elections\n\nUNMISS is authorized to use all necessary means to implement its mandate, prioritizing the protection of civilians. The mandate includes:\n\n* Protection of civilians, including through:\n\t+ Preventing, deterring, and stopping violence against civilians\n\t+ Maintaining a proactive deployment and mobile posture\n\t+ Identifying and deterring threats and attacks against civilians\n\t+ Providing specific protection for women and children\n\nThe Council also emphasizes the importance of strategic communications, welcomes the commitment of the Secretary-General to mainstream strategic communications activities, and expresses concern over allegations of sexual exploitation and abuse reportedly committed by peacekeepers and other UN personnel in South Sudan.\nHere is a concise summary of the Security Council document:\n\nThe Security Council authorizes the following:\n\n**Protection of Civilians**\n\n* To deter, prevent, and respond to sexual and gender-based violence, including by protecting civilians threatened by and survivors of sexual violence\n* To exercise good offices to support UNMISS's protection strategy, especially for women and children\n* To provide support for national and state-level authorities and civil society organizations in developing and implementing gender-responsive community violence reduction programs\n* To foster a secure environment for the safe return, relocation, resettlement, or integration of IDPs and refugees\n\n**Humanitarian Assistance**\n\n* To contribute to the creation of security conditions conducive to the delivery of humanitarian assistance\n* To ensure the security and freedom of movement of UN personnel and associated personnel\n\n**Supporting the Implementation of the Revitalised Agreement and the Peace Process**\n\n* To use good offices to support the peace process and the creation of conditions conducive to the full implementation of the Revitalised Agreement\n* To assist all parties in providing full, equal, and meaningful participation of women and meaningful engagement of civil society, youth, and other marginalized groups in the peace process\n* To participate in and support the work of CTSAMVM, RJMEC, and other implementation mechanisms\n* To provide technical assistance and capacity-building to support mechanisms of the Revitalised Agreement\n\n**Other Mandates**\n\n* To facilitate the conditions for safe and free movement into, out of, and around Juba\n* To monitor and report environmental impacts of its operations and manage them as appropriate\n* To provide technical assistance, capacity-building, and logistical support focused on creating conditions for civic and political space and legal frameworks for the electoral process.\nHere is a concise summary of the Security Council document:\n\nThe Security Council:\n\n1. Authorizes UNMISS to support South Sudanese authorities and non-governmental organizations in drafting a permanent constitution, mitigating tensions during the electoral period, and ensuring the full, equal, and meaningful participation of women and youth.\n\n2. Directs UNMISS to provide support for:\n\t* Implementation of gender-responsive community violence reduction programs\n\t* Strengthening the rule of law and justice sector\n\t* Capacity building for civilian institutions\n\n3. Mandates UNMISS to:\n\t* Monitor, investigate, and report on human rights abuses and violations of international humanitarian law\n\t* Focus on abuses against women and children, including conflict-related sexual violence\n\t* Coordinate with international, regional, and national mechanisms\n\n4. Decides to maintain UNMISS force levels at 17,000 personnel and a police ceiling of 2,101 personnel.\n\n5. Demands:\n\t* All parties to end fighting and engage in political dialogue\n\t* South Sudanese authorities to protect civilians and implement the permanent ceasefire\n\n6. Expresses concern about delays in implementing the Revitalised Agreement, calls for:\n\t* Full implementation of the Agreement\n\t* Establishment of transitional institutions\n\t* Progress on transitional reforms\n\n7. Stresses the importance of free and fair elections, and calls for:\n\t* Key conditions to be met, including prevention of political violence and creation of an inclusive civic space\n\t* Concrete progress on key milestones to ensure a transition to a stable and democratic state.\nHere is a concise summary of the Security Council document:\n\nThe Security Council:\n\n Facilitate a peaceful electoral process in South Sudan, including the adoption of a Permanent Constitution, necessary legislation, and transitional security arrangements.\n\n Calls upon the Government of South Sudan (GoSS) and relevant parties to ensure an environment conducive to open political dialogue, free and constructive debate, and freedom of expression.\n\n Urges the GoSS to fulfill priority measures before the end of UNMISS's current mandate, including:\n\n* Protecting civilians and providing security to re-designated protection sites\n* Creating a conducive political environment for elections\n* Ending obstructions to UNMISS and humanitarian actors\n* Implementing security arrangements, including paying salaries to unified forces\n* Establishing the Hybrid Court for South Sudan and the Commission for Truth, Reconciliation, and Healing\n\n Reiterates its call on the GoSS to comply with the Status of Forces Agreement (SOFA) and cease obstructing UNMISS.\n\n Demands that all parties cease all forms of violence, human rights violations, and abuses, and hold those responsible accountable.\n\n Calls on the GoSS to expedite the implementation of Action Plans to address conflict-related sexual violence.\n\n Demands that all parties allow rapid, safe, and unhindered access of relief personnel, equipment, and supplies.\n\n Calls on the GoSS to resolve housing, land, and property issues for durable solutions for internally displaced persons (IDPs) and refugees.\n\n Calls for the full, effective, and meaningful participation of women in all spheres and levels of political leadership, the peace process, and transitional government.\nHere is a concise summary of the Security Council document:\n\nThe Security Council:\n\n Condemns continued acts of sexual violence and demands all parties prevent further commission of sexual violence, implement a survivor-centered approach, and hold perpetrators accountable.\n\n Strongly urges parties to protect women-led organizations and women peacebuilders from threats and reprisals, and ensure their meaningful participation in the implementation of the Revitalised Agreement.\n\n Urges parties to implement actions to prevent conflict-related sexual violence and protect children from armed conflict.\n\n Calls on the Government of South Sudan (GoSS) to prioritize expanding and reforming the rule of law and justice sector, and to establish the Hybrid Court for South Sudan.\n\n Expresses intention to consider measures against those who undermine peace, stability, and security in South Sudan.\n\n Requests the Secretary-General to direct UNMISS operations and coordinate UN activities in South Sudan.\n\n Encourages continued engagement by regional entities, including IGAD and the AU, to find durable solutions to peace and security challenges.\n\n Urges cooperation with the Panel of Experts and provides technical assistance to the African Union and GoSS to establish the Hybrid Court for South Sudan.\n\n Requests the Secretary-General to make available technical assistance to the Commission of the African Union and to the GoSS.\nHere is a summarized version of the Security Council document:\n\nThe Security Council:\n\n Requests the African Union to share information on progress made in establishing the Hybrid Court for South Sudan with the Secretary-General.\n\n Commends troop- and police-contributing countries' commitment to implementing the Mission's mandate, stresses the importance of effective command and control, and requests them to implement relevant provisions to reduce barriers to women's participation in peacekeeping.\n\n Urges troop- and police-contributing countries to prevent sexual exploitation and abuse, including through vetting, training, and accountability measures.\n\n Calls upon the international community to scale up gender-sensitive humanitarian response for the people of South Sudan and for the Government of South Sudan to prioritize funds for implementing the R-ARCSS.\n\n Stresses the need for bilateral and multilateral partners to work closely with the Government of South Sudan to respond to the COVID-19 pandemic.\n\n Requests the Secretary-General to:\n\n * Report on violations of the SOFA or obstructions to UNMISS on a monthly basis;\n * Conduct an impact assessment of the mission's implementation of its protection of civilians mandate by October 15, 2023;\n * Provide a separate report assessing factors delaying R-ARCSS implementation, conditions necessary for credible elections, and an integrated UN transition strategy by October 15, 2023;\n * Report on implementation of the UNMISS mandate and obstructions encountered every 90 days, providing integrated, evidence-based analysis and strategic assessments.\n\n Decides to remain actively seized of the matter.",
  "url": "https://storage.googleapis.com/bluelines-rag-bucket/2023/S_RES_2677_2023_EN.pdf"
}