{
  "resolution_no": "2695",
  "year": "2023",
  "theme": [
    "Peacekeeping",
    "Lebanon",
    "UNIFIL",
    "Middle East"
  ],
  "chapter": "Chapter VII",
  "charter_articles": [
    "Article 24",
    "Article 25",
    "Article 42"
  ],
  "entities": [
    "UNIFIL",
    "Lebanese Armed Forces",
    "Government of Lebanon",
    "Israel",
    "International Support Group for Lebanon"
  ],
  "reporting_cycle": "every four months",
  "operative_authority": "Chapter VII",
  "summary": "The Security Council adopted Resolution 2695 (2023) at its 9409th meeting on 31 August 2023. \nThe Security Council recalls all its previous resolutions on Lebanon and the statements of its President on the situation in Lebanon. \nIt strongly urges Lebanese political leadership and Members of Parliament to elect a new President without delay, prioritizing the national interest. \nThe Council expresses grave concern about obstacles to the political process and implementation of necessary reforms, stressing the urgent need for Lebanon to respond to its people's aspirations to overcome current crises. \nIt welcomes the delineation of a maritime boundary between Lebanon and Israel on 27 October 2022, contributing to regional stability, security, and prosperity. \nThe Council expresses solidarity with Lebanon and its people after the Beirut explosions on 4 August 2020 and calls for an independent investigation. \nIt extends the mandate of the UNIFIL for a period of one year, reiterating support for Lebanon's territorial integrity, sovereignty, and political independence. \nThe Council reaffirms its commitment to the full implementation of resolution 1701 (2006) and calls for strengthened efforts to achieve a permanent ceasefire and other key provisions. \nIt expresses deep concern at continued violations of resolution 1701 (2006), including Israeli presence in northern Ghajar and construction works, and urges parties to exercise maximum calm and restraint. \nThe Council condemns incidents across the Blue Line and calls on parties to resort to the Tripartite Mechanism, commending UNIFIL's liaison and prevention role.\nHere is a clear and concise summary of the Security Council document:\n\nThe Security Council emphasizes the importance of full compliance with the prohibition on sales and supply of arms and related materiel to Lebanon. It calls on the Government of Lebanon to secure its borders and entry points to prevent unauthorized arms entry. The Council reiterates the importance of extending government control over all Lebanese territory and encourages Lebanese parties to resume discussions on a National Defence Strategy.\n\nThe Council expresses concern over restrictions on UNIFIL's access to and visibility of the Blue Line, unauthorized firing ranges, and tunnels crossing the Blue Line. It urges Lebanese authorities to conclude investigations into these matters. The Council also notes the lack of progress in marking the Blue Line and encourages parties to resume efforts to delineate and visibly mark it.\n\nThe Council condemns attempts to threaten Lebanon's security and stability, and reaffirms its determination to ensure UNIFIL's mandate is implemented without intimidation. It strongly condemns attacks against peacekeepers, including a fatal attack on a UNIFIL convoy on December 14, 2022.\n\nThe Council commends UNIFIL's role in maintaining peace and security since 2006 and recognizes its authority to take necessary actions to ensure its area of operations is not used for hostile activities. It welcomes the Lebanese Armed Forces' crucial role in extending government authority and responding to security challenges.\n\nThe Council urges increased international support to the Lebanese Armed Forces, particularly in the context of the economic crisis, and calls on Member States to urgently assist them. It expresses concern about the impact of crises on the Lebanese Armed Forces' capacities and recalls the importance of evaluating UNIFIL's performance based on clear benchmarks.\nHere is a clear and concise summary of the Security Council document:\n\nThe Security Council:\n\nRecalling previous resolutions, including 2242 (2015) on increasing women's participation in peacekeeping operations and 1701 (2006) on the situation in Lebanon,\n\nExtending the mandate of UNIFIL until 31 August 2024,\n\nCommending UNIFIL's positive role in southern Lebanon and calling for enhanced cooperation with the Lebanese Armed Forces,\n\nAffirming its commitment to the existing UNIFIL mandate and calling for the full implementation of resolution 1701 (2006),\n\nReiterating the need for a permanent ceasefire and a long-term solution between Israel and Lebanon,\n\nStrongly reaffirming the necessity of an effective and durable deployment of the Lebanese Armed Forces in southern Lebanon,\n\nRequesting precise benchmarks and timelines for the Lebanese Armed Forces' deployments,\n\nWelcoming efforts to increase the Lebanese Navy's capabilities and decrease UNIFIL's Maritime Taskforce,\n\nEncouraging the Government of Lebanon to accelerate its deployment of a model regiment and an offshore patrol vessel,\n\nUrging increased international support for the Lebanese Armed Forces,\n\nCondemning violations of the Blue Line and calling for respect for international law and the cessation of hostilities,\n\nWelcoming the Tripartite Mechanism's constructive role in facilitating coordination and de-escalating tensions,\n\nStressing the need for enhanced cooperation between UNIFIL and UNSCOL.\nHere is a summarized version of the Security Council document:\n\nThe Security Council:\n\n* Encourages the Secretary-General to continue efforts to improve efficiency and effectiveness between UNIFIL and UNSCOL.\n\n* Urges all parties to respect the safety of UNIFIL and other UN personnel, and to enhance their safety and security.\n\n* Calls for closer cooperation between UNIFIL and the Lebanese Armed Forces.\n\n* Requests the rapid finalization of investigations into attacks against UNIFIL and its personnel.\n\n* Urges all parties to cooperate fully with UNIFIL in implementing resolution 1701.\n\n* Demands the parties cease any restrictions on UNIFIL personnel movement.\n\n* Requests the Secretary-General to review and enhance the safety and security of UNIFIL personnel.\n\n* Urges tangible progress towards a permanent ceasefire and a long-term solution.\n\n* Strongly urges Israel to withdraw its army from northern Ghajar.\n\n* Reaffirms the call for an area free of armed personnel, assets, and weapons between the Blue Line and the Litani River.\n\n* Condemns the maintenance of arms outside Lebanese State control.\n\n* Authorizes UNIFIL to take necessary action to ensure its area of operations is not used for hostile activities.\n\n* Commends UNIFIL's operational changes and requests enhanced efforts to address misinformation.\n\n* Requests UNIFIL to improve communication efforts and prioritize a strategic communications strategy.\n\n* Recalls UNIFIL's role in assisting the Lebanese government to implement resolution 1701.\n\n* Underscores the importance of implementing the UN Department of Operational Support's Environment Strategy.\nHere is a summarized version of the Security Council document:\n\n26. Welcomes UNIFIL's efforts to implement the Secretary-General's zero-tolerance policy on sexual exploitation and abuse, requests the Secretary-General to ensure full compliance of all personnel with the policy, and urges troop-contributing countries to take preventative action and hold perpetrators accountable.\n\n27. Requests UNIFIL to consider gender issues throughout its mandate, assist Lebanese authorities in promoting women's participation in decision-making, and support efforts to prevent and respond to sexual and gender-based violence.\n\n28. Requests the Secretary-General and troop-contributing countries to increase the number of women in UNIFIL and ensure their full participation in operations.\n\n29. Requests the Secretary-General to implement peacekeeping performance requirements in UNIFIL's operations.\n\n30. Requests the Secretary-General to report to the Council every four months on the implementation of resolution 1701 (2006), including on violations, accountability, and investigations.\n\n31. Stresses the importance of achieving a comprehensive, just, and lasting peace in the Middle East, based on relevant resolutions.\n\n32. Decides to remain actively seized of the matter.",
  "url": "https://storage.googleapis.com/bluelines-rag-bucket/2023/S_RES_2695_2023_EN.pdf"
}