{
  "resolution_no": "2612",
  "year": "2021",
  "theme": [
    "Peacekeeping",
    "Conflict Resolution",
    "Humanitarian Access",
    "Women, Peace and Security",
    "Children and Armed Conflict",
    "Climate Change"
  ],
  "chapter": "Chapter VII",
  "charter_articles": [
    "Article 24",
    "Article 25",
    "Article 27"
  ],
  "entities": [
    "MONUSCO",
    "UN Group of Experts",
    "United Nations Organization Stabilisation Mission in the DRC",
    "Armed Forces of the DRC (FARDC)"
  ],
  "reporting_cycle": "every six months",
  "operative_authority": "Chapter VII",
  "summary": "The Security Council, recalling its previous resolutions on the Democratic Republic of the Congo (DRC), adopted Resolution 2612 (2021) on December 20, 2021. \nThe Council reaffirmed its strong commitment to the sovereignty, independence, unity, and territorial integrity of the DRC and all States in the region. \nIt noted the DRC continues to suffer from recurring cycles of conflict and violence by foreign and domestic armed groups, exacerbating a security, human rights, and humanitarian crisis. \nThe Council recognized efforts of the Government and people of the DRC, the Armed Forces of the DRC (FARDC), and the United Nations Organization Stabilisation Mission in the DRC (MONUSCO) in addressing threats posed by armed groups. \nIt encouraged continued efforts by the Secretary-General, the African Union (AU), the International Conference on the Great Lakes Region (ICGLR), and other regional actors to restore peace and security in the DRC. \nThe Council expressed concern over the humanitarian situation, with 27 million Congolese in need of humanitarian assistance, 5 million internally displaced persons, and 515,000 refugees in the DRC. \nIt called upon the DRC and all States in the region to work towards a peaceful environment conducive to durable solutions for refugees and internally displaced persons. \nThe Council commended humanitarian agencies, partners, and donors for their efforts and called on member States to scale up funding to address humanitarian needs. \nIt recalled the UN guiding principles of humanitarian emergency assistance and resolutions demanding a general and immediate cessation of hostilities. \nThe Council also commended MONUSCO for preventive measures against COVID-19 and requested the Secretary-General to instruct peacekeeping operations to support host country authorities in containing the pandemic.\nHere is a clear and concise summary of the Security Council document:\n\nThe Security Council:\n\n**Recalling previous resolutions**, welcomes efforts to address COVID-19, women, peace and security, youth, peace and security, children and armed conflict, and protection of civilians.\n\n**Condemns** attacks against peacekeepers, and **emphasizes** accountability for such attacks.\n\n**Welcomes** efforts of the Government of the DRC to respond to the needs of the Congolese people, and **urges** all Congolese political stakeholders to implement critical governance, security, and economic reforms.\n\n**Supports** President Tshisekedi's efforts towards reconciliation, peace, and stability, and **calls** for strengthened State institutions, particularly in areas of conflict.\n\n**Requests** the Secretary-General and regional organizations to provide political support to strengthen State institutions and restore trust among parties.\n\n**Commends** the commitment of Troops and Police Contributing Countries (T/PCCs) and **recalls** expectations on delivering on mandated reforms and enhancements to MONUSCO.\n\n**Welcomes** increased collaboration between Congolese authorities and MONUSCO, and **stresses** the importance of coordination and information sharing.\n\n**Reiterating** the importance of adequately resourcing United Nations peace operations during mission transitions.\n\n**Determining** that the situation in the DRC continues to constitute a threat to international peace and security in the region.\n\n**Under Chapter VII**, \n\n**Political situation**\n\n1. **Welcomes** efforts to respond to Congolese people's needs, and **urges** stakeholders to implement critical reforms.\n2. **Welcomes** President Tshisekedi's efforts towards reconciliation and peace, and **calls** for strengthened State institutions.\n3. **Requests** the Secretary-General and regional organizations to provide political support.\n\n**Human Rights**\n\n4. **Welcomes** President Tshisekedi's commitments to protect and respect human rights, and **calls** for upholding these commitments.\nHere is a concise summary of the Security Council document:\n\nThe Security Council remains deeply concerned about high levels of human rights violations and abuses, and violations of international humanitarian law in parts of the DRC, committed by all parties. The Council:\n\n* Urges the Government of the DRC to hold accountable those responsible for violations, including targeted attacks against civilians, sexual and gender-based violence, and recruitment and use of children.\n* Welcomes cooperation between the Government of the DRC and international experts, and requests implementation of recommendations to address human rights abuses.\n* Condemns sexual violence in conflict and post-conflict situations, and urges the Government to combat impunity and provide services to survivors.\n* Encourages the Government to implement its National Strategy and Roadmap to fight sexual violence in conflict.\n* Welcomes progress in consolidating gains of the Action Plan to End and Prevent the Recruitment and Use of Children.\n* Strongly condemns armed groups operating in the DRC for their human rights abuses and violations of international humanitarian law.\n* Demands that all armed groups cease violence and destabilizing activities, and that their members be held accountable.\nHere is a summarized version of the Security Council document:\n\nThe Security Council:\n\n Condemns the continued presence of armed groups in the DRC and calls on them to disband, lay down their arms, reject violence, end and prevent violations against children, and release children from their ranks.\n\n Notes that eliminating the threat posed by armed groups requires an integrated regional approach, strong political engagement, and cooperation between governments, MONUSCO, and the Special Envoy for the Great Lakes.\n\n Urges the signatory States of the PSC Framework to complete the repatriation of former M23 combatants and other combatants seeking voluntary return to their country of origin.\n\n Condemns the illegal exploitation and trafficking of natural resources, particularly conflict minerals, and encourages the Government of the DRC to strengthen efforts to safeguard protected natural areas.\n\n Calls for increased and effective joint operations by the Congolese security forces and MONUSCO to prevent, deter, and stop armed groups.\n\n Welcomes the establishment of the Disarmament, Demobilisation, Community Recovery and Stabilisation Programme (PDDRC-S) and urges the Government of the DRC and its partners to provide adequate support for swift and effective implementation of DDR.\n\n Welcomes preliminary commitments by President Tshisekedi to advance security sector reform (SSR), promote consolidation of State authority, reconciliation, tolerance, and democracy.\n\n Calls on the Government of the DRC to remain fully committed to protecting the civilian population through the establishment of professional, accountable, and sustainable security forces that respect international humanitarian law and human rights law.\n\n Notes with concern the limited progress in SSR and calls on the Government of the DRC to uphold its national commitments to SSR, including allocating necessary financial resources.\n\n Calls for continued national efforts to address the threat posed by the illicit transfer, destabilising accumulation, and misuse of small arms and light weapons.\nHere is a summarized version of the Security Council document:\n\n**Extension of MONUSCO's Mandate**\n\n* The mandate of MONUSCO in the DRC is extended until 20 December 2022, including its Intervention Brigade.\n\n**Troop Ceiling and Deployment**\n\n* MONUSCO's authorised troop ceiling will comprise 13,500 military personnel, 660 military observers and staff officers, 591 police personnel, and 1,050 personnel of formed police units.\n* A temporary deployment of up to 360 personnel of formed police units is allowed, replacing military personnel.\n\n**Strategic Priorities**\n\n* MONUSCO's strategic priorities are:\n\t+ Protection of civilians.\n\t+ Support to the stabilisation and strengthening of State institutions in the DRC and key governance and security reforms.\n\n**Implementation of Mandate**\n\n* MONUSCO's mandate should be implemented based on a prioritization of tasks, with the protection of civilians given priority.\n* MONUSCO is authorised to take all necessary measures to carry out its mandate.\n\n**Priority Tasks**\n\n* MONUSCO's mandate includes the following priority tasks:\n\t+ Protection of civilians, including:\n\t\t- Ensuring effective, timely, dynamic, and integrated protection of civilians under threat of physical violence.\n\t\t- Maintaining a proactive deployment and mobile posture.\n\t\t- Working with the Government and humanitarian workers to identify threats to civilians and implement joint prevention and response plans.\n\t\t- Enhancing community engagement with civilians.\n\t+ Carrying out targeted offensive operations to neutralise armed groups.\n\n**Support to National Security Forces**\n\n* Any support provided to operations conducted by national security forces should be only for joint operations, jointly planned and executed, and subject to oversight and scrutiny.\n\n**Regional Engagement**\n\n* MONUSCO should work with the Office of the Special Envoy for the Great Lakes to seek political solutions to stop cross-border flows of armed combatants, arms, and natural resources.\nHere is a summarized version of the Security Council document:\n\nThe Security Council demands that MONUSCO:\n\n**Protection of Civilians**\n\n* Prioritize the protection of civilians, including through a mobile, flexible, and robust posture\n* Implement standing operating procedures for persons captured or who surrender\n\n**Support to Judicial System**\n\n* Work with DRC authorities to strengthen and support the judicial system to investigate and prosecute those responsible for genocide, war crimes, and crimes against humanity\n* Cooperate with States of the region and the ICC to support investigations and prosecutions\n\n**Promotion of Human Rights**\n\n* Provide good offices, advice, and support to the Government of the DRC to promote human rights and fight impunity\n* Support the implementation of the Government's \"zero tolerance policy\" on human rights and international humanitarian law violations\n\n**Early Warning and Response Mechanisms**\n\n* Strengthen early warning and response mechanisms, including systematic recording and analysis of response rates\n* Include risks of sexual violence in conflict and post-conflict situations in data collection and threat analysis\n\n**Stabilization and Governance**\n\n* Support stabilization and strengthening of State institutions in the DRC\n* Provide technical advice to the Government of the DRC on natural resource management\n\n**Root Causes of Conflict**\n\n* Provide good offices and technical support to promote reconciliation, democratization, and inclusion\n* Address root causes of conflict and promote intercommunal and gender-responsive reconciliation\n\n**Security Sector Reform (SSR)**\n\n* Provide good offices and strategic and technical advice to the Government of the DRC on SSR\n* Support the development of a national SSR plan and implementation roadmap\n* Promote inclusive SSR and facilitate military, police, justice, and prison sector reforms\n\n**Disarmament, Demobilization, Reintegration (DDR)**\n\n* Provide good offices, advice, and assistance to the Government of the DRC on DDR\n* Support the implementation of the PDDRC-S and DDR of combatants not suspected of serious crimes.\nHere is a summarized version of the Security Council document:\n\nThe Security Council requests MONUSCO to:\n\n* Support disarmament, demobilization, and reintegration (DDR) efforts, prioritizing the needs of women and children formerly associated with armed forces and groups (para 29);\n* Coordinate with civil society, donors, and government officials to support DDR efforts (para 29(h));\n* Support the disarmament, demobilization, repatriation, resettlement, and reintegration (DDRRR) process for foreign combatants and their dependents (para 29(i));\n* Assist the DRC authorities in disposing of weapons and ammunition in compliance with international arms control treaties (para 29(j));\n* Collaborate with the Government to prevent and end the recruitment and use of children and expedite the implementation of the Action Plan (para 29(k));\n\nThe Security Council also requests MONUSCO to:\n\n* Ensure the protection of UN personnel, facilities, and equipment (para 30);\n* Take into account child protection as a cross-cutting issue throughout its mandate and assist the Government in protecting children's rights (para 31);\n* Take into account gender considerations throughout its mandate and support the Government in creating a conducive environment for women's participation (para 32);\n\nThe Security Council:\n\n* Recalls its relevant resolutions on the protection of humanitarian and medical personnel and demands that all parties allow and facilitate humanitarian access (para 35);\n* Calls on MONUSCO to strengthen collaboration with humanitarian actors and streamline coordination mechanisms (para 36);\n* Emphasizes the importance of maintaining international support to respond to infectious disease outbreaks (para 37);\n\nThe Security Council requests MONUSCO to:\n\n* Monitor the implementation of the arms embargo and report on flows of military personnel, arms, or related materiel across the eastern border of the DRC (para 38).\nHere is a summarized version of the document:\n\nThe Security Council:\n\n**Arms and Materiel**\n\n* Authorizes the seizure, collection, recording, and disposal of arms or related materiel brought into the DRC in violation of measures imposed by paragraph 1 of resolution 2293 (2016)\n* Requests exchange of relevant information with the Group of Experts\n\n**Support to the Group of Experts**\n\n* Expresses full support to the UN Group of Experts established by resolution 1533 (2004)\n* Calls for enhanced cooperation between States, MONUSCO, and the Group of Experts\n* Requests timely information exchange between MONUSCO and the Group of Experts\n* Encourages cooperation with the Group of Experts by individuals and entities\n\n**Mission Effectiveness**\n\n* Recognizes that effective implementation of peacekeeping mandates is the responsibility of all stakeholders\n* Stresses the importance of providing MONUSCO with necessary capacities to fulfill its mandate\n* Requests the Secretary-General, Member States, and the Government of DRC to ensure the safety and security of MONUSCO's personnel\n\n**MONUSCO Operations**\n\n* Requests the Secretary-General to implement the following activities:\n\t+ Strengthen early warning and response strategy\n\t+ Encourage confidence-building, facilitation, mediation, community engagement, and strategic communications\n\t+ Prioritize enhanced mission mobility and active patrolling\n\t+ Improve intelligence and analysis capacities\n\t+ Provide training, knowledge, and equipment to counter explosive devices\n\t+ Implement effective casualty and medical evacuation procedures\n\t+ Improve safety and security facilities and arrangements\n\t+ Secure long-term rotation schemes for critical capabilities\n\t+ Ensure support to non-UN security forces is provided in strict compliance with HRDDP\n\t+ Prioritize mandated protection activities\n\t+ Strengthen sexual and gender-based violence prevention and response activities\n\t+ Implement resolutions 1325 (2000) and 2467 (2019)\n\t+ Ensure child protection and youth, peace, and security\n\t+ Implement peacekeeping performance requirements\nHere is a concise summary of the Security Council document:\n\nThe Security Council:\n\n* Reiterates the need to improve the effectiveness of the Force Intervention Brigade to protect civilians and neutralize armed groups.\n* Requests the Secretary-General to maximize MONUSCO's operational capacity to discharge its mandate.\n* Urges troop- and police-contributing countries to prevent sexual exploitation and abuse, and hold perpetrators accountable.\n* Welcomes the Transition plan for MONUSCO's progressive and phased drawdown and requests MONUSCO to withdraw from Tanganyika by mid-2022.\n* Stresses the importance of a strategic approach to resource mobilization to ensure MONUSCO's responsible and sustainable withdrawal.\n* Calls upon MONUSCO to work closely with the UNCT to identify gaps in capabilities and transfer tasks to the Government of the DRC and other stakeholders.\n* Recognizes the role of Radio Okapi in providing information to the Congolese population and requests MONUSCO to explore options to sustain its programming.\n* Stresses that MONUSCO's activities should facilitate progress towards sustainable peace and development and address root causes of conflict.\n* Encourages the Government of the DRC to address key issues, including disciplinary and judicial procedures against officials engaged in corruption and human rights violations.\nThe Security Council:\n\n Requests the Secretary-General to report to the Council every three months on:\n \n- Situation in the DRC, including progress towards strengthening State institutions and key governance and security reforms;\n- Implementation of MONUSCO’s mandate, including protection of civilians, progress towards consolidating MONUSCO's footprint, and cooperation among regional security forces;\n- Progress towards the realisation of 18 benchmarks and indicators set by the Government and the UN in the Transition plan;\n- Efforts to adequately resource and progress on implementation of priority collaborative actions with UN specialised agencies, funds and programmes;\n- Progressive transfer of MONUSCO’s tasks to the Government of the DRC, the UNCT and other stakeholders;\n\n Requests the Secretary-General to report to the Security Council every six months on the implementation of commitments under the PSC Framework and its linkages with the broader security situation in the Great Lakes Region;\n\nDecides to remain actively seized of the matter.",
  "url": "https://storage.googleapis.com/bluelines-rag-bucket/2021/S_RES_2612_2021_EN.pdf"
}