{
  "resolution_no": "1736",
  "year": "2006",
  "theme": [
    "Peacekeeping",
    "Democratic Republic of the Congo"
  ],
  "chapter": "Chapter VII",
  "charter_articles": [
    "Article 42"
  ],
  "entities": [
    "MONUC",
    "ONUB",
    "FARDC"
  ],
  "reporting_cycle": "",
  "operative_authority": "Chapter VII",
  "summary": "The Security Council,\n\nRecalling its previous resolutions and statements on the situation in the Democratic Republic of the Congo, Burundi, and the Great Lakes region,\n\nPaying tribute to the Democratic Republic of the Congo's citizens for their commitment to the democratic process,\n\nTaking note of the Secretary-General's letter (S/2006/892) and its recommendation,\n\nNoting the successful performance of 50 military observers deployed from ONUB, who will be repatriated by 31 December 2006,\n\nCondemning continued hostilities by militias and foreign armed groups in eastern Democratic Republic of the Congo, threatening civilians and regional stability,\n\nDeploring human rights and international humanitarian law violations, particularly by militias, foreign armed groups, and elements of the Armed Forces of the Democratic Republic of the Congo (FARDC),\n\nBearing in mind the expiring mandates of ONUB (31 December 2006) and MONUC (15 February 2007),\n\nLooking forward to the Secretary-General's proposals on MONUC's future mandate,\n\nNoting the situation in the Democratic Republic of the Congo remains a threat to international peace and security,\n\nActing under Chapter VII of the Charter,\n\n1. Authorizes a temporary increase in MONUC's military strength by up to 916 personnel from 1 January 2007 until 15 February 2007, to integrate an infantry battalion and military hospital from ONUB,\n2. Expresses intention to examine this issue further before 15 February 2007, in light of the Secretary-General's proposals, to ensure MONUC has adequate capabilities,\n3. Decides to remain actively seized of the matter.",
  "url": "https://storage.googleapis.com/bluelines-rag-bucket/2006/S_RES_1736_2006_EN.pdf"
}