{
  "resolution_no": "1707",
  "year": "2006",
  "theme": [
    "Peacekeeping",
    "Security",
    "Terrorism"
  ],
  "chapter": "Chapter VII",
  "charter_articles": [
    "Article 24",
    "Article 25"
  ],
  "entities": [
    "ISAF",
    "OEF coalition",
    "NATO",
    "United Kingdom",
    "Italy"
  ],
  "reporting_cycle": "quarterly reports",
  "operative_authority": "Chapter VII",
  "summary": "Here is a clear and concise summary of the Security Council document:\n\nThe Security Council:\n\nReaffirms its commitment to Afghanistan's sovereignty, independence, and territorial integrity, and its support for international efforts to combat terrorism.\n\nRecognizes the challenges in Afghanistan, including security, governance, development, and counter-narcotics, and welcomes the Afghanistan Compact as a framework for partnership between the Afghan Government and the international community.\n\nExpresses concern about the security situation, including increased violence and terrorist activity by the Taliban, Al-Qaida, and others, and calls on all Afghan parties to engage in peaceful development.\n\nStresses the importance of security sector reform, including strengthening the Afghan National Army and Police, disbanding illegal armed groups, and counter-narcotics.\n\nSupports the Afghan Security Forces, with assistance from ISAF and the OEF coalition, and welcomes ISAF's expansion into Southern and Eastern Afghanistan.\n\nAppreciates the contributions of NATO and many nations to ISAF and expresses gratitude to the United Kingdom for taking over the lead in commanding ISAF.\n\nDetermines that the situation in Afghanistan still constitutes a threat to international peace and security.\n\nUnder Chapter VII of the Charter, decides to:\n\n1. Extend ISAF's authorization for 12 months beyond 13 October 2006.\n2. Authorize ISAF to take necessary measures to fulfil its mandate.\n3. Call on Member States to contribute personnel, equipment, and resources to ISAF.\n4. Request ISAF to work in close consultation with the Afghan Government and the Special Representative of the Secretary-General.\n5. Request ISAF's leadership to provide quarterly reports on its mandate implementation.\n\nDecides to remain actively seized of this matter.",
  "url": "https://storage.googleapis.com/bluelines-rag-bucket/2006/S_RES_1707_2006_EN.pdf"
}