{
  "resolution_no": "1718",
  "year": "2006",
  "theme": [
    "Non-Proliferation",
    "Peace and Security",
    "Sanctions"
  ],
  "chapter": "Chapter VII",
  "charter_articles": [
    "Article 41"
  ],
  "entities": [
    "DPRK",
    "Six-Party Talks",
    "UN Security Council",
    "IAEA"
  ],
  "reporting_cycle": "every 90 days",
  "operative_authority": "Chapter VII",
  "summary": "Here is a clear and concise summary of the Security Council document:\n\nThe Security Council:\n\n- Recalls previous resolutions on the non-proliferation of nuclear, chemical, and biological weapons.\n- Expresses concern at the Democratic People's Republic of Korea's (DPRK) claim to have conducted a nuclear test on 9 October 2006.\n- Condemns the test, which poses a threat to international peace and security.\n- Demands the DPRK not conduct further nuclear tests or ballistic missile launches.\n- Demands the DPRK retract its withdrawal from the Treaty on the Non-Proliferation of Nuclear Weapons and return to the Treaty and International Atomic Energy Agency (IAEA) safeguards.\n\n Acting under Chapter VII of the Charter, the Council:\n\n1. Condemns the nuclear test and demands the DPRK not conduct further tests.\n2. Demands the DPRK not launch ballistic missiles.\n3. Demands the DPRK retract its withdrawal from the Non-Proliferation Treaty.\n4. Demands the DPRK return to the Treaty and IAEA safeguards.\n5. Requires the DPRK to suspend ballistic missile activities and re-establish a moratorium on launches.\n6. Requires the DPRK to abandon nuclear weapons and programmes, and provide IAEA transparency measures.\n7. Requires the DPRK to abandon other mass destruction weapons and ballistic missile programmes.\n\nThe Council also:\n\n8. Imposes an arms embargo on the DPRK, prohibiting the supply, sale, or transfer of:\n \n (a) Specified military equipment and \n (b) Items, materials, equipment, goods, and technology related to nuclear, chemical, and biological weapons.\nHere is a concise summary of the Security Council document 1718 (2006):\n\n**Imposing Sanctions on the DPRK**\n\nThe Security Council imposes sanctions on the Democratic People's Republic of Korea (DPRK) due to its nuclear-related, ballistic missile-related, and other weapons of mass destruction-related programs.\n\n**Prohibited Items and Activities**\n\n* The DPRK shall cease exporting and all Member States shall prohibit the procurement of:\n\t+ Items, materials, equipment, goods, and technology related to nuclear, ballistic missile, or other WMD-related programs (para 8(a)(i) and (ii))\n\t+ Luxury goods (para 8(a)(iii))\n* Member States shall prevent transfers of technical training, advice, services, or assistance related to the provision, manufacture, maintenance, or use of prohibited items (para 8(c))\n\n**Financial Measures**",
  "url": "https://storage.googleapis.com/bluelines-rag-bucket/2006/S_RES_1718_2006_EN.pdf"
}