{
  "resolution_no": "2231",
  "year": 2015,
  "theme": [
    "Iran",
    "Nuclear",
    "JCPOA"
  ],
  "chapter": "Chapter VII",
  "charter_articles": [
    "Article 41"
  ],
  "entities": [
    "Iran",
    "IAEA",
    "UN Security Council",
    "E3/EU+3"
  ],
  "reporting_cycle": "",
  "operative_authority": "UN Security Council",
  "summary": "Here is a clear and concise summary of the Security Council document:\n\nThe Security Council:\n\nRecalling previous resolutions and statements on Iran's nuclear programme, reaffirms its commitment to the Treaty on the Non-Proliferation of Nuclear Weapons.\n\nWelcomes the Joint Comprehensive Plan of Action (JCPOA) concluded on 14 July 2015, and Iran's reaffirmation that it will not seek, develop or acquire nuclear weapons.\n\nAffirms that the JCPOA marks a fundamental shift in its consideration of this issue and expresses its desire to build a new relationship with Iran.\n\nStrongly supports the International Atomic Energy Agency's (IAEA) role in verifying compliance with safeguards agreements.\n\nEndorses the JCPOA and urges its full implementation on the established timetable.\n\nCalls upon all Member States to support the implementation of the JCPOA, including by taking commensurate actions.\nHere is a summarized version of the Security Council document:\n\nThe Security Council:\n\n1. Urges all parties to implement the JCPOA and this resolution, and refrain from actions that undermine the implementation of commitments under the JCPOA.\n\n2. Requests the IAEA Director General to verify and monitor Iran's nuclear-related commitments under the JCPOA, and reaffirms Iran's cooperation with the IAEA.\n\n3. Requests the IAEA Director General to provide regular updates on Iran's implementation of its commitments under the JCPOA to the IAEA Board of Governors and the Security Council.\n\n**Terminations**\n\n4. Requests the IAEA Director General to report on Iran's actions specified in Annex V of the JCPOA, and on the Broader Conclusion that all nuclear material in Iran remains in peaceful activities.\n\n5. Decides that upon receipt of the IAEA report, the provisions of resolutions 1696 (2006), 1737 (2006), 1747 (2007), 1803 (2008), 1835 (2008), 1929 (2010), and 2224 (2015) shall be terminated.\n\n6. Decides that all States shall comply with paragraphs 1, 2, 4, and 5 and the provisions in subparagraphs (a)-(f) of paragraph 6 of Annex B for the duration specified.\n\n7. Decides that on the date ten years after the JCPOA Adoption Day, all provisions of this resolution shall be terminated.\n\n**Application of Provisions of Previous Resolutions**\n\n8. Encourages JCPOA participants to resolve issues through JCPOA procedures.\n\n9. Decides that within 30 days of receiving a notification of significant non-performance, it shall vote on a draft resolution to continue in effect the terminations.\n\n10. Decides that if the Security Council does not adopt a resolution, the provisions of previous resolutions shall apply.\n\n11. Underscores that Iran and JCPOA participants should strive to resolve issues, and expresses its intention to prevent reapplication of provisions.\n\n12. Affirms that the application of previous resolutions does not apply with retroactive effect to contracts signed before the date of application.\nHere is a summarized version of the Security Council document:\n\n15. Affirms that application of previous resolutions' provisions won't harm individuals/entities that engaged in business with Iran/Iranian entities consistent with JCPOA and this resolution, encourages Member States to mitigate unintended harm.\n\n16. Decides to review Joint Commission recommendations on proposals for nuclear-related activities, and deems them approved unless Security Council rejects within five working days.\n\n17. Requests Member States to submit proposals for nuclear-related activities to Security Council, and Joint Commission to review and provide recommendations within 20-30 working days.\n\n18. Requests Secretary-General to facilitate communications with Member States and between Security Council and Joint Commission.\n\n19. Requests IAEA and Joint Commission to consult and exchange information.\n\n20. Requests Joint Commission to review proposals for transfers/activities, recommending approval if consistent with JCPOA and this resolution.\n\n21. Exempts JCPOA participant States/Member States from measures imposed in previous resolutions for activities related to: (a) Fordow facility modification; (b) export of enriched uranium; (c) Arak reactor modernization.\n\n22. Decides that Member States engaging in exempted activities must: (a) follow JCPOA; (b) notify Committee/Joint Commission; (c) meet Guidelines requirements; (d) verify end-use/end-use location; (e) notify IAEA.\n\n23. Exempts measures imposed in previous resolutions for transfers/activities approved by Committee, related to: (a) JCPOA implementation; (b) JCPOA preparation; (c) consistency with this resolution's objectives.\n\n24. Notes provisions of paragraphs 21, 22, 23, and 27 continue if previous resolutions' provisions are applied.\n\n25. Decides to make practical arrangements for implementing this resolution.\n\n26. Urges States/UN bodies to cooperate with Security Council.\n\n27. Decides JCPOA provisions are only for its implementation between E3/EU+3 and Iran, not setting precedents for other States/international law.\nHere is a concise summary of the Security Council document:\n\nThe Security Council:\n\nRecalls measures imposed by resolution 1737 (2006) and underscores that designated persons/entities can make payments due under contracts entered into prior to listing, if conditions are met.\n\nEmphasizes that no claim shall lie against governments, persons, or entities in connection with contracts or transactions prevented by resolutions 1737 (2006), 1747 (2007), 1803 (2008), 1929 (2010), and this resolution.\n\nDecides to remain seized of the matter until termination of the provisions of this resolution.\n\nAnnex A: Joint Comprehensive Plan of Action (JCPOA)\n\nThe E3/EU+3 and Iran welcome the JCPOA, ensuring Iran's nuclear program will be exclusively peaceful.\n\nIran reaffirms it will not seek, develop, or acquire nuclear weapons.\n\nThe JCPOA allows Iran to move forward with a peaceful, indigenous nuclear program, with initial limitations followed by a gradual evolution.\n\nThe E3/EU+3 envision confidence in Iran's program through implementation of the JCPOA.\n\nThe JCPOA addresses concerns through transparency and verification measures.\n\nThe JCPOA will produce comprehensive lifting of UN Security Council sanctions, as well as multilateral and national sanctions related to Iran's nuclear program.\nThe Islamic Republic of Iran and the E3/EU+3 have decided on a Joint Comprehensive Plan of Action (JCPOA) to be endorsed by the UN Security Council. \nThe JCPOA ensures Iran's nuclear programme will be exclusively peaceful. \nIran reaffirms it will not seek, develop or acquire nuclear weapons. \nSuccessful implementation enables Iran to enjoy its right to nuclear energy for peaceful purposes under the NPT. \nThe JCPOA will lift all UN Security Council, multilateral and national sanctions related to Iran's nuclear programme. \nThe E3/EU+3 and Iran commit to implement the JCPOA in good faith and a constructive atmosphere. \nA Joint Commission will monitor implementation and address issues. \nThe IAEA will monitor and verify voluntary nuclear-related measures. \nProvisions are only for E3/EU+3 and Iran, and do not set precedents for other states or international law. \nTechnical details are in the annexes. \nThe EU, E3+3, and Iran will cooperate on peaceful nuclear energy uses. \nThe E3+3 will submit a draft resolution to the UN Security Council endorsing the JCPOA. \nProvisions will be implemented for set durations, and the E3/EU+3 and Iran will meet every 2 years to review progress.\nIran and E3/EU+3 will take voluntary measures within the timeframe detailed in the JCPOA and its Annexes.\n\n**Nuclear**\n\n* **Enrichment, Enrichment R&D, Stockpiles**\n\t1. Iran's long-term plan includes limitations on uranium enrichment and enrichment-related activities, with gradual evolution over 8 years for exclusively peaceful purposes.\n\t2. Iran will phase out IR-1 centrifuges in 10 years, maintaining 5060 IR-1 centrifuges at Natanz, with excess centrifuges and infrastructure stored under IAEA monitoring.\n\t3. Iran will conduct enrichment R&D without accumulating enriched uranium, using only IR-4, IR-5, IR-6, and IR-8 centrifuges for 10 years.\n\t4. Iran will not manufacture or assemble centrifuges, except as provided, and will replace failed centrifuges with the same type.\n\t5. For 15 years, Iran will carry out uranium enrichment-related activities exclusively in Natanz, with 3.67% enrichment, and refrain from enrichment and R&D at Fordow.\n\t6. Fordow will be converted into a nuclear, physics, and technology centre, with 1044 IR-1 centrifuges in one wing, and two cascades spinning without uranium for stable isotope production.\n\t7. Iran will keep its uranium stockpile under 300 kg of up to 3.67% enriched uranium hexafluoride (UF6) for 15 years, with excess quantities sold or down-blended.\n\n**Arak, Heavy Water, Reprocessing**\n\n* 8. Iran will redesign and rebuild a modernized heavy water research reactor in Arak, using fuel enriched up to 3.67%, in an international partnership.\n* 9. Iran plans to rely on light water for future power and research reactors with international cooperation.\n* 10. No additional heavy water reactors or accumulation of heavy water in Iran for 15 years, with excess heavy water available for export.\n* 11. Iran intends to ship out all spent fuel for all future and present power and research nuclear reactors.\n* 12. For 15 years, Iran will not engage in spent fuel reprocessing or construction of a facility capable of spent fuel reprocessing.\nHere is a summarized version of the document:\n\n**Nuclear-Related Measures**\n\n* Iran will not engage in reprocessing or reprocessing R&D activities leading to a spent fuel reprocessing capability, except for separation activities aimed at producing medical and industrial radio-isotopes.\n* Iran will implement the \"Roadmap for Clarification of Past and Present Outstanding Issues\" agreed with the IAEA, and complete it by 15 October 2015.\n* Iran will allow the IAEA to monitor the implementation of voluntary measures, including a long-term presence in Iran, monitoring of uranium ore concentrate, and containment and surveillance of centrifuge rotors and bellows.\n\n**Transparency and Confidence Building Measures**\n\n* Iran will apply the Additional Protocol to its Comprehensive Safeguards Agreement and proceed with its ratification.\n* Iran will fully implement the modified Code 3.1 of the Subsidiary Arrangements to its Safeguards Agreement.\n\n**Restrictions on Nuclear Explosive Device**\n\n* Iran will not engage in activities that could contribute to the development of a nuclear explosive device, including uranium or plutonium metallurgy activities.\n\n**Procurement Channel**\n\n* Iran will cooperate and act in accordance with the procurement channel in this JCPOA, as detailed in Annex IV.\n\n**Sanctions**\n\n* The UN Security Council resolution endorsing this JCPOA will terminate all provisions of previous UN Security Council resolutions on the Iranian nuclear issue simultaneously with the IAEA-verified implementation of agreed nuclear-related measures by Iran.\n* The EU will terminate all provisions of the EU Regulation implementing all nuclear-related economic and financial sanctions, including related designations, simultaneously with the IAEA-verified implementation of agreed nuclear-related measures by Iran.\nHere is a concise summary of the document:\n\nThe Security Council document 2231 (2015) outlines sanctions relief for Iran. \n\n20. The EU will terminate all provisions of the EU Regulation implementing EU proliferation-related sanctions 8 years after Adoption Day or when the IAEA concludes that all nuclear material in Iran remains in peaceful activities.\n\n21. The US will cease applying sanctions specified in Annex II, covering areas including: \n- Financial and banking transactions with Iranian banks\n- Transactions in Iranian Rial\n- Provision of US banknotes to the Government of Iran\n- Bilateral trade limitations on Iranian revenues abroad\n- Purchase of Iranian sovereign debt\n- Financial messaging services\n- Underwriting services, insurance, or reinsurance\n- Efforts to reduce Iran’s crude oil sales\n- Investment in Iran’s oil, gas, and petrochemical sectors\n- Purchase, sale, or transportation of petroleum products from Iran\n- Export of refined petroleum products to Iran\n- Transactions with Iran’s energy, shipping, and shipbuilding sectors\n- Trade in gold and precious metals\n- Trade with Iran in graphite, raw metals, coal, and software\n- Sale of goods and services used in connection with Iran’s automotive sector\n\n22. The US will allow the sale of commercial passenger aircraft and related parts and services to Iran and license non-US persons to engage in activities with Iran.\n\n23. Eight years after Adoption Day or when the IAEA concludes that all nuclear material in Iran remains in peaceful activities, the US will seek legislative action to terminate or modify sanctions.\n\n24. The E3/EU and the US specify a full list of nuclear-related sanctions or restrictive measures in Annex II and will lift them according to Annex V.\n\n25. If a US state or local law prevents implementation of sanctions lifting, the US will take steps to achieve implementation, and encourage officials to refrain from actions inconsistent with the change in policy.\nThe EU will refrain from re-introducing or re-imposing terminated sanctions under JCPOA, except through the dispute resolution process. The US will make best efforts to sustain JCPOA and prevent interference with Iran's benefit from sanctions lifting. The US Administration will refrain from re-introducing or re-imposing sanctions specified in Annex II and from imposing new nuclear-related sanctions. Re-introduction or re-imposition of such sanctions or new sanctions would be grounds for Iran to cease performing its commitments.\n\nThe E3/EU+3 and Iran commit to implement JCPOA in good faith and a constructive atmosphere. Senior Government officials will support successful implementation, including in public statements. The E3/EU+3 will take measures to lift sanctions and refrain from imposing exceptional or discriminatory regulatory requirements.\n\nThe EU, its Member States, and the US will issue guidelines and statements on lifted sanctions and consult with Iran. They will refrain from policies that directly and adversely affect normalisation of trade and economic relations with Iran. The E3/EU+3 will not apply sanctions to persons or entities engaging in activities covered by lifted sanctions.\n\nThe EU and its Member States will terminate implementation of measures applicable to designated entities and individuals, and the US will remove designations of certain entities and individuals. The E3/EU+3 and Iran will engage in joint projects on peaceful nuclear technology. They will agree on steps to ensure Iran's access in areas of trade, technology, finance, and energy, and explore possible areas for cooperation.\nHere is a concise summary of the document:\n\n**IMPLEMENTATION PLAN**\n\nThe implementation of JCPOA commitments by Iran and E3/EU+3 will follow a sequence with specific milestones:\n\n* **Finalisation Day**: Negotiations conclude, and the resolution endorsing JCPOA is submitted to the UN Security Council.\n* **Adoption Day**: 90 days after endorsement by the UN Security Council, JCPOA comes into effect, and participants make arrangements for implementation.\n* **Implementation Day**: IAEA verifies Iran's nuclear-related measures, EU and US take actions, and UN Security Council resolution actions occur.\n* **Transition Day**: 8 years after Adoption Day or when IAEA confirms Iran's nuclear material is in peaceful activities; EU and US take actions, and Iran seeks ratification of the Additional Protocol.\n* **UN Security Council resolution Termination Day**: 10 years from Adoption Day, UN Security Council resolution terminates.\n\n**DISPUTE RESOLUTION MECHANISM**\n\nIf a participant believes another is not meeting commitments:\n\n* The issue is referred to the Joint Commission for resolution within 15 days.\n* If unresolved, the issue is referred to Ministers of Foreign Affairs for 15 days.\n* An Advisory Board provides a non-binding opinion within 15 days.\n* If still unresolved, the complaining participant can cease performing commitments and/or notify the UN Security Council.\n* The UN Security Council votes on a resolution to continue sanctions lifting within 30 days of notification; if not adopted, previous UN Security Council resolutions are re-imposed, with some exceptions.\nHere is a summarized version of the document:\n\n**JCPOA Annex I – Nuclear-related measures**\n\n**A. General**\n\n* The sequence of implementation of commitments is specified in Annex V to the JCPOA.\n* Durations of commitments are from Implementation Day unless otherwise specified.\n\n**B. Arak Heavy Water Research Reactor**\n\n* Iran will modernize the Arak heavy water research reactor to support peaceful nuclear research and radioisotopes production.\n* The reactor will be redesigned and rebuilt based on an agreed conceptual design to minimize plutonium production and not produce weapon-grade plutonium.\n* The power of the redesigned reactor will not exceed 20 MWth.\n\n**Implementation Details**\n\n* Iran will not pursue construction of the existing unfinished reactor based on its original design.\n* The existing calandria will be made inoperable by filling openings with concrete.\n* Iran will maximize the use of existing infrastructure.\n* A Working Group composed of E3/EU+3 participants will facilitate the redesign and rebuilding of the reactor.\n* Iran and the Working Group will cooperate to develop the final design and review conformity with international safety standards.\n\n**Fuel and Operation**\n\n* The redesigned reactor will use up to 3.67% enriched uranium.\n* The international partnership will fabricate the initial fuel core load outside Iran.\n* Iran will not produce or test natural uranium pellets, fuel pins or fuel assemblies for the original reactor design.\n\n**International Cooperation and Monitoring**\n\n* E3/EU+3 parties will support the purchase and transfer of necessary materials and equipment.\n* The IAEA will monitor the construction and report to the Working Group.\n* The redesigned reactor and subsidiary laboratories will be submitted to the Joint Commission for review and endorsement.\nHere is a summarized version of the document:\n\n**Redesign of Arak Reactor (Paragraphs 10-13)**\n\n* Iran will redesign the Arak reactor to a modernized version that can only use uranium fuel.\n* Spent fuel from the redesigned reactor will be shipped out of Iran for treatment or disposition.\n* Iran will submit the reactor's design information to the IAEA and operate it under IAEA monitoring.\n* The Fuel Manufacturing Plant will only produce fuel assemblies for light water reactors and reloads for the modernized Arak reactor.\n\n**Heavy Water Production Plant (Paragraphs 14-15)**\n\n* Excess heavy water beyond Iran's needs will be exported to the international market.\n* Iran will inform the IAEA about the inventory and production of the Heavy Water Production Plant and allow IAEA monitoring.\n\n**Other Reactors (Paragraphs 16-17)**\n\n* Iran will rely only on light water for future nuclear power and research reactors.\n* Iran intends to ship out all spent fuel for further treatment or disposition.\n\n**Spent Fuel Reprocessing Activities (Paragraphs 18-26)**\n\n* For 15 years, Iran will not engage in spent fuel reprocessing or R&D activities.\n* Iran will not reprocess spent fuel except for irradiated enriched uranium targets for medical and peaceful industrial purposes.\n* Iran will not develop, acquire, or build facilities capable of separating plutonium, uranium, or neptunium from spent fuel.\n* Hot cells and shielded cells will be limited in size and use.\n* Iran will not produce or acquire plutonium or uranium metals or their alloys.\n* Iran will not produce separated plutonium, highly enriched uranium, or uranium-233.\n* Exceptions for laboratory standards, instruments, and medical/industrial purposes are allowed.\nHere is a summarized version of the document:\n\n**ENRICHMENT CAPACITY**\n\n* Iran will maintain its enrichment capacity at no more than 5,060 IR-1 centrifuge machines in 30 cascades at the Natanz Fuel Enrichment Plant (FEP) for 10 years (para. 27).\n* Iran will limit uranium enrichment to up to 3.67 percent for 15 years (para. 28).\n* Excess centrifuges and infrastructure will be stored at Natanz in Hall B of FEP under IAEA continuous monitoring (para. 29).\n\n**CENTRIFUGES RESEARCH AND DEVELOPMENT**\n\n* Iran will conduct enrichment R&D without accumulating enriched uranium (para. 32).\n* For 10 years, Iran's enrichment R&D with uranium will only include IR-4, IR-5, IR-6, and IR-8 centrifuges (para. 32).\n* Specific centrifuge testing and R&D activities are allowed, including:\n\t+ IR-2m, IR-4, IR-5, IR-6, IR-6s, IR-7, and IR-8 centrifuges (para. 32).\n\t+ 164-machine IR-2m and IR-4 cascades at PFEP (paras. 33-34).\n\t+ Single IR-4 centrifuge machine and IR-4 centrifuge cascade of up to 10 centrifuge machines for 10 years (para. 35).\n\t+ Single IR-5 centrifuge machine for 10 years (para. 36).\n\t+ IR-6 and IR-8 centrifuges with specific testing and R&D timelines (paras. 37-38).\n* For 15 years, Iran will conduct all testing of centrifuges with uranium only at the PFEP and mechanical testing only at the PFEP and Tehran Research Centre (para. 40).\n\n**ADDITIONAL PROVISIONS**\n\n* The IAEA will confirm the failed or damaged status of centrifuge machines before removal (para. 30).\n* Iran will remove all centrifuges except those needed for testing and make the IR-1 cascade (No.1) inoperable (para. 41).\n* Iran will adapt PFEP to R&D activities and maintain cascade infrastructure for testing of single centrifuges and small and intermediate cascades (paras. 42-43).\nH. FORDOW FUEL ENRICHMENT PLANT \n\nThe Fordow Fuel Enrichment Plant (FFEP) will be converted into a nuclear, physics, and technology centre with international collaboration in agreed areas of research. \n\nIran will not conduct uranium enrichment or related R&D and will have no nuclear material at FFEP for 15 years. \n\nFor 15 years, Iran will maintain no more than 1044 IR-1 centrifuge machines at one wing of FFEP. \n\nTwo cascades will be modified for stable isotope production in joint partnership with Russia. \n\nTwo cascades will be placed in an idle state, not spinning. \n\nIran will remove excess centrifuges and infrastructure from both wings of FFEP and store them at Natanz under IAEA monitoring. \n\nCentrifuges from idle cascades can be used for replacement of failed or damaged centrifuges in stable isotope production. \n\nIran will limit stable isotope production activities to FFEP for 15 years using no more than 348 IR-1 centrifuges. \n\nThe IAEA will establish a baseline for uranium legacy and have regular access to FFEP.\n\n I. OTHER ASPECTS OF ENRICHMENT \n\nIran will abide by its voluntary commitments on enrichment and enrichment R&D plan. \n\nThe IAEA will confirm annually that Iran's enrichment and R&D activities are in line with this plan. \n\nIran will install necessary infrastructure for IR-8 at Natanz after year 10.\n\n Templates and procedures for describing centrifuge types and measuring performance data need to be agreed upon.\n\nJ. URANIUM STOCKS AND FUELS \n\nIran will maintain a total enriched uranium stockpile of no more than 300 kg of up to 3.67% enriched uranium hexafluoride for 15 years.\n\nExcess enriched uranium will be down-blended or sold on the international market. \n\nIran will permit IAEA to share the content of the enrichment and enrichment R&D plan with the Joint Commission participants.\nHere is a summarized version of the document:\n\n**Section on Uranium Stockpile and Fuel Fabrication**\n\n* Iran will sell its excess enriched uranium stockpile (over 300 kg UF6) to an entity outside Iran in exchange for natural uranium.\n* The E3/EU+3 will facilitate this contract.\n* Iran may also sell excess enriched uranium to the IAEA fuel bank in Kazakhstan.\n* Uranium oxide enriched to 5-20% will be fabricated into fuel plates for the Tehran Research Reactor (TRR) or transferred outside Iran.\n* Scrap oxide and other forms will be transferred outside Iran or diluted to 3.67% or less.\n\n**Fuel Fabrication and Stockpile Limits**\n\n* Russian-designed fuel assemblies for Russian-supplied reactors in Iran will not count against the 300 kg UF6 stockpile limit.\n* Enriched uranium in fabricated fuel assemblies from other sources will not count against the limit if certified by the fuel supplier and Iranian authority.\n* A Technical Working Group will establish criteria for assessing whether fabricated fuel can be readily converted to UF6.\n\n**Fuel Supply for TRR and Enriched Uranium Targets**\n\n* Iran will seek a commercial contract for fuel for the TRR and enriched uranium targets.\n* If no contract is concluded, the E3/EU+3 will supply 19.75% enriched uranium oxide (U3O8) in increments.\n\n**Centrifuge Manufacturing**\n\n* Iran will only produce centrifuges to meet enrichment and enrichment R&D requirements.\n* Iran will use stored IR-1 centrifuge machines to replace failed or damaged machines.\n* Iran will manufacture IR-6 and IR-8 centrifuges without rotors from year 8-10.\n\n**Additional Protocol and Modified Code 3.1**\n\n* Iran will notify the IAEA of provisional application of the Additional Protocol and seek ratification.\n* Iran will implement the Modified Code 3.1 of the Subsidiary Arrangement to Iran's Safeguards Agreement.\nHere is a concise summary of the document:\n\n**Past and Present Issues of Concern**\n\n* Iran will complete all activities outlined in paragraphs 2, 4, 5, and 6 of the \"Roadmap for Clarification of Past and Present Outstanding Issues\" as verified by the IAEA.\n\n**Modern Technologies and Long-term Presence of IAEA**\n\n* Iran will permit the IAEA to use online enrichment measurement and electronic seals, and other modern technologies for 15 years or longer.\n* Iran will facilitate a long-term IAEA presence, including issuing long-term visas and providing working space at nuclear sites.\n* Iran will increase the number of designated IAEA inspectors to 130-150 within 9 months.\n\n**Transparency related to Uranium Ore Concentrate (UOC)**\n\n* Iran will permit the IAEA to monitor uranium ore concentrate production and transfer to the uranium conversion facility in Esfahan or other future facilities for 25 years.\n* Iran will provide the IAEA with necessary information to verify production and inventory of uranium ore concentrate.\n\n**Transparency related to Enrichment**\n\n* Iran will permit the IAEA to implement continuous monitoring of stored centrifuges and infrastructure for 15 years.\n* Iran will allow daily access to relevant buildings at Natanz, including all parts of the FEP and PFEP, for 15 years.\n* Natanz will be the sole location for Iran's uranium enrichment related activities, including safeguarded R&D, for 15 years.\n\n**Access**\n\n* Requests for access will be made in good faith, with due observance of Iran's sovereign rights.\n* The IAEA will take precautions to protect commercial, technological, and industrial secrets.\n* If the IAEA has concerns regarding undeclared nuclear materials or activities, it will provide Iran with the basis for such concerns and request clarification.\n* If Iran's explanations do not resolve the IAEA's concerns, the IAEA may request access to locations for verification.\nHere is a summarized version of the document:\n\n**IAEA Access and Resolving Concerns**\n\n* Iran will provide IAEA access to specified locations within 14 days of the original request.\n* Iran, in consultation with the Joint Commission, will resolve IAEA concerns through agreed-upon means.\n* If no agreement is reached, the Joint Commission will advise on resolving concerns within 7 days, and Iran will implement necessary means within 3 additional days.\n\n**Centrifuge Component Manufacturing Transparency**\n\n* Iran and IAEA will ensure containment and surveillance of centrifuge rotor tubes and bellows for 20 years.\n* Iran will provide IAEA with an initial inventory of centrifuge rotor tubes and bellows and permit verification.\n* Iran will declare locations and equipment used for centrifuge production and permit IAEA monitoring.\n\n**Other Uranium Isotope Separation Activities**\n\n* For 10 years, Iran's uranium isotope separation activities will be based on gaseous centrifuge technology.\n* IAEA will have access to verify Iran's compliance.\n\n**Activities Contributing to Nuclear Explosive Device Design**\n\n* Iran will not engage in activities that could contribute to nuclear explosive device design, including:\n\t+ Designing or simulating nuclear explosive devices.\n\t+ Developing or acquiring multi-point explosive detonation systems.\n\t+ Developing or acquiring explosive diagnostic systems.\n\t+ Developing or acquiring explosively driven neutron sources. \n\t+ Unless approved by the Joint Commission for non-nuclear purposes and subject to monitoring.\nHere is a summarized version of the document:\n\n**Fundamental Principles for the Modernization of the Arak Research Reactor (IR-40)**\n\n* Maximize use of current infrastructure of original design\n* Convert to a multi-purpose research reactor for radio-isotope production, materials testing, and neutronic experiments\n* Use heavy water as coolant, moderator, and reflector; light water may be used as an annular ring for safety\n* ~78 fuel assemblies with up to 3.67% enriched UO2 fuel\n* Power limited to 20 MWth\n* Addition of beam tubes, in-core and lateral irradiation channels, and a central channel with passive cooling\n\n**Preliminary Characteristics:**\n\n* Core power: 20 MW\n* Fuel: UO2 with up to 3.67% enrichment\n* Coolant/Moderator/Reflector: Heavy water (D2O)\n* Core configuration: Hexagonal lattice with ~78 fuel assemblies\n* Core diameter: ~240 cm; active length: ~110 cm\n* Thermal flux: ~3•1014; Fast flux: ~1•1014\n* Pressure: 0.33 MPa; flow rate: 610 kg/s (coolant), 42 kg/s (moderator)\nThe European Union and EU Member States commit to terminate all provisions of Council Regulation (EU) No 267/2012 and Council Decision 2010/413/CFSP implementing nuclear-related sanctions or restrictive measures as specified in Sections 1.1-1.10, and to terminate or amend national implementing legislation as required, in accordance with Annex V.\n\nThe commitments include:\n\nA. Terminating sanctions related to:\n1.1. Financial, banking and insurance measures (prohibition on financial transfers, sanctions on banking activities, insurance, financial messaging services, financial support for trade, grants, and Government of Iran public-guaranteed bonds)\n1.2. Oil, gas and petrochemical sectors (import of oil and gas, petrochemical products, export of key equipment, investment, and associated services)\n1.3. Shipping, shipbuilding and transport sectors (sanctions related to shipping, shipbuilding, and transport)\n1.4. Gold, other precious metals, banknotes and coinage (sanctions on gold, precious metals, diamonds, banknotes, and coinage)\n1.5. Nuclear proliferation-related measures (sanctions related to proliferation-sensitive nuclear activities)\n\nThe sequence of implementation of these commitments is specified in Annex V (Implementation Plan) to the Joint Comprehensive Plan of Action (JCPOA).\nHere is a summarized version of the document:\n\n**Section 1: EU Sanctions and Restrictive Measures**\n\n1.1. Nuclear-related sanctions (Articles 1 to 1.8)\n1.2-1.5. (Not mentioned)\n1.6. Metals: Sanctions on metals and associated services (Articles 4e, 4f, 15a, 15b, 15c, and Annex VIIB of Council Regulation)\n1.7. Software: Sanctions on software and associated services (Articles 4i, 4j, 10d, 10e, 10f, and Annex VIIA of Council Regulation)\n1.8. Arms: Sanctions on arms and associated services (Articles 1(1)(c), 3, and 3 of Council Decision)\n1.9. Listing of persons, entities, and bodies (asset freeze and visa ban)\n\t* 1.9.1.1-1.9.1.6: Various categories of listed individuals and entities\n1.10. Other provisions: remaining provisions of Council Decision and Council Regulation\n\n**Section 2: Representation of EU Sanctions**\n\nThe EU represents that Section 1 lists all EU nuclear-related sanctions or restrictive measures, which will be lifted according to Annex V.\n\n**Section 3: Effects of Lifting EU Economic and Financial Sanctions**\n\nAs a result of lifting sanctions, the following activities will be allowed:\n\n3.1. (General statement)\n3.2. Financial, banking, and insurance measures:\n\t* 3.2.1: Transfers of funds between EU and Iranian persons without authorization or notification\n\t* 3.2.2: Opening of new branches, subsidiaries, or representative offices of Iranian banks in EU territories\n\t* 3.2.3: Provision of insurance or reinsurance to Iran or Iranian entities\n\t* 3.2.4: Supply of specialized financial messaging services to Iranian persons\n\t* 3.2.5: Entering into commitments to provide financial support for trade with Iran\nThe Security Council document 2231 (2015) outlines specific sanctions relief measures related to Iran. \n\nThe following transactions are allowed: \n\n3.2.6. Sale or purchase of public or public-guaranteed bonds to and from Iran, the Government of Iran, the Central Bank of Iran, or Iranian banks and financial institutions.\n\nThe following sectors have specific allowances and restrictions:\n\n3.3. Oil, gas and petrochemical sectors: \n- 3.3.1. Import, purchase, swap or transport of Iranian crude oil and petroleum products.\n- 3.3.2. Sale, supply, transfer or export of equipment or technology for oil, gas and petrochemical industries.\n- 3.3.3. Granting of financial loans or credits to Iranian persons in these sectors.\n\n3.4. Shipping, shipbuilding and transport sectors: \n- 3.4.1. Sale, supply, transfer or export of naval equipment and technology for ship building.\n- 3.4.2. Access to EU airports for Iranian cargo flights.\n- 3.4.3. Cessation of inspection, seizure and disposal of cargoes to and from Iran.\n- 3.4.4. Provision of bunkering or ship supply services to Iranian-owned or contracted vessels.\n\n3.5. Gold, other precious metals, banknotes and coinage: \n- 3.5.1. Sale, supply, purchase, export, transfer or transport of gold and precious metals to/from Iran.\n- 3.5.2. Delivery of newly printed or minted Iranian banknotes and coinage to the Central Bank of Iran.\n\n3.6. Metals: \n- 3.6.1. Sale, supply, transfer or export of graphite and raw or semi-finished metals to Iran.\n\n3.7. Software: \n- 3.7.1. Sale, supply, transfer or export of software for integrating industrial processes to Iran.\n\n3.8. Listing of persons, entities and bodies: \n- 3.8.1. Release of funds and economic resources of delisted persons, entities and bodies.\n- 3.8.2. Allowing entry into or transit through EU territories of delisted individuals.\nThe United States commits to cease the application of, and to seek legislative action to terminate or modify to effectuate the termination of, all nuclear-related sanctions as specified in Sections 4.1-4.9, and to terminate Executive Orders 13574, 13590, 13622, and 13645, and Sections 5-7 and 15 of Executive Order 13628, in accordance with Annex V.\n\nThe sanctions to be ceased and terminated include:\n\n**Financial and Banking Measures**\n\n* Sanctions on transactions with individuals and entities listed in Attachment 3, including the Central Bank of Iran, Iranian financial institutions, and certain designated individuals and entities (Section 4.1.1)\n* Sanctions on the Iranian Rial (Section 4.1.2)\n* Sanctions on the provision of US banknotes to the Government of Iran (Section 4.1.3)\n* Bilateral trade limitations on Iranian revenues held abroad (Section 4.1.4)\n* Sanctions on the purchase, subscription to, or facilitation of the issuance of Iranian sovereign debt (Section 4.1.5)\n* Sanctions on financial messaging services to the CBI and Iranian financial institutions (Section 4.1.6)\n* Sanctions on associated services for each of the categories above (Section 4.1.7)\n\n**Insurance Measures**\n\n* Sanctions on the provision of underwriting services, insurance, or re-insurance in connection with activities consistent with this JCPOA (Section 4.2.1)\n\n**Energy and Petrochemical Sectors**\n\n* Efforts to reduce Iran's crude oil sales, including limitations on quantities sold and nations that can purchase Iranian crude oil (Section 4.3.1)\n* Sanctions on investment, including participation in joint ventures, goods, services, information, technology, and technical expertise and support for Iran's oil, gas, and petrochemical sectors (Section 4.3.2)\nHere is a summarized version of the document:\n\n**Sanctions on Iran**\n\nThe document outlines various sanctions on Iran, including:\n\n**4.3 Energy Sector Sanctions**\n\n* Sanctions on purchase, acquisition, sale, transportation, or marketing of petroleum, petrochemical products, and natural gas from Iran (Sections 212(a) TRA, 1244(c)(1), (d) and (h)(2) IFCA)\n* Sanctions on export, sale, or provision of refined petroleum products and petrochemical products to Iran (ISA Section 5(a)(3), NDAA Sections 1245(d)(1) and (3))\n* Sanctions on transactions with Iran's energy sector, including NIOC, NICO, and NITC (NDAA Sections 1245(d)(1) and (3))\n\n**4.4 Shipping, Shipbuilding, and Port Sectors**\n\n* Sanctions on transactions with Iran's shipping and shipbuilding sectors and port operators (TRA Sections 211(a) and 212(a), IFCA Sections 1244(c)(1) and (d))\n\n**4.5 Gold and Other Precious Metals**\n\n* Sanctions on Iran's trade in gold and other precious metals (NDAA Sections 1245(d)(1) and (3), IFCA Sections 1244(c)(1), 1245(a)(1)(A) and (c))\n\n**4.6 Software and Metals**\n\n* Sanctions on trade with Iran in graphite, raw or semi-finished metals, coal, and software for integrating industrial processes (NDAA Sections 1245(d)(1) and (3), IFCA Sections 1244(c)(1), 1245(a)(1)(B)-(C) and (c))\n\n**4.7 Automotive Sector**\n\n* Sanctions on sale, supply, or transfer of goods and services used in connection with Iran's automotive sector (NDAA Sections 1245(d)(1) and (3), IFCA Sections 1244(c)(1), 1245(a)(1)(B), (a)(1)(C)(i)(II), (a)(1)(C)(ii)(II) and (c))\n\n**4.8 Designations and Other Sanctions Listings**\n\n* Removal of individuals and entities from the Specially Designated Nationals and Blocked Persons List (SDN List), the Foreign Sanctions Evaders List, and/or the Non-SDN Iran Sanctions Act List\n\n**4.9 Nuclear Proliferation-Related Measures**\n\n* Sanctions under the Iran, North Korea and Syria Nonproliferation Act on acquisition of nuclear-related commodities and services\n* Sanctions on joint ventures relating to mining, production, or transportation of uranium\n\n**5. Other Trade Measures**\n\n* The United States commits to allow for the sale of commercial passenger aircraft and related parts and services to Iran by licensing exports, re-exports, sales, leases, or transfers to Iran of commercial passenger aircraft for exclusively civil aviation end-use.\nThe document outlines the sanctions relief to be provided to Iran as part of the Joint Comprehensive Plan of Action (JCPOA). \n\n5.1.1 The US will license the export, re-export, sale, lease or transfer to Iran of spare parts and components for commercial passenger aircraft, and associated services, provided that licensed items and services are used exclusively for commercial passenger aviation.\n\n5.1.2 The US will license non-U.S. entities that are owned or controlled by a U.S. person to engage in activities with Iran that are consistent with this JCPOA.\n\n5.1.3 The US will license the importation into the United States of Iranian-origin carpets and foodstuffs, including pistachios and caviar.\n\n6. The US represents that the provisions listed in Section 4 constitute the full and complete list of all U.S. nuclear-related sanctions.\n\n7. Effects of the lifting of U.S. economic and financial sanctions: \n\n7.1 As a result of the lifting of sanctions, beginning on implementation day, such sanctions, including associated services, would not apply to non-U.S. persons who carry out certain activities.\n\n7.2 Financial and banking measures: Engage in activities, including financial and banking transactions, with the Government of Iran, the Central Bank of Iran, Iranian financial institutions and other Iranian persons.\n\n7.3 Insurance measures: Provide underwriting services, insurance, or re-insurance in connection with activities consistent with this JCPOA.\n\n7.4 Energy and petrochemical sectors: Engage in activities with Iran’s energy sector, including purchase, acquisition, sale, transport or market petroleum, petroleum products, petrochemical products or natural gas to or from Iran.\n\n7.5 Shipping, shipbuilding and port sectors: Own, operate, control or insure a vessel used to transport crude oil, petroleum products to or from Iran; operate a port in Iran.\n\n7.6 Gold and other precious metals: Sell, supply, export or transfer, directly or indirectly, to or from Iran, gold and other precious metals.\nThe Security Council document 2231 (2015) outlines several provisions related to the sale, supply, and transfer of certain goods and services to or from Iran. \n\nThe document allows for:\n- The sale, supply, or transfer of graphite, raw or semi-finished metals, coal, and software for integrating industrial processes to or from Iran in connection with activities consistent with the JCPOA, including trade with individuals and entities listed in Attachment 3.\n- The provision of services, including security, insurance, and transportation, for the foregoing.\n- Financial transactions or provision of services for the sale, supply, or transfer of such materials to the energy, petrochemical, shipping, and shipbuilding sectors of Iran, and Iranian ports.\n- Transactions for the sale, supply, or transfer to Iran of goods and services used in connection with the automotive sector of Iran.\n- The removal of designations and/or sanctions as described in Section 4.8.1, ceasing the application of secondary sanctions for transactions with individuals and entities set out in Attachment 3, and unblocking of property and interests in property within U.S. jurisdiction for individuals and entities set out in Attachment 3.\n\nAttachment 1 lists persons, entities, and bodies set out in Annex II to Council Decision 2010/413/CFSP and Annex IX to Council Regulation (EU) No 267/2012, including companies such as Acena Shipping Company Limited, Advance Novel, Aghajari Oil & Gas Production Company, and Arian Bank, among others.\nThis document appears to be a list of entities, likely related to sanctions or other regulatory actions, as indicated by the reference to 2231 (2015), which is a UN Security Council Resolution. The list includes:\n\nCompanies:\n- CONCEPT GIANT LTD\n- COOPERATIVE DEVELOPMENT BANK\n- CRYSTAL SHIPPING FZE\n- DAMALIS MARINE CORPORATION\n- DARYA CAPITAL ADMINISTRATION GMBH\n- DARYA DELALAN SEFID KHAZAR SHIPPING COMPANY\n- DELTA KARA NAVIGATION LTD\n- DELTA NARI NAVIGATION LTD\n- DIAMOND SHIPPING SERVICES\n- DORKING SHIPPING COMPANY LTD\n- EAST OIL & GAS PRODUCTION COMPANY\n- EDBI EXCHANGE COMPANY\n- EDBI STOCK BROKERAGE COMPANY\n- EFFINGHAM SHIPPING COMPANY LTD\n- EIGHTH OCEAN ADMINISTRATION GMBH\n- EIGHTH OCEAN GMBH & CO. KG\n- ELBRUS LTD\n- ELCHO HOLDING LTD\n- ELEGANT TARGET DEVELOPMENT LIMITED\n- ELEVENTH OCEAN ADMINISTRATION GMBH\n- ELEVENTH OCEAN GMBH & CO. KG\n- EMKA COMPANY\n- EPSILON NARI NAVIGATION LTD\n- E-SAIL A.K.A.E-SAIL SHIPPING COMPANY\n- ETA NARI NAVIGATION LTD\n- ETERNAL EXPERT LTD.\n- EUROPÄISCH-IRANISCHE HANDELSBANK\n- EXPORT DEVELOPMENT BANK OF IRAN\n- FAIRWAY SHIPPING\n- FASIRUS MARINE CORPORATION\n- FATSA\n- FIFTEENTH OCEAN ADMINISTRATION GMBH\n- FIFTEENTH OCEAN GMBH & CO. KG\n- FIFTH OCEAN ADMINISTRATION GMBH\n- FIFTH OCEAN GMBH & CO. KG\n- FIRST ISLAMIC INVESTMENT BANK\n- FIRST OCEAN ADMINISTRATION GMBH\n- FIRST OCEAN GMBH & CO. KG\n- FIRST PERSIAN EQUITY FUND\n- FOURTEENTH OCEAN ADMINISTRATION GMBH\n- FOURTEENTH OCEAN GMBH & CO. KG\n- FOURTH OCEAN ADMINISTRATION GMBH\n- FOURTH OCEAN GMBH & CO. KG\n- FUTURE BANK BSC\n- GACHSARAN OIL & GAS COMPANY\n- GALLIOT MARITIME INCORPORATION\n- GAMMA KARA NAVIGATION LTD\n- GIANT KING LIMITED\n- GOLDEN CHARTER DEVELOPMENT LTD.\n- GOLDEN SUMMIT INVESTMENTS LTD.\n- GOLDEN WAGON DEVELOPMENT LTD.\n- GOMSHALL SHIPPING COMPANY LTD\n- GOOD LUCK SHIPPING COMPANY LLC\n- GRAND TRINITY LTD.\n- GREAT EQUITY INVESTMENTS LTD.\n- GREAT METHOD LTD\n- GREAT PROSPECT INTERNATIONAL LTD.\n- HAFIZ DARYA SHIPPING LINES\n- HANSEATIC TRADE TRUST & SHIPPING GMBH\n- HARVEST SUPREME LTD.\n- HARZARU SHIPPING\n- HELIOTROPE SHIPPING LIMITED\n- HELIX SHIPPING LIMITED\n- HK INTERTRADE COMPANY LTD\n- HONG TU LOGISTICS PRIVATE LIMITED\n- HORSHAM SHIPPING COMPANY LTD\n- IFOLD SHIPPING COMPANY LIMITED\n- INDUS MARITIME INCORPORATION\n- INDUSTRIAL DEVELOPMENT & RENOVATION ORGANIZATION\n- INSIGHT WORLD LTD\n- INTERNATIONAL SAFE OIL\n- IOTA NARI NAVIGATION LIMITED\n- IRAN ALUMINIUM COMPANY\n- IRAN FUEL CONSERVATION ORGANIZATION\n- IRAN INSURANCE COMPANY\n- IRAN LIQUEFIED NATURAL GAS CO.\n- IRANIAN OFFSHORE ENGINEERING & CONSTRUCTION CO\n- IRANIAN OIL COMPANY LIMITED\n- IRANIAN OIL PIPELINES AND TELECOMMUNICATIONS COMPANY (IOPTC)\n- IRANIAN OIL TERMINALS COMPANY\n- IRANO MISR SHIPPING COMPANY\n- IRINVESTSHIP LTD\n- IRISL (MALTA) LTD\n- IRISL EUROPE GMBH\n- IRISL MARINE SERVICES AND ENGINEERING COMPANY\n- IRISL MARITIME TRAINING INSTITUTE\n- IRITAL SHIPPING SRL\n- ISI MARITIME LIMITED\n- ISIM AMIN LIMITED\n- ISIM ATR LIMITED\n- ISIM OLIVE LIMITED\n- ISIM SAT LIMITED\n- ISIM SEA CHARIOT LTD\n- ISIM SEA CRESCENT LTD\n- ISIM SININ LIMITED\n\nIndividuals:\n- DAJMAR, Mohammad Hossein\n- FAQIHIAN, Dr Hoseyn\n- GOLPARVAR, Gholam Hossein\nThe Security Council document 2231 (2015) lists the following entities and individuals subject to sanctions:\n\nEntities:\n\n1. ISIM TAJ MAHAL LTD\n2. ISIM TOUR COMPANY LIMITED\n3. ISLAMIC REPUBLIC OF IRAN SHIPPING LINES\n4. JACKMAN SHIPPING COMPANY\n5. KALA NAFT\n6. KALAN KISH SHIPPING COMPANY LTD\n7. KAPPA NARI NAVIGATION LTD\n8. KARA SHIPPING AND CHARTERING GMBH\n9. KAROON OIL & GAS PRODUCTION COMPANY\n10. KAVERI MARITIME INCORPORATION\n11. KAVERI SHIPPING LLC\n12. KEY CHARTER DEVELOPMENT LTD\n13. KHALILIPOUR, Said Esmail\n14. KHANCHI, Ali Reza\n15. KHAZAR EXPL & PROD CO\n16. KHAZAR SHIPPING LINES\n17. KHEIBAR COMPANY\n18. KING PROSPER INVESTMENTS LTD\n19. KINGDOM NEW LTD\n20. KINGSWOOD SHIPPING COMPANY LIMITED\n21. KISH SHIPPING LINE MANNING COMPANY\n22. LAMBDA NARI NAVIGATION LIMITED\n23. LANCING SHIPPING COMPANY LIMITED\n24. LOGISTIC SMART LTD\n25. LOWESWATER LTD\n26. MACHINE SAZI ARAK\n27. MAGNA CARTA LIMITED\n28. MALSHIP SHIPPING AGENCY\n29. MARBLE SHIPPING LIMITED\n30. MAROUN OIL & GAS COMPANY\n31. MASJED-SOLEYMAN OIL & GAS COMPANY\n32. MASTER SUPREME INTERNATIONAL LTD\n33. MAZANDARAN CEMENT COMPANY\n34. MEHR CAYMAN LTD\n35. MELLAT BANK SB CJSC\n36. MELLI AGROCHEMICAL COMPANY PJS\n37. MELLI BANK PLC\n38. MELLI INVESTMENT HOLDING INTERNATIONAL\n39. MELODIOUS MARITIME INCORPORATION\n40. METRO SUPREME INTERNATIONAL LTD\n41. MIDHURST SHIPPING COMPANY LIMITED (MALTA)\n42. MILL DENE LTD\n43. MINISTRY OF ENERGY\n44. MINISTRY OF PETROLEUM\n45. MODALITY LTD\n46. MODERN ELEGANT DEVELOPMENT LTD\n47. MOUNT EVEREST MARITIME INCORPORATION\n48. NAFTIRAN INTERTRADE COMPANY\n49. NAFTIRAN INTERTRADE COMPANY SRL\n50. NAMJOO, Majid\n51. NARI SHIPPING AND CHARTERING GMBH & CO. KG\n52. NARMADA SHIPPING\n53. NATIONAL IRANIAN DRILLING COMPANY\n54. NATIONAL IRANIAN GAS COMPANY\n55. NATIONAL IRANIAN OIL COMPANY\n56. NATIONAL IRANIAN OIL COMPANY NEDERLAND (A.K.A.: NIOC NETHERLANDS REPRESENTATION OFFICE)\n57. NATIONAL IRANIAN OIL COMPANY PTE LTD\n58. NATIONAL IRANIAN OIL COMPANY, INTERNATIONAL AFFAIRS LIMITED\n59. NATIONAL IRANIAN OIL ENGINEERING AND CONSTRUCTION COMPANY (NIOEC)\n60. NATIONAL IRANIAN OIL PRODUCTS DISTRIBUTION COMPANY (NIOPDC)\n61. NATIONAL IRANIAN OIL REFINING AND DISTRIBUTION COMPANY\n62. NATIONAL IRANIAN TANKER COMPANY\n63. NEUMAN LTD\n64. NEW DESIRE LTD\n65. NEW SYNERGY\n66. NEWHAVEN SHIPPING COMPANY LIMITED\n67. NINTH OCEAN ADMINISTRATION GMBH\n68. NINTH OCEAN GMBH & CO. KG\n69. NOOR AFZA GOSTAR\n70. NORTH DRILLING COMPANY\n71. NUCLEAR FUEL PRODUCTION AND PROCUREMENT COMPANY\n72. OCEAN CAPITAL ADMINISTRATION GMBH\n73. OCEAN EXPRESS AGENCIES PRIVATE LIMITED\n74. ONERBANK ZAO\n75. OXTED SHIPPING COMPANY LIMITED\n76. PACIFIC SHIPPING\n77. PARS SPECIAL ECONOMIC ENERGY ZONE\n78. PARTNER CENTURY LTD\n79. PEARL ENERGY COMPANY LTD\n80. PEARL ENERGY SERVICES, SA\n81. PERSIA INTERNATIONAL BANK PLC\n82. PETRO SUISSE\n83. PETROIRAN DEVELOPMENT COMPANY LTD\n84. PETROLEUM ENGINEERING & DEVELOPMENT COMPANY\n85. PETROPARS INTERNATIONAL FZE\n86. PETROPARS IRAN COMPANY\n87. PETROPARS LTD\n88. PETROPARS OILFIELD SERVICES COMPANY\n89. PETROPARS OPERATION & MANAGEMENT COMPANY\n90. PETROPARS RESOURCES ENGINEERING LTD\n91. PETROPARS UK LIMITED\n92. PETWORTH SHIPPING COMPANY LIMITED\n93. POST BANK OF IRAN\n94. POWER PLANTS\nThe document 2231 (2015) lists the following entities and individuals subject to sanctions:\n\nEntities:\n \n1. RESEARCH INSTITUTE OF NUCLEAR SCIENCE & TECHNOLOGY  \n2. RISHI MARITIME INCORPORATION  \n3. SACKVILLE HOLDINGS LTD \n4. SAFIRAN PAYAM DARYA SHIPPING COMPANY  \n5. SANFORD GROUP \n6. SANTEXLINES  \n7. SECOND OCEAN ADMINISTRATION GMBH  \n8. SECOND OCEAN GMBH & CO. KG  \n9. SEIBOW LOGISTICS LIMITED  \n10. SEVENTH OCEAN ADMINISTRATION GMBH  \n11. SEVENTH OCEAN GMBH & CO. KG \n12. SHALLON LTD  \n13. SHEMAL CEMENT COMPANY  \n14. SHINE STAR LIMITED  \n15. SHIPPING COMPUTER SERVICES COMPANY  \n16. SILVER UNIVERSE INTERNATIONAL LTD.  \n17. SINA BANK  \n18. SINO ACCESS HOLDINGS  \n19. SINOSE MARITIME  \n20. SISCO SHIPPING COMPANY LTD  \n21. SIXTEENTH OCEAN ADMINISTRATION GMBH \n22. SIXTEENTH OCEAN GMBH & CO. KG  \n23. SIXTH OCEAN ADMINISTRATION GMBH  \n24. SIXTH OCEAN GMBH & CO. KG  \n25. SMART DAY HOLDINGS LTD  \n26. SORINET COMMERCIAL TRUST (SCT) \n27. SOROUSH SARAMIN ASATIR  \n28. SOUTH WAY SHIPPING AGENCY CO. LTD  \n29. SOUTH ZAGROS OIL & GAS PRODUCTION COMPANY \n30. SPARKLE BRILLIANT DEVELOPMENT LIMITED  \n31. SPRINGTHORPE LIMITED  \n32. STATIRA MARITIME INCORPORATION  \n33. SUREH (NUCLEAR REACTORS FUEL COMPANY)  \n34. SYSTEM WISE LTD  \n35. TAMALARIS CONSOLIDATED LTD  \n36. TENTH OCEAN ADMINISTRATION GMBH  \n37. TENTH OCEAN GMBH & CO. KG \n38. TEU FEEDER LIMITED  \n39. THETA NARI NAVIGATION  \n40. THIRD OCEAN ADMINISTRATION GMBH  \n41. THIRD OCEAN GMBH & CO. KG \n42. THIRTEENTH OCEAN ADMINISTRATION GMBH  \n43. THIRTEENTH OCEAN GMBH & CO. KG  \n44. TOP GLACIER COMPANY LIMITED  \n45. TOP PRESTIGE TRADING LIMITED  \n46. TRADE CAPITAL BANK  \n47. TRADE TREASURE  \n48. TRUE HONOUR HOLDINGS LTD  \n49. TULIP SHIPPING INC \n50. TWELFTH OCEAN ADMINISTRATION GMBH  \n51. TWELFTH OCEAN GMBH & CO. KG \n52. UNIVERSAL TRANSPORTATION LIMITATION UTL  \n53. VALFAJR8TH SHIPPING LINE \n54. WEST OIL & GAS PRODUCTION COMPANY \n55. WESTERN SURGE SHIPPING COMPANY LIMITED  \n56. WISE LING SHIPPING COMPANY LIMITED  \n57. ZETA NERI NAVIGATION \n\nIndividuals:\n \n1. Rezvanianzadeh, Mohammad Reza \n2. Salehi, Ali Akbar \n3. Soltani, Behzad \n4. Zanani, Babak\nHere is a summarized version of the document:\n\nThe document contains two attachments listing persons, entities, and bodies subject to sanctions.\n\n**Attachment 1 - Part II**\n\nLists 57 persons and entities, including:\n\n* Iranian individuals, such as Dawood Agha-Jani and Mohammad Jafar Mohammadi\n* Iranian organizations, such as the Atomic Energy Organisation of Iran (AEOI) and the Esfahan Nuclear Fuel Research and Production Centre (NFRPC)\n* Companies, such as the First East Export Bank and the Irano Hind Shipping Company\n\n**Attachment 2 - Part I**\n\nLists 74 persons and entities, including:\n\n* Iranian individuals, such as Javad Al Yasin and Davoud Babaei\n* Iranian organizations, such as the Aerospace Industries Organisation (AIO) and the Armed Forces Geographical Organisation\n* Companies, such as Aluminat, Ansar Bank, and Bank Saderat Iran\n\nThese lists are set out in Annex I to Council Decision 2010/413/CFSP and Annex VIII to Council Regulation (EU) No 267/2012, and Annex II to Council Decision 2010/413/CFSP and Annex IX to Council Regulation (EU) No 267/2012, respectively.\nThe document lists entities and individuals subject to sanctions as per Resolution 2231 (2015) of the Security Council. The listed entities and individuals are: \n\n1. Companies: \n IRAN POOYA, IRAN SAFFRON COMPANY, IRANIAN AVIATION INDUSTRIES ORGANIZATION, ISFAHAN OPTICS, ISLAMIC REVOLUTIONARY GUARD CORPS, JAFARI, JAVEDAN MEHR TOOS, JELVESAZAN COMPANY, KARANIR, KHALA AFARIN PARS, MAAA SYNERGY, MACPAR MAKINA SAN VE TIC, MAHMUDZADEH, MARINE INDUSTRIES, MAROU SANAT, MATSA, MECHANIC INDUSTRIES GROUP, MEHR BANK, MINISTRY OF DEFENSE, MOBIN SANJESH, MODERN TECHNOLOGIES FZC, MOHAMMADI, MOHAMMADLU, MOVASAGHNIA, MULTIMAT LC VE DIS TICARET PAZARLAMA LIMITED SIRKETI, NACCACHE, NADERI, NAJJAR, NAQDI, NASERI, NASERIN VAHID, NEDA INDUSTRIAL GROUP, NEKA NOVIN, NOAVARAN POOYAMOJ, NOURI, OIL INDUSTRY PENSION FUND INVESTMENT COMPANY, ORGANISATION OF DEFENSIVE INNOVATION AND RESEARCH, PAKPUR, PARCHIN CHEMICAL INDUSTRIES, PARTO SANAT CO, PASSIVE DEFENSE ORGANIZATION, PAYA PARTO, QASEMI, RAAD IRAN, RAKA, RESEARCH CENTRE FOR EXPLOSION AND IMPACT, ROSMACHIN, SAIDI, SALAMI, SAMAN NASB ZAYENDEH ROOD, SAMAN TOSE’E ASIA, SAMEN INDUSTRIES, SCHILLER NOVIN, SEPANIR OIL AND GAS ENERGY ENGINEERING COMPANY, SHAFI’I RUDSARI, SHAHID AHMAD KAZEMI INDUSTRIAL GROUP, SHAHID BEHESHTI UNIVERSITY, SHAKHESE BEHBUD SANAT, SHAMS, SHAMSHIRI, SHARIF UNIVERSITY OF TECHNOLOGY, SHETAB G, SHETAB GAMAN, SHETAB TRADING, SHIRAZ ELECTRONICS INDUSTRIES, SIMATEC DEVELOPMENT COMPANY, SOLAT SANA, SOLTANI, STATE PURCHASING ORGANISATION, STEP STANDART TEKNIK PARCA SAN VE TIC A.S., SUN MIDDLE EAST FZ COMPANY, SURENA, TABA, TAGHTIRAN, TAJHIZ SANAT SHAYAN, TECHNOLOGY COOPERATION OFFICE, TEST TAFSIR, TIDEWATER, TOSSE SILOOHA, TURBINE ENGINEERING MANUFACTURING, VAHIDI, WEST SUN TRADE GMBH, Y.A.S. CO. LTD, YARSANAT, YASA PART, ZADEH \n\n2. IRGC Units: \n IRGC AIR FORCE, IRGC QODS FORCE, IRGC-AIR FORCE AL-GHADIR MISSILE COMMAND \n\n3. Individuals: \n JAFARI, Milad; KARIMIAN, Ali; KHANSARI, Majid; MAHMUDZADEH, Ebrahim; MOHAMMADI, Mohammad; MOHAMMADLU, Brigadier-General Beik; MOVASAGHNIA, Mohammad Reza; NACCACHE, Anis; NADERI, Brigadier-General Mohammad; NAJJAR, IRGC Brigadier-General Mostafa Mohammad; NAQDI, BrigGen Mohammad Reza; NASERI, Mohammad Sadegh; NOURI, Ali Ashraf; PAKPUR, BrigGen Mohammad; QASEMI, Rostam; SAIDI, Hojatoleslam Ali; SALAMI, BrigGen Hossein; SHAFI’I RUDSARI, Rear Admiral Mohammad; SHAMS, Abolghassem Mozaffari; SHAMSHIRI, IRGC Brigadier-General Ali; SOLAT SANA, Abdollah; SOLTANI, Hamid; VAHIDI, IRGC Brigadier-General Ahmad; ZADEH, Amir Ali Haji\nLIST OF PERSONS, ENTITIES AND BODIES SET OUT IN ANNEX I TO \nCOUNCIL DECISION 2010/413/CFSP AND ANNEXES VIII TO COUNCIL \nREGULATION (EU) NO 267/2012\n\nThe list includes:\n\n1. Persons:\n- ABBASI-DAVANI, Fereidoun \n- AGHAJANI, Azim \n- AHMADIAN, Ali Akbar \n- BAHMANYAR, Bahmanyar Morteza \n- DASTJERDI, Ahmad Vahid \n- DERAKHSHANDEH, Ahmad \n- ESLAMI, Mohammad  \n- ESMAELI, Reza-Gholi \n- FAKHRIZADEH-MAHABADI, Mohsen \n- HEJAZI, Mohammad \n- HOJATI, Mohsen \n- KETABACHI, Mehrdada Akhlaghi \n- MALEKI, Naser \n- NAQDI, Mohammad Reza \n- NEJAD NOURI, Mohammad Mehdi \n- REZAIE, Morteza \n- SAFARI, Morteza \n- SAFAVI, Yahya Rahim \n- SALIMI, Hosein \n- SOLEIMANI, Qasem \n- TABATABAEI, Ali Akbar \n- ZAHEDI, Mohammad Reza \n- ZOLQADR, General \n\n2. Entities and Bodies:\n- ABZAR BORESH KAVEH CO.  \n- AMIN INDUSTRIAL COMPLEX  \n- AMMUNITION AND METALLURGY INDUSTRIES GROUP  \n- ARMAMENT INDUSTRIES GROUP \n- BANK SEPAH  \n- BANK SEPAH INTERNATIONAL \n- BARZAGANI TEJARAT TAVANMAD SACCAL COMPANIES \n- BEHINEH TRADING CO. \n- CRUISE MISSILE INDUSTRY GROUP  \n- DEFENCE INDUSTRIES ORGANISATION (DIO) \n- DEFENSE TECHNOLOGY AND SCIENCE RESEARCH CENTER \n- DOOSTAN INTERNATIONAL COMPANY  \n- ELECTRO SANAM COMPANY  \n- ETTEHAD TECHNICAL GROUP  \n- FAJR INDUSTRIAL GROUP \n- FARASAKHT INDUSTRIES  \n- FARAYAND TECHNIQUE \n- FATER (OR FAATER) INSTITUTE \n- GHARAGAHE SAZANDEGI GHAEM \n- GHORB KARBALA  \n- GHORB NOOH  \n- HARA COMPANY \n- IMENSAZAN CONSULTANT ENGINEERS INSTITUTE  \n- INDUSTRIAL FACTORIES OF PRECISION (IFP) MACHINERY  \n- JOZA INDUSTRIAL CO.  \n- KALA-ELECTRIC  \n- KAVEH CUTTING TOOLS COMPANY  \n- KHATAM AL-ANBIYA CONSTRUCTION HEADQUARTERS \n- KHORASAN METALLURGY INDUSTRIES  \n- M. BABAIE INDUSTRIES \n- MAKIN  \n- MALEK ASHTAR UNIVERSITY  \n- MINISTRY OF DEFENSE LOGISTICS EXPORT  \n- MIZAN MACHINERY MANUFACTURING A.K.A.:3MG  \n- NIRU BATTERY MANUFACTURING COMPANY \n- OMRAN SAHEL  \n- ORIENTAL OIL KISH  \n- PARCHIN CHEMICAL INDUSTRIES  \n- PARS AVIATION SERVICES COMPANY  \n- PEJMAN INDUSTRIAL SERVICES CORPORATION  \n- QODS AERONAUTICS INDUSTRIES \n- RAH SAHEL  \n- RAHAB ENGINEERING INSTITUTE  \n- SABALAN COMPANY  \n- SAD IMPORT EXPORT COMPANY \n- SAFETY EQUIPMENT PROCUREMENT (SEP)  \n- SAHAND ALUMINUM PARTS INDUSTRIAL COMPANY  \n- SAHEL CONSULTANT ENGINEERS  \n- SANAM INDUSTRIAL GROUP \n- SEPANIR  \n- SEPASAD ENGINEERING COMPANY  \n- SHAHID BAGHERI INDUSTRIAL GROUP (SBIG) \n- SHAHID HEMMAT INDUSTRIAL GROUP (SHIG) \n- SHAHID KARRAZI INDUSTRIES  \n- SHAHID SATARRI INDUSTRIES  \n- SHAHID SAYYADE SHIRAZI INDUSTRIES  \n- SHO’A’ AVIATION. \n- SPECIAL INDUSTRIES GROUP \n- TIZ PARS  \n- YA MAHDI INDUSTRIES GROUP \n- YAS AIR \n- YAZD METALLURGY INDUSTRIES\nThe document lists Iranian financial institutions and individuals and entities identified as Government of Iran (GOI) on the Specially Designated Nationals (SDN) list, as well as designated entities and individuals on the SDN list and entities and individuals listed on the Foreign Sanctions Evaders (FSE) list, and individuals and entities sanctioned under the Iran Sanctions Act (ISA), with blocked property. \n\nThe list includes but not limited to: \n- Financial institutions: \n  * Bank Kargoshaee \n  * Bank Keshavarzi Iran \n  * Bank Markazi Jomhouri Islami Iran \n  * Bank Maskan \n  * Bank Mellat \n  * Bank Melli Iran \n  * Bank Refah Kargaran \n  * Bank Sepah \n  * Bank Tejarat \n  * Bank-e Shahr \n- Shipping Companies: \n  * Aban Air \n  * Antares Shipping Company NV \n  * Arash Shipping Enterprises Limited \n  * Aria Bank \n  * Arta Shipping Enterprises Limited \n  * Asan Shipping Enterprise Limited \n  * Ashtread Shipping Company Limited \n  * Azores Shipping Company LL FZE \n- Individuals: \n  * Afzali, Ali \n  * Agha-Jani, Dawood \n  * Al Aqili, Mohamed Saeed \n  * Ameri, Teymour \n  * Bahadori, Masoud \n  * Bateni, Naser \n  * Bazaragan, Farzad \n  * Behza, Morteza Ahmadali \n  * Cambis, Dimitris \n  * Dajmar, Mohhammad Hossein \n  * Danesh Shipping Company Limited \n  * Davar Shipping Co Ltd \n  * Derakhshandeh, Ahmad \n  * Divandari, Ali \n\n* Denotes Iranian financial institutions and individuals and entities identified as GOI by the Office of Foreign Assets Control (OFAC). U.S. persons and foreign entities owned or controlled by a U.S. person will continue to be prohibited from transactions with these individuals and entities.\nThis document appears to be a list of entities and individuals, likely subject to sanctions, as referenced in Security Council Resolution 2231 (2015). The list includes:\n\nCompanies:\n- EDBI Exchange Company\n- EDBI Stock Brokerage Company\n- Effingham Shipping Company Limited\n- Eghtesad Novin Bank\n- Eighth Ocean Administration GMBH\n- Eighth Ocean GMBH & Co. KG\n- Eleventh Ocean Administration GMBH\n- Eleventh Ocean GMBH & Co. KG\n- Esfahan Nuclear Fuel Research and Production Center\n- Europaish-Iranische Handelsbank AG\n- European Oil Traders\n- Everex\n- Execution of Imam Khomeini’s Order\n- Export Development Bank of Iran\n- Farway Shipping Ltd\n- Fal Oil Company Limited\n- Farnham Shipping Company Limited\n- Faylaca Petroleum\n- Ferland Company Limited\n- Fifteenth Ocean GMBH & Co. KG\n- Fifth Ocean Administration GMBH\n- Fifth Ocean GMBH & Co. KG\n- First East Export Bank, P.L.C.\n- First Islamic Investment Bank Ltd.\n- First Ocean Administration GMBH\n- First Ocean GMBH & Co. KG\n- First Persia Equity Fund\n- Fourteenth Ocean GMBH & Co. KG\n- Fourth Ocean Administration GMBH\n- Fourth Ocean GMBH & Co. KG\n- Future Bank B.S.C.\n- Galliot Maritime Inc\n- Garbin Navigation Ltd\n- Georgian Business Development\n- Ghadir Investment Company\n- Ghaed Bassir Petrochemical Products Company\n- Ghalebani, Ahmad \n- Gharzolhasaneh Resalat Bank\n- Ghavamin Bank\n- Ghezeli Ayagh, Alireza\n- Golden Resources Trading Company L.L.C.\n- Goldentex FZE\n- Golparvar, Gholamhossein\n- Gomshall Shipping Company Limited\n- Good Luck Shipping L.L.C.\n- Grace Bay Shipping Inc\n- Great Business Deals\n- Great Method Limited\n- Hadi Shipping Company Limited\n- Hafiz Darya Shipping Co\n- Haraz Shipping Company Limited\n- Hatef Shipping Company Limited\n- Hekmat Iranian Bank\n- Hercules International Ship\n- Hermis Shipping SA\n- Hirmand Shipping Company Limited\n- Hoda Shipping Company Limited\n- Homa Shipping Company Limited\n- Honar Shipping Company Limited\n- Hong Kong Intertrade Company\n- Hormoz Oil Refining Company\n- Horsham Shipping Company Limited\n- Hosseinpour, Houshang\n- HTTS Hanseatic Trade Trust and Shipping, GMBH\n- Ideal Success Investments Limited\n- IFIC Holding AG\n- Ihag Trading GMBH\n- Impire Shipping Company\n- Indus Maritime Inc\n- Industrial Development and Renovation Organization of Iran\n- International Safe Oil\n- Intra Chem Trading GMBH\n- Iran & Shargh Company\n- Iran & Shargh Leasing Company\n- Iran Air\n- Iran Foreign Investment Company\n- Iran Insurance Company\n- Iran O Hind Shipping Company\n- Iran O Misr Shipping Company\n- Iran Petrochemical Commercial Company\n- Iran Zamin Bank\n- Iranair Tours\n- Iranian Mines and Mining Industries Development and Renovation Organization\n- Iranian Oil Company (U.K.) Limited\n- Iranian-Venezuelan Bi-National Bank / Joint Iran-Venezuela Bank\n- Irasco S.R.L.\n- Irinvestship Ltd.\n- IRISL (Malta) Limited\n- IRISL (UK) Ltd.\n- IRISL China Shipping Co., Ltd.\n- IRISL Europe GMBH\n- IRISL Marine Services & Engineering Company\n- IRISL Multimodal Transport Co.\n- Irital Shipping SRL Company\n\nIndividuals:\n- Eslami, Mansour\n- Ezati, Ali\n- Farsoudeh, Houshang\n- Ghezel Ayagh, Alireza\n- Golparvar, Gholamhossein\n- Ghalebani, Ahmad\nHere is a summarized version of the Security Council document:\n\n2231 (2015)\n\nThe document lists various entities, including:\n\n1. Companies: ISI Maritime Limited, Islamic Republic of Iran Shipping Lines, Karafarin Bank, Khavar Miane Bank, Kish International Bank, Kont Investment Bank, KSN Foundation, Kuo Oil Pte. Ltd, and many others.\n2. Individuals: Abdelhak Kaddouri, Ali Hajinia Leilabadi, Ali Mahdavi, Anahita Nasirbeik, Ghasem Nabipour, Jamshid Khalili, Mohammad Moghaddami Fard, Seyed Mahmoud Mohaddes.\n\nThe list appears to include Iranian entities and individuals, with many marked with an asterisk (*). \n\nNo additional information or extra lines are included in this response.\nThis document appears to be a list of entities and individuals, likely related to sanctions or other regulatory actions, as indicated by the context of a UN Security Council resolution (2231 (2015)). The list includes:\n\n \nNinth Ocean Administration GMBH \nNinth Ocean GMBH & Co. KG \nNIOC International Affairs (London) Limited \nIndividuals: \n- Nizami, Anwar Kamal \n- Noor Afzar Gostar Company \n- Companies: \n- Noor Energy (Malaysia) Ltd \n- Nouri Petrochemical Company \n- Novin Energy Company \n- NPC International Limited \n- Nuclear Research Center for Agriculture and Medicine \n- Nuclear Science and Technology Research Institute \n- Ocean Capital Administration GMBH \n- Oil Industry Investment Company \n- Omid Rey Civil & Construction Company \n- One Class Properties (PTY) Ltd \n- One Vision Investments 5 (PTY) Ltd \n- Onerbank ZAO \n- Orchidea Gulf Trading \n- P.C.C. (Singapore) Private Limited \n- Pacific Shipping DMCEST \n- Pajand, Mohammad Hadi \n- Pardis Investment Company \n- Pars MCS \n- Pars Oil and Gas Company \n- Pars Oil Co \n- Pars Petrochemical Company \n- Pars Petrochemical Shipping Company \n- Pars Trash Company \n- Parsaei, Reza \n- Parsiian Bank \n- Partner Century Limited \n- Parvaresh, Farhad Ali \n- Pasargad Bank \n- Pearl Energy Company Ltd \n- Pearl Energy Services, SA \n- Persia International Bank PLC \n- Persia Oil & Gas Industry Development Co \n- Petro Energy Intertrade Company \n- Petro Royal FZE \n- Petro Suisse Intertrade Company SA \n- Petrochemical Commercial Company (U.K.) Limited \n- Petrochemical Commercial Company FZE \n- Petrochemical Commercial Company International \n- Petroiran Development Company (PEDCO) Limited \n- Petroleos de Venezuela S.A. (PDVSA) \n- Petropars International FZE \n- Petropars Ltd \n- Petropars UK Limited \n- Pioneer Energy Industries Company \n- Polat, Muzaffer \n- Polynex General Trading LLC \n- Polynar Company \n- Post Bank of Iran \n- Pouransari, Hashem \n- Proton Petrochemicals Shipping Limited \n- Pryvatne Aktsioner Tovarystvo Aviakompani BUKOVYNA \n- Qannadi, Mohammad \n- Qulandary, Azizullah Asadullah \n- Rahiqi, Javad \n- Rasool, Seyed Alaeddin Sadat \n- Rey Investment Company \n- Rey Niru Engineering Company \n- Reyco GMBH \n- Rezvanianzadeh, Mohammed Reza \n- Rishi Maritime Inc \n- Rishmak Productive & Exports Company \n- Royal Arya Co \n- Royal Oyster Group \n- Royal-Med Shipping Agency Ltd \n- Sabet, Javad Karimi \n- Sackville Holdings Limited \n- Sadaf Petrochemical Assaluyeh Company \n- Safdari, Seyed Jaber \n- Safiran Payam Darya Shipping Company \n- Saman Bank \n- Saman Shipping Company Limited \n- Sambouk Shipping FZC \n- Sandford Group Limited \n- Santex Lines Limited \n- Sarkandi, Ahmad \n- Sarmayeh Bank \n- Sarv Shipping Company Limited \n- Second Ocean Administration GMBH \n- Second Ocean GMBH & Co. KG \n- Seibow Limited \n- Seibow Logistics Limited \n- Seifi, Asadollah \n- Sepid Shipping Company Limited \n- Seventh Ocean Administration GMBH \n- Seventh Ocean GMBH & Co. KG \n- Seyyedi, Seyed Nasser Mohammad \n- Seyyedi, Seyedeh Hanieh Seyed Nasser Mohammad \n- Shahid Tondgooyan Petrochemical Company \n- Shalloon Limited \n- Shazand Petrochemical Company \n- Shere Shipping Company Limited \n- Shipping Computer Services Company \n- Shomal Cement Company \n- Sima General Trading Co FZE \n- Sima Shipping Company Limited\nThe document lists entities and individuals subject to sanctions, as follows:\n\n1. Entities: \n   - Sina Bank\n   - Sina Shipping Company Limited\n   - Singa Tankers Pte. Ltd.\n   - Sino Access Holdings Limited\n   - Sinose Maritime Pte. Ltd.\n   - Siqiriya Maritime Corp.\n   - Sixth Ocean Administration GMBH\n   - Sixth Ocean GMBH & Co. KG\n   - Smart Day Holdings Group Limited\n   - Sorinet Commercial Trust (SCT) Bankers\n   - Soroush Sarzamin Asatir Ship Management Company\n   - South Shipping Line Iran\n   - Speedy Ship FZC\n   - Springthorpe Limited\n   - Starry Shine International Limited\n   - Swiss Management Services Sarl\n   - Synergy General Trading FZE\n   - System Wise Limited\n   - Tabatabaei, Seyyed Mohammad Ali Khatibi\n   - Tabriz Petrochemical Company\n   - Tadbir Brokerage Company\n   - Tadbir Construction Development Company\n   - Tadbir Economic Development Group\n   - Tadbir Energy Development Group Co.\n   - Tadbir Investment Company\n   - Tafazoli, Ahmad \n   - Talai, Mohamad\n   - Tamas Company\n   - Tat Bank\n   - TC Shipping Company Limited\n   - Tenth Ocean GMBH & Co. KG\n   - The Exploration and Nuclear Raw Materials Production Company\n   - The Nuclear Reactors Fuel Company\n   - Third Ocean Administration GMBH\n   - Third Ocean GMBH & Co. KG\n   - Thirteenth Ocean GMBH & Co. KG\n   - Tongham Shipping Co Ltd\n   - Top Glacier Company Limited\n   - Top Prestige Trading Limited\n   - Toosee Eqt-esad Ayandehsazan Company\n   - Toosee Taavon Bank\n   - Tourism Bank\n   - Trade Treasure Limited\n   - True Honour Holdings Limited\n   - Twelfth Ocean Administration GMBH\n   - Twelfth Ocean GMBH & Co. KG\n   - Uppercourt Shipping Company Limited\n   - Valfajr 8th Shipping Line Co SSK\n   - Vobster Shipping Company Ltd\n   - West Sun Trade GMBH\n   - Woking Shipping Investments Limited\n   - Zhuhai Zhenrong Company\n   - Ziraccian Zadeh, Mahmoud\n\n2. Individuals: \n   - Sokolenko, Vitaly\n   - Tafazoli, Ahmad\n   - Talai, Mohamad \n   - Wippermann, Ulrich \n   - Yasini, Seyed Kamal\n   - Yazdi, Bahareh Mirza Hossein\n   - Zadeh, Hassan Jalil\n   - Zanjani, Babak Morteza\n   - Zeidi, Hossein \n   - Ziraccian Zadeh, Mahmoud\nHere is a summarized version of the document:\n\nThe document lists blocked properties of individuals and entities identified as Government of Iran (GOI) by the Office of Foreign Assets Control.\n\n**Aircraft:**\n\n* 36 aircraft of Iran Air with registration numbers: EP-CFD, EP-CFE, EP-CFH, EP-CFI, EP-CFJ, EP-CFK, EP-CFL, EP-CFM, EP-CFO, EP-CFP, EP-CFQ, EP-CFR, EP-IAA, EP-IAB, EP-IAC, EP-IAD, EP-IAG, EP-IAH, EP-IAI, EP-IAM, EP-IBA, EP-IBB, EP-IBC, EP-IBD, EP-IBG, EP-IBH, EP-IBI, EP-IBJ, EP-IBK, EP-IBL, EP-IBM, EP-IBN, EP-IBP, EP-IBQ, EP-IBS, EP-IBT, EP-IBV, EP-IBZ, EP-ICD, EP-ICE, EP-ICF, EP-IDA, EP-IDD, EP-IDF, EP-IDG, EP-IEB, EP-IEC, EP-IED, EP-IEE, EP-IEF, EP-IEG, EP-IRK, EP-IRL, EP-IRM, EP-IRN, EP-IRR, EP-IRS, EP-IRT, EP-MDD, EP-MDE\n* 5 aircraft of Pryvatne Aktsionerner Tovarystvo Avia Kompaniya with registration numbers: UR-BXI, UR-BXL, UR-BXM, UR-BHJ \n* 6 aircraft of Pryvatne Aktsionerner Tovarystvo Avia Kompaniya with registration numbers: UR-CGS, UR-CGT, UR-CHW, UR-CHX, UR-CHY, UR-CHZ, UR-CJQ, UR-CIX, UR-CIY, UR-CJA, UR-CJK \n\n**Vessels:**\n\n* 9 vessels of Islamic Republic of Iran Shipping Lines with the following names and numbers: \n  RIONA (9349588), MIRZA KOCHEK KHAN (7027899), ASSA (7632814), AMITEES (7632826), HORMUZ2 (7904580), PARMIDA (8105284), BARSAM (8107581), PANTEA (8108559) \n\n× Denotes blocked property of individual and entities identified as GOI by the Office of Foreign Assets Control. U.S. persons and foreign entities owned or controlled by a U.S. person will continue to be prohibited from transactions with these individuals and entities, pursuant to the Iranian Transactions and Sanctions Regulations.\n2231 (2015) 75/104 15-12243 \n\nThe document lists vessels of the Islamic Republic of Iran Shipping Lines, including: \n\n1. SARINA (Vessel 8113009)\n2. SABRINA (Vessel 8203608)\n3. ATTRIBUTE (Vessel 8215742)\n4. ALIAS (Vessel 8309593)\n5. AQUARIAN (Vessel 8309608)\n6. ADVENTIST (Vessel 8309610)\n7. AGEAN (Vessel 8309622)\n8. ANGEL (Vessel 8309634)\n9. AGILE (Vessel 8309658)\n10. AJAX (Vessel 8309672)\n11. ACROBAT (Vessel 8309684)\n12. SHADFAR (Vessel 8309696)\n13. AMPLIFY (Vessel 8309701)\n14. IRAN HORMUZ21 (Vessel 8314263)\n15. IRAN HORMUZ22 (Vessel 8314275)\n16. IRAN HORMUZ23 (Vessel 8319782)\n17. IRAN SHALAK (Vessel 8319940)\n18. IRAN YOUSHAT (Vessel 8319952)\n19. AEROLITE (Vessel 8320121)\n20. ADRIAN (Vessel 8320133)\n21. NAGHMEH (Vessel 8320145)\n22. RONAK (Vessel 8320157)\n23. ACCURATE (Vessel 8320169)\n24. TABANDEH (Vessel 8320171)\n25. GULAFSHAN (Vessel 8320183)\n26. ALAMEDA (Vessel 8320195)\n27. IRAN PARAK (Vessel 8322064)\n28. IRAN CHARAK (Vessel 8322076)\n29. IRAN HORMUZ25 (Vessel 8422072)\n30. IRAN HORMUZ26 (Vessel 8422084)\n31. DORITA (Vessel 8605234)\n32. IRAN SHALAMCHEH (Vessel 8820925)\n33. AAJ (Vessel 8984484)\n34. IRAN HORMUZ12 (Vessel 9005596)\n35. IRAN KONG (Vessel 9007582)\n36. VISTA (Vessel 9010711)\n37. VIANA (Vessel 9010723)\n38. IRAN HORMUZ14 (Vessel 9020778)\n39. HAMD (Vessel 9036052)\n40. SOBHAN (Vessel 9036935)\n41. SATTAR (Vessel 9040479)\n42. ABBA (Vessel 9051624)\n43. BEHDAD (Vessel 9051636)\n44. PARSHAN (Vessel 9051648)\n45. VALERIAN (Vessel 9051650)\n46. NEGEEN (Vessel 9071519)\n47. ATTAR (Vessel 9074092)\n48. PARIN (Vessel 9076478)\n49. TEEN (Vessel 9101649)\n50. GOWHAR (Vessel 9103087)\n51. IRAN DALEER (Vessel 9118551)\n52. PATRIS (Vessel 9137210)\n53. NARDIS (Vessel 9137246)\n54. KADOS (Vessel 9137258)\n55. ZOMOROUD (Vessel 9138044)\n56. BRELYAN (Vessel 9138056)\n57. NILDA (Vessel 9165786)\n58. JOVITA (Vessel 9165798)\n59. MANOLA (Vessel 9165803)\n60. GLADIOLUS (Vessel 9165815)\n61. ELYANA (Vessel 9165827)\n62. NEGAR (Vessel 9165839)\n63. SAVIZ (Vessel 9167253)\n64. GLOXINIA (Vessel 9167265)\n65. NESHAT (Vessel 9167277)\n66. BEHSHAD (Vessel 9167289)\n67. JAIRAN (Vessel 9167291)\n68. IRAN SHAHED (Vessel 9184691)\n69. GOLSAR (Vessel 9193185)\n70. ZARSAN (Vessel 9193197)\n71. ARVIN (Vessel 9193202)\n72. ARTAVAND (Vessel 9193214)\n73. TERESA (Vessel\nThe document lists vessels associated with the Islamic Republic of Iran Shipping Lines and the National Iranian Tanker Company. \n\nThe vessels associated with the Islamic Republic of Iran Shipping Lines are: \nUPPERCOURT \nTONGHAM \nVOBSTER \nGOLAFRUZ \nADALIA \nSHABGOUN \nAGATA \nBENITA \nMARISOL \nORIANA \nMERCEDES \nRAMONA \nGILDA \nSANIA \nSARIR \nSOMIA \nGLORY \nARIES \nABTIN1 \nARSHAM \nPARSHAD \nHAADI \nRAAZI \nSAEI \nARTMAN \nBASKAR \nBAHJAT \nHAAMI \nSHAADI \nSHAYAN1 \nTABAN1 \nYARAN \nAMIN \nAVANG \nKIAZAND \nBATIS \nWARTA \nSALIM \nARDAVAN \nNAMI \n\nThe vessels associated with Lissome Marine Services LLC are: \nLISSOME \nGAS CAMELLIA \nTESS \nKATERINA1 \nMARIA \nSUN OCEAN \nYOUNES \n\nThe vessels associated with the National Iranian Tanker Company are: \nYOUSEF \nYAGHOUB \nTOLOU \nVALFAJR2 \nBADR \nBANEH \nSARDASHT \nMARIVAN \nBRIGHT \nCARIBO \nAURA \nBICAS \nMAHARLIKA \nNAPOLI \nNYOS \nNAINITAL \nNATIVE LAND \nATLANTIC \nSPARROW \nSWALLOW \nSUPERIOR \nSPOTLESS \nSABRINA \nDESTINY \nHUMANITY \nORIENTAL \nSHONA \nABELIA \nALERT \nSUNDIAL \nSILVER CLOUD \nHUWAYZEH \nHORIZON \nHAPPINESS \nMARINA \nHALISTIC \nDELVAR \nDAYLAM \nDAMAVAND \nDENA \nDARAB \nIRAN FAZEL \nFIANGA \nIRAN FAHIM \nIRAN FALAGH \nDECESIVE \nSANCHI \nMAJESTIC \nSUCCESS\nHere is a summarized version of the Security Council document:\n\nThe document lists vessels and their respective owners, as well as entities and individuals.\n\n**Vessels and Owners:**\n\n1. SUNEAST, SPLENDOUR, COURAGE, HONESTY, AMBER, DAL LAKE, JUSTICE, HYDRA, DOVE, ZEUS, IMICO NEKA455, IMICO NEKA456, IMICO NEKA457, SUNSHINE, DOJRAN, ATLANTIS, FORTUN, SALALEH, SMOOTH, SKYLINE, INFINITY, DEMOS, YANGZHOU DAYANG, SUNRISE, ANTHEM, JAFFNA, OLYSA \n- Owned by: NATIONAL IRANIAN TANKER COMPANY\n\n**Entities:**\n\n1. ADVANCE ELECTRICAL AND INDUSTRIAL TECHNOLOGIES SL\n2. ALUMINAT\n3. ANDISHEH ZOLAL\n4. ARIA NIKAN MARINE INDUSTRY\n5. EYVAZ TECHNIC MANUFACTURING COMPANY\n6. FARATECH\n7. FARAYAND TECHNIQUE\n8. FULMEN GROUP\n9. IMANIRAD \n10. IRAN CENTRIFUGE TECHNOLOGY COMPANY\n11. IRAN POOYA\n12. JAHAN TECH ROOYAN PARS\n13. JAVEDAN MEHR TOOS\n14. KALAYE ELECTRIC COMPANY\n15. MANDEGAR BASPAR KIMIYA COMPANY\n16. MARO SANAT COMPANY\n17. MODERN INDUSTRIES TECHNIQUE COMPANY\n18. NEDA INDUSTRIAL GROUP\n19. NEKA NOVIN\n20. PARTO SANAT CO.\n21. PAYA PARTOV CO.\n22. PENTANE CHEMISTRY INDUSTRIES\n23. PETRO GREEN\n24. PISHRO SYSTEMS RESEARCH COMPANY\n25. POUYA CONTROL\n26. SIMATIC DEVELOPMENT CO.\n27. TAGHTIRAN KASHAN COMPANY\n28. TARH O PALAYESH\n29. THE ORGANIZATION OF DEFENSIVE INNOVATION AND RESEARCH\n30. TOWLID ABZAR BORESHI IRAN\n31. ZOLAL IRAN COMPANY\n\n**Individuals:**\n\n1. ABBASI-DAVANI, Fereidoun\n2. BUJAR, Farhad\n3. DAYENI, Mahmoud Mohammadi\n4. FAKHRIZADEH-MAHABADI, Mohsen\n5. IMAIRAD, Arman\n6. IMAIRAD, Mohammad Javad\n7. KAHVARIN, Iradj Mohammadi\n8. KHAKI, Parviz\n9. PUNTI, Pere\n10. RAHIMYAR, Amir Hossein\n11. TANIDEH, Hossein\n12. WISSER, Gerhard\nIran and E3/EU+3 agreed to cooperate in civil nuclear areas through IAEA technical cooperation, within the JCPOA framework, without prejudice to existing bilateral agreements. The Joint Commission will support assistance to Iran, including IAEA technical cooperation projects.\n\nCivil nuclear cooperation projects will be mutually determined by participating states, consistent with the JCPOA and national laws. Cooperation may be undertaken in various formats, including:\n\n* Bilateral or multilateral arrangements with Iran\n* IAEA technical cooperation projects, including Project and Supply Agreements\n* International Science and Technology Centres\n\nE3/EU+3 parties will facilitate Iran's acquisition of light-water research and power reactors, including:\n\n* Construction and operation of new light-water power reactors and associated equipment (Generation III+ requirements)\n* Construction of modern light-water moderated multipurpose research reactors\n* Supply of instrumentation and control systems, nuclear simulation codes, and software solutions\n* Supply of main equipment and core of research and power reactors\n* On-the-job training on fuel management scenarios and reshuffling\n\nThe Arak Modernisation Project will be established, with an international partnership composed of E3/EU+3 parties and Iran, to redesign and rebuild the IR-40 reactor into a modernised, 20MWth, heavy-water moderated and cooled research reactor.\n\n* Iran will lead the project, with a Working Group composed of E3/EU+3 participants to support and facilitate the redesign and rebuilding.\n* The Working Group may be enlarged to include other countries by consensus.\n* E3/EU+3 participants and Iran will conclude an official document expressing commitments to the project, defining responsibilities, and providing an assured path forward to modernise the reactor.\nHere is a summarized version of the document:\n\n**Nuclear Fuel**\n\n* E3/EU+3 parties will support Iran in meeting international qualification standards for nuclear fuel fabricated by Iran (6.1).\n* E3/EU+3 parties will cooperate with Iran on the supply of modern fuels, including joint design and fabrication, licenses, and technologies for current and future nuclear research and power reactors (6.2).\n\n**Research and Development (R&D) Practices**\n\n* E3/EU+3 and Iran will cooperate in nuclear science and technology, including:\n\t+ Accelerator-based nuclear physics and nuclear astrophysics research, and stable isotope production (7.1).\n\t+ Plasma physics and nuclear fusion (7.2).\n\t+ Research reactor applications, such as training, radio-isotope production, and neutron imaging (7.3).\n\t+ Additional areas, including design and manufacture of in-core measuring instrumentation, nuclear instrumentation and control, and fusion technology (7.4).\n\n**Nuclear Safety, Safeguards and Security**\n\n* E3/EU+3 parties will cooperate with Iran to establish a Nuclear Safety Centre, engage in workshops and training events, and share best practices on nuclear safety culture (8).\n* E3/EU+3 parties will support Iran's accession to relevant conventions on nuclear safety and security, and cooperate in areas such as:\n\t+ Conclusion of bilateral/multilateral agreements (8.1).\n\t+ Supply of valid codes, instruments, and equipment related to nuclear safety (8.2).\n\t+ Exchange of knowledge and experience in nuclear safety (8.3).\n\t+ Enhancement of domestic emergency preparedness and severe accident management capability (8.4).\n\t+ On-the-job training and apprenticeship courses for reactor and facility operators (8.5).\nHere is a summarized version of the Security Council document:\n\n**Nuclear Safety**\n\n* Establish a Nuclear Safety Centre in Iran to support technical and professional training and exchange of lessons-learned for reactor and facility operators, regulatory authority personnel, and related organizations.\n\n**Nuclear Safeguards**\n\n* E3/EU+3 parties are prepared to cooperate with Iran on effective and efficient implementation of IAEA safeguards and transparency measures.\n* Cooperation areas include:\n\t+ On-the-job trainings and workshops to strengthen nuclear material accounting and control process, human resource development, and quality assurance/quality control processes.\n\t+ Training and workshops to strengthen Iran's safeguards regulatory authority, nuclear material accounting and control processes, human resource development, and quality assurance/quality control processes.\n\n**Nuclear Security**\n\n* E3/EU+3 parties are prepared to cooperate with Iran on implementation of nuclear security guidelines and best practices.\n* Cooperation areas include:\n\t+ Training courses and workshops to strengthen Iran's ability to prevent, protect, and respond to nuclear security threats.\n\t+ Training and workshops to strengthen Iran's ability to protect against and respond to nuclear security threats, including sabotage.\n\n**Nuclear Medicine and Radioisotopes**\n\n* E3/EU+3 parties are prepared to cooperate with Iran to improve utilization of nuclear medicine in Iran.\n* Cooperation areas include:\n\t+ Upgrades to infrastructure associated with existing cyclotron facilities.\n\t+ Acquisition of new cyclotron and associated radio-pharmacy equipment.\n\t+ Acquisition of state-of-the-art diagnostic imaging and radiotherapy equipment.\n\t+ Cooperation on occupational and patient dosimetry procedures.\n\n**Waste Management and Facility Decommissioning**\n\n* E3/EU+3 parties are prepared to cooperate with Iran in safe, effective, and efficient management and disposition of nuclear and radiological wastes.\n* Cooperation areas include:\n\t+ Safe, effective, and environmentally friendly best practices for facility decontamination and decommissioning.\n\t+ Exchanges and visits to relevant sites and locations outside of Iran.\n\n**Other projects**\n\n* Other projects may be implemented between E3/EU+3 parties and Iran, including:\n\t+ Construction of nuclear desalination and associated infrastructure in Iran.\n\t+ Development of laser technology for medical applications.\nHere is a concise summary of the document:\n\n**Establishment and Composition of the Joint Commission**\n\n* The Joint Commission is established to carry out functions assigned to it in the JCPOA, including its Annexes.\n* The Commission comprises representatives of Iran and the E3/EU+3 (China, France, Germany, Russia, UK, US, and the High Representative of the Union for Foreign Affairs and Security Policy).\n* The High Representative or their designated representative serves as the Coordinator.\n\n**Functions of the Joint Commission**\n\n* Review and approve various nuclear-related projects and activities, including:\n\t+ Modernized heavy water research reactor design and fuel design.\n\t+ Development of hot cells, shielded cells, and glove boxes.\n\t+ Uranium metal-based TRR fuel R&D.\n\t+ New centrifuge designs.\n\t+ Projects at Fordow.\n\t+ Stable isotope production at Fordow.\n\t+ Fuel assembly manufacturing in Iran.\n* Provide consultation and advice on access and implementation matters.\n* Review and decide on proposals for nuclear-related transfers to or activities with Iran.\n* Address issues arising from sanctions lifting.\n\n**Procedures**\n\n* The Joint Commission meets quarterly and at any time upon request of a JCPOA participant.\n* Meetings are held in New York, Vienna, or Geneva.\n* The Commission may invite observers to attend meetings.\n* The work of the Joint Commission is subject to confidentiality procedures, except as provided in Section 6 of the Annex.\nThe document outlines the procedures and guidelines for the Joint Commission and Procurement Working Group established under the Joint Comprehensive Plan of Action (JCPOA). \n\n4. Decisions:\n- Decisions are made by consensus, with each JCPOA participant having one vote.\n- The vote of each participant will be made known if a recorded vote is requested.\n- For matters under Section Q of Annex I, decisions are made by consensus or affirmative vote of five JCPOA participants.\n\n5. Other:\n- Each participant covers its own costs of participation unless the Joint Commission decides otherwise.\n- Participants can request the Coordinator to circulate notifications to other participants.\n\n6. Procurement Working Group:\n- The Group reviews and decides on proposals for nuclear-related transfers to or activities with Iran.\n- Proposals are considered for:\n  - Supply, sale, or transfer of items, materials, equipment, goods, and technology to Iran.\n  - Provision of technical assistance or training, financial assistance, investment, brokering, or other services related to the supply, sale, transfer, manufacture, or use of these items.\n  - Acquisition by Iran of an interest in a commercial activity in another State involving uranium mining, production, or use of nuclear materials and technologies.\n- The Group consists of E3+3 States and Iran, with the High Representative as Coordinator.\n- Proposals are considered within 30 working days, with necessary supporting information required.\n- Participants communicate approval or rejection within 20 working days, with a possible 10-working-day extension. \n- Proposals are recommended for approval if all participants approve or if no disapprovals are received within the 30-working-day period.\nHere is a summarized version of the Security Council document:\n\n**6. Procurement Channel**\n\n6.4.1-6.4.5: Proposals for procurement will be reviewed by a Procurement Working Group. If not approved, the proposal can be referred to the Joint Commission, which decides by consensus within 10 working days.\n\n6.4.6: The Procurement Working Group meets every three weeks; IAEA may attend as an observer for nuclear-related proposals.\n\n6.5: JCPOA participants will act in accordance with the procurement channel; Iran will not use procured items for nuclear activities inconsistent with the JCPOA.\n\n6.6: Any JCPOA participant can refer procurement-related activities to the Joint Commission under the dispute settlement mechanism.\n\n6.7: Iran will provide IAEA access to locations of intended use of imported items.\n\n6.8: Iran will permit exporting states to verify end-use of imported items; Joint Commission may provide expertise.\n\n6.9: Procurement Working Group responds to guidance requests from third parties within 9 working days.\n\n6.10: Joint Commission reports to the UNSC every 6 months on Procurement Working Group decisions and implementation issues.\n\n**7. Working Group on Implementation of Sanctions Lifting**\n\n7.1-7.2: Joint Commission has a working group on sanctions lifting implementation, coordinated by the High Representative.\n\n7.3-7.5: If Iran faces issues with sanctions lifting, it can refer the issue to the working group, which reviews and consults within 30 working days; unresolved issues can be referred to the Joint Commission.\nHere is a summarized version of the document:\n\nAnnex V - Implementation Plan\n\n**Finalisation Day**\n\n* E3/EU+3 and Iran endorse the JCPOA\n* UN Security Council resolution is submitted for adoption\n* EU endorses the resolution through Council Conclusions\n* Iran and IAEA start developing arrangements for transparency measures\n\n**Adoption Day (90 days after endorsement)**\n\n* JCPOA comes into effect\n* Participants make arrangements for implementation\n* Iran informs IAEA of intent to apply Additional Protocol and implement modified code 3.1\n* Iran implements paragraph 66 from Section M\n* EU adopts regulation terminating nuclear-related sanctions\n* US issues waivers ceasing application of statutory nuclear-related sanctions\n\n**Implementation Day (upon IAEA-verified implementation)**\n\n* Iran implements nuclear-related measures (Annex I)\n* E3/EU+3 take actions (paragraphs 16-18)\n* UN level actions take place according to UN Security Council resolution\n\nIran's nuclear-related measures to be implemented:\n\n* Arak Heavy Water Research Reactor (paragraphs 3, 10)\n* Heavy Water Production Plant (paragraphs 14, 15)\n* Enrichment Capacity (paragraphs 27-29.2)\n* Centrifuges Research and Development (paragraphs 32-42)\n* Fordow Fuel Enrichment Plant (paragraphs 45, 46, 46.1, 46.2, 47.1, 48.1)\n* Other Aspects of Enrichment (paragraphs 52, 54, 55)\n* Uranium Stocks and Fuels (paragraphs 57, 58)\n* Centrifuge Manufacturing (paragraph 62)\n* Additional Protocol and Modified Code 3.1 (paragraphs 64, 65)\n* Centrifuge Component Manufacturing Transparency (paragraphs 80.1, 80.2)\n* Completes measures specified in paragraphs 47.2 and 48.2 within one year.\nThe European Union will: \n16.1. Terminate/suspend provisions of Council Regulation (EU) No267/2012 and Council Decision 2010/413/CFSP specified in Sections 1.1.1-1.1.3; 1.1.5-1.1.8; 1.2.1-1.2.5; 1.3.1, 1.3.2 (Articles 16 and 17); 1.3.3; 1.4.1, 1.4.2; 1.10.1.2 (Articles 39, 43, 43a). \n16.2. Amend provisions of Council Regulation (EU) No267/2012 and Council Decision 2010/413/CFSP specified in Sections 1.6.1-1.7.2 of Annex II. \n16.3. Remove individuals/entities from Annexes VIII and IX to Council Regulation (EU)267/2012 and suspend provisions of Council Decision 2010/413/CFSP. \n16.4. Amend provisions to implement the relevant UN Security Council resolution.\n\nThe United States will: \n17.1. Cease application of sanctions set forth in Sections 4.1-4.5 and 4.7 of Annex II (exception: Section 211(a) of the Iran Threat Reduction and Syria Human Rights Act of 2012). \n17.2. Cease application of sanctions in Section 4.6 of Annex II. \n17.3. Remove individuals/entities from the SDN List, FSE List, and/or Non-SDN Iran Sanctions Act List. \n17.4. Terminate Executive Orders. \n17.5. License activities set forth in Section 5 of Annex II.\n\nUN Security Council: \n18.1. Provisions imposed in previous UNSC resolutions will be terminated, subject to re-imposition in case of significant non-performance by Iran. \n18.2. The E3/EU+3 will implement the new UNSC resolution.\n\nTransition Day (8 years from Adoption Day or upon IAEA report): \n20. The European Union will: \n20.1. Terminate/suspend additional provisions of Council Regulation (EU) No267/2012 and Council Decision 2010/413/CFSP. \n20.2. Remove individuals/entities from Annexes VIII and IX. \n20.3. Remove individuals/entities from Annexes I and II to Council Decision 2010/413/CFSP. \n20.4. Terminate suspended provisions.\n\nThe United States will: \n21.1. Seek legislative action to terminate/modify statutory sanctions. \n21.2. Seek legislative action to terminate/modify statutory sanctions in connection with activities consistent with this JCPOA. \n21.3. Remove individuals/entities from the SDN List and/or FSE List.\n\nIran will: \n22.1. Seek ratification of the Additional Protocol.\n\nUNSCR Termination Day will occur as per the UN Security Council resolution.\nHere is a clear and concise summary of the Security Council document:\n\nThe Security Council resolution 2231 (2015) relates to the Joint Comprehensive Plan of Action (JCPOA) on the Iranian nuclear issue.\n\n**Termination of Provisions**\n\n* The provisions of previous resolutions will not be reinstated if the JCPOA is implemented for 10 years from Adoption Day.\n* On UNSCR Termination Day, all provisions and measures imposed will terminate, and the UN Security Council will no longer be seized of the Iran nuclear issue.\n\n**European Union's Actions**\n\n* The European Union will terminate all remaining provisions of Council Regulation (EU) No 267/2012 and Council Decision 2010/413/CFSP.\n\n**Other Provisions**\n\n* The terminations described do not affect other JCPOA commitments that continue beyond termination dates.\n\n**Statement by China, France, Germany, Russia, UK, US, and EU**\n\n* These countries have concluded the JCPOA with Iran to resolve the Iranian nuclear issue.\n* Their participation in the JCPOA is contingent on the UN Security Council adopting a new resolution.\n\n**Provisions to Apply**\n\n* On the date the IAEA Director General verifies Iran's actions, the following provisions will apply:\n\t+ All States may participate in and permit certain activities with Iran, subject to advance approval by the Security Council, including:\n\t\t- Supply, sale, or transfer of items, materials, equipment, goods, and technology related to nuclear activities.\n\t\t- Provision of technical assistance, financial assistance, investment, brokering, or other services related to nuclear activities.\n\t\t- Acquisition by Iran of an interest in commercial activities in another State involving uranium mining or production.\nHere is a concise summary of the Security Council document:\n\n**Exemptions from prior approval for supply to Iran**: \nThe supply, sale, or transfer to Iran of equipment for light water reactors, low-enriched uranium for such reactors, and items for exclusive use in light water reactors do not require prior Security Council approval. \n\n**Conditions for supply**: \nFor such supplies, States must ensure that requirements of the Guidelines have been met, they have the right to verify end-use and end-use location, and they notify the Security Council and IAEA within ten days.\n\n**Exception for specific activities**: \nNo prior approval is required for activities related to modifying the Fordow facility, exporting Iran's enriched uranium, and modernizing the Arak reactor, provided that these activities are undertaken in accordance with the JCPOA and with notifications to the Security Council and Joint Commission.\n\n**Ballistic missile activities**: \nIran is called upon not to undertake activities related to ballistic missiles designed to deliver nuclear weapons until eight years after JCPOA Adoption Day or until the IAEA submits a report confirming the Broader Conclusion.\n\n**Permitted activities with prior approval**: \nThe supply of items that could contribute to nuclear weapon delivery systems and related technical assistance require prior Security Council approval on a case-by-case basis.\n\n**Arms transfers**: \nThe supply of battle tanks, combat aircraft, and other listed military items to Iran requires prior Security Council approval on a case-by-case basis.\n\n**General obligations**: \nAll States must take measures to ensure that activities occur on their territories or involving their nationals only pursuant to the relevant terms and prevent activities inconsistent with those terms.\nThe Security Council resolution 2231 (2015) outlines several provisions related to Iran. \n\nThe provisions state that:\n\n* Arms and related materiel supply, sale, or transfer from Iran will be prevented until five years after the JCPOA Adoption Day or until the IAEA submits a report confirming the Broader Conclusion, whichever is earlier, except as decided otherwise by the UN Security Council.\n\n* Funds, financial assets, and economic resources of individuals and entities specified on a list established and maintained by the Committee, and those designated by the Security Council, will be frozen for eight years or until the IAEA submits a report confirming the Broader Conclusion.\n\n* The provision of funds, financial assets, or economic resources to or for the benefit of designated individuals or entities will be prevented for eight years or until the IAEA submits a report confirming the Broader Conclusion.\n\n* Exceptions to the freeze include: \n    - Basic expenses \n    - Extraordinary expenses approved by the Security Council \n    - Civil nuclear cooperation projects described in Annex III of the JCPOA \n    - Judicial, administrative or arbitral lien or judgment \n    - Activities directly related to the items specified \n\n* Designated individuals or entities can make payments due under contracts entered into prior to listing, provided certain conditions are met.\n\n* Frozen accounts can receive interest or other earnings due, and payments due under contracts that arose prior to freezing, which will remain subject to these measures.\n(e) For five years from the JCPOA Adoption Day or until the IAEA submits a report confirming the Broader Conclusion, whichever is earlier, take measures to prevent entry into or transit through their territories of individuals described in paragraph 6(c), except when the Security Council determines on a case-by-case basis that travel is justified on humanitarian grounds, including religious obligations, or would further the objectives of the resolution;\n\n(f) Take required actions, in accordance with the resolution and Security Council guidance, with respect to items supplied, sold, transferred, or exported contrary to the JCPOA or this statement, and cooperate in such efforts.\n\n7. All States are called upon to facilitate full implementation of the JCPOA by inspecting cargo to and from Iran in their territory, if they have information providing reasonable grounds to believe the cargo contains items supplied, sold, transferred, or exported contrary to the JCPOA or this statement; and to cooperate in inspections on the high seas with the consent of the flag State, if there is such information.\n\n China, France, Germany, the Russian Federation, the United Kingdom, the United States, and the European Union note their understanding that the Security Council will make practical arrangements to undertake tasks specified in this statement, including monitoring and taking action to support implementation by Member States.\n\nThe duration of the provisions may be reviewed by the Joint Commission at its biannual ministerial-level meetings, and the Joint Commission could make recommendations by consensus to the Security Council. \n\nThe list of 36 entities and individuals subject to sanctions is attached.",
  "url": "https://storage.googleapis.com/bluelines-rag-bucket/2015/S_RES_2231_2015_EN.pdf"
}