{
  "resolution_no": "2227",
  "year": "2015",
  "theme": [
    "Peace and Reconciliation in Mali",
    "Security Sector Reform",
    "Human Rights",
    "Counter-Terrorism",
    "Humanitarian Assistance"
  ],
  "chapter": "Chapter VII",
  "charter_articles": [
    "Article 39",
    "Article 41",
    "Article 42"
  ],
  "entities": [
    "MINUSMA",
    "United Nations",
    "Security Council",
    "Mali",
    "Al-Qaida",
    "African Union",
    "European Union"
  ],
  "reporting_cycle": "every three months",
  "operative_authority": "Chapter VII",
  "summary": "The Security Council adopted Resolution 2227 (2015) on 29 June 2015, recalling its previous resolutions and statements on Mali. The Council reaffirmed its commitment to Mali's sovereignty, unity, and territorial integrity, and emphasized the primary responsibility of the Malian authorities to provide stability and security. \n\nThe Council welcomed the signing of the Agreement on Peace and Reconciliation in Mali in 2015, considering it a historic opportunity for lasting peace, and commended the signatories for their courage. The Agreement aims to address the crisis in Mali's political, institutional, governance, security, development, and reconciliation dimensions.\n\nThe Council stressed that the responsibility for implementing the Agreement rests with the Government of Mali, the Plateforme and Coordination armed groups, and emphasized the need for clear oversight mechanisms. \n\nThe Council strongly condemned ceasefire violations, which resulted in loss of life and displacement, and welcomed the signing of the Arrangement sécuritaire pour une cessation des hostilités on 5 June 2015.\n\nThe Council reiterated its support for the Special Representative of the Secretary-General and the United Nations Multidimensional Integrated Stabilization Mission in Mali (MINUSMA), commending troop- and police-contributing countries.\n\nThe Council expressed concern at MINUSMA's slow deployment pace, which hindered its ability to implement its mandate, and welcomed efforts to accelerate deployment and provide adequate training.\n\nThe Council strongly condemned terrorist organizations' activities in Mali and the Sahel region, including Al-Qaida in the Islamic Maghreb (AQIM), Ansar Eddine, and the Movement for Unity and Jihad in West Africa (MUJAO), which threaten peace and security in the region.\nHere is a concise summary of the Security Council document:\n\nThe Security Council stresses that terrorism requires a sustained and comprehensive approach, involving all States and organizations, to impede and isolate the terrorist threat. The Council recalls the listing of MUJAO, Ansar Eddine, and Al Mourabitoune on the Al-Qaida sanctions list and reiterates its readiness to sanction further individuals and entities associated with Al-Qaida.\n\nThe Council welcomes French forces' efforts to deter the terrorist threat in Mali and notes with concern the transnational dimension of the terrorist threat in the Sahel region. It underscores the importance of regional ownership and response, welcoming the Group of Five for the Sahel (G5) and the Nouakchott process.\n\nThe Council expresses concern over serious threats posed by transnational organized crime, including arms and drug trafficking, human trafficking, and kidnapping and hostage-taking. It strongly condemns abuses and violations of human rights and international humanitarian law, calling on all parties to respect the civilian character of schools and cease unlawful detention of children.\n\nThe Council reiterates the need for accountability for perpetrators of such acts and emphasizes the importance of humanitarian assistance being delivered on the basis of need. It underscores the need for Malian civilian control and oversight and commends the role of the European Union Training Mission (EUTM Mali) and the European Union Capacity Building Mission (EUCAP Sahel Mali).\n\nThe Council calls upon the Malian authorities to address immediate and long-term needs, encompassing security, governance reform, development, and humanitarian issues. It urges all Member States and other donors to contribute generously to humanitarian operations and remains seriously concerned over the significant ongoing food and humanitarian crisis in Mali.\n\nThe Council determines that the situation in Mali continues to constitute a threat to international peace and security and acts under Chapter VII of the Charter of the United Nations.\nHere is a concise summary of the Security Council document:\n\n1. Urges the Government of Mali, Plateforme, and Coordination armed groups to fulfill their commitments under the Agreement on Peace and Reconciliation in Mali, and to engage constructively to achieve its full and effective implementation.\n\n2. Urges the parties to immediately and fully respect and uphold the ceasefire agreements.\n\n3. Expresses readiness to consider targeted sanctions against those obstructing or threatening the Agreement's implementation.\n\n4. Demands that all armed groups in Mali cease hostilities, reject violence, and recognize the unity and territorial integrity of the Malian State.\n\n5. Urges Malian authorities to combat impunity and hold accountable perpetrators of human rights and international humanitarian law violations.\n\n6. Urges parties to cooperate with MINUSMA's deployment and activities.\n\n7. Requests the Special Representative of the Secretary-General to support and oversee the Agreement's implementation.\n\n8. Urges parties to cooperate with the Special Representative and MINUSMA.\n\n9. Calls on the Comité de suivi de l’Accord (CSA) and international partners to support the Agreement's implementation.\n\n10. Encourages the Government of Mali to take steps for the Agreement's effective implementation.\n\n11. Calls on UN agencies and partners to provide technical and financial support.\n\n12. Extends MINUSMA's mandate until 30 June 2016 with a troop ceiling of 11,240 military personnel and 1,440 police personnel.\n\n13. Authorizes MINUSMA to take necessary means to carry out its mandate.\n\n14. Decides MINUSMA's tasks:\n \n(a) Support, monitor, and supervise ceasefire implementation.\n\n(b) Support Agreement implementation:\n \n(i) Support political and institutional reforms.\n\n(ii) Support defence and security measures, including ceasefire monitoring and cantonment.\n\n(iii) Support reconciliation and justice measures, including an international commission of inquiry.\nHere is a summarized version of the Security Council document:\n\n**Mandate of MINUSMA**\n\n* Support the conduct of inclusive, free, fair and transparent local elections (para iv)\n* Exercise good offices, confidence-building and facilitation for national and local dialogue and reconciliation (para c)\n* Protect civilians under imminent threat of physical violence and stabilize key population centers (para d)\n* Provide specific protection for women and children affected by armed conflict (para d(iii))\n* Assist Malian authorities with removal and destruction of mines and explosive devices (para d(iv))\n* Promote and protect human rights, including supporting efforts to bring to justice those responsible for serious abuses (para e)\n* Provide humanitarian assistance and support stabilization projects (para f)\n* Protect UN personnel, installations, and equipment (para g)\n* Assist in protecting cultural and historical sites in Mali (para h)\n\n**Deployment and Capacities of MINUSMA**\n\n* Request Secretary-General to enable MINUSMA to reach full operational capacity (para 15)\n* Request Secretary-General to take measures to enhance safety and security of MINUSMA personnel (para 16)\n* Urge troop- and police-contributing countries to expedite deployment of equipment and personnel (para 17)\n* Call upon Member States to ensure free and unhindered movement of MINUSMA personnel and equipment (para 18)\n\n**Cross-cutting Issues**\n\n* Request MINUSMA to enhance interaction with civilian population and communication with Malian Defence and Security Forces (para 20)\nHere is a concise summary of the Security Council document:\n\nThe Security Council:\n\n* Requests MINUSMA to raise awareness about its mandate and activities through its radio station;\n* Requires MINUSMA to provide support to non-UN security forces in compliance with the Human Rights Due Diligence Policy;\n* Urges MINUSMA to adhere to the UN's zero-tolerance policy on sexual exploitation and abuse;\n* Requests MINUSMA to integrate gender considerations and child protection into its mandate;\n* Directs MINUSMA to consider environmental impacts of its operations and protect cultural and historical sites;\n\n* Authorizes inter-mission cooperation between MINUSMA, UNMIL, and UNOCI, subject to certain conditions;\n* Authorizes French forces to intervene in support of MINUSMA elements under imminent threat;\n* Encourages G5 Sahel and African Union contributions to combat terrorism and transnational organized crime;\n\n* Calls on Member States to enhance coordination to combat terrorist groups in the Sahel region;\n* Reiterates the need for regional strategies to address security, governance, development, human rights, and humanitarian issues in the Sahel;\n* Calls on the European Union to coordinate closely with MINUSMA;\n\n* Urges all parties to comply with international humanitarian law, respect and protect humanitarian personnel, and facilitate humanitarian access.\nThe Security Council:\n\nReiterates Malian authorities' primary responsibility to protect civilians, recalling resolutions on protection of civilians, children, and women in armed conflict, and calls upon MINUSMA and military forces to abide by international humanitarian, human rights, and refugee law.\n\nCalls on Malian authorities, with MINUSMA's assistance, to address small arms and light weapons proliferation and illicit trafficking, consistent with ECOWAS Convention and UN Programme of Action.\n\nRequests the Secretary-General to report every three months on implementation of this resolution, focusing on progress in implementing the Agreement on Peace and Reconciliation and MINUSMA's efforts.\n\nAffirms intention to review MINUSMA's mandate before 30 June 2016, considering progress on Agreement implementation.\n\nDecides to remain actively seized of the matter.",
  "url": "https://storage.googleapis.com/bluelines-rag-bucket/2015/S_RES_2227_2015_EN.pdf"
}