{
  "resolution_no": "2217",
  "year": "2015",
  "theme": [
    "Central African Republic",
    "Peace and security",
    "Humanitarian assistance"
  ],
  "chapter": "Chapter VII",
  "charter_articles": [
    "Article 41",
    "Article 42"
  ],
  "entities": [
    "MINUSCA",
    "French Forces",
    "African Union",
    "European Union"
  ],
  "reporting_cycle": "every four months",
  "operative_authority": "Chapter VII",
  "summary": "Here is a clear and concise summary of the Security Council document:\n\nThe Security Council:\n\nRecalling previous resolutions on the Central African Republic (CAR), reaffirms its commitment to the country's sovereignty, independence, unity, and territorial integrity.\n\nReaffirms the basic principles of peacekeeping, including consent of parties, impartiality, and non-use of force, except in self-defence.\n\nNotes the primary responsibility of CAR authorities to protect populations from genocide, war crimes, ethnic cleansing, and crimes against humanity.\n\nEmphasizes the need for a CAR-owned solution, prioritizing reconciliation, and the critical role of the region, African Union, and UN in promoting lasting peace and stability.\n\nCommends the African-led International Support Mission to the CAR (MISCA), Sangaris, and EUFOR RCA for their work, and the transition to the UN Integrated Multi-dimensional Mission in the CAR (MINUSCA).\n\nExpresses concern over the fragile security situation, condemns multiple human rights violations and abuses, including extrajudicial killings, enforced disappearances, and attacks on civilians.\n\nWelcomes the report of the International Commission of Inquiry, noting concern over its findings of war crimes and crimes against humanity.\n\nCondemns attacks on MINUSCA contingents and international forces, underlining that such attacks may constitute war crimes.\n\nStresses the urgent need to end impunity, bolstering national accountability mechanisms, and supports the work of the Independent Expert on human rights.\n\nWelcomes Transitional Authorities' efforts to establish a Special Criminal Court, urging national authorities to implement the law and ensure a conducive environment for investigations and prosecutions.\n\nEmphasizes the current security situation provides a conducive environment for transnational criminal activity and radical networks.\nHere is a concise summary of the Security Council document 2217 (2015):\n\nThe Security Council:\n\n* Acknowledges the contribution of the arms embargo to countering illicit transfer of arms in the Central African Republic (CAR) and the region, and supports post-conflict peacebuilding, disarmament, demobilization, and reintegration.\n\n* Expresses grave concern at the threat to peace and security in the CAR arising from illicit transfer, accumulation, and misuse of small arms and light weapons.\n\n* Reiterates that targeted sanctions aim at individuals and entities engaging in acts that undermine peace, stability, or security in the CAR.\n\n* Expresses concern about reported travel by sanctioned individuals and stresses the importance of effective implementation of the sanctions regime.\n\n* Reiterates serious concern at the dire humanitarian situation in the CAR, emphasizing the needs of internally displaced persons, civilians trapped in enclaves, and refugees.\n\n* Urges all parties to ensure the safety and security of humanitarian personnel, UN personnel, and installations.\n\n* Welcomes efforts of the International Contact Group on the CAR and encourages stakeholders to pursue their efforts.\n\n* Calls upon Transitional Authorities to accelerate preparation of the electoral process to hold free, fair, and credible elections.\n\n* Welcomes grassroots consultations, the Bangui Forum, and joint action by domestic religious leaders to pacify relations and end violence.\n\n* Underlines the need to support national and coordinate international efforts to rebuild the security sector in the CAR.\n\n* Recalls resolutions on protection of civilians, children, and women in armed conflict, and calls upon all parties to engage with Special Representatives.\n\n* Expresses concern about continued abuses against children and women, and dire situation of persons with disabilities in the CAR.\nHere is a concise summary of the Security Council document:\n\nThe Security Council commends the African Union's (AU) role in stabilizing the Central African Republic (CAR) and welcomes the European Union's (EU) and United States' contributions. The Council encourages the international community to provide support for humanitarian needs and reconstruction, linking relief, rehabilitation, and development.\n\nThe Council calls on international partners to assist the Transitional Authorities in building institutional capacity, particularly for national police and customs authorities, and to support disarmament and repatriation of foreign armed elements.\n\nThe Council welcomes the World Bank's plan and encourages international financial institutions to engage with the Transitional Authorities. It also calls for urgent financial contributions to support national dialogue, reconciliation, elections, and security sector reform.\n\nThe Council supports the Transitional Authorities, led by Catherine Samba-Panza, and reiterates its call for accelerated completion of the transition process. It welcomes regional efforts, particularly by the Economic Community of Central African States (ECCAS), and demands that all militias and non-state armed groups lay down their arms.\n\nThe Council also:\n\n* Commends initial measures to restore peace and stability\n* Urges the Transitional Authorities to accelerate preparations for free and inclusive presidential and legislative elections\n* Calls on all actors to respect the Transitional Constitutional Charter\n* Urges a comprehensive reform of the CAR security sector\n* Supports the role of the Peace Building Commission CAR configuration in supporting Transitional Authorities' efforts. \n\nThe Council determines that the situation in the CAR continues to constitute a threat to international peace and security, and acts under Chapter VII of the Charter of the United Nations.\nHere is a summarized version of the Security Council document:\n\nThe Security Council:\n\nReforms and Security Sector\n\n* Requests the Central African authorities to reform the security sector, including the Armed Forces (FACA) and internal security forces, to make them professional, ethnically representative, and regionally balanced.\n* Calls for the adoption of human rights vetting procedures for all defense and security personnel.\n\nJustice and Accountability\n\n* Urges the Central African authorities to strengthen justice institutions, fight impunity, and implement the law establishing the Special Criminal Court.\n* Calls for the redeployment of state administration in the provinces, including the restoration of the judiciary and criminal justice system.\n\nInternational Support\n\n* Calls on Member States and international organizations to provide urgent support to the Transitional Authorities, including contributions for the payment of salaries, restoration of state authority, and holding of elections.\n\nHuman Rights\n\n* Reiterates the need to hold accountable all perpetrators of human rights violations and abuses, including those that may amount to crimes under the Rome Statute of the International Criminal Court (ICC).\n* Welcomes the ICC's investigation into alleged crimes committed since 2012.\n\nProtection of Civilians\n\n* Calls upon all parties to protect children and consider them as victims, and to issue clear orders prohibiting all violations and abuses committed against children.\n* Demands that all parties protect and consider as victims those children who have been released or otherwise separated from armed forces and armed groups.\n\nPeacekeeping Operation\n\n* Commends the transition of authority from MISCA to MINUSCA and welcomes the re-hatting of former MISCA troops and police under MINUSCA.\n* Decides to extend the mandate of MINUSCA until 30 April 2016, with an authorized troop ceiling of 10,750 military personnel and 2,080 police personnel.\n* Requests the Secretary-General to accelerate the deployment of MINUSCA's civilian, police, and military capabilities.\nHere is a summarized version of the Security Council document:\n\n25. Urges former MISCA troop and police contributing countries to expedite procurement and deployment of remaining equipment to meet UN standards.\n\n26. Urges the Secretariat to explore using specialized police teams and equipment for police capacity building and operational support.\n\n27. Requests the Secretary-General to reinforce the police component of MINUSCA, including strengthening the chain of command and accelerating deployment.\n\n28. Stresses the importance of expediting deployment of MINUSCA's civilian component to support police and military components.\n\n29. Urges MINUSCA to ensure unhindered access for the Panel of Experts.\n\n30. Decides MINUSCA's mandate should be implemented based on prioritized tasks and requests the Secretary-General to reflect this in deployment and resource allocation.\n\n31. Authorizes MINUSCA to take necessary means to carry out its mandate.\n\n32. Decides MINUSCA's mandate includes:\n\n(a) Protection of civilians:\n\n* Protect civilians from physical violence\n* Provide specific protection for women and children\n* Identify and record threats and attacks against civilians\n* Implement a mission-wide protection strategy\n\n(b) Support for transition process, extension of State authority, and preservation of territorial integrity:\n\n* Assist Transitional Authorities and facilitate international efforts\n* Provide good offices and political support\n* Support security for key national stakeholders\n* Assist in mediation and reconciliation processes\n* Support electoral process and constitutional referendum\n* Promote extension of State authority\n\n(c) Facilitate humanitarian assistance:\n\n* Enhance civil-military coordination and create a secure environment for humanitarian assistance.\nHere is a clear and concise summary of the Security Council document:\n\nThe Security Council authorizes the Multidimensional Integrated Stabilization Mission in the Central African Republic (MINUSCA) to perform various tasks, including:\n\n* Protection of civilians, humanitarian personnel, and UN personnel\n* Facilitating the voluntary return or local integration of internally displaced persons and refugees\n* Protecting UN personnel, installations, equipment, and goods\n* Promoting and protecting human rights, including:\n\t+ Monitoring and reporting on human rights abuses and violations\n\t+ Helping to investigate and prosecute perpetrators\n\t+ Supporting the establishment of a national human rights commission\n* Implementing urgent temporary measures to maintain law and order\n* Assisting in the establishment of a Special Criminal Court\n* Supporting disarmament, demobilization, reintegration, and repatriation (DDRR) of former combatants\n* Providing support for national and international justice and the rule of law, including:\n\t+ Building the capacities of the national judicial system\n\t+ Providing support to policing, justice, and correctional institutions\n\nMINUSCA is authorized to use its capacities to assist the CAR authorities in implementing these tasks.\nHere is a concise summary of the Security Council document:\n\n**Security Sector Reform and Related Tasks**\n\n* MINUSCA to support restoration and maintenance of public safety and rule of law, including through UN police presence and assistance.\n* MINUSCA to support Transitional Authorities in devising and implementing security sector reform and vetting processes.\n* MINUSCA to coordinate provision of technical assistance and training for FACA and internal security forces.\n\n**Illicit Exploitation and Trafficking of Natural Resources**\n\n* MINUSCA to support CAR authorities in developing a strategy to tackle illicit exploitation and trafficking networks.\n\n**Additional Tasks**\n\n* MINUSCA to coordinate international assistance.\n* MINUSCA to assist Committee and Panel of Experts established by resolution 2127 (2013).\n* MINUSCA to monitor implementation of measures renewed and modified by resolution 2196 (2015).\n* MINUSCA to seize and collect arms and related materiel transferred to CAR in violation of measures imposed by resolution 2127 (2013).\n\n**Other Requests**\n\n* Secretary-General to deploy and allocate personnel and expertise within MINUSCA.\n* MINUSCA to enhance operational coordination with African Union Regional Task Force on LRA.\n* Transitional Authorities and international partners to address illicit transfer and misuse of small arms and light weapons.\n* CAR, neighbouring States, and ICGLR member States to cooperate to investigate and combat regional criminal networks.\n\n**Cross-Cutting Issues**\n\n* MINUSCA to take fully into account child protection and gender considerations throughout its mandate.\n* MINUSCA to assist Transitional Authorities in ensuring protection of children's rights and full and effective participation of women.\n\n**Exemptions and Reporting**\n\n* Measures imposed by resolution 2196 (2015) do not apply to MINUSCA, AU Regional Task Force, European Union Missions, and French forces.\nHere is a concise summary of the Security Council document:\n\n43. The Secretary-General must ensure MINUSCA complies with the UN's zero-tolerance policy on sexual exploitation and abuse, and inform the Council of any misconduct cases.\n\n44. MINUSCA must provide support to non-UN security forces in line with the Human Rights Due Diligence Policy, and the Secretary-General must report on such support.\n\n45. MINUSCA, EUMAM-RCA, and French forces must respect CAR's sovereignty, territorial integrity, and unity, and comply with international humanitarian law, human rights law, and refugee law.\n\n46. All parties in CAR must cooperate with MINUSCA's deployment and activities, ensuring its safety, security, and freedom of movement.\n\n47. Member States, especially in the region, must ensure the free and unhindered movement of MINUSCA personnel, equipment, and supplies.\n\n48. All parties must allow and facilitate humanitarian access to populations in need.\n\n49. The Council welcomes the humanitarian appeal, regrets its insufficient funding, and calls on Member States to respond swiftly with increased contributions.\n\n50. French forces are authorized to provide operational support to MINUSCA, and must report to the Council on implementation.\n\n51. The Secretary-General must review conditions for MINUSCA's transition, drawdown, and withdrawal.\n\n52. The Secretary-General must regularly inform the Council of the situation in CAR and MINUSCA's implementation of its mandate, reporting every four months.\n\n53. The Council remains actively seized of the matter.",
  "url": "https://storage.googleapis.com/bluelines-rag-bucket/2015/S_RES_2217_2015_EN.pdf"
}