{
  "resolution_no": "2220",
  "year": "2015",
  "theme": [
    "Small arms and light weapons",
    "Conflict prevention",
    "Peace and security"
  ],
  "chapter": "Chapter VI",
  "charter_articles": [
    "Article 24",
    "Article 25",
    "Article 51"
  ],
  "entities": [
    "United Nations",
    "Security Council",
    "Sanctions Committees",
    "United Nations peacekeeping operations"
  ],
  "reporting_cycle": "Biennial",
  "operative_authority": "Chapter VI",
  "summary": "The Security Council, recalling its primary responsibility for maintaining international peace and security, adopted Resolution 2220 (2015) on 22 May 2015. The Council noted the significant impact of small arms and light weapons on recent armed conflicts, emphasizing that their excessive accumulation and destabilizing effect endanger civilians, including women, children, and vulnerable groups.\n\nThe Council recalled previous resolutions and statements on small arms and light weapons, including 1196 (1998), 1209 (1998), 1467 (2003), and 2117 (2013). It emphasized that the right to self-defense and legitimate security demands should be considered, while recognizing that small arms and light weapons are traded, manufactured, and retained by States for legitimate purposes.\n\nThe Council expressed grave concern over the illicit transfer, destabilizing accumulation, and misuse of small arms and light weapons, which pose threats to international peace and security, cause loss of life, and contribute to instability. It reiterated deep regret that civilians account for the majority of casualties in armed conflicts and recalled the negative human rights, humanitarian, development, and socioeconomic consequences of these actions.\n\nThe Council emphasized the devastating impact on children in armed conflict, including recruitment, killing, and maiming, and underlined the responsibility of States to prevent threats posed by the illicit transfer, destabilizing accumulation, and misuse of small arms and light weapons. It reaffirmed that parties to armed conflict bear the primary responsibility to protect civilians and recalled that States bear the primary responsibility to respect and ensure human rights.\n\nThe Council recognized the need for a comprehensive approach to address the illicit transfer, destabilizing accumulation, and misuse of small arms and light weapons, incorporating coherence between political, security, development, human rights, and rule of law activities. It also recognized the negative impact of insecurity resulting from these actions on conflict prevention, post-conflict peacebuilding, and peace consolidation.\nThe Security Council:\n\nAcknowledges the contribution of arms embargoes in countering illicit transfer of small arms and light weapons, and emphasizes the need for improved information sharing on possible embargo violations.\n\nRecognizes the importance of aligning objectives of arms embargoes with overall objectives of other UN efforts in relevant Member States or regions.\n\nReiterates that UN peacekeeping operations and other Council-mandated entities may assist host governments in weapons collection, disarmament, demobilization, and reintegration programs.\n\nRecalls with concern the connection between international terrorism, transnational organized crime, and illicit trafficking of arms, and stresses the importance of women's participation in efforts to counter illicit transfer of small arms.\n\nExpresses concern at threats posed by illicit transfer of small arms to UN peacekeepers, humanitarian workers, and civilians, including women and children.\n\nRecognizes the value of effective physical security and management of stockpiles, and notes the importance of marking and tracing small arms.\n\nAcknowledges the entry into force of the Arms Trade Treaty and reaffirms the significance of the UN Convention against Transnational Organized Crime and its Protocols.\n\nNotes with appreciation efforts made by Member States, intergovernmental organizations, and civil society in addressing threats posed by illicit transfer of small arms.\n\nWelcomes the Secretary-General's report and expresses determination to implement existing and take further practical steps to prevent illicit transfer of small arms.\n\n1. Welcomes efforts made by Member States and regional organizations in addressing illicit transfer of small arms and encourages establishment or strengthening of subregional and regional cooperation mechanisms.\n\n2. Reiterates that illicit transfer of small arms fuels conflict and has devastating impact on civilians, and demands that all parties to armed conflict comply strictly with international humanitarian law, human rights law, and refugee law.\nHere is a summarized version of the Security Council document:\n\nThe Security Council:\n\n1. Stresses the need to avoid civilian casualties and protect the civilian population.\n\n2. Reiterates the obligation of parties to armed conflict to respect and protect humanitarian personnel, facilities, and relief consignments, and to facilitate the safe passage of relief consignments, equipment, and personnel.\n\n3. Expresses its intention to consider issues related to the illicit transfer, destabilizing accumulation, and misuse of small arms and light weapons when mandating UN peacekeeping operations and other entities.\n\n4. Encourages the Secretary-General to identify capacities of UN entities to counter the illicit transfer, destabilizing accumulation, and misuse of small arms and light weapons.\n\n5. Emphasizes the need for capacity-building of governments to manage, store, secure, mark, record, and trace stockpiles of small arms and light weapons.\n\n6. Encourages the UN to gather and share best practices on safe storage, marking, and destruction of collected weapons.\n\n7. Recognizes that the effectiveness of weapons collection and disarmament, demobilization, and reintegration programs depends on providing opportunities to former combatants and fostering a secure environment.\n\n8. Emphasizes the importance of security sector reform in improving public security and rule of law.\n\n9. Reaffirms its responsibility to monitor the implementation of arms embargoes and strengthen monitoring mechanisms.\n\n10. Recognizes the need for Member States to establish laws and regulations to control the production and transfer of small arms and light weapons.\n\n11. Urges Member States and relevant entities to cooperate and share information on suspected traffickers, trafficking routes, and suspicious financial transactions.\n\n12. Urges Member States to regulate brokering activities for small arms and light weapons.\n\n13. Reiterates that Council-mandated arms embargoes should have clear objectives and provisions for regular review.\n\n14. Notes that Sanctions Committees may benefit from information on existing holdings and self-defense needs when determining exemptions to arms embargoes.\nThe Security Council,\n\n \n12. Requests relevant Sanctions Committees, when appropriate, to consider \nexemptions, conditions of their storage, as well as quantities of arms and related \nmateriel destroyed through disarmament, demobilization and reintegration \nprogramme, if applicable;\n\n13. Encourages Sanctions Committees to maintain dialogue on implementation \nof arms embargoes with Member States;\n\n14. Encourages Member States to better understand the impact of the illicit \ntransfer, destabilizing accumulation and misuse of small arms and light weapons on \nwomen and children;\n\n15. Calls upon Member States, United Nations entities, intergovernmental, \nregional and subregional organizations to take into consideration the specific impact \nof conflict and post-conflict environments on women’s security;\n\n16. Urges Member States, United Nations entities, intergovernmental, \nregional and subregional organizations, to take further measures to facilitate \nwomen’s full and meaningful participation in all policymaking;\n\n17. Reaffirms its decision that States shall eliminate the supply of weapons, \nincluding small arms and light weapons, to terrorists;\n\n18. Recognizes the importance of preventing the illicit transfers and sales of \nweapons and ammunition, including small arms and light weapons, to armed groups \nand criminal networks that target civilians;\n\n19. Urges States to consider ratifying or acceding to the Arms Trade Treaty \nas soon as possible;\n\n20. Recognizes that improving national implementation of Council-mandated \narms embargoes and mandating United Nations peacekeeping operations may contribute \nto a more effective implementation of the Arms Trade Treaty;\n\n21. Notes that implementation of national reporting provisions of the Arms \nTrade Treaty by the States Parties can contribute to increased transparency;\n\n22. Encourages all Member States that have not yet done so to consider \nacceding to and to implement the United Nations Convention against Transnational \nOrganized Crime;\n\n23. Stresses the need for full and effective implementation by States at the \nnational, regional and international levels, of the United Nations Programme of \nAction;\n\n24. Requests the Secretary-General to include in his reports and briefings to \nthe Council on country-specific situations, more comprehensive and detailed \ninformation and recommendations relating to the impact of the illicit transfer;\n\n25. Requests \nthe \nSecretary-General \nto \ninclude \ninformation \nand \nrecommendations regarding the impact of the illicit transfer;\n\n26. Reiterates its request to the Secretary-General to direct any relevant \nUnited Nations agencies operating in a State or region in relation to which the \nCouncil maintains an arms embargo provide the utmost assistance.\nThe Security Council:\n\n Requests the Secretary-General to include information and recommendations on the impact of illicit transfer, destabilizing accumulation and misuse of small arms and light weapons on children in his annual and country-specific reports on children and armed conflict (para 29).\n\n Encourages the Committee established pursuant to resolutions 1267 (1999) and 1989 (2011) and the Analytical Support and Sanctions Monitoring Team to focus on threats posed by accessibility of weapons used by individuals and entities associated with al-Qaida and to provide recommendations for actions to enhance response to such threats (para 30).\n\n Encourages the Counter-Terrorism Committee and Counter-Terrorism Committee Executive Directorate (CTED) to focus on Member States' capacities and needs to address threats posed by accessibility of weapons used by terrorists and to provide concrete plans to facilitate technical assistance (para 31).\n\n Requests the Secretary-General to submit a biennial report on small arms and light weapons, including on the implementation of this resolution (para 32).\n\n Decides to remain seized of the matter (para 33).",
  "url": "https://storage.googleapis.com/bluelines-rag-bucket/2015/S_RES_2220_2015_EN.pdf"
}