{
  "resolution_no": "2253",
  "year": "2015",
  "theme": [
    "Terrorism",
    "Counter-terrorism",
    "Sanctions"
  ],
  "chapter": "Chapter VII",
  "charter_articles": [
    "24",
    "25",
    "27"
  ],
  "entities": [
    "United Nations",
    "Security Council",
    "ISIL (Da'esh) & Al-Qaida Sanctions List",
    "Monitoring Team",
    "Ombudsperson"
  ],
  "reporting_cycle": "",
  "operative_authority": "Chapter VII",
  "summary": "Here is a concise summary of the Security Council document:\n\nThe Security Council:\n\n- Recalls previous resolutions on terrorism, \n- Reaffirms that terrorism is a serious threat to peace and security, \n- Condemns the Islamic State in Iraq and the Levant (ISIL, also known as Da’esh), Al-Qaida, and associated individuals and entities, \n- Recognizes the need for collective efforts to counter terrorism, \n- Reaffirms that terrorism cannot be associated with any religion, nationality, or civilization.\n\nThe Council:\n\n- Expresses concern about ISIL, Al-Qaida, and their affiliates' presence and actions, \n- Reaffirms its commitment to sovereignty, territorial integrity, and political independence of all States, \n- Recalls previous Presidential Statements on threats to international peace and security caused by terrorist acts.\n\nThe Council:\n\n- Reaffirms the need to combat terrorist threats by all means, in accordance with the Charter of the United Nations and international law, \n- Recognizes that development, security, and human rights are mutually reinforcing, \n- Reaffirms resolution 1373 (2001) and decisions on financing of terrorist acts.\n\nThe Council:\n\n- Stresses that terrorism can only be defeated by a sustained and comprehensive approach, \n- Emphasizes that sanctions are an important tool in maintaining and restoring international peace and security, \n- Recalls that ISIL is a splinter group of Al-Qaida.\n\nThe Council:\n\n- Condemns terrorist attacks perpetrated by ISIL, \n- Reminds all States of their obligation to take measures with respect to individuals and entities on the ISIL (Da’esh) & Al-Qaida Sanctions List, \n- Urges Member States to participate actively in maintaining and updating the Sanctions List.\nThe Security Council:\n\n\n\n1. Decides to expand the scope of sanctions to ISIL (Da’esh) and Al-Qaida; \n2. Expresses intent to ensure fair and clear procedures for listing and delisting entities; \n3. Recognizes challenges in implementing measures under paragraph 2 and need for capacity building; \n4. Welcomes Office of the Ombudsperson’s contributions to fairness and transparency; \n5. Encourages cooperation between Committee and INTERPOL, UN bodies, and CTITF; \n6. Condemns kidnapping and hostage-taking by terrorist groups; \n7. Expresses concern over ISIL, Al-Qaida profiting from transnational organized crime; \n8. Recognizes need to prevent terrorist financing, including from organized crime proceeds; \n9. Calls on non-governmental organizations to prevent terrorist abuse; \n10. Decides to eliminate supply of weapons to terrorists; \n11. Expresses concern over terrorists’ use of new technologies; \n12. Condemns destruction of cultural heritage; \n13. Reiterates obligations to prevent foreign terrorist fighters’ movement and financing.\nThe Security Council:\n\nCondemns the trade in Iraqi and Syrian cultural property and other items of archaeological, historical, cultural, rare scientific, and religious importance illegally removed from Iraq since 6 August 1990 and from Syria since 15 March 2011;\n\nRecalling resolution 2178 (2014) and expressing concern with the continued threat posed by ISIL, Al-Qaida, and associated individuals, groups, undertakings, and entities;\n\nCondemns in strongest terms abductions of women and children by ISIL, ANF, and associated individuals, groups, undertakings, and entities and recalls resolution 2242 (2015);\n\nWelcoming Secretariat efforts to standardize the format of UN sanctions lists;\n\nActing under Chapter VII of the Charter:\n\n1. Renames the 1267/1989 Al-Qaida Sanctions Committee as the “1267/1989/2253 ISIL (Da’esh) and Al-Qaida Sanctions Committee” and the Al-Qaida Sanctions List as the “ISIL (Da’esh) and Al-Qaida Sanctions List”;\n\n2. Imposes measures on ISIL (Da’esh), Al-Qaida, and associated individuals, groups, undertakings, and entities:\n \n   a. Asset Freeze: Freeze funds and other financial assets or economic resources;\n \n   b. Travel Ban: Prevent entry into or transit through territories;\n \n   c. Arms Embargo: Prevent direct or indirect supply, sale, or transfer of arms and related materiel;\n\n3. Sets out listing criteria for the ISIL (Da’esh) & Al-Qaida Sanctions List, including participating in financing, planning, facilitating, preparing, or perpetrating acts or activities by ISIL or Al-Qaida;\n\n4. Notes means of financing or support include proceeds derived from crime;\n\n5. Confirms individuals, groups, undertakings, or entities supporting Al-Qaida or ISIL are eligible for listing;\n\n6. Confirms requirements apply to financial and economic resources used for support;\n\n7. Confirms requirements apply to funds for listed individuals’ travel.\nHere is a concise summary of the document:\n\n**Travel-related funds and assets**\n\n* Travel-related funds, other financial assets or economic resources may only be provided in accordance with exemption procedures set out in resolutions 1452 (2002) and 1735 (2006) (para 7).\n\n**Payment of ransoms**\n\n* Payment of ransoms to individuals, groups, undertakings or entities on the ISIL (Da’esh) & Al-Qaida Sanctions List is subject to requirements in paragraph 2 (a) (para 8).\n\n**Frozen accounts and exemptions**\n\n* Member States may permit addition to frozen accounts of payments in favour of listed individuals, groups, undertakings or entities, provided they are frozen (para 9).\n* Exemptions to travel ban must be submitted by Member States, individuals or the Ombudsperson (para 10).\n\n**Implementation of measures**\n\n* States must identify and introduce procedures to implement measures (para 11).\n* Those responsible for terrorist acts must be held accountable and Member States must provide assistance in investigations and proceedings (para 12).\n\n**Obligations of Member States**\n\n* Member States must ensure their nationals and persons in their territory do not make available economic resources to ISIL, Al-Qaida, and associated individuals, groups, undertakings, and entities (para 13).\n* Member States must report to the Committee on measures taken to comply with provisions (para 15).\n\n**Financial Action Task Force (FATF) standards**\n\n* Member States must implement FATF’s revised Forty Recommendations on Combating Money Laundering and the Financing of Terrorism and Proliferation (para 16).\n* FATF reports on ISIL financing and emerging terrorist financing risks are welcomed (para 17).\nThe Security Council:\n\n18. Encourages FATF to prioritize countering terrorist financing, particularly identifying and working with Member States with AML/CFT deficiencies.\n\n19. Clarifies that the obligation in resolution 1373 (2001) applies to making funds available for the benefit of terrorist organizations or individual terrorists.\n\n20. Calls upon States to make wilful violation of the prohibition a serious criminal offence.\n\n21. Calls upon Member States to cut flows of funds to individuals and entities on the ISIL & Al-Qaida Sanctions List.\n\n22. Urges Member States to prevent terrorists from recruiting and to counter violent extremist propaganda.\n\n23. Urges Member States to promote awareness of the ISIL & Al-Qaida Sanctions List.\n\n24. Highlights the importance of strong relationships with the private sector in countering terrorist financing.\n\n25. Recognizes the importance of information sharing to counter terrorist financing.\n\n26. Decides that Member States shall undertake measures to prevent ISIL, Al-Qaida, and associated individuals from obtaining explosives.\n\n27. Encourages Member States to meet with the Committee for in-depth discussion.\n\n28. Urges Member States to invalidate and remove fraudulent travel documents.\n\n29. Encourages Member States to share information on fraudulent travel documents.\n\n30. Encourages Member States to note travel bans on listed individuals.\n\n31. Encourages Member States to consult the ISIL & Al-Qaida Sanctions List when considering travel visa applications.\nThe Security Council resolution 2253 (2015) makes the following decisions:\n\n**Information Exchange and Implementation**\n\n* Encourages Member States to exchange information on the travel of individuals on the ISIL (Da’esh) & Al-Qaida Sanctions List (paragraph 32).\n* Encourages designating States to inform the Monitoring Team about judicial proceedings related to listed parties (paragraph 33).\n* Encourages Member States to designate national focal points to liaise with the Committee and the Monitoring Team (paragraph 34).\n* Encourages Member States to report to the Committee on obstacles to implementing the measures (paragraph 35).\n* Calls upon States to submit an updated report on their implementation of the measures within 120 days (paragraph 36).\n\n**Committee's Tasks**\n\n* Directs the Committee to ensure fair and clear procedures for listing and removing individuals and entities from the ISIL (Da’esh) & Al-Qaida Sanctions List (paragraph 37).\n* Directs the Committee to review its guidelines and report to the Council on its findings and recommendations (paragraphs 38 and 39).\n* Directs the Committee to identify possible cases of non-compliance and determine the appropriate course of action (paragraph 40).\n* Confirms that no matter should be left pending before the Committee for more than six months (paragraph 41).\n* Requests the Committee to facilitate assistance on capacity-building for enhancing implementation of the measures (paragraph 42).\n\n**Listing and Sanctions**\n\n* Encourages Member States to submit names of individuals and entities participating in the financing or support of ISIL, Al-Qaida, and associated individuals and entities for inclusion on the ISIL (Da’esh) & Al-Qaida Sanctions List (paragraph 43).\n* Reiterates that the measures are preventative in nature and not reliant upon criminal standards set out under national law (paragraph 44).\n* Reaffirms the requirements for proposing names to the Committee for inclusion on the ISIL (Da’esh) & Al-Qaida Sanctions List (paragraph 45).\n* Encourages Member States to submit photographs and biometric data of individuals for inclusion in INTERPOL-United Nations Security Council Special Notices (paragraph 47).\n\n**Monitoring and Reporting**\n\n* Directs the Committee to update the standard form for listing and directs the Monitoring Team to report on further steps to improve the quality of the ISIL (Da’esh) & Al-Qaida Sanctions List (paragraph 48).\n* Directs the Committee to make accessible on its website a narrative summary of reasons for listing (paragraph 49).\n* Encourages Member States and international organizations to inform the Committee of relevant court decisions and proceedings (paragraph 50).\nHere is a concise summary of the document:\n\n51. The Committee and Monitoring Team are called upon to share information on listing requests from Member States to inform the Committee's decision.\n\n52. The Secretariat must notify the Permanent Mission of the State where an individual or entity is believed to be located and publish relevant information on the Committee's website within three working days of adding a name to the ISIL (Da’esh) & Al-Qaida Sanctions List.\n\n53. Member States must notify listed individuals or entities of the listing, including the narrative summary of reasons for listing, effects of listing, and procedures for delisting requests.\n\n54. The mandate of the Office of the Ombudsperson is extended for 24 months, and the Ombudsperson shall receive delisting requests, present observations and recommendations to the Committee.\n\n55. If the Ombudsperson recommends retaining a listing, the requirement for States to take measures remains in place.\n\n56. If the Ombudsperson recommends delisting, the requirement for States to take measures terminates 60 days after Committee consideration, unless the Committee decides by consensus to maintain the listing.\n\n57. The Committee may shorten the 60-day period by consensus.\n\n58. The measures referred to are preventative and not reliant on criminal standards.\n\n59. The Secretary-General is requested to strengthen the capacity of the Office of the Ombudsperson.\n\n60. Member States are urged to provide relevant information to the Ombudsperson.\n\n61. Member States and international organizations are urged to encourage individuals and entities to seek removal from the ISIL (Da’esh) & Al-Qaida Sanctions List through the Office of the Ombudsperson.\n\n62. The Financial Action Task Force (FATF) international standards are noted.\n\n63. When a designating State submits a delisting request, the requirement for States to take measures is recalled.\nHere is a concise summary of the document:\n\n63. The sanctions measures shall terminate with respect to an individual, group, undertaking or entity after 60 days unless the Committee decides by consensus to maintain them; if consensus does not exist, the Chair shall submit the question to the Security Council for a decision within 60 days.\n\n64. The Committee may shorten the 60-day period by consensus on a case-by-case basis.\n\n65. For delisting requests, consensus must exist between all designating States; co-sponsors of listing requests are not considered designating States.\n\n66. Designating States are urged to allow the Ombudsperson to reveal their identities to listed individuals and entities that have submitted delisting petitions.\n\n67. The Committee shall consider delisting requests from Member States for individuals, groups, undertakings, and entities that no longer meet the criteria.\n\n68. States are encouraged to submit delisting requests for deceased individuals and entities that have ceased to exist.\n\n69. When unfreezing assets of a deceased individual or ceased entity, States should recall obligations under resolution 1373 (2001) and prevent assets from being used for terrorist purposes.\n\n70. For assets frozen due to Usama bin Laden's listing, States shall submit a request to unfreeze assets and provide assurances they will not be used for terrorist purposes.\n\n71. The Committee should consider delisting requests, giving due consideration to designating States and other relevant States.\n\n72. Member States are encouraged to provide information to the Committee on delisting petitions.\n\n73. The Secretariat shall notify the Permanent Mission of the State(s) of residence, nationality, location or incorporation when a name is removed from the ISIL (Da’esh) & Al-Qaida Sanctions List.\n\n74. The Ombudsperson may request exemptions to allow petitioners to travel for interviews.\n\n75. The assets freeze measures shall not apply to funds necessary for basic expenses or extraordinary expenses, subject to Committee approval.\nThe Security Council:\n\n76. Reaffirms the Focal Point mechanism's role in receiving requests from listed individuals, groups, undertakings, and entities for exemptions to measures outlined in paragraph 2, and directs the Committee to consider such requests, including in consultation with relevant States.\n\n77. Reaffirms the Focal Point's role in receiving communications from individuals removed from the ISIL (Da’esh) & Al-Qaida Sanctions List and those claiming to have been subjected to measures due to false or mistaken identification.\n\n78. Directs the Committee to carefully consider such communications and respond within 60 days, and to communicate with Member States to address possible or confirmed cases of false or mistaken identity.\n\n79. Encourages Member States to submit additional identifying and other information on listed individuals, groups, undertakings, and entities.\n\n80. Requests the Monitoring Team to circulate a list of individuals and entities on the ISIL (Da’esh) & Al-Qaida Sanctions List whose entries lack identifiers, are reportedly deceased, or have ceased to exist.\n\n81. Directs the Committee to review listings and remove them if no longer appropriate.\n\n82. Directs the Monitoring Team to refer listings for review if no relevant State has responded in writing to the Committee’s requests for information.\n\n83. Directs the Committee to cooperate with other relevant Security Council Sanctions Committees.\n\n84. Reiterates the need to enhance cooperation among the Committee and United Nations counter-terrorism bodies.\n\n85. Encourages the Monitoring Team and the United Nations Office on Drugs and Crime to continue joint activities.\n\n86. Requests the Committee to consider visits to selected countries by the Chair and/or Committee members.\nHere is a concise summary of the Security Council document:\n\n87. The Committee is requested to report orally to the Council at least once a year on its work and the Monitoring Team's activities.\n\n88. The Committee should consider requests for information from States and international organizations with ongoing judicial proceedings.\n\nMonitoring Team:\n\n89. The mandate of the current Monitoring Team is extended for 24 months from the expiration of its current mandate in December 2017.\n\n90. The Secretary-General is requested to add up to two new experts to the Monitoring Team to analyze ISIL's financing, radicalization, and recruitment.\n\n91. The Monitoring Team should report on relevant thematic and regional topics and developing trends.\n\n92. UN Missions are encouraged to assist the Committee and Monitoring Team within their existing mandates.\n\n93. The Monitoring Team should identify instances of non-compliance, facilitate assistance on capacity-building, and provide recommendations.\n\n94. The Committee, with the Monitoring Team's assistance, should hold special meetings on thematic or regional topics.\n\n95. The Analytical Support and Sanctions Monitoring Team should submit recommendations to strengthen monitoring of global implementation.\n\n96. The Analytical Support and Sanctions Monitoring Team should provide quarterly oral briefings.\n\nISIL Reporting:\n\n97. The Secretary-General is requested to provide an initial strategic-level report on the threat posed by ISIL within 45 days.\n\nReviews:\n\n98. The measures described will be reviewed in 18 months or sooner if necessary.\n\n99. The Council decides to remain actively seized of the matter.\nThe Monitoring Team shall operate under the direction of the Committee and have the following mandates and responsibilities:\n\n(a) Submit comprehensive, independent reports to the Committee every six months on:\n  (i) Implementation by Member States of measures referred to in paragraph 2;\n  (ii) Global threat posed by ISIL, Al-Qaida, and associated individuals and entities;\n  (iii) Impact of measures in resolution 2199 (2015), including oil trade, cultural property, kidnapping for ransom, and arms supply;\n  (iv) Threat posed by foreign terrorist fighters;\n  (v) Other issues requested by the Security Council or Committee; and\n  (vi) Recommendations for improved implementation of sanctions measures;\n\n(b) Assist the Ombudsperson in carrying out his/her mandate, including providing updated information on individuals and entities seeking removal from the ISIL (Da’esh) & Al-Qaida Sanctions List;\n\n(c) Assist the Committee in reviewing names on the ISIL (Da’esh) & Al-Qaida Sanctions List, including undertaking travel and contacting Member States;\n\n(d) Assist the Committee in following up on requests to Member States for information;\n\n(e) Submit a comprehensive programme of work to the Committee for review and approval;\n\n(f) Work closely with CTED and the 1540 Committee’s group of experts to identify areas of convergence and overlap;\n\n(g) Participate actively in and support all relevant activities under the United Nations Global Counter-Terrorism Strategy;\n\n(h) Gather information on instances of reported non-compliance with measures referred to in paragraph 2;\n\n(i) Present recommendations to assist Member States with implementation of measures and preparing proposed additions to the ISIL (Da’esh) & Al-Qaida Sanctions List;\n\n(j) Assist the Committee in considering proposals for listing, including compiling and circulating information;\n\n(k) Consult with the Committee or relevant Member States when identifying individuals or entities for listing or delisting;\n\n(l) Bring to the Committee’s attention new or noteworthy circumstances that may warrant a delisting;\n\n(m) Consult with Member States in advance of travel;\n\n(n) Coordinate and cooperate with national counter-terrorism focal points;\n\n(o) Cooperate closely with relevant United Nations counter-terrorism bodies;\n\n(p) Encourage Member States to submit names and additional identifying information for inclusion on the ISIL (Da’esh) & Al-Qaida Sanctions List.\nHere is a concise summary of the Security Council document:\n\n**Monitoring Team's tasks:**\n\n* Present additional information to assist the Committee in updating the ISIL (Da'esh) & Al-Qaida Sanctions List (q)\n* Encourage Member States to provide relevant information (r)\n* Study and report on the changing nature of the threat of Al-Qaida and ISIL (s)\n* Collate, assess, and report on implementation of measures, including preventing the misuse of the Internet (t)\n* Consult with Member States, international organizations, and private sector representatives on various issues (u-w)\n* Consult with Member States' intelligence and security services (v)\n* Promote awareness and compliance with asset freeze, travel ban, and arms embargo (w-x-y)\n* Assist with capacity-building for enhancing implementation of measures (z)\n* Work with INTERPOL to obtain photographs and biometric information of listed individuals (aa)\n* Assist other subsidiary bodies of the Security Council (bb)\n* Report to the Committee on its work (cc)\n* Perform any other responsibility identified by the Committee (dd)\n\n**Office of the Ombudsperson's tasks:**\n\n* Upon receipt of a delisting request, acknowledge receipt and inform the petitioner of the procedure (1.a-b)\n* Answer specific questions from the petitioner about Committee procedures (1.c)\n* Gather information for four months (no specific details given)\nThe Ombudsperson's procedures for handling delisting petitions are as follows: \n\nThe Ombudsperson shall: \n- Inform the petitioner if the petition fails to address the original listing criteria and return it for consideration \n- Verify if the request is new or repeated and return repeated requests without new information \n\nFor delisting petitions not returned, the Ombudsperson shall: \n- Forward the request to Committee members, designating States, and relevant UN bodies \n- Ask for additional information within four months \n\nThe Ombudsperson may engage in dialogue to determine States' opinions and information requests \n\nIf all designating States do not object, the Ombudsperson may shorten the information gathering period \n\nThe Ombudsperson shall also forward the request to the Monitoring Team, which shall provide: \n- All relevant information \n- Fact-based assessments \n- Questions or requests for clarifications \n\nAfter four months, the Ombudsperson presents a written update to the Committee \n\nThe Ombudsperson facilitates a two-month dialogue period with the petitioner \n\nDuring dialogue, the Ombudsperson: \n- Submits questions \n- Requests additional information \n- Requests a signed statement from the petitioner \n- Meets with the petitioner \n- Forwards replies and follows up \n\nThe Ombudsperson drafts a Comprehensive Report \n- Summarizing information \n- Describing activities \n- Laying out principal arguments and recommendation\nHere is a concise summary of the document:\n\n**Delisting Request Process**\n\n* After 15 days of review, the Chair of the Committee places the delisting request on the agenda (para 9).\n* The Ombudsperson presents the Comprehensive Report and answers Committee members' questions (para 10).\n* Committee consideration is completed within 30 days (para 11).\n* The Ombudsperson may notify relevant States of the recommendation (para 12).\n\n**Ombudsperson's Role**\n\n* The Ombudsperson may provide a copy of the Comprehensive Report to relevant States with redactions (para 13).\n* In cases where the Ombudsperson recommends retaining the listing, the requirement for States to take measures remains in place (para 14).\n* In cases where the Ombudsperson recommends delisting, the requirement for States to take measures terminates after 60 days unless the Committee decides otherwise (para 15).\n\n**Communication with the Petitioner**\n\n* The Committee conveys its decision to the Ombudsperson within 60 days (para 16).\n* The Ombudsperson sends a letter to the petitioner with the outcome of the petition and factual information (para 17).\n* The Ombudsperson respects confidentiality of Committee deliberations and communications (para 18).\n\n**Other Tasks**\n\n* The Ombudsperson distributes publicly releasable information about Committee procedures (para 20(a)).\n* The Ombudsperson notifies individuals or entities about the status of their listing (para 20(b)).\n* The Ombudsperson submits biannual reports to the Security Council (para 20(c)).",
  "url": "https://storage.googleapis.com/bluelines-rag-bucket/2015/S_RES_2253_2015_EN.pdf"
}