{
  "resolution_no": "2382",
  "year": "2017",
  "theme": [
    "Peacekeeping",
    "Policing",
    "Security Sector Reform",
    "Women, Peace and Security"
  ],
  "chapter": "Chapter VI",
  "charter_articles": [
    "Article 24",
    "Article 25"
  ],
  "entities": [
    "United Nations Policing",
    "Peacekeeping Strategic Force Generation and Capability Planning Cell",
    "Police Division",
    "Victims' Rights Advocate"
  ],
  "reporting_cycle": "The Secretary-General reports by the end of 2018",
  "operative_authority": "Chapter VI",
  "summary": "The Security Council, recalling its primary responsibility for maintaining international peace and security, adopted resolution 2382 (2017) on November 6, 2017. The resolution emphasizes the role of United Nations Policing in peacekeeping and special political missions, stressing that lasting peace requires political solutions. \n\nThe Council reaffirmed its commitment to upholding the purposes and principles of the UN Charter and recalled relevant resolutions on peacekeeping, protection of civilians, women, peace and security, and security sector reform. \n\nThe resolution highlights the importance of UN Policing in facilitating transitions from peacekeeping to development and peacebuilding, and stresses the need for improved performance, strengthened doctrine, and clearer standards for personnel, equipment, and operations.\n\nThe Council welcomes the role of UN Police Components in strengthening the rule of law and security sector reform, underlining the lead role of national authorities in progressing police reform. \n\nThe resolution also notes the importance of building the capacity of host-State policing and law enforcement institutions, addressing organized crime, and supporting border, immigration, and maritime security.\n\nThe Council encourages Member States to contribute well-trained and vetted police personnel with language skills for formed police units, and welcomes ongoing efforts to attain specialized capacities, capabilities, and technologies for UN Police Components. \n\nThe resolution aims to improve the performance of UN Policing through transparent and accountable efforts, increased training, and capacity-building to prepare police contributing countries.\nHere is a concise summary of the Security Council document:\n\nThe Security Council:\n\n1. **Stresses** the primacy of political solutions in conflict resolution and the integration of policing in UN peacekeeping operations and special political missions, with clear and achievable mandates.\n\n2. **Underscores** the critical importance of improving accountability, transparency, efficiency, and effectiveness in UN peacekeeping operations and special political missions.\n\n3. **Reaffirms** its efforts to review peacekeeping operations to ensure maximum effectiveness and efficiency.\n\n4. **Resolves** to promote and support the finalization and operationalization of the Strategic Guidance Framework for International Police Peacekeeping.\n\n5. **Recognizes** the role of UN Policing in contributing to conflict prevention and protection of civilians.\n\n6. **Reaffirms** that States bear primary responsibility for protecting civilians and recognizes the important role of UN Police Components in protection of civilians.\n\nThe Council requests the Secretary-General to:\n- Ensure data streams related to peacekeeping operations are centralized.\n- Strengthen collaboration between UN Policing and the Peacekeeping Strategic Force Generation and Capability Planning Cell.\n- Provide guidance for officials on delivering police-related tasks.\n- Report on progress in gender-responsive police reform and protection activities.\n\nThe Council also welcomes efforts to increase women's participation and leadership in decision-making in host-States and encourages the Secretary-General's System-wide Strategy on Gender Parity.\nHere is a clear and concise summary of the Security Council document:\n\nThe Security Council:\n\nUrges Police-Contributing Countries to ensure comprehensive training for deployed police personnel on protection of civilians, sexual and gender-based violence, and child protection.\n\nRequests the Secretary-General to ensure United Nations Police Components support protection of civilians activities.\n\nReiterates the importance of protecting children in armed conflict and stresses the need for specialized training on child protection.\n\nRequests the Secretary-General to strengthen efforts to prevent and address sexual exploitation and abuse by UN personnel.\n\nReaffirms the importance of national ownership and leadership in peacebuilding and recognizes the role of UN Police Components in supporting host-State police.\n\nRequests the Secretary-General to continue efforts to enhance measures against sexual exploitation and abuse.\n\nReaffirms commitment to convene annual briefings of Heads of UN Police Components.\n\nHighlights the importance of national ownership and commitment in policing.\n\nWelcomes efforts to strengthen strategic generation of female and male police personnel.\n\nUrges Police-Contributing Countries to contribute well-trained and equipped police personnel, including female police officers.\n\nRequests the Secretary-General to enhance coordination between Police Components and Child Protection Advisers.\n\nNotes continued efforts to enhance performance in peace and security pillar.\n\nWelcomes work of Police Division Standing Police Capacity.\n\nRequests the Secretary-General to provide a report by the end of 2018.\nThe Security Council requests the Secretary-General to provide a report on United Nations Policing, addressing: \nImplications for policing mandates from changes to the UN Peace and Security Architecture; \nStrengthening operational and policy coherence of UN Policing; \nImproving capability, accountability and transparency; \nPlanning for police generation gaps and key skill sets; \nCoherence of UN Policing initiatives for mission transitions and exits; \nStrengthening partnerships with international, regional and subregional organizations under Chapter VIII of the UN Charter.",
  "url": "https://storage.googleapis.com/bluelines-rag-bucket/2017/S_RES_2382_2017_EN.pdf"
}