{
  "resolution_no": "2368",
  "year": "2017",
  "theme": [
    "Terrorism",
    "Counter-terrorism",
    "Sanctions"
  ],
  "chapter": "Chapter VII",
  "charter_articles": [
    "Article 24",
    "Article 25",
    "Article 27"
  ],
  "entities": [
    "ISIL (Da’esh)",
    "Al-Qaida",
    "United Nations",
    "Security Council",
    "Monitoring Team",
    "Ombudsperson"
  ],
  "reporting_cycle": "",
  "operative_authority": "Chapter VII",
  "summary": "The Security Council adopted Resolution 2368 (2017) on 20 July 2017, recalling its previous resolutions on terrorism, and reaffirming that terrorism in all forms and manifestations is a serious threat to peace and security. The Council condemns the Islamic State in Iraq and the Levant (ISIL, also known as Da’esh), Al-Qaida, and associated individuals, groups, undertakings, and entities for their terrorist acts. \n\nThe Council recognizes that countering terrorism requires collective efforts on national, regional, and international levels, and reaffirms that terrorism cannot be associated with any religion, nationality, or civilization. \n\nThe Council stresses that Member States have the primary responsibility in countering terrorist acts and violent extremism, and urges all States to prevent any trade, economic, and financial ties with ISIL, Al-Qaida, and associated individuals, groups, undertakings, and entities.\n\nThe Council emphasizes that sanctions are an important tool in maintaining international peace and security, including in support of countering terrorism, and stresses the need for robust implementation of the measures. \n\nThe Council also recalls that ISIL is a splinter group of Al-Qaida, and that any individual, group, undertaking, or entity supporting ISIL or Al-Qaida is eligible for listing.\nCondemning recent terrorist attacks by ISIL worldwide resulting in numerous casualties and gross human rights abuses, \nthe Security Council stresses the need for sanctions to reflect current threats. \nRecalling resolution 2249 (2015), \nit urges States to assist in obtaining evidence for criminal proceedings related to terrorist financing or support. \nAll States must take measures against individuals, groups, and entities on the ISIL (Da’esh) and Al-Qaida Sanctions list, \nregardless of nationality or residence. \nThe Council urges Member States to participate in maintaining and updating the Sanctions List, \ncontributing information, submitting delisting requests, and nominating additional individuals or entities for listing. \nThe ISIL (Da’esh) and Al-Qaida Sanctions Committee should remove individuals or entities that no longer meet listing criteria. \nThe Council recognizes the importance of building Member States’ capacities to counter terrorism and terrorist financing. \nIt welcomes the Office of the Ombudsperson, \nestablished pursuant to resolution 1904 (2009), \nand its significant contribution to fairness and transparency. \nThe Council also welcomes cooperation between the Committee and INTERPOL, \nthe United Nations Office on Drugs and Crime, \nand other United Nations bodies, \nand encourages engagement with the United Nations Counter-Terrorism Implementation Task Force (CTITF). \nIt condemns kidnapping and hostage-taking by terrorist groups, \nincluding for ransom or political concessions, \nand urges States to prevent terrorists from benefiting from ransom payments or concessions. \nThe Council expresses concern that ISIL, Al-Qaida, and affiliates profit from transnational organized crime, \nincluding trafficking of arms, persons, and natural resources. \nIt recognizes the need to prevent and suppress terrorist financing, \nincluding from organized crime proceeds, \nand to prevent the abuse of non-governmental, non-profit, and charitable organizations by terrorists.\nThe Security Council:\n\nCondemns the continued flow of weapons to ISIL, Al-Qaida, and associated groups;\nEncourages prevention and disruption of procurement networks for such weapons;\n\nExpresses concern at terrorists' use of new technologies, including the Internet, to facilitate acts;\nStresses the need to counter terrorist narratives;\n\nIs concerned at the flow of international recruits to ISIL, Al-Qaida, and associated groups;\nReiterates obligations to prevent entry, transit, and movement of terrorist groups;\n\nCalls for information sharing on individuals and groups implicated in terrorist activities;\nCondemns engagement in trade with ISIL, Al-Nusrah Front, and associated entities;\n\nCondemns destruction of cultural heritage in Iraq and Syria;\nRecalls the need to prevent trade in Iraqi and Syrian cultural property;\n\nCondemns abductions of women and children by ISIL, ANF, and associated entities;\nExpresses outrage at their exploitation and abuse;\n\nRecalls previous resolutions 2178 (2014), 2242 (2015), and 2331 (2016);\nReaffirms resolve to address the threat posed by ISIL, Al-Qaida, and associated individuals and entities.\nThe Security Council,\n\nWelcoming efforts to standardize UN sanctions lists and translate list entries and narrative summaries,\n\nActing under Chapter VII of the Charter,\n\n**Measures**\n\n1. Decides all States shall impose the following measures on ISIL, Al-Qaida, and associated individuals, groups, undertakings, and entities:\n\t* **Asset Freeze**: Freeze funds, financial assets, and economic resources, and prevent their availability for their benefit.\n\t* **Travel Ban**: Prevent entry into or transit through their territories, except for judicial processes or Committee-approved cases.\n\t* **Arms Embargo**: Prevent supply, sale, or transfer of arms and related materiel.\n\n**Listing Criteria**\n\n2. Decides acts or activities indicating association with ISIL or Al-Qaida include:\n\t* Participating in financing, planning, facilitating, or perpetrating acts or activities.\n\t* Supplying, selling, or transferring arms and related materiel.\n\t* Recruiting for or supporting acts or activities.\n\n3. Notes means of financing or support include proceeds from crime, including narcotic drugs and precursors.\n\n4. Confirms individuals, groups, undertakings, or entities supporting ISIL or Al-Qaida are eligible for listing.\n\n5. Confirms requirements apply to financial and economic resources used for support.\n\n6. Confirms requirements apply to funds for travel-related expenses, subject to exemption procedures.\n\n7. Notes requirements apply to financial transactions benefiting listed individuals, groups, undertakings, and entities.\n\n8. Confirms requirements apply to payment of ransoms to listed individuals, groups, undertakings, and entities.\n\n9. Reaffirms allowing payments into frozen accounts, subject to provisions.\nHere is a summarized version of the document:\n\n10. Encourages Member States to utilize exemptions to measures in paragraph 1(a) as outlined in paragraphs 1 and 2 of resolution 1452 (2002), as amended by resolution 1735 (2006), and notes that exemptions to travel bans must be submitted by Member States, individuals, or the Ombudsperson.\n\n11. Reiterates the importance of implementing procedures to fully enforce measures described in paragraph 1.\n\n12. Reaffirms that those responsible for terrorist acts must be held accountable, and urges Member States to provide assistance in investigations and proceedings related to ISIL, Al-Qaida, and associated individuals.\n\n13. Reiterates Member States' obligation to prevent their nationals and persons in their territory from making economic resources available to ISIL, Al-Qaida, and associated individuals.\n\n14. Encourages Member States to submit listing requests of individuals and entities supporting ISIL, Al-Qaida, and associated individuals.\n\n15. Recalls resolution 2331 (2016) and reaffirms intention to consider targeted sanctions for individuals and entities associated with ISIL or Al-Qaida involved in trafficking and sexual violence.\n\n16. Expresses concern about lack of implementation of previous resolutions and calls upon Member States to report interdictions of petroleum, antiquities, and other materials being transferred to or from ISIL or ANF.\n\n17. Urges Member States to implement FATF's revised Forty Recommendations on Combating Money Laundering and the Financing of Terrorism.\n\n18. Welcomes FATF reports on ISIL financing and emerging terrorist financing risks, and highlights the importance of implementing targeted financial sanctions.\nHere is a summarized version of the Security Council document:\n\n19. Encourages FATF to prioritize countering terrorist financing, particularly identifying and working with Member States with strategic deficiencies that hinder countering terrorism financing, including by ISIL, Al-Qaida, and associated individuals.\n\n20. Clarifies that the obligation in resolution 1373 (2001) applies to making funds, financial assets, or economic resources available for the benefit of terrorist organizations or individuals.\n\n21. Calls upon States to establish as a serious criminal offense the willful violation of the prohibition described in resolution 1373 (2001).\n\n22. Calls upon Member States to cut flows of funds and financial assets to individuals and entities on the ISIL (Da’esh) & Al-Qaida Sanctions List, and to protect non-profit organizations from terrorist abuse.\n\n23. Urges Member States to prevent terrorists from using information and communication technology for terrorist purposes and to counter their propaganda.\n\n24. Urges Member States to promote awareness of the ISIL (Da’esh) & Al-Qaida Sanctions List and encourages Member States to screen their databases against the List.\n\n25. Highlights the importance of strong relationships with the private sector in countering terrorist financing and welcomes FATF's work on risk indicators.\n\n26. Underscores that ransom payments to ISIL, Al-Qaida, and associated individuals support their recruitment efforts and incentivize future kidnappings.\n\n27. Urges Member States to remain vigilant about ISIL's presence and to identify and propose for listing individuals and entities that meet the criteria.\n\n28. Recognizes the importance of information sharing within and between governments to counter terrorist financing.\n\n29. Decides that Member States shall undertake measures to prevent ISIL, Al-Qaida, and associated individuals from obtaining explosives and related materials.\n\n30. Encourages Member States to meet with the Committee for in-depth discussion on relevant issues.\n\n31. Urges Member States to invalidate and remove fraudulent, counterfeit, stolen, and lost passports and travel documents from circulation.\n\n32. Encourages Member States to share information with the private sector on fraudulent travel documents.\nThe Security Council resolution 2368 (2017) addresses measures to combat ISIL (Da’esh) and Al-Qaida. \n\n33. Member States issuing travel documents to listed individuals should note the bearer is subject to a travel ban and corresponding exemption procedures.\n\n34. Member States should consult the ISIL (Da’esh) & Al-Qaida Sanctions List when considering travel visa applications.\n\n35. Member States should require airlines to provide advance passenger information to detect the departure, entry, or transit of listed individuals.\n\n36. Member States should develop the capability to process Passenger Name Records (PNR) data to prevent terrorist offenses.\n\n37. Member States should establish serious criminal offenses to prosecute and penalize foreign terrorist fighter-related activities.\n\n38. Member States should exchange information expeditiously when detecting the travel of listed individuals.\n\n39. Member States should improve international cooperation to address the issue of foreign terrorist fighters.\n\n40. Member States should exchange information on the identity of foreign terrorist fighters and ensure consular access.\n\n41. Designating States should inform the Monitoring Team about judicial proceedings against listed parties.\n\n42. Member States should designate national focal points to liaise with the Committee and the Monitoring Team.\n\n43. Member States should report to the Committee on obstacles to implementing the measures.\n\n44. States should submit an updated report to the Committee within 120 days on their implementation of the measures.\n\nThe Committee \n\n45. The Committee should ensure fair and clear procedures for listing and removing individuals and entities.\n\n46. The Committee should report to the Council at least once per year on its findings and recommend steps to improve implementation.\n\n47. The Committee should identify possible cases of non-compliance and determine the course of action.\n\n48. No matter should be left pending before the Committee for more than six months.\n\n49. The Committee should facilitate assistance on capacity-building for enhancing implementation of the measures.\nHere is a summarized version of the document:\n\n**Listing on the ISIL (Da’esh) & Al-Qaida Sanctions List**\n\n50. Encourages Member States to submit names of individuals, groups, undertakings, and entities supporting ISIL, Al-Qaida, and associated individuals and entities for inclusion on the ISIL (Da’esh) & Al-Qaida Sanctions List.\n\n51. When proposing names, Member States must use the standard form and provide a detailed statement of case, including identifying information, and releasable information.\n\n52. Member States may specify if their status as a designating State should not be made known.\n\n53. Member States are encouraged to submit photographs and biometric data for inclusion in INTERPOL-United Nations Security Council Special Notices.\n\n54. The Committee shall update the standard form for listing and the Monitoring Team shall report on improving the quality of the ISIL (Da’esh) & Al-Qaida Sanctions List.\n\n55. The Committee shall make accessible a narrative summary of reasons for listing on its website.\n\n56. Member States and international organizations are encouraged to inform the Committee of relevant court decisions and proceedings.\n\n57. Committee members and the Monitoring Team shall share information on listing requests.\n\n58. The Secretariat shall notify the Permanent Mission of the State where the individual or entity is believed to be located and publish relevant information on the Committee’s website.\n\n59. Member States must notify listed individuals or entities of the listing and provide relevant information.\n\n**Review of Delisting Requests**\n\n60. The mandate of the Office of the Ombudsperson is extended for 24 months, and the Ombudsperson shall continue to receive delisting requests and present recommendations to the Committee.\n\n61. If the Ombudsperson recommends retaining the listing, the requirement for States to take measures shall remain in place.\n\n62. If the Committee completes consideration of a Comprehensive Report of the Ombudsperson, the requirement for States to take measures shall terminate 60 days later.\nThe Security Council:\n\n62. Decides that the Ombudsperson's recommendation to delist an individual, group, undertaking or entity shall be considered by the Committee unless it decides by consensus to maintain the listing within 60 days; if consensus doesn't exist, the Chair shall submit the question to the Security Council for a decision within 60 days.\n\n63. Allows the Committee to shorten the 60-day period by consensus on a case-by-case basis.\n\n64. Reiterates that the measures are preventative and not reliant on national law.\n\n65. Requests the Secretary-General to strengthen the Ombudsperson's capacity and provide necessary resources.\n\n66. Urges Member States to provide relevant information to the Ombudsperson, including confidential information, and encourages them to conclude arrangements with the Office of the Ombudsperson.\n\n67. Urges Member States and international organizations to encourage individuals and entities to seek removal from the ISIL (Da'esh) & Al-Qaida Sanctions List by submitting delisting petitions.\n\n68. Notes the Financial Action Task Force (FATF) international standards.\n\n69. Decides that when a designating State submits a delisting request, the requirement for States to take measures shall terminate after 60 days unless the Committee decides by consensus to maintain the listing.\n\n70. Allows the Committee to shorten the 60-day period by consensus on a case-by-case basis.\n\n71. Recalls that consensus must exist between all designating States for delisting requests.\n\n72. Urges designating States to allow the Ombudsperson to reveal their identities to listed individuals and entities.\n\n73. Directs the Committee to consider delisting requests and urges Member States to provide reasons for submitting requests.\n\n74. Encourages States to submit delisting requests for deceased individuals or entities that have ceased to exist.\n\n75. Encourages States to prevent unfrozen assets from being used for terrorist purposes.\n\n76. Reaffirms the procedure for unfreezing assets that have been frozen as a result of the listing of Usama bin Laden.\n\n77. Calls upon the Committee to consider delisting requests, giving due consideration to the opinions of relevant States.\nHere is a concise summary of the document:\n\n**Delisting Requests and Procedures**\n\n* The Committee shall provide reasons for objecting to delisting requests to relevant Member States and national/regional courts and bodies, upon request and where appropriate (para. 77).\n* Member States, including designating States and States of residence, are encouraged to provide information to the Committee on delisting petitions and meet with the Committee, if requested (para. 78).\n* The Secretariat shall notify the Permanent Mission of the State(s) of residence, nationality, location, or incorporation within three days of a name being removed from the ISIL (Da’esh) & Al-Qaida Sanctions List (para. 79).\n\n**Exemptions and Focal Point**\n\n* The assets freeze measures shall not apply to funds and other financial assets or economic resources necessary for basic expenses or extraordinary expenses, subject to notification and approval by the Committee (para. 81).\n* The Focal Point mechanism may receive requests from listed individuals, groups, undertakings, and entities for exemptions to the measures outlined in paragraph 1 (para. 82).\n* The Focal Point may receive communications from individuals who have been removed from the ISIL (Da’esh) & Al-Qaida Sanctions List or claim to have been subjected to the measures as a result of false or mistaken identification (para. 83).\n\n**Review and Maintenance of the ISIL (Da’esh) & Al-Qaida Sanctions List**\n\n* Member States are encouraged to submit additional identifying and other information on listed individuals, groups, undertakings, and entities (para. 85).\n* The Monitoring Team shall circulate to the Committee every twelve months a list compiled in consultation with the respective designating States and States of residence, nationality, location, or incorporation (para. 86).\nThe Security Council directs the Committee to review and update the ISIL (Da’esh) & Al-Qaida Sanctions List, specifically:\n\n* Individuals, groups, undertakings, and entities lacking necessary identifiers \n* Deceased individuals, with assessment of frozen assets and potential recipients of unfrozen assets\n* Entities reported or confirmed to have ceased to exist \n* Listings not reviewed in three or more years \n\nThe Committee to review and remove listings if no longer appropriate. The Monitoring Team to refer listings for review if no State response within three years.\n\nThe Committee to cooperate with other Sanctions Committees and enhance cooperation with counter-terrorism bodies. The Monitoring Team and UN Office on Drugs and Crime to assist Member States.\n\nThe Committee to consider country visits to enhance implementation of measures. The Committee to respond to requests for information from States and international organizations.\n\nThe Monitoring Team’s mandate extended for 24 months. The Team to report on thematic and regional topics, identify non-compliance, and provide recommendations. The Team to work closely with States and UN Missions. \n\nThe Committee to hold special meetings on thematic or regional topics and capacity challenges.\nHere is a summarized version of the Security Council document:\n\n99. Requests the Analytical Support and Sanctions Monitoring Team to provide quarterly oral briefings to the Committee on the global implementation of resolutions 2199 (2015) and 2178 (2014), including information and analysis relevant to potential sanctions designations.\n\n100. Recalls its request to the Analytical Support and Sanctions Monitoring Team to discuss with Member States the issue of trafficking in persons and sexual violence in armed conflict related to ISIL (Da’esh), Al-Qaida, and associated individuals and entities.\n\n101. Requests the Secretary-General to provide strategic-level reports on the threat posed by ISIL, including on foreign terrorist fighters, financing, and attacks, with the next report due by 31 January 2018 and then every six months.\n\n102. Decides to add individuals and entities specified in Annex III to the ISIL (Da’esh) and Al-Qaida Sanctions List.\n\n103. Directs the Committee to make accessible on its website the narrative summaries of reasons and list entries for the individuals and entities added to the Sanctions List.\n\n104. Decides to review the measures described in paragraph 1 with a view to their possible further strengthening in eighteen months or sooner if necessary.\n\n105. Decides to remain actively seized of the matter.\n\n Annex I:\n\n* The Monitoring Team shall operate under the direction of the Committee and have specific mandates and responsibilities, including:\n\t+ Submitting comprehensive, independent reports every six months on implementation by Member States, global threat posed by ISIL and Al-Qaida, impact of resolutions 2199 (2015) and 2253 (2015), and threat posed by foreign terrorist fighters.\n\t+ Assisting the Ombudsperson and the Committee in carrying out their mandates.\n\t+ Providing specific recommendations related to improved implementation of relevant sanctions measures.\nThe Security Council document 2368 (2017) outlines the responsibilities of the Monitoring Team. \n\n(e) The Monitoring Team is to submit a comprehensive programme of work to the Committee for review and approval, detailing activities, proposed travel, and coordination with CTED and the 1540 Committee's group of experts.\n\n(f) The Team must work closely with CTED and the 1540 Committee's group of experts to identify areas of convergence and overlap, and facilitate concrete coordination.\n\n(g) The Team is to participate actively in and support activities under the United Nations Global Counter-Terrorism Strategy, including the Counter-Terrorism Implementation Task Force.\n\n(h) The Team must gather information on instances of reported non-compliance with measures referred to in paragraph 1, and provide cases and recommendations to the Committee.\n\n(i) The Team is to present recommendations to assist Member States with implementing measures and preparing proposed additions to the ISIL (Da'esh) & Al-Qaida Sanctions List.\n\n(j) The Team must assist the Committee in considering proposals for listing, including compiling and circulating information and preparing draft narrative summaries.\n\n(k) The Team is to consult with the Committee or relevant Member States when identifying individuals or entities for listing or delisting.\n\n(l) The Team must bring to the Committee's attention new or noteworthy circumstances that may warrant delisting.\n\n(m) The Team is to consult with Member States in advance of travel to selected Member States.\n\n(n) The Team must coordinate and cooperate with national counter-terrorism focal points or similar bodies in visited states.\n\n(o) The Team must cooperate closely with relevant United Nations counter-terrorism bodies on kidnapping and hostage-taking for ransom by Al-Qaida, ISIL, and associated individuals and entities.\n\n(p) The Team is to encourage Member States to submit names and identifying information for inclusion on the ISIL (Da'esh) & Al-Qaida Sanctions List.\n\n(q) The Team must present additional identifying and other information to assist the Committee in keeping the Sanctions List updated and accurate.\n\n(r) The Team is to encourage Member States to provide relevant information.\n\n(s) The Team must study and report on the changing nature of the threat of Al-Qaida and ISIL, and best measures to confront them.\n\n(t) The Team must collate, assess, monitor, report on, and make recommendations regarding implementation of measures, including preventing the criminal misuse of the Internet.\n\n(u) The Team is to consult with Member States, international organizations, and other relevant bodies.\n\n(v) The Team must consult with Member States' intelligence and security services.\n\n(w) The Team is to consult with Member States, private sector representatives, and international organizations on asset freeze implementation.\n\n(x) The Team must consult on travel ban implementation, including use of advanced passenger information.\nHere is a concise summary of the Security Council document:\n\nThe Security Council decides:\n\n**Monitoring Team's tasks**\n\n* To consult with Member States, international organizations, and the private sector to promote awareness and enhance compliance with the arms embargo, particularly on measures to counter the use of improvised explosive devices (IEDs) by listed individuals and entities.\n* To assist the Committee in facilitating capacity-building for enhancing implementation of measures, upon request by Member States.\n* To work with INTERPOL to obtain photographs and biometric information of listed individuals and to address possible cases of false or mistaken identity.\n* To assist other subsidiary bodies of the Security Council and their expert panels, upon request, with enhancing their cooperation with INTERPOL.\n* To report to the Committee on a regular basis or when requested.\n\n**Ombudsperson's tasks**\n\n* To receive delisting requests from individuals, groups, undertakings, or entities on the ISIL (Da'esh) & Al-Qaida Sanctions List or their legal representatives.\n* To acknowledge receipt of delisting requests and inform petitioners of the general procedure.\n* To gather information from relevant States, United Nations bodies, and the Monitoring Team within four months.\n* To present a written update to the Committee on progress and significant challenges encountered.\n\n**Information gathering process**\n\n* The Ombudsperson forwards delisting requests to relevant States and United Nations bodies to gather information within four months.\n* The Monitoring Team provides information, fact-based assessments, and questions or requests for clarifications to the Ombudsperson within four months.\n* The Ombudsperson may shorten or extend the information gathering period as necessary.\nHere is a concise summary of the Security Council document:\n\n**Dialogue Period**\n\n* After information gathering, the Ombudsperson facilitates a 2-month dialogue period with the petitioner, which can be extended or shortened based on assessment.\n* During this period, the Ombudsperson:\n\t+ Submits questions to the petitioner\n\t+ Requests a signed statement from the petitioner declaring no association with Al-Qaida or ISIL\n\t+ Meets with the petitioner, if possible\n\t+ Forwards replies to relevant States, Committee, and Monitoring Team\n\t+ Coordinates with States, Committee, and Monitoring Team\n\t+ Shares information with States, with their consent\n\t+ Keeps confidential information shared by States\n\n**Comprehensive Report**\n\n* After the dialogue period, the Ombudsperson drafts a Comprehensive Report, which:\n\t+ Summarizes information available\n\t+ Describes Ombudsperson's activities\n\t+ Lays out principal arguments and recommendation for delisting\n\n**Committee Discussion**\n\n* Committee reviews the report for 15 days\n* Ombudsperson presents report and answers questions\n* Committee consideration completed within 30 days\n* Ombudsperson may notify relevant States of recommendation\n\n**Report Sharing and Follow-up**\n\n* Committee decides on sharing report with States, with redactions if necessary\n* Report is confidential and not shared with petitioner or other States without Committee approval\n* In cases where listing is recommended to be retained, measures remain in place unless Committee decides otherwise\n* In cases where delisting is recommended, measures terminate 60 days after Committee consideration, unless Committee decides otherwise.\nHere is a clear and concise summary of the Security Council document:\n\n16. The Committee shall convey to the Ombudsperson, within 60 days, whether measures are to be retained or terminated, and approve an updated narrative summary of reasons for listing. The Ombudsperson informs the Petitioner of the Committee's decision and submits a summary of analysis to the Committee for review. The Committee reviews the summary within 30 days and communicates its views to the Ombudsperson.\n\n17. The Ombudsperson sends a letter to the petitioner with an advance copy to the Committee, communicating the outcome of the petition, describing the process and factual information gathered, and forwarding information about the decision.\n\n18. The Ombudsperson respects the confidentiality of Committee deliberations and confidential communications with Member States.\n\n19. The Ombudsperson may notify the petitioner and relevant States of the stage of the process.\n\n20. The Ombudsperson's tasks include: distributing publicly releasable information about Committee procedures; notifying individuals or entities about the status of their listing; and submitting biannual reports to the Security Council.\n\nAnnex III lists entities and individuals associated with ISIL or Al-Qaida:\n \n1. Muhammad Bahrum Naim Anggih Tamtomo \n2. Hanifa Money Exchange Office \n3. Selselat al-Thabab \n4. Jaysh Khalid Ibn al Waleed \n\nlisting reasons are detailed for each.\nThe Security Council has designated the following individuals and entity as associated with Islamic State in Iraq and the Levant (ISIL) or Al-Qaida:\n\n1. Malik Ruslanovich Barkhanoev - associated with ISIL/Al-Qaida for participating in financing, planning, facilitating, preparing or perpetrating acts or activities, recruiting for, and otherwise supporting ISIL.\n2. Murad Iraklievich Margoshvili - associated with ISIL/Al-Qaida for participating in financing, planning, facilitating, preparing or perpetrating acts or activities, recruiting for, and otherwise supporting Jabhat Fatah al-Sham (listed as Al-Nusrah Front for the People of the Levant).\n3. Oman Rochman - associated with ISIL/Al-Qaida for participating in financing, planning, facilitating, preparing or perpetrating acts or activities, recruiting for, and otherwise supporting ISIL.\n \nThe entity:\n \n1. Jund al Aqsa - associated with ISIL/Al-Qaida for participating in financing, planning, facilitating, preparing or perpetrating acts or activities, supplying, selling or transferring arms, otherwise supporting acts or activities, and being owned or controlled by ISIL.",
  "url": "https://storage.googleapis.com/bluelines-rag-bucket/2017/S_RES_2368_2017_EN.pdf"
}