{
  "resolution_no": "2344",
  "year": "2017",
  "theme": [
    "Peacekeeping",
    "Security",
    "Development",
    "Human Rights",
    "Counter-Terrorism"
  ],
  "chapter": "Chapter VI",
  "charter_articles": [
    "Article 24",
    "Article 25"
  ],
  "entities": [
    "UNAMA",
    "NATO",
    "ISIL (Da'esh)",
    "Al-Qaida",
    "Taliban",
    "Afghan National Defence and Security Forces (ANDSF)"
  ],
  "reporting_cycle": "every three months",
  "operative_authority": "Chapter VI",
  "summary": "The Security Council, recalling its previous resolutions on Afghanistan, adopted resolution 2344 (2017) on 17 March 2017. The resolution stresses the UN's role in promoting peace and stability in Afghanistan, reaffirming its commitment to the country's sovereignty, independence, territorial integrity, and national unity. \n\nThe Council emphasizes the importance of a comprehensive and inclusive Afghan-led political process to support reconciliation, welcoming efforts to advance the peace process, including via the High Peace Council. It also welcomes the Kabul Process and the strategic consensus between the Government of Afghanistan and the international community on the Self-Reliance through Mutual Accountability Framework (SMAF).\n\nThe resolution stresses the need for a comprehensive approach to address security, economic, governance, and development challenges in Afghanistan, recognizing that there is no purely military solution to ensure stability. It also recognizes the positive impact of international commitments made in 2016, including the NATO Warsaw Summit and the Brussels Conference on Afghanistan.\n\nThe Council expresses concern over the threats posed by the Taliban, Al-Qaida, ISIL (Da’esh) affiliates, and other terrorist groups, and notes the ongoing work of the Committee established pursuant to resolution 1988 (2011). It also expresses concern over the increasing cooperation of the Taliban with other organizations involved in criminal activities.\n\nThe resolution welcomes the contribution of the International Contact Group (ICG) to UN efforts in coordinating and broadening international support for Afghanistan. It also underlines the importance of operationally capable, professional, inclusive, and sustainable Afghan National Defence and Security Forces (ANDSF) for meeting Afghanistan’s security needs.\n\nThe Council expresses serious concern over the record number of civilian casualties, condemning suicide attacks and targeted killings, particularly of women and girls. It reaffirms that all parties to armed conflict must take all feasible steps to ensure the protection of civilians, especially women, children, and displaced persons. \n\nThe resolution emphasizes the need for continued support of UNAMA, at the request of the Afghan authorities, and commends the resiliency and exceptional courage displayed by ANDSF.\nHere is a summarized version of the Security Council document:\n\nThe Security Council:\n\n1. Welcomes the report of the Secretary-General of 3 March 2017;\n2. Expresses appreciation for the United Nations' long-term commitment to support the Government and people of Afghanistan;\n3. Decides to extend until 17 March 2018 the mandate of UNAMA;\n\nThe Council recognizes the importance of supporting Afghan-led efforts to address drug production and trafficking, and encourages the international community to support these efforts in a balanced and integrated approach.\n\nThe Council expresses concern over the humanitarian situation in Afghanistan and supports the Afghan Government's role in providing humanitarian assistance.\n\nThe mandate of UNAMA will focus on:\n\n* Promoting coherent support to the Afghan Government's development and governance priorities;\n* Supporting the organization of future Afghan elections and strengthening the electoral process;\n* Providing outreach and good offices to support the Afghan-led peace process;\n* Supporting regional cooperation;\n* Continuing to cooperate with and strengthen the capacity of the Afghanistan Independent Human Rights Commission (AIHRC);\n* Coordinating with the non-combat Resolute Support Mission and the NATO Senior Civilian Representative.\n\nThe Council calls on UNAMA to increase efforts to achieve greater coherence, coordination, and efficiency among relevant United Nations Agencies, Funds, and Programmes in Afghanistan, based on a \"One UN\" approach.\nHere is a summarized version of the Security Council document:\n\nThe Security Council:\n\n6. Requests the Secretary-General to conduct a strategic review of UNAMA to optimize its efficiency and effectiveness.\n\n7. Calls upon all Afghan and international parties to coordinate with UNAMA in implementing its mandate.\n\n8. Stresses the importance of UNAMA's presence in provinces to respond to needs and promote security.\n\n9. Underscores the importance of sustainable democratic development in Afghanistan through inclusive, transparent, and credible elections.\n\n10. Requests UNAMA to provide assistance to Afghan institutions to support the integrity and inclusiveness of the electoral process.\n\n11. Calls on the UN to support the Government of Afghanistan's reform agenda.\n\n12. Welcomes efforts to advance the peace process, including the High Peace Council and the Afghanistan Peace and Reintegration Programme.\n\n13. Stresses UNAMA's role in supporting an inclusive Afghan-led peace process.\n\n14. Welcomes regional and international partners' efforts to support peace and reconciliation in Afghanistan.\n\n15. Reaffirms the central role of the JCMB in coordinating and monitoring the implementation of the Government's reform agenda.\n\n16. Reiterates the importance of increasing the functionality, professionalism, and accountability of the Afghan security sector.\n\n17. Welcomes progress in the development of the Afghan National Army and encourages sustained training efforts.\n\n18. Takes note of efforts to enhance the capabilities of the Afghan National Police and calls for further efforts to develop a strategy for coordinating increased recruitment, retention, training, and capacity development for women in the police.\nHere is a summarized version of the Security Council document:\n\n19. The Security Council reiterates its support for the Government of Afghanistan, particularly the Afghan National Defence and Security Forces (ANDSF), in securing their country and fighting against terrorism and violent extremism.\n\n20. The Council expresses concern about the security situation in Afghanistan, citing ongoing violence and attacks by the Taliban, Al-Qaida, ISIL, and other terrorist groups, and calls for strengthened international and regional cooperation to counter the threat.\n\n21. The Council condemns attacks targeting civilians and Afghan and international forces, and the use of civilians as human shields by the Taliban and other terrorist groups.\n\n22. The Council strongly condemns the flow of weapons to the Taliban and other terrorist groups, and encourages Member States to share information and develop strategies to counter improvised explosive devices (IEDs).\n\n23. The Council condemns acts of violence against diplomatic and consular officials, humanitarian and development workers, and attacks on health-care workers and facilities.\n\n24. The Council welcomes achievements in the Mine Action Programme of Afghanistan and encourages the Government to continue efforts to remove and destroy anti-personnel landmines and explosive remnants of war.\n\n25. The Council notes concern over increasing child casualties and recruitment, and calls for the protection of schools and hospitals, and for those responsible for violations against children to be brought to justice.\n\n26. The Council calls for strengthened international and regional cooperation to counter the threat posed by the production, trafficking, and consumption of illicit drugs originating in Afghanistan.\n\n27. The Council welcomes the efforts of the United Nations Office on Drugs and Crime in empowering the Afghan Ministry of Counter Narcotics.\n\n28. The Council reiterates the importance of establishing a fair and transparent justice system, eliminating impunity, and strengthening the rule of law in Afghanistan.\n\n29. The Council encourages Afghan institutions to tackle corruption and ensure good governance.\n\n30. The Council calls for full respect for and protection of all human rights and fundamental freedoms in Afghanistan.\n\n31. The Council calls for enhanced efforts to secure the rights and full participation of women and girls, and to ensure they are protected from violence and abuse.\n\n32. The Council calls on international donors and organizations and the Afghan Government to adhere to their commitments made at recent conferences.\n\n33. The Council reaffirms its support for Afghan-led regional efforts within the framework of the “Heart of Asia-Istanbul Process on Regional Security.\nThe Security Council:\n\nWelcomes efforts to build trust and cooperation in Afghanistan, including by organizations such as the Organization of Islamic Cooperation, Shanghai Cooperation Organization, and South Asian Association for Regional Cooperation.\n\nUrges further regional economic cooperation, including measures to facilitate connectivity, trade, and transit, such as the Silk Road Economic Belt and regional development projects like the Turkmenistan-Afghanistan-Pakistan-India gas pipeline project.\n\nRecalls that regional security cooperation is key to maintaining stability in Afghanistan and the region, and calls for further efforts to strengthen partnership and cooperation.\n\nExpresses concern over the recent increase in internally displaced persons and refugees from Afghanistan, and encourages intensified efforts by the Government of Afghanistan to make repatriation and reintegration of Afghan refugees a priority.\n\nRequests the Secretary-General to report to the Council every three months on developments in Afghanistan, including progress made against benchmarks for measuring and tracking progress in the implementation of UNAMA's mandate.\n\nDecides to remain actively seized of the matter.",
  "url": "https://storage.googleapis.com/bluelines-rag-bucket/2017/S_RES_2344_2017_EN.pdf"
}