{
  "resolution_no": "2356",
  "year": "2017",
  "theme": [
    "Sanctions",
    "Non-Proliferation",
    "Peace and Security"
  ],
  "chapter": "Chapter VII",
  "charter_articles": [
    "Article 41"
  ],
  "entities": [
    "DPRK",
    "Korean People's Army",
    "Workers' Party of Korea",
    "General Bureau of Atomic Energy",
    "Korea Kumsan Trading Corporation",
    "Kangbong Trading Corporation",
    "Koryo Bank",
    "Strategic Rocket Force of the Korean People's Army"
  ],
  "reporting_cycle": "",
  "operative_authority": "Chapter VII",
  "summary": "The Security Council, recalling previous relevant resolutions, reaffirms that the proliferation of nuclear, chemical, and biological weapons constitutes a threat to international peace and security. The Council expresses serious concern over the DPRK's continued ballistic missile launches and prohibited arms sales, which contribute to its nuclear weapons delivery systems and increase regional tension. \n\nThe Council, acting under Chapter VII of the Charter, condemns in the strongest terms the DPRK's nuclear and ballistic missile activities, including launches since 9 September 2016. It reaffirms the DPRK's obligation to abandon all nuclear weapons and existing nuclear programmes in a complete, verifiable, and irreversible manner and immediately cease related activities.\n\nThe Council decides to impose measures specified in paragraph 8 (d) and (e) of resolution 1718 (2006) on individuals and entities listed in Annex I and II of this resolution. It reiterates the importance of maintaining peace and stability on the Korean Peninsula and expresses its commitment to a peaceful, diplomatic, and political solution to the situation.\n\nThe Council welcomes efforts to facilitate a peaceful and comprehensive solution through dialogue, stresses the importance of reducing tensions, and decides to remain seized of the matter.\nHere is a summarized version of the document:\n\n2356 (2017)\n\nAnnex I: Travel Ban/Asset Freeze (Individuals)\n\n1. CHO IL U \n- Director of the Fifth Bureau of the Reconnaissance General Bureau, in charge of overseas espionage operations and foreign intelligence collection for the DPRK.\n- AKA: Cho Il Woo\n- Identifiers: DOB: May 10, 1945; POB: Musan, North Hamgyo'ng Province, DPRK; nationality: DPRK; Passport Number: 736410010\n\n2. CHO YON CHUN \n- Vice Director of the Organization and Guidance Department, directs key personnel appointments for the Workers' Party of Korea and the DPRK's military.\n- AKA: Jo Yon Jun\n- Identifiers: DOB: September 28, 1937; Nationality: DPRK\n\n3. CHOE HWI \n- First Vice Director of the Workers' Party of Korea Propaganda and Agitation Department, controls all DPRK media and is used by the government to control the public.\n- Identifiers: YOB: 1954 or 1955; Nationality: DPRK; Gender: male; Address: DPRK\n\n4. JO YONG-WON \n- Vice Director of the Worker's Party of Korea's Organization and Guidance Department, directs key personnel appointments for the Workers' Party of Korea and the DPRK's military.\n- AKA: Cho Yongwon\n- Identifiers: DOB: October 24, 1957; Nationality: DPRK; Gender: male; Address: DPRK\n\n5. KIM CHOL NAM \n- President of Korea Kumsan Trading Corporation, procures supplies for General Bureau of Atomic Energy and serves as a cash route to the DPRK.\n- Identifiers: DOB: February 19, 1970; Nationality: DPRK; Passport no.: 563120238; Address: DPRK\n\n6. KIM KYONG OK \n- Vice Director of the Organization and Guidance Department, directs key personnel appointments for the Workers' Party of Korea and the DPRK's military.\n- AKA: Kim Kyong Ok\n- Identifiers: YOB: 1937 or 1938; Nationality: DPRK; Address: Pyongyang, DPRK\n\n7. KIM TONG-HO \n- Vietnam Representative for Tanchon Commercial Bank, main DPRK financial entity for weapons and missile-related sales.\n- Identifiers: DOB: August 18, 1969; Nationality: DPRK; Passport no.: 745310111; Gender: male; Address: Vietnam\n\n8. MIN BYONG CHOL \n- Member of the Worker's Party of Korea's Organization and Guidance Department, directs key personnel appointments for the Workers' Party of Korea and the DPRK's military.\n- AKA: Min Pyo'ng-ch'o'l, Min Byong-chol, Min Byong Chun\n- Identifiers: DOB: August 10, 1948; Nationality: DPRK; Gender: male; Address: DPRK\n\n9. PAEK SE BONG \n- Former Chairman of the Second Economic Committee, former member of the National Defense Commission, and former Vice Director of Munitions Industry Department (MID).\n- Identifiers: DOB: 21 March 1938; Nationality: DPRK\n\n10. PAK HAN SE \n- Vice Chairman of the Second Economic Committee, oversees the production of the DPRK's ballistic missiles and directs the activities of Korea Mining Development Corporation.\n- AKA: Kang Myong Chol\n- Identifiers: Nationality: DPRK; Passport no.: 290410121; Address: DPRK\n\n11. PAK TO CHUN \n- Former Secretary of Munitions Industry Department (MID) and currently advises on affairs relating to nuclear and missile programmes.\n- AKA: Pak Do Chun\n- Identifiers: DOB: 9 March 1944; Nationality: DPRK\n\n12. RI JAE IL \n- Vice Director of the Workers' Party of Korea Propaganda and Agitation Department, controls all DPRK's media and is used by the government to control the public.\nHere is a concise summary of the document:\n\n**Individuals:**\n\n1. **RI CHAE-IL**: Official for Korea Ryonbong General Corporation, involved in procurement for DPRK's defense industries and military-related sales. \n   - AKA: RI; Chae-Il \n   - Identifiers: YOB 1934; Nationality: DPRK \n\n2. **RI SU YONG**: Official for Korea Ryonbong General Corporation, involved in procurement for DPRK's defense industries and possibly chemical weapons program. \n   - Identifiers: DOB: June 25, 1968; Nationality: DPRK; Passport no.: 654310175; Gender: male; Address: Cuba \n\n3. **RI YONG MU**: Vice Chairman of the State Affairs Commission, directing and guiding DPRK's military, defense, and security-related affairs. \n   - Identifiers: DOB: 25 January 1925; Nationality: DPRK \n\n**Entities (Asset Freeze):**\n\n1. **KANGBONG TRADING CORPORATION**: Sold, supplied, transferred, or purchased metal, graphite, coal, or software, benefiting the DPRK Government or Workers' Party of Korea. \n   - Parent: Ministry of People’s Armed Forces \n   - Location: DPRK \n\n2. **KOREA KUMSAN TRADING CORPORATION**: Owned or controlled by the General Bureau of Atomic Energy, overseeing DPRK's nuclear program. \n   - Location: Pyongyang, DPRK \n\n3. **KORYO BANK**: Operates in the financial services industry, associated with Office 38 and Office 39 of the KWP. \n   - Location: Pyongyang, DPRK \n\n4. **STRATEGIC ROCKET FORCE OF THE KOREAN PEOPLE’S ARMY**: In charge of DPRK ballistic missile programs and SCUD and NODONG launches. \n   - AKA: Strategic Rocket Force; Strategic Rocket Force Command of KPA; Strategic Force; Strategic Forces \n   - Location: Pyongyang, DPRK",
  "url": "https://storage.googleapis.com/bluelines-rag-bucket/2017/S_RES_2356_2017_EN.pdf"
}