{
  "resolution_no": "2348",
  "year": "2017",
  "theme": [
    "Peacekeeping",
    "Elections",
    "Humanitarian",
    "Security Sector Reform",
    "DDR",
    "Child Protection",
    "Gender",
    "Sanctions"
  ],
  "chapter": "Chapter VII",
  "charter_articles": [
    "Article 24",
    "Article 25",
    "Article 42"
  ],
  "entities": [
    "MONUSCO",
    "UNCT",
    "Group of Experts",
    "International Criminal Court"
  ],
  "reporting_cycle": "every 3 months on MONUSCO's mandate implementation, every 45 days on political and technical progress and obstacles to the implementation of the 31 December 2016 agreement",
  "operative_authority": "Chapter VII",
  "summary": "The Security Council, recalling its previous resolutions on the Democratic Republic of the Congo (DRC), adopted Resolution 2348 (2017) at its 7910th meeting on 31 March 2017. \n\nThe resolution reaffirms the basic principles of peacekeeping and its strong commitment to the sovereignty, independence, unity, and territorial integrity of the DRC and all States in the region. \n\nIt recalls that the Government of the DRC bears the primary responsibility to protect civilians within its territory and subject to its jurisdiction. \n\nThe resolution reaffirms its strong support for the “Comprehensive and Inclusive Political Agreement” signed on 31 December 2016, calling for its swift implementation to organize peaceful, credible, inclusive, and timely elections no later than December 2017.\n\nThe resolution stresses the importance of the Government of the DRC taking all necessary steps to accelerate preparations for the elections, ensure an environment conducive to the peaceful and inclusive conduct of political activities, and to respect human rights and comply with the principle of proportionality in the use of force.\n\nThe resolution expresses deep concern over reports of serious human rights and international humanitarian law violations committed by some members of the Armed Forces of the DRC (FARDC), the National Intelligence Agency (ANR), the Republican Guard, and Congolese National Police (PNC).\n\nThe resolution reiterates its concern over the lack of progress in investigations and prosecutions against alleged perpetrators of human rights violations and abuses.\n\nThe resolution calls for the neutralization of armed groups in the DRC and recognizes the importance of efforts of the FARDC and the United Nations Organization Stabilisation Mission in the DRC (MONUSCO). \n\nThe resolution urges all parties to refrain from violence and provocation, stressing the importance of releasing all persons detained arbitrarily, including human rights defenders and persons of different political affiliations. \n\nThe resolution emphasizes that the Government of the DRC must respect human rights and comply with the principle of proportionality in the use of force. \n\nThe resolution calls for further efforts to hold those responsible for human rights violations and abuses to account and fight impunity. \n\nThe resolution commends the DRC authorities for prosecutions and convictions of members of the FARDC and PNC for crimes against humanity. \n\nThe resolution expresses concern at reports of growing inter-communal and militia violence in some areas of the DRC, in particular in the regions of Kasaï and Tanganyika. \n\nThe resolution calls upon all parties to take appropriate measures to protect and respect United Nations, diplomatic and foreign premises, property, and personnel and other civilians in the DRC.\nHere is a concise summary of the Security Council document:\n\nThe Security Council:\n\n1. Stresses the strategic importance of implementing the Peace, Security and Cooperation (PSC) Framework for the DRC and the region to address root causes of conflict.\n\n2. Recalls its readiness to impose targeted sanctions for human rights violations or abuses.\n\n3. Encourages continued efforts by the Secretary-General, African Union, ICGLR, and SADC to restore peace and security in the DRC.\n\n4. Expresses concern at the illegal exploitation and trafficking of natural resources and their negative impact on peace and development.\n\n5. Remains deeply concerned by persistent high levels of violence, human rights violations, and abuses, particularly against civilians.\n\n6. Welcomes progress achieved by the DRC, including cooperation with the Special Representatives of the Secretary-General on sexual violence and children in armed conflict.\n\n7. Stresses the need for continued cooperation with the International Criminal Court (ICC) to hold accountable those responsible for genocide, war crimes, and crimes against humanity.\n\n8. Expresses concern at the humanitarian situation, internally displaced persons (over 2.2 million), and refugees (over 452,000 in DRC and 468,000 from DRC).\n\n9. Calls for a peaceful environment conducive to durable solutions for refugees and internally displaced persons.\n\n10. Expresses concern at impediments to humanitarian access and attacks against humanitarian actors.\n\n11. Notes slow progress in implementing the national plan for disarmament, demobilization, and reintegration of former combatants.\n\n12. Recalls its resolutions on women, peace, and security, children and armed conflicts, and protection of civilians.\n\n13. Welcomes efforts of MONUSCO and international partners in delivering training to Congolese security institutions.\n\n14. Reaffirms its strong support to the Special Representative of the Secretary-General and MONUSCO in implementing their mandates.\nHere is a concise summary of the Security Council document 2348 (2017):\n\nThe Security Council:\n\n**Political Situation and Electoral Process**\n\n* Calls on all stakeholders in the DRC, including President Kabila, to implement the 31 December 2016 agreement in good faith and in all its components.\n* Urges swift nomination of a Prime Minister, establishment of the Conseil national de suivi de l’accord (CNSA), and implementation of confidence-building measures.\n* Calls for a transparent and credible electoral process, with full participation of women, and for the Independent National Electoral Commission (CENI) to publish a revised electoral calendar.\n* Requests the Government to ensure a conducive environment for free, fair, and peaceful elections.\n\n**Human Rights**\n\n* Urges the Government to hold accountable those responsible for human rights violations and abuses, including war crimes and crimes against humanity.\n* Calls for prosecution of those responsible for crimes involving grave human rights violations and abuses committed in the context of the electoral process.\n* Condemns violence in the Kasaï region, expresses concern at serious human rights abuses, and welcomes the Government's announcement to conduct investigations into these abuses.\n\n**MONUSCO and International Support**\n\n* Reiterates its call on all parties to cooperate fully with MONUSCO and to remain committed to the full and objective implementation of the Mission's mandate.\n* Emphasizes the importance of joint analysis and effective strategic planning with the UNCT.\n* Determines that the situation in the DRC continues to constitute a threat to international peace and security in the region, and acts under Chapter VII of the Charter of the United Nations.\nHere is a summarized version of the document:\n\nThe Security Council:\n\n Condemns armed groups in the DRC for human rights abuses and international humanitarian law violations, and demands they cease violence and disarm.\n\n Welcomes efforts to combat sexual violence, but urges the DRC government to do more to hold perpetrators accountable, including those in the FARDC and PNC.\n\n Encourages the DRC government to implement its National Strategy and Roadmap to fight sexual violence.\n\n Welcomes progress in preventing child recruitment, but calls on the DRC government to ensure children are not detained for association with armed groups.\n\n Strongly condemns armed groups, including the FDLR, for violence and human rights abuses.\n\n Demands joint operations between the FARDC and MONUSCO to neutralize armed groups.\n\n Condemns killings in the Beni area and calls for thorough investigations and military action to end armed group threats.\n\n Reiterates calls for the DRC government and neighboring countries to implement commitments under the PSC Framework.\n\n Expresses concern at former M23 combatants' presence in the DRC and requests repatriation.\n\n Calls for a solution for the relocation of SPLM/A-iO elements in the DRC.\n\n Urges the DRC government to make progress on implementing commitments, including consolidating state authority, promoting democracy, and protecting civilians.\nHere is a concise summary of the Security Council document:\n\nThe Security Council:\n\n Notes with deep concern the limited progress in areas essential for the DRC's stabilization and calls on the Government to take further steps on Security Sector Reform (SSR) and implement the national Disarmament, Demobilization and Reintegration (DDR) programme.\n\n Calls for continued national efforts to address the threat posed by illicit transfer, accumulation, and misuse of small arms and light weapons.\n\n Urges the Government to fully implement and fund its DDR Plan, including reintegration, training, and resettlement.\n\n Requests the UN Special Envoy for the Great Lakes Region to continue promoting peace and stability in the DRC and the region.\n\n Extends MONUSCO's mandate until 31 March 2018, with an authorized troop ceiling of 16,215 military personnel, 660 military observers and staff officers, 391 police personnel, and 1,050 personnel of formed police units.\n\n Sets MONUSCO's strategic priorities as: \n- Protection of civilians \n- Support to the implementation of the 31 December 2016 agreement and the electoral process.\n\n Requests MONUSCO components to work together in an integrated way and encourages MONUSCO and the UN system to strengthen integration through joint analysis and planning.\n\n Notes that a purely military solution to armed groups' activities is not feasible and underlines the importance of enhanced political and conflict analysis.\n\n Stresses the need for coordination and cooperation between the Government, UN entities, and development actors to build and sustain peace.\n\n Reaffirms that the protection of civilians must be given priority in decisions about the use of available capacity and resources.\n\n Authorizes MONUSCO to take all necessary measures to carry out its mandate.\n\n Decides that MONUSCO's mandate shall include priority tasks on:\n- Protection of civilians \n- Ensure effective and dynamic protection of civilians under threat of physical violence.\n\n Requests MONUSCO to accelerate the coordinated implementation of monitoring, analysis, and reporting arrangements on sexual violence in conflict.\nHere is a summarized version of the Security Council document:\n\n**Tasks of MONUSCO**\n\n* Neutralize armed groups through the Intervention Brigade, in support of the DRC authorities, while protecting civilians and mitigating risks.\n* Provide good offices, advice, and assistance to the DRC Government to ensure actions against armed groups are supported by civilian and police components.\n* Work with DRC authorities to arrest and bring to justice those responsible for genocide, war crimes, and crimes against humanity.\n* Provide good offices, advice, and support to promote human rights and fight impunity.\n\n**Implementation of the 31 December 2016 agreement and support to the electoral process**\n\n* Provide technical and political support to the implementation of the agreement and the electoral process.\n* Monitor and report on human rights violations and abuses, and support the UN system to ensure consistency with international law.\n* Provide technical assistance and logistical support for the electoral process.\n\n**Protection of the United Nations**\n\n* Ensure the protection of UN personnel, facilities, installations, and equipment.\n\n**Stabilisation and DDR**\n\n* Provide coordination for stabilisation efforts through the International Security and Stabilisation Support Strategy (ISSSS).\n* Collaborate with the DRC Government to prevent and end recruitment and use of children and sexual violence against children by the FARDC.\n* Provide support to disarmament, demobilization, repatriation, resettlement, and reintegration (DDRRR) process for foreign combatants.\nHere is a concise summary of the Security Council document 2348 (2017):\n\n**Demobilization, Disarmament and Reintegration (DDR) and Security Sector Reform (SSR)**\n\n* Facilitate the reintegration of combatants not suspected of genocide, war crimes, crimes against humanity, or human rights abuses and their dependents into a peaceful civilian life.\n* Work with the Government of the DRC to reform the police, develop a national security policy, and implement a comprehensive SSR roadmap.\n* Enhance accountability, efficiency, and effectiveness of the army, while ensuring oversight and scrutiny.\n\n**Sanctions Regime**\n\n* Monitor the implementation of the arms embargo and observe and report on flows of military personnel, arms, or related materiel across the eastern border of the DRC.\n\n**Mining Activities**\n\n* Encourage the consolidation of an effective national civilian structure to control key mining activities and manage natural resources.\n\n**Child Protection**\n\n* Take fully into account child protection as a cross-cutting issue throughout its mandate and assist the Government of the DRC in ensuring the protection of children's rights.\n\n**Gender, Sexual Violence, Sexual Exploitation and Abuse**\n\n* Take fully into account gender considerations as a cross-cutting issue throughout its mandate and assist the Government of the DRC in ensuring the participation and representation of women.\n* Ensure full compliance with the United Nations zero-tolerance policy on sexual exploitation and abuse.\n\n**Humanitarian Access**\n\n* Demand that all parties allow and facilitate the full, safe, immediate, and unhindered access of humanitarian personnel, equipment, and supplies.\n* Call on all Member States to generously contribute to the United Nations humanitarian appeal for the DRC.\nHere is a summarized version of the Security Council document:\n\n**Support to the Group of Experts**\n\n* The Council expresses full support to the UN Group of Experts established by resolution 1533 (2004)\n* Calls for enhanced cooperation between all States, MONUSCO, and the Group of Experts\n* Demands that all parties and States ensure cooperation with the Group of Experts and ensure their safety and unhindered access\n\n**Force effectiveness**\n\n* Urges the UN to continuously incorporate lessons learned to conduct reforms across MONUSCO\n* Demands that all relevant parties cooperate fully with MONUSCO's deployment, operations, and monitoring functions\n* Requests MONUSCO to maximize Force interoperability, flexibility, mobility, and effectiveness\n* Commends troop- and police-contributing countries' commitment to implementing the Mission's mandate\n\n**Environmental impacts and inter-mission cooperation**\n\n* Requests MONUSCO to consider environmental impacts of its operations and manage them accordingly\n* Takes note of the Secretary-General's recommendation to consider deploying two Formed Police Units and associated enablers through inter-mission cooperation\n\n**Exit strategy**\n\n* Stresses that MONUSCO's exit should be phased and progressive, tied to specific targets developed with the Government of the DRC and other stakeholders\n* Requests the Secretary-General to report to the Council on progress made and make recommendations on the planning of subsequent phases of the withdrawal\n\n**Strategic review**\n\n* Requests the Secretary-General to conduct a strategic review of MONUSCO, examining the continued relevance of all mandated tasks, priorities, and related resources\n* Provides options for a reduction of MONUSCO's Force and civilian components and advice on an exit strategy\n\n**Reports by the Secretary-General**\n\n* Requests the Secretary-General to report to the Council every three months on the implementation of MONUSCO's mandate.\nThe Security Council:\n\nRequests the Secretary-General to:\n\n- Report every 45 days in writing on progress and obstacles to implementing the 31 December 2016 agreement (para 53);\n\n- Report every six months on:\n  - Implementation of commitments under the PSC Framework \n  - Linkages with the broader security situation in the Great Lakes Region \n  - In coordination with the Secretary-General’s Special Envoy for the Great Lakes Region and the SRSG for the DRC (para 54);\n\nThe reports should cover:\n- Progress made by the DRC on the implementation of the 31 December 2016 agreement and electoral process (para 51.i)\n- Situation on the ground, including operations to neutralize armed groups and instances where MONUSCO is not fulfilling its protection of civilians mandate (para 51.ii)\n- Progress made by the DRC on protecting human rights and implementing its commitments under the PSC Framework (para 51.iii)\n- Progress in implementing measures to transform MONUSCO’s Force and improve its performance (para 51.iv)\n- Risks and implications for the safety and security of United Nations personnel and facilities (para 51.v)\n\nDecides to remain actively seized of the matter (para 55).",
  "url": "https://storage.googleapis.com/bluelines-rag-bucket/2017/S_RES_2348_2017_EN.pdf"
}