{
  "resolution_no": "2397",
  "year": 2017,
  "theme": [
    "Sanctions",
    "Non-Proliferation",
    "Peace and Security"
  ],
  "chapter": "Chapter VII",
  "charter_articles": [
    "Article 41"
  ],
  "entities": [
    "DPRK",
    "UNSC",
    "Panel of Experts",
    "Foreign Trade Bank",
    "Bank of East Land",
    "Daesong Bank",
    "Ilsim International Bank",
    "Korea Unification Development Bank",
    "Koryo Bank",
    "Koryo Credit Development Bank"
  ],
  "reporting_cycle": "90 days",
  "operative_authority": "Chapter VII",
  "summary": "Here is a concise summary of the Security Council document:\n\nThe Security Council:\n\n1. Condemns the Democratic People's Republic of Korea's (DPRK) ballistic missile launch on November 28, 2017, in violation of previous resolutions.\n\n2. Reaffirms the DPRK's obligations to abandon its nuclear weapons and ballistic missile programs, and to cease all related activities.\n\n3. Imposes sanctions on individuals and entities listed in Annex I and II, and decides that measures specified in resolution 1718 (2006) shall apply to them.\n\n4. Prohibits the supply, sale, or transfer of crude oil to the DPRK, except for livelihood purposes, and sets a limit of 4 million barrels or 525,000 tons per 12-month period.\n\n5. Prohibits the supply, sale, or transfer of refined petroleum products to the DPRK, with an exception for up to 500,000 barrels per 12-month period, subject to notification to the Committee.\n\n Recalling previous resolutions, including 825 (1993), 1695 (2006), 1718 (2006), and 2371 (2017), and expressing concern at the DPRK's nuclear and ballistic missile programs, which pose a threat to international peace and security.\nHere is a concise summary of the Security Council document 2397 (2017):\n\n**Refined Petroleum Products**\n\n* Imposes limits on the supply, sale, or transfer of refined petroleum products to the DPRK\n* Requires notification to the Committee when 75%, 90%, and 95% of aggregate yearly amounts are reached\n* Prohibits supply, sale, or transfer of refined petroleum products for DPRK's nuclear or ballistic missile programs\n* Committee to make publicly available the total amount of refined petroleum products sold, supplied, or transferred to the DPRK\n\n**Trade Restrictions**\n\n* Prohibits the supply, sale, or transfer to the DPRK of:\n\t+ Industrial machinery (HS codes 84 and 85)\n\t+ Transportation vehicles (HS codes 86 through 89)\n\t+ Iron, steel, and other metals (HS codes 72 through 83)\n* Exempts spare parts for DPRK commercial civilian passenger aircraft\n\n**DPRK Nationals Working Abroad**\n\n* Requires Member States to repatriate DPRK nationals earning income in their jurisdiction within 24 months\n* Member States to provide midterm and final reports on repatriation efforts\n\n**Maritime Interdiction**\n\n* Authorizes Member States to seize, inspect, and freeze vessels involved in prohibited activities\n* Encourages consultation with flag States of seized vessels\n* Allows Committee to decide on case-by-case basis to release frozen vessels\n\n**Information Requests**\n\n* Allows Member States to request maritime and shipping information from other Member States to prevent illicit cargo transport\n* Committee to facilitate timely coordination of information requests through an expedited process.\nHere is a summarized version of the Security Council document 2397 (2017):\n\n11. Reaffirms previous resolutions and decides that Member States shall prohibit insurance or re-insurance services to vessels believed to be involved in prohibited activities, unless approved by the Committee for livelihood or humanitarian purposes.\n\n12. Reaffirms previous resolutions and decides that Member States shall de-register vessels involved in prohibited activities and prohibit classification services, except as approved by the Committee.\n\n13. Expresses concern about DPRK-flagged vessels intentionally disregarding AIS requirements to evade sanctions monitoring.\n\n14. Decides that all Member States shall prevent the supply, sale, or transfer of new or used vessels to the DPRK, except as approved by the Committee.\n\n15. Decides that Member States shall notify the Committee of information regarding designated vessels and measures taken to inspect, freeze, and impound.\n\n16. Exempts Russia-origin coal trans-shipment through the Russia-DPRK Rajin-Khasan port and rail project from the provisions of this resolution.\n\n17. Decides that Member States shall report to the Security Council within 90 days on measures taken to implement this resolution.\n\n18. Calls upon Member States to redouble efforts to implement previous resolutions and cooperate with each other.\n\n19. Decides that the Committee's and Panel of Experts' mandates shall apply with respect to the measures imposed in this resolution.\n\n20. Authorizes Member States to seize and dispose of prohibited items identified in inspections.\n\n21. Emphasizes that the measures set forth in this resolution shall not impede diplomatic or consular missions in the DPRK.\n\n22. Reiterates concern at the hardship faced by the people in the DPRK and demands that the DPRK prioritize their welfare.\nHere is a summarized version of the document:\n\n**Regrets and Concerns**\n\n* The Security Council regrets the DPRK's diversion of scarce resources towards nuclear weapons and ballistic missiles, causing hardship to its people.\n* The Council notes that over half of the DPRK's population suffers from food and medical insecurities, with 41% undernourished.\n\n**Humanitarian Concerns and Exemptions**\n\n* The Council reaffirms that sanctions are not intended to harm the civilian population and allows for exemptions for humanitarian activities.\n* The Committee may exempt activities from sanctions if necessary to facilitate humanitarian work in the DPRK.\n\n**Six-Party Talks and Denuclearization**\n\n* The Council supports the resumption of Six-Party Talks and reaffirms its support for the 2005 Joint Statement, which aims for the verifiable denuclearization of the Korean Peninsula.\n\n**Peace and Stability**\n\n* The Council stresses the importance of maintaining peace and stability on the Korean Peninsula and in north-east Asia.\n* It welcomes efforts to facilitate a peaceful solution through dialogue and stresses the need to reduce tensions.\n\n**Future Actions**\n\n* The Council will keep the DPRK's actions under review and is prepared to strengthen, modify, suspend, or lift measures as needed.\n* If the DPRK conducts a further nuclear test or launch, the Council will take action to restrict petroleum exports.\n\n**Travel Ban and Asset Freeze**\n\n* The Council imposes travel bans and asset freezes on individuals, including:\n\t+ Ch'oe So'k-min, an overseas Foreign Trade Bank representative\n\t+ Chu Hyo'k, a North Korean national and Foreign Trade Bank representative\n\t+ Kim Jong Sik, a leading official guiding DPRK's WMD development efforts\n\t+ Kim Kyong Il, a Foreign Trade Bank deputy chief representative in Libya\n\t+ Kim Tong Chol, an overseas Foreign Trade Bank representative\n\t+ Ko Chol Man, an overseas Foreign Trade Bank representative\n\n**Conclusion**\n\n* The Council decides to remain seized of the matter.\nHere is a summarized version of the document:\n\nThe document lists 12 individuals subject to sanctions:\n\n1. **KU JA HYONG**: \n   - Description: Foreign Trade Bank chief representative in Libya\n   - AKA: Ku Cha-hyo’ng \n   - Identifiers: Location Libya; DOB:08 September1957; Nationality: DPRK; Gender: male\n\n2. **MUN KYONG HWAN**: \n   - Description: Overseas Bank of East Land representative\n   - AKA: Mun Kyo’ng-hwan \n   - Identifiers: DOB:22 August1967; Passport No.381120660 expires 25 March2016; Nationality: DPRK; Gender: male\n\n3. **PAE WON UK**: \n   - Description: Overseas Daesong Bank representative\n   - AKA: Pae Wo’n-uk \n   - Identifiers: DOB:22 August1969; Nationality: DPRK; Gender: male; Passport No.472120208 expires22 Feb2017\n\n4. **PAK BONG NAM**: \n   - Description: Overseas Ilsim International Bank representative\n   - AKA: Lui Wai Ming; Pak Pong Nam; Pak Pong-nam \n   - Identifiers: DOB:06 May1969; Nationality: DPRK; Gender: male\n\n5. **PAK MUN IL**: \n   - Description: Overseas official of Korea Daesong Bank\n   - AKA: Pak Mun-il  \n   - Identifiers: DOB01 January1965; Passport No.563335509 expires 27 August2018; Nationality: DPRK; Gender: male\n\n6. **RI CHUN HWAN**: \n   - Description: Overseas Foreign Trade Bank representative\n   - AKA: Ri Ch’un-hwan \n   - Identifiers: DOB21 August1957; Passport No.563233049 expires 09 May2018; Nationality: DPRK; Gender: male\n\n7. **RI CHUN SONG**: \n   - Description: Overseas Foreign Trade Bank representative\n   - AKA: Ri Ch’un-so’ng \n   - Identifiers: DOB:30 October1965; Passport No.654133553 expires 11 March2019; Nationality: DPRK; Gender: male\n\n8. **RI PYONG CHUL**: \n   - Description: Alternate Member of the Political Bureau of the Workers’ Party of Korea and First Vice Director of the Munitions Industry Department\n   - A.K.A.: Ri Pyo’ng-ch’o’l \n   - Identifiers: YOB:1948; Nationality: DPRK; Gender: male; Address: DPRK\n\n9. **RI SONG HYOK**: \n   - Description: Overseas representative for Koryo Bank and Koryo Credit Development Bank\n   - AKA: Li Cheng He \n   - Identifiers: DOB:19 March1965; Nationality: DPRK; Gender: male\n\n10. **RI U’N SO’NG**: \n    - Description: Overseas Korea Unification Development Bank representative\n    - AKA: Ri Eun Song; Ri Un Song \n    - Identifiers: DOB:23 July1969; Nationality: DPRK; Gender: male\n\n11. **KIM TONG MYONG** Not mentioned \n12 Not mentioned \nso \n - Hence 10 individuals  are mentioned\n2397 (2017) Annex II \n\nAsset Freeze (Entities) \n\n1. MINISTRY OF THE PEOPLE’S ARMED FORCES (MPAF) \n  a. Description: Manages general administrative and logistical needs of the Korean People’s Army. \n  b. Location: Pyongyang, DPRK",
  "url": "https://storage.googleapis.com/bluelines-rag-bucket/2017/S_RES_2397_2017_EN.pdf"
}