{
  "resolution_no": "2378",
  "year": "2017",
  "theme": [
    "Peacekeeping",
    "Regional Organizations",
    "Conflict Prevention"
  ],
  "chapter": "Chapter VI",
  "charter_articles": [
    "Chapter VIII"
  ],
  "entities": [
    "United Nations",
    "African Union",
    "African Standby Force"
  ],
  "reporting_cycle": "",
  "operative_authority": "Chapter VI",
  "summary": "Here is a concise summary of the Security Council document:\n\nThe Security Council:\n\n- Recalls the purposes and principles of the UN Charter and reaffirms its primary responsibility for maintaining international peace and security.\n\n- Recalls previous resolutions and presidential statements on peacekeeping.\n\n- Emphasizes that lasting peace requires political solutions, not just military and technical engagements.\n\n- Underscores the importance of peacekeeping as a key tool for the UN in promoting and maintaining international peace and security.\n\n- Reaffirms its resolve to strengthen the central role of the UN in peacekeeping.\n\n- Reaffirms the basic principles of peacekeeping: consent of parties, impartiality, and non-use of force except in self-defense.\n\n- Emphasizes the importance of safety and security of peacekeepers.\n\n- Recognizes pledges made by Member States to improve peacekeeping performance and capabilities.\n\n- Recalls the Secretary-General's report on the Future of UN Peace Operations and recommendations of the High-Level Independent Panel.\n\n- Recognizes the value of cooperation with regional organizations.\n\n- Reaffirms States' primary responsibility to protect civilians.\n\n- Recognizes the indispensable role of women in peacekeeping.\n\n- Reaffirms support for the UN's zero-tolerance policy on sexual exploitation and abuse.\n\n- Notes the Joint UN-African Union Framework for enhanced partnership.\n\n- Takes note of ongoing efforts of the African Union and subregional organizations.\n\n- Encourages the African Union to finalize its human rights and Conduct and Discipline Compliance frameworks.\nThe Security Council,\n\nRecalling its previous resolutions and the commitments made by the Assembly of the African Union,\n\nStresses the primacy of politics in conflict resolution, including through mediation, ceasefire monitoring, and peace accord implementation (1).\n\nFurther stresses conflict prevention as a primary State responsibility, with UN actions supporting and complementing national efforts (2).\n\nReaffirms the duty of States to settle disputes peacefully, through means such as negotiation, mediation, and arbitration (3).\n\nRecognizes the role of the Secretary-General's good offices in conflict resolution, encouraging coordination with regional organizations (4).\n\nEmphasizes improving accountability, transparency, efficiency, and effectiveness in peacekeeping operations (5).\n\nPromotes agile and flexible field support through innovation for better delivery and results (6).\n\nWelcomes the Secretary-General's intention to introduce peacekeeping reform, ensuring transparency and Member State engagement (7).\n\nTakes note of the Secretary-General's initiatives to structurally reform the Secretariat (8).\n\nUnderlines the importance of implementing and following up on UN peacekeeping reform (9).\n\nRequests the Secretary-General to provide a comprehensive annual briefing on peacekeeping reform, including efforts to fill capability gaps (10).\n\nUnderscores the need to enhance peacekeeping effectiveness by improving mission planning, capability pledges, and performance through training (11).\n\nReaffirms its determination to prioritize and strengthen consultations with Troop- and Police-Contributing Countries and host countries (12).\n\nFurther reaffirms efforts to review peacekeeping operations for maximum effectiveness and efficiency (13).\n\nReaffirms commitment to cooperation between the UN and regional organizations, in line with Chapter VIII of the Charter (14).\n\n Reiterates determination to enhance the UN-African Union relationship, in accordance with Chapter VIII of the UN Charter (15).\nThe Security Council:\n\nUnderlines the importance of operationalizing the African Standby Force, calling on the UN and Member States to support its readiness within existing means.\n\n Reiterates regional organizations' responsibility to secure resources, recognizing ad hoc financing arrangements may impact peace support operations.\n\nIntends to consider practical steps for partly financing African Union-led peace support operations through UN assessed contributions on a case-by-case basis.\n\n Reiterates its request to the Secretary-General to enhance measures against abuse and exploitation in UN peacekeeping operations and urges Troop- and Police-Contributing Countries to take disciplinary action.\n\n Requests the Secretary-General to present a reporting framework for clear, consistent, and predictable reporting channels between the Secretariat, the Commission, and the two Councils.\n\nDecides to remain seized of the matter.",
  "url": "https://storage.googleapis.com/bluelines-rag-bucket/2017/S_RES_2378_2017_EN.pdf"
}