{
  "resolution_no": "2350",
  "year": "2017",
  "theme": [
    "Peacekeeping",
    "Rule of Law",
    "Human Rights",
    "Security Sector Reform"
  ],
  "chapter": "Chapter VII",
  "charter_articles": [
    "Article 42"
  ],
  "entities": [
    "MINUSTAH",
    "MINUJUSTH",
    "HNP",
    "UNPOL",
    "UNCT"
  ],
  "reporting_cycle": "90 days and 180 days",
  "operative_authority": "Chapter VII",
  "summary": "Here is a clear and concise summary of the Security Council document:\n\nThe Security Council:\n\nReaffirms previous resolutions on Haiti and commends Haitian authorities and the Haitian National Police (HNP) for ensuring credible and inclusive elections.\n\nCommends the Special Representative of the Secretary-General and the United Nations Stabilization Mission in Haiti (MINUSTAH) for their efforts in supporting the political process and maintaining a secure environment.\n\nExpresses appreciation to MINUSTAH personnel and Member States that contributed to the mission.\n\nWelcomes the strengthening and professionalization of the HNP, but notes the need for continued international support.\n\nEmphasizes the importance of continued UN and international community support for Haiti's long-term security and development.\n\nReaffirms the primary responsibility of the Haitian Government in implementing peacebuilding and sustaining peace strategies.\n\nAcknowledges progress made, but notes significant humanitarian challenges, particularly after Hurricane Matthew.\n\nWelcomes the General Assembly's resolution on the UN's 'New Approach to Cholera in Haiti'.\n\nRecognizes the importance of strengthening national human rights institutions and respect for human rights.\n\nConsiders developing a broader framework of mutual accountability among the Government of Haiti, the UN, and the international community.\n\nWelcomes the Secretary-General's report and recommends establishing a new UN peacekeeping mission in Haiti to consolidate gains and strengthen national capacity.\n\nActs under Chapter VII of the Charter of the United Nations to establish the new mission.\n1. Decides to extend MINUSTAH's mandate for a final six-month period, until 15 October 2017, and close the Mission by that date.\n\n2. The military component of MINUSTAH will gradually draw down and fully withdraw from Haiti by 15 October 2017.\n\n3. Reaffirms the importance of strengthening the justice sector and the Haitian National Police (HNP) for the Government of Haiti to take responsibility for security needs.\n\n4. Requests the Secretary-General to reduce MINUSTAH tasks and prioritize a successful transition to MINUJUSTH.\n\n5. Establishes MINUJUSTH, a follow-on peacekeeping mission, for an initial six-month period from 16 October 2017 to 15 April 2018, with up to seven Formed Police Units (FPUs) and 295 Individual Police Officers (IPOs).\n\n6. MINUJUSTH will assist the Government of Haiti to strengthen rule of law institutions, support and develop the HNP, and engage in human rights monitoring.\n\n7. MINUJUSTH will be headed by a Special Representative of the Secretary-General with a good offices and advocacy role.\n\n8. MINUJUSTH will retain seven FPUs, deployed to five regional departments, to provide operational support to the HNP.\n\n9. The 295 IPOs will play a key role in implementing the HNP Strategic Development Plan 2017-2021.\n\n10. The 38 government-provided corrections personnel will support efforts to strengthen the Directorate of Prisons Administration (DAP) management.\n\n11. MINUJUSTH's rule of law efforts will be part of a strategy towards a continued, progressive transition to development actors.\n\n12. Authorizes MINUJUSTH to use necessary means to carry out its mandate to support and develop the HNP.\n\n13. Authorizes MINUJUSTH to protect civilians under imminent threat of physical violence.\n\n14. Requests the Secretary-General to ensure medical enablers and air assets necessary to deploy security forces.\n\n15. Reaffirms the importance of gender mainstreaming throughout MINUJUSTH's mandate.\n\n16. Recognizes the ownership and primary responsibility of the Government and people of Haiti over the country's development.\n\n17. Recalls resolution 2272 (2016) and requests the Secretary-General to ensure full compliance with the United Nations zero-tolerance policy on sexual exploitation and abuse.\n\n18. Commends troop- and police-contributing countries and highlights the importance of addressing issues that may affect mandate implementation.\n\n19. Affirms the importance of a successful and responsible transition between MINUSTAH and MINUJUSTH.\n\n20. Requests the Secretary-General to establish a MINUJUSTH advance planning team and complete the joint MINUSTAH and UNCT Transition Plan.\n\n21. Requests the Secretary-General to report to the Security Council on the implementation of this resolution within 90 days and 180 days.\n\n22. Requests the initial 90-day report to include details on the joint MINUSTAH and UNCT Transition Plan.\nThe Security Council:\n\n23. Expresses its intent to continue reviewing conditions in Haiti and consider adapting MINUJUSTH's mandate and police force levels as needed to preserve progress towards durable security and stability;\n\n24. Decides to remain actively seized of the matter.",
  "url": "https://storage.googleapis.com/bluelines-rag-bucket/2017/S_RES_2350_2017_EN.pdf"
}