{
  "resolution_no": "2396",
  "year": "2017",
  "theme": [
    "Counter-Terrorism",
    "Foreign Terrorist Fighters",
    "Security",
    "International Cooperation"
  ],
  "chapter": "Chapter VII",
  "charter_articles": [
    "Article 24",
    "Article 25",
    "Article 41",
    "Article 42"
  ],
  "entities": [
    "UNODC",
    "UNOCT",
    "CTED",
    "INTERPOL",
    "ICAO",
    "Counter-Terrorism Committee",
    "Analytical Support and Sanctions Monitoring Team"
  ],
  "reporting_cycle": "",
  "operative_authority": "Chapter VII",
  "summary": "The Security Council,\n \nReaffirming its previous resolutions on terrorism, \n\nReaffirming that terrorism in all forms constitutes one of the most serious threats to international peace and security, \n\nReaffirming that countering terrorism requires collective efforts on national, regional and international levels, \n\nEmphasizing that terrorism and violent extremism cannot be associated with any religion, nationality, or civilization,\n\nReaffirming its commitment to sovereignty, territorial integrity and political independence of all States,\n\nStressing that Member States have the primary responsibility in countering terrorist acts and violent extremism,\n\nReaffirming that measures taken to counter terrorism must comply with international law, \n\nStressing that terrorism can only be defeated by a sustained and comprehensive approach,\n\nUrging Member States and the UN system to address drivers of violent extremism,\n\nRecalling Resolution 2178 and expressing concern over the threat posed by foreign terrorist fighters,\n\nReaffirming its call on Member States to ensure refugee status is not abused by terrorists,\n\nExpressing concern over international networks established by terrorists,\n\nAcknowledging that returning foreign terrorist fighters have attempted, organized, planned or participated in attacks,\n\nStressing the need for Member States to develop national risk and threat assessments,\n\nExpressing grave concern over foreign terrorist fighters seeking to return or relocate,\n\nHaving regard to the situation of individuals of more than one nationality,\n\nUnderlining the importance of strengthening international cooperation.\nThe Security Council,\n\nRecalling its previous resolutions and statements on counter-terrorism,\n\nUrges Member States to redouble their efforts to prevent and suppress terrorist acts, including by:\n\n* Preventing radicalization to terrorism and recruitment of foreign terrorist fighters\n* Disrupting and preventing financial support to foreign terrorist fighters\n* Developing and implementing risk assessments on returning and relocating foreign terrorist fighters and their families\n* Prosecution, rehabilitation, and reintegration efforts, consistent with applicable international law\n\nRecognizes that foreign terrorist fighters may travel with family members, and underscores the need for Member States to assess and investigate these individuals for potential involvement in criminal or terrorist activities.\n\nNotes with concern that terrorists craft distorted narratives to polarize communities, recruit supporters, and mobilize resources, and encourages Member States to collaborate on effective counter-narrative strategies.\n\nCalls upon Member States to improve timely information sharing on foreign terrorist fighters, especially among law enforcement, intelligence, and counter-terrorism agencies.\n\nRecognizes the challenges in obtaining admissible evidence from conflict zones and welcomes the establishment of the UN Office on Counter-terrorism (UNOCT).\n\nWelcomes recent developments and initiatives, including the UN Counter-terrorism Committee's 2015 Madrid Guiding Principles and the Global Counter-terrorism Forum's (GCTF) 2016 Hague-Marrakech Memorandum Addendum.\n\nExpresses concern that foreign terrorist fighters may use civil aviation as a means of transportation or target, and notes the importance of implementing International Civil Aviation Organization (ICAO) standards and recommended practices.\n\nNotes with concern that terrorists continue to use the Internet for terrorist purposes and stresses the need for cooperative action to prevent exploitation of technology and communications.\n\nRecognizes the development of the UN CTED-ICT4 Peace Tech Against Terrorism initiative and the efforts of INTERPOL to address the threat posed by foreign terrorist fighters.\n\nWelcomes the Global Internet Forum to Counter Terrorism (GIFCT) and calls for increased engagement with governments and technology companies.\nHere is a clear and concise summary of the Security Council document:\n\nThe Security Council:\n\n Recognizes that a comprehensive approach to counter terrorism requires addressing conditions conducive to its spread, including radicalization, recruitment, and financial support.\n\n Reaffirms the request to establish an investigative team to collect evidence in Iraq of ISIL's war crimes, crimes against humanity, and genocide.\n\n Acknowledges that prisons can be incubators for radicalization and terrorist recruitment, and that proper assessment and monitoring of imprisoned foreign terrorist fighters is critical.\n\n Notes that some Member States may face technical assistance and capacity-building challenges and encourages donor states to provide assistance.\n\n Encourages UN entities to enhance technical assistance to States to implement this resolution.\n\n Acting under Chapter VII of the Charter:\n\n1. Recalls the obligation of Member States to establish serious criminal offenses regarding travel, recruitment, and financing of foreign terrorist fighters.\n\n Border Security and Information Sharing:\n\n2. Calls upon Member States to prevent terrorist movement through effective border controls and controls on identity papers and travel documents.\n\n3. Calls upon Member States to notify countries of travel, arrival, or deportation of suspected terrorists, including foreign terrorist fighters.\n\n4. Calls upon Member States to assess and investigate individuals suspected of terrorism and distinguish them from other individuals.\n\n5. Calls upon Member States to intensify and accelerate exchange of operational information and financial intelligence on terrorists and terrorist networks.\n\n6. Urges Member States to expeditiously exchange information on foreign terrorist fighters, including their identity.\n\n7. Calls upon Member States to ensure access to relevant information for domestic law enforcement, intelligence, counter-terrorism, and military entities.\n\n8. Urges Member States to consider downgrading intelligence threat and travel data related to foreign terrorist fighters.\n\n9. Welcomes the approval by ICAO of the new Global Aviation Security Plan (GASeP) to enhance aviation security worldwide.\nHere is a concise summary of the Security Council document 2396 (2017) without adding any extra information:\n\nThe Security Council:\n\n Urges ICAO, Member States, and industry stakeholders to implement the Global Aviation Security Plan (GASeP) and specific measures to enhance aviation security.\n\n Welcomes the GASeP's recognition of the importance of enhancing risk awareness and response, and calls for updating international security standards to address terrorist threats.\n\n Decides that Member States shall:\n- Require airlines to provide Advance Passenger Information (API) to detect foreign terrorist fighters and listed individuals.\n- Collect, process, and analyze Passenger Name Record (PNR) data to prevent terrorist offenses.\n- Develop watch lists or databases of known and suspected terrorists.\n- Implement systems to collect biometric data to identify terrorists.\n\n Encourages:\n- Improved cooperation between ICAO and CTED to provide technical assistance and capacity-building.\n- Member States to share PNR data, API, and biometric data responsibly.\n\n Calls upon Member States to:\n- Contribute to and use INTERPOL's databases to screen travelers and strengthen investigations.\n- Ensure accountability for terrorist acts and violations of international humanitarian law.\n\n Urges Member States to:\n- Develop and implement investigative and prosecutorial strategies for foreign terrorist fighter-related offenses.\n- Share best practices and technical expertise to improve information collection and handling.\n\n Reaffirms that those responsible for terrorist acts must be held accountable.\nHere is a summarized version of the Security Council document 2396 (2017):\n\n21. Encourages Member States to enhance cooperation with the private sector, especially technology companies, to gather digital data and evidence in terrorism cases.\n\n22. Calls on Member States to improve international cooperation to prevent undetected travel of foreign terrorist fighters, share information, and adopt best practices.\n\n23. Recalls the obligation of Member States to assist each other in investigations and proceedings related to terrorist acts, including obtaining evidence, and urges States to find and bring to justice those who support terrorist activities.\n\n24. Underscores the need for strengthened international judicial cooperation, including mutual legal assistance and extradition in terrorism cases, and encourages Member States to enhance bilateral and multilateral treaties.\n\n25. Calls on Member States to help build the capacity of other States to address the threat posed by foreign terrorist fighter returnees and relocators.\n\n26. Calls on Member States to improve domestic information sharing within their criminal justice systems to monitor returning and relocating foreign terrorist fighters.\n\n27. Calls on Member States to establish partnerships with stakeholders to share information and experience to prevent and respond to terrorist attacks on \"soft\" targets.\n\n28. Urges States to assist in delivering capacity development, training, and resources to enable States to develop contingency and response plans.\n\n29. Calls on Member States to assess and investigate suspected terrorists, including foreign terrorist fighters, and develop comprehensive risk assessments.\n\n30. Calls on Member States to develop and implement comprehensive prosecution, rehabilitation, and reintegration strategies for foreign terrorist fighters and their families.\n\n31. Emphasizes the need for special focus on women and children associated with foreign terrorist fighters when developing rehabilitation and reintegration strategies.\n\n32. Underscores the importance of a whole-of-government approach and the role of civil society organizations in contributing to the rehabilitation and reintegration of returning and relocating foreign terrorist fighters.\nHere is a concise summary of the Security Council document:\n\nThe Security Council stresses the need to counter terrorist narratives used by ISIL, Al-Qaida, and associated individuals and groups to incite and recruit others to commit terrorist acts. The Council encourages Member States to develop and implement effective counter-narrative strategies, in compliance with international law, including human rights law and refugee law.\n\nThe Council also emphasizes the importance of:\n\n* Engaging with religious authorities, community leaders, and civil society actors to craft and deliver effective counter-narratives\n* Providing reintegration and rehabilitation assistance to children associated with foreign terrorist fighters\n* Developing legal safeguards to ensure prosecution, rehabilitation, and reintegration strategies are in line with international law\n* Conducting risk assessments to identify individuals at risk of radicalization to violence\n* Ensuring participation and leadership of women in designing and implementing strategies to address returning and relocating foreign terrorist fighters and their families\n\nThe Council further:\n\n* Encourages Member States to prevent inmates from radicalizing others in prisons\n* Directs the Committee established pursuant to resolutions 1267 (1999), 1989 (2011), and 2253 (2015) to focus on the threat posed by foreign terrorist fighters\n* Requests the Counter-Terrorism Committee to review the 2015 Madrid Guiding Principles and identify new good practices\n* Requests the Analytical Support and Sanctions Monitoring Team to collect and develop best practices on biometric data collection and sharing\n* Encourages relevant UN entities to enhance technical assistance to States to implement this resolution.\nHere is a summarized version of the document:\n\n49. Urges the Office of Counterterrorism to incorporate CTED assessments into their work, enhance cooperation with UN counter-terrorism entities, and identify emerging issues related to foreign terrorist fighters.\n\n50. Requests the Office of Counterterrorism to review the UN Capacity Building Implementation Plan to counter the flow of FTFs, in cooperation with CTED, to ensure it supports Member States in implementing priorities, including API systems, PNR capability, biometric data systems, judicial procedures, and prosecution, rehabilitation, and reintegration strategies, and to communicate updates to Member States and international bodies by June 2018.\n\n51. Decides to remain seized of the matter.",
  "url": "https://storage.googleapis.com/bluelines-rag-bucket/2017/S_RES_2396_2017_EN.pdf"
}