{
  "resolution_no": "2375",
  "year": "2017",
  "theme": [
    "Sanctions",
    "Non-Proliferation",
    "Peace and Security"
  ],
  "chapter": "Chapter VII",
  "charter_articles": [
    "Article 41"
  ],
  "entities": [
    "Central Military Commission of the Workers’ Party of Korea",
    "Organization and Guidance Department",
    "Propaganda and Agitation Department",
    "Pak Yong Sik"
  ],
  "reporting_cycle": "Member States shall report to the Security Council within ninety days of the adoption of this resolution, and thereafter upon request by the Committee",
  "operative_authority": "Chapter VII",
  "summary": "The Security Council,\n\nRecalling previous relevant resolutions and statements, reaffirms that proliferation of nuclear, chemical, and biological weapons constitutes a threat to international peace and security.\n\nExpressing gravest concern at the Democratic People’s Republic of Korea’s (DPRK) nuclear test on September 2, 2017, in violation of previous resolutions, and the challenge it poses to the Treaty on Non-Proliferation of Nuclear Weapons and international efforts.\n\nUnderlining the importance of the DPRK responding to international security and humanitarian concerns, and expressing great concern that the DPRK continues to develop nuclear weapons and ballistic missiles, diverting resources away from the people.\n\nExpressing gravest concern that the DPRK’s ongoing nuclear- and ballistic missile-related activities have destabilized the region and beyond, and determining that a clear threat to international peace and security exists.\n\nUnderscoring its commitment to the sovereignty, territorial integrity, and political independence of all States, and recalling the purposes and principles of the Charter of the United Nations.\n\nSeeking a peaceful and diplomatic solution, and welcoming efforts by Council members and other Member States to facilitate a peaceful and comprehensive solution through dialogue.\n\nActing under Chapter VII of the Charter, and taking measures under Article 41:\n\n1. Condemns in strongest terms the DPRK’s nuclear test on September 2, 2017;\n\n2. Reaffirms its decisions that the DPRK shall not conduct further launches using ballistic missile technology, nuclear tests, or provocations; and shall abandon all nuclear weapons and existing nuclear programs in a complete, verifiable, and irreversible manner.\n\n3. Decides that measures specified in paragraph 8 (d) of resolution 1718 (2006) shall apply to individuals and entities listed in Annex I and II, and to any individuals or entities acting on their behalf or at their direction.\n\n4. Decides to adjust measures imposed by paragraph 8 of resolution 1718 (2006) through designation of additional WMD-related dual-use items, materials, equipment, goods, and technology.\n\n5. Decides to adjust measures imposed by paragraph 8 (a), 8 (b), and 8 (c) of resolution 1718 (2006) through designation of additional conventional arms-related items, materials, equipment, goods, and technology.\n\n6. Decides to apply measures imposed by paragraph 6 of resolution 2371 (2016) on vessels transporting prohibited items from the DPRK.\nHere is a concise and clear summary of the Security Council document:\n\n**Maritime Interdiction of Cargo Vessels**\n\n* Calls upon Member States to inspect vessels on the high seas if they have information that provides reasonable grounds to believe the cargo contains prohibited items (para 7).\n* Requires flag States to direct vessels to proceed to a port for inspection if they do not consent to inspection on the high seas (para 8).\n* If a flag State does not cooperate, the Committee shall consider designating the vessel for measures imposed in previous resolutions (para 8).\n* Requires Member States to report incidents where they do not receive cooperation from a flag State (para 9).\n\n**Sectoral**\n\n* Prohibits the direct or indirect supply, sale, or transfer of condensates and natural gas liquids to the DPRK (para 13).\n* Prohibits the direct or indirect supply, sale, or transfer of refined petroleum products to the DPRK, with certain exceptions (para 14).\n* Sets limits on the amount of refined petroleum products that can be supplied to the DPRK (500,000 barrels for an initial 3-month period and 2,000,000 barrels per year).\n* Requires Member States to notify the Committee of transactions and ensures that supplies are exclusively for livelihood purposes and not for generating revenue for prohibited programs (para 14).\n* Directs the Committee Secretary to notify Member States when certain thresholds of refined petroleum products have been reached and to make publicly available the total amount of refined petroleum products sold, supplied, or transferred to the DPRK (para 14).\nHere is a concise summary of the Security Council document 2375 (2017):\n\n15. Limits crude oil supplies to DPRK: Member States shall not supply, sell, or transfer crude oil to DPRK in excess of the amount supplied in the previous 12 months, unless approved by the Committee for humanitarian purposes.\n\n16. Restricts textile exports: DPRK shall not supply, sell, or transfer textiles, and all States shall prohibit procurement of such items from DPRK, unless approved by the Committee; existing contracts allowed for 90 days.\n\n17. Restricts work authorizations for DPRK nationals: Member States shall not provide work authorizations unless approved by the Committee for humanitarian or denuclearization purposes; existing contracts exempt.\n\n18. Prohibits joint ventures: States shall prohibit joint ventures with DPRK entities or individuals, unless approved by the Committee; existing joint ventures to be closed within 120 days if not approved.\n\n19. Reporting requirements: Member States to report to the Security Council within 90 days on measures taken to implement this resolution.\n\n20. Calls for redoubled efforts to implement sanctions: Member States to cooperate in implementing measures.\n\n21. Committee and Panel of Experts mandates: Committee's mandate and Panel of Experts' mandate to apply to measures imposed in this resolution.\n\n22. Authorizes seizure and disposal of prohibited items: Member States to seize and dispose of items prohibited by previous resolutions.\n\n23. No claims allowed: No claims shall lie at the instance of DPRK or persons/entities designated for sanctions.\n\n24. Concern at DPRK's humanitarian situation: Reiterates concern at the grave hardship faced by the people in DPRK.\n\n25. Regrets DPRK's diversion of resources: Regrets DPRK's diversion of resources to nuclear weapons and ballistic missiles instead of addressing people's needs.\nThe Security Council expresses deep concern at the grave hardship to which the people in the DPRK are subjected, particularly with regard to major insecurities in food and medical care, with a large number of pregnant and lactating women and under-five children at risk of malnutrition and nearly a quarter of the population suffering from chronic malnutrition.\n\nThe Council reaffirms that measures imposed by previous resolutions are not intended to have adverse humanitarian consequences for the civilian population of the DPRK and decides that the Committee may exempt certain activities from these measures on a case-by-case basis.\n\nThe Council emphasizes compliance with provisions of resolution 1718 (2006) and reaffirms its support for the Six Party Talks, calling for their resumption. It reiterates its support for the commitments set forth in the Joint Statement of 19 September 2005, including verifiable denuclearization of the Korean Peninsula.\n\nThe Council stresses the importance of maintaining peace and stability on the Korean Peninsula, expresses commitment to a peaceful, diplomatic, and political solution, and welcomes efforts to facilitate a peaceful and comprehensive solution through dialogue.\n\nThe Council urges further work to reduce tensions, underscores the imperative of achieving complete, verifiable, and irreversible denuclearization, and affirms it shall keep the DPRK’s actions under continuous review.\n\nThe Council decides to remain seized of the matter.\n\nIt also imposes travel ban and asset freeze on individuals, starting with PAK YONG SIK, a member of the Workers’ Party of Korea Central Military Commission.\nThe Security Council has designated the following entities for an asset freeze:\n\n1. **CENTRAL MILITARY COMMISSION OF THE WORKERS’ PARTY OF KOREA (CMC)**\n\t* Description: Develops and implements military policies, commands and controls the DPRK's military, and directs military defense industries.\n\t* Location: Pyongyang, DPRK\n2. **ORGANIZATION AND GUIDANCE DEPARTMENT (OGD)**\n\t* Description: Directs personnel appointments, controls political affairs, and implements censorship policies.\n\t* Location: DPRK\n3. **PROPAGANDA AND AGITATION DEPARTMENT (PAD)**\n\t* Description: Controls media, engages in censorship, and uses media to control the public on behalf of the DPRK leadership.\n\t* Location: Pyongyang, DPRK \n No alternative names (AKA) are specified for these entities.",
  "url": "https://storage.googleapis.com/bluelines-rag-bucket/2017/S_RES_2375_2017_EN.pdf"
}