{
  "resolution_no": "2374",
  "year": "2017",
  "theme": [
    "Peacekeeping",
    "Sanctions",
    "Terrorism",
    "WPS/CAAC"
  ],
  "chapter": "Chapter VII",
  "charter_articles": [
    "Article 39",
    "Article 41",
    "Article 42"
  ],
  "entities": [
    "MINUSMA",
    "Panel of experts",
    "French forces",
    "FC-G5S",
    "EUTM Mali",
    "EUCAP Sahel Mali",
    "UNODC",
    "INTERPOL"
  ],
  "reporting_cycle": "The Panel of experts shall provide to the Council, after discussion with the Committee, an interim update by March, 1, 2018, and a final report by September, 1, 2018, and periodic updates in between; The Committee to report orally, through its Chair, at least once per year to the Council",
  "operative_authority": "Chapter VII",
  "summary": "Here is a clear and concise summary of the Security Council document:\n\nThe Security Council:\n\nRecalling previous resolutions on Mali, reaffirms its commitment to Mali's sovereignty, unity, and territorial integrity. \n\nRecognizes the Agreement on Peace and Reconciliation in Mali (2015) as a historic opportunity for lasting peace and condemns repeated ceasefire violations by armed groups.\n\nUrges armed groups to cease hostilities, adhere to the ceasefire, and implement the Agreement. \n\nWelcomes recent progress, including establishment of interim administrations, but expresses concern over delays in implementation.\n\nAffirms its intention to facilitate and support the Agreement's implementation and commends Algeria and the international mediation team's role.\n\nDeplores slow progress in implementing the Agreement, particularly on defence and security provisions, and stresses the primary responsibility of the Malian government and armed groups to accelerate implementation.\n\nExpresses concern over the volatile security situation, terrorist expansion, and criminal activities in Mali and the Sahel region.\n\nEmphasizes the link between security in Mali and the Sahel and West Africa regions.\n\nCondemns terrorist organizations' activities, including MUJAO, Al-Qaida in the Islamic Maghreb, and associates, and calls for cooperation to address these threats.\n\nRecalls sanctions listings for terrorist groups and individuals and reiterates readiness to sanction further entities or individuals associated with terrorism.\n\nStrongly condemns continuing attacks, including terrorist attacks against civilians, Malian defense forces, MINUSMA, and other international actors.\nHere is a concise summary of the Security Council document:\n\nThe Security Council strongly condemns terrorist attacks in Mali, kidnappings, and hostage-taking, and urges the Malian government to hold perpetrators accountable. The Council also condemns human rights abuses and violations of international humanitarian law, including extrajudicial killings, arbitrary arrests, and sexual violence.\n\nThe Council welcomes the efforts of French forces, the Force Conjointe des Etats du G5 Sahel (FC-G5S), and the European Union Training Mission (EUTM Mali) in combating terrorism and stabilizing the region.\n\nThe Council recalls the mandate of MINUSMA and reiterates its strong support for the Special Representative of the Secretary-General for Mali.\n\nThe Council determines that the situation in Mali continues to constitute a threat to international peace and security and, acting under Chapter VII, imposes a travel ban on individuals designated by a Committee established pursuant to paragraph 9.\n\nThe travel ban, effective for one year, allows for exemptions on humanitarian grounds, for judicial processes, or where it would further the objectives of peace and national reconciliation in Mali. \n\nThe Council calls on all parties and Member States to cooperate with the Committee and emphasizes that violations of the travel ban can undermine peace, stability, or security in Mali.\nThe Security Council has adopted resolution 2374 (2017) with several key provisions:\n\n**Travel Ban and Asset Freeze**\n\nThe resolution imposes a travel ban on individuals and an asset freeze on individuals and entities that threaten the peace, security, or stability of Mali.\n\n**Asset Freeze Details**\n\n* All Member States must freeze funds, financial assets, and economic resources owned or controlled by designated individuals or entities.\n* The measures do not apply to funds necessary for basic expenses, extraordinary expenses, or to satisfy a judicial lien or judgment.\n* Member States may permit the addition of interests or earnings to frozen accounts.\n\n**Designation Criteria**\n\nThe Committee will designate individuals and entities responsible for:\n\n* Engaging in hostilities in violation of the Agreement\n* Obstructing the implementation of the Agreement\n* Supporting or financing individuals and entities engaged in such actions\n* Attacks against Malian institutions, MINUSMA peacekeepers, and UN personnel\n* Obstructing humanitarian assistance\n* Committing human rights abuses or violations\n* Using or recruiting children in armed groups or forces\n\n**New Sanctions Committee**\n\nThe resolution establishes a new Committee to:\n\n* Monitor implementation of the measures\n* Designate individuals and entities subject to the measures\n* Review information and consider requests for exemptions.\nHere is a summarized version of the Security Council document 2374 (2017):\n\nThe Security Council:\n\nEstablishes a Committee to oversee sanctions on individuals and entities in Mali.\n\nThe Committee's tasks include:\n\n* Establishing guidelines for implementing sanctions\n* Encouraging dialogue with interested states and organizations\n* Seeking information on actions taken to implement sanctions\n* Examining information on alleged violations or non-compliance\n\nThe Secretary-General is requested to:\n\n* Make financial arrangements to enable the Committee to undertake its tasks\n\nA Panel of experts is established for 13 months, with tasks including:\n\n* Assisting the Committee in carrying out its mandate\n* Gathering and analyzing information on implementation of sanctions\n* Providing reports to the Council\n* Cooperating with INTERPOL and UNODC\n\nThe Panel of experts should have:\n\n* Necessary gender expertise\n* Strongest qualifications, with regional and gender representation\n\nThe Panel of experts is directed to:\n\n* Cooperate with other relevant expert groups\n\nAll parties and Member States are urged to:\n\n* Cooperate with the Panel of experts\n* Ensure safety and access for the Panel\n\nMINUSMA is encouraged to:\n\n* Exchange information with the Panel of experts\n* Assist the Committee and Panel of experts\n\nStates are called upon to:\n\n* Implement sanctions and report to the Committee\n\nThe Committee is requested to:\n\n* Report orally to the Council at least once a year\n\nThe Security Council:\n\n* Affirms it will keep the situation in Mali under review\n* Decides to remain actively seized of the matter.",
  "url": "https://storage.googleapis.com/bluelines-rag-bucket/2017/S_RES_2374_2017_EN.pdf"
}