{
  "resolution_no": "2406",
  "year": "2018",
  "theme": [
    "Peacekeeping",
    "Humanitarian",
    "WPS/CAAC",
    "Sanctions",
    "Conflict Resolution"
  ],
  "chapter": "Chapter VII",
  "charter_articles": [
    "Article 24",
    "Article 25",
    "Article 42"
  ],
  "entities": [
    "UNMISS",
    "CTSAMM",
    "IGAD",
    "AU",
    "SPLA",
    "SPLA-IO"
  ],
  "reporting_cycle": "90 days",
  "operative_authority": "Chapter VII",
  "summary": "Here is a clear and concise summary of the Security Council document:\n\nThe Security Council:\n\nRecalling previous resolutions and statements on South Sudan, reaffirms its commitment to the country's sovereignty, independence, territorial integrity, and national unity.\n\nExpresses grave alarm and concern over the ongoing crisis, violence, and humanitarian situation in South Sudan, emphasizing that there can be no military solution.\n\nStrongly condemns ongoing fighting, including violations of the 21 December 2017 Agreement on Cessation of Hostilities, Protection of Civilians, and Humanitarian Access (ACOH).\n\nDeeply regrets the parties' disregard for previous Presidential Statements and the 4 September 2016 Joint Communique.\n\nWelcomes efforts by IGAD, JMEC, AU, AUPSC, and the UN to engage with South Sudanese leaders, and encourages continued proactive engagement.\n\nTakes note of the 2015 Agreement on the Resolution of the Conflict in South Sudan, the IGAD-led High Level Revitalization Forum, and the ACOH.\n\nCalls on South Sudanese parties to demonstrate political will to peacefully resolve the conflict, stressing that the IGAD High-Level Revitalization Forum is a last chance for sustainable peace and stability.\n\nNotes the importance of accountability for those who violate the ACOH and recalls the possibility of targeted sanctions for those who undermine peace, security, or stability.\n\nCommends the work of UNMISS, stressing the importance of effective engagement with local communities and humanitarian actors.\n\nRecognizes the value of unarmed civilian protection and encourages UNMISS to explore civilian protection techniques.\n\nNotes the dire humanitarian situation, high levels of food insecurity, and the importance of UNMISS's contribution to creating conditions for safe, voluntary, and dignified return of displaced communities.\nHere is a summary of the Security Council document 2406 (2018):\n\nThe Security Council:\n\nCondemns the obstruction of UNMISS by the Transitional Government of National Unity (TGNU) and opposition groups, including restrictions on freedom of movement and assault on UNMISS personnel.\n\nDemands that all parties, particularly the TGNU and SPLA-IO, end all obstructions to UNMISS, including its mandate to monitor and investigate human rights.\n\nStrongly condemns human rights violations and abuses, including extrajudicial killings, ethnically targeted violence, rape, and use of children, and emphasizes that those responsible must be held accountable.\n\nExpresses grave concern at the possibility of an ethnic war in South Sudan and the use of hate speech and incitement to violence.\n\nCalls on the Government of South Sudan to condemn and counter hate speech and promote reconciliation.\n\nExpresses concern at the systematic and widespread use of sexual violence against women and girls.\n\nStresses the urgent need to end impunity and hold accountable all perpetrators of human rights abuses.\n\nNotes with interest reports on the human rights situation in South Sudan, including the AU Commission of Inquiry report, and emphasizes the importance of collecting and preserving evidence for the Hybrid Court.\n\nExpresses serious concern over the humanitarian crisis, including 4 million displaced persons, 5.3 million facing severe food insecurity, and 7 million in need of life-saving assistance.\n\nCondemns obstructions to humanitarian actors' movement and attacks on humanitarian personnel and facilities.\n\nAppreciates the actions taken by UNMISS peacekeepers and Troop- and Police-Contributing Countries in implementing the UNMISS mandate.\n\nWelcomes the Secretary-General's commitment to enforcing his zero-tolerance policy on sexual exploitation and abuse.\nHere is a concise summary of the Security Council document 2406 (2018):\n\nThe Security Council expresses grave concern over the situation in South Sudan, including recent allegations of sexual exploitation and abuse by peacekeepers, and demands that all parties end fighting and implement a permanent ceasefire. The Council also demands that the Transitional Government of National Unity (TGNU) cease obstructing UNMISS and humanitarian actors. \n\nThe Council emphasizes the need to prevent sexual exploitation and abuse, and hold those responsible accountable. It also recognizes the challenges faced by UNMISS in implementing its mandate and appreciates its efforts to ensure the safety of internally displaced persons (IDPs).\n\nThe Council condemns attacks on UN personnel and facilities, and expresses its intention to consider measures, including an arms embargo, to deprive parties of the means to continue fighting. It commends the report by JMEC Chairperson Festus Mogae on the status of implementation of the Agreement and underscores the importance of a ceasefire and inclusive peace process.\n\nThe Council decides to extend the mandate of UNMISS until 15 March 2019, maintaining the overall force levels, and requests the Secretary-General to expedite force and asset generation. \n\nThe Council recalls its previous resolutions, including 2272 (2016), 1325 (2000), 2242 (2015), and 2117 (2013), and expresses concern over the illicit transfer and misuse of small arms and light weapons, and the threats to economic infrastructure.\nHere is a concise summary of the document:\n\nThe Security Council:\n\n1. Notes the Secretary-General's intention to conduct a military and police capability study and expresses readiness to consider adjustments to UNMISS.\n\n2. Decides on the mandate of UNMISS, authorizing it to use necessary means to:\n \n   **Protection of Civilians:**\n     - Protect civilians under threat of physical violence\n     - Deter violence against civilians, including foreign nationals\n     - Implement an early warning strategy\n     - Maintain public safety and security in UNMISS protection sites\n     - Deter and prevent sexual and gender-based violence\n     - Foster a secure environment for IDPs and refugees to return\n\n   **Creating Conditions for Humanitarian Assistance:**\n     - Contribute to security conditions for humanitarian assistance delivery\n     - Ensure security and freedom of movement for UN personnel\n\n   **Monitoring and Investigating Human Rights:**\n     - Monitor, investigate, verify, and report on human rights abuses and violations\n     - Focus on abuses against children and women, including sexual violence\n\n   **Supporting Implementation of the Agreement and Peace Process:**\n     - Support the peace process, including the High-Level Revitalization Forum\n     - Participate in and support the CTSAMM and JMEC\n\n3. Stresses the need for all parties to commit to the peace process in good faith.\nHere is a summarized version of the Security Council document:\n\nThe Security Council:\n\n* Keeps the tasks and composition of UNMISS under active review, based on the outcomes of the High-Level Revitalization Forum.\n\n**Mandate of UNMISS**\n\n* UNMISS shall continue to include a Regional Protection Force (RPF) to provide a secure environment in and around Juba and other parts of South Sudan.\n* The RPF is authorized to use all necessary means to:\n\t+ Facilitate safe and free movement into, out of, and around Juba.\n\t+ Protect the airport and key facilities in Juba.\n\t+ Engage any actor preparing or engaging in attacks against UN protection of civilians sites, premises, personnel, humanitarian actors, or civilians.\n\n**Importance of UNMISS Bases and Access**\n\n* Affirms the critical importance of UNMISS using all its bases without restrictions to execute its mandate.\n* Calls on the Government of South Sudan to uphold its obligations to guarantee UNMISS unimpeded access to UN premises.\n\n**Principles of Peacekeeping**\n\n* Reaffirms the basic principles of peacekeeping, including consent of parties, impartiality, and non-use of force, except in self-defense and defense of the mandate.\n\n**Protection of Civilians**\n\n* Emphasizes that protection of civilians must be given priority in decisions about the use of available capacity and resources.\n* Authorizes UNMISS to use all necessary means to protect civilians from threats, regardless of source.\n\n**Role of the Special Representative of the Secretary-General**\n\n* Requests the Special Representative to direct UNMISS operations and coordinate all UN activities in South Sudan.\n* Underscores the critical role of CTSAMM and the importance of support provided by UNMISS.\n\n**Gender Considerations and Training**\n\n* Requests UNMISS to take fully into account gender considerations throughout its mandate.\n* Encourages Troop- and Police-contributing Countries to increase the deployment of women in the military, police, and civilian components.\n\n**Patrolling and Deployment**\n\n* Requests UNMISS to intensify its presence and active patrolling in high-risk areas.\n* Conduct regular reviews of its geographic deployment to ensure that its forces are best placed to fulfill its mandate.\n\n**Performance and Accountability**\n\n* Recognizes that effective implementation of UNMISS mandate is the responsibility of all stakeholders.\n* Welcomes initiatives to standardize a culture of performance in UN peacekeeping.\n\n**Sexual Exploitation and Abuse**\n\n* Requests the Secretary-General to ensure full compliance of UNMISS with the UN zero-tolerance policy on sexual exploitation and abuse.\n\n**Support to Non-UN Security Forces**\n\n* Requests UNMISS to ensure that any support provided to non-UN security forces is provided in strict compliance with the HRDDP.\nHere is a summarized version of the Security Council document:\n\nThe Security Council:\n\n* Urges cooperation with the Panel of Experts and ensures their safety and unhindered access to execute their mandate (para 19).\n* Condemns attacks on UNMISS personnel and facilities, and demands respect for the inviolability of UN premises (para 20).\n* Condemns clashes in Malakal and Juba, and urges the UN to incorporate lessons learned to improve UNMISS operations (para 21).\n* Reiterates the request for UNMISS to ensure security of its air operations and report to the Council (para 22).\n* Condemns attacks on humanitarian aid and personnel, and demands rapid, safe, and unhindered access to relief personnel and supplies (para 23).\n* Demands an immediate ceasefire, and holds parties accountable for human rights violations and abuses (para 24).\n* Condemns violations against children, and urges parties to release children from their ranks and implement action plans (para 25).\n* Urges the prevention of sexual violence, and demands accountability for perpetrators (para 26).\n* Stresses the importance of truth-seeking and reconciliation, and the establishment of the Commission of Truth, Reconciliation and Healing (para 27).\n* Takes note of steps towards setting up the Hybrid Court for South Sudan, and requests technical assistance (para 28).\n* Calls on the Government of South Sudan to sign the Memorandum of Understanding with the African Union to establish the Hybrid Court (para 29).\n* Calls on the Government to complete investigations of human rights violations and abuses, and hold perpetrators accountable (para 30-31).\nHere is a concise summary of the document:\n\nThe Security Council:\n- Requests the Secretary-General to report monthly on violations of the SOFA or obstructions to UNMISS.\n- Requests a comprehensive written report from the Secretary-General within 90 days on UNMISS mandate implementation, including:\n  - Progress in implementing the HRDDP\n  - Details on protection of civilians, troop performance, and patrol areas\n  - Consideration of gender throughout the mandate\n  - Women's participation in peace processes\n  - Steps to enhance UN personnel safety and address performance concerns\n  - Human rights issues in South Sudan\n  - Recommendations on adapting UNMISS to the situation on the ground\n- Requests reporting on technical assistance provided and invites the African Union to share information on the Hybrid Court for South Sudan.\n- Expresses intention to assess the establishment of the Hybrid Court based on the Secretary-General's reports.\n- Decides to remain seized of the matter.",
  "url": "https://storage.googleapis.com/bluelines-rag-bucket/2018/S_RES_2406_2018_EN.pdf"
}