{
  "resolution_no": "2423",
  "year": "2018",
  "theme": [
    "Peacekeeping",
    "Security Sector Reform",
    "Human Rights",
    "Climate Change"
  ],
  "chapter": "Chapter VII",
  "charter_articles": [
    "Article 24",
    "Article 25",
    "Article 42"
  ],
  "entities": [
    "MINUSMA",
    "French Forces",
    "European Union",
    "G5 Sahel States",
    "UNCT"
  ],
  "reporting_cycle": "The Secretary-General reports to the Security Council every three months",
  "operative_authority": "Chapter VII",
  "summary": "The Security Council,\n \nRecalling its previous resolutions on Mali, \nReaffirming its commitment to Mali's sovereignty, unity, and territorial integrity,\n \nAdopted resolution 2423 (2018) at its 8298th meeting on 28 June 2018.\n\nThe Council reaffirms the basic principles of peacekeeping and recognizes the specific mandate of each peacekeeping mission.\n\nIt welcomes the Agreement on Peace and Reconciliation in Mali signed in 2015 and stresses the primary responsibility of all parties to implement it.\n\nThe Council notes the renewed commitment of the Government of Mali and armed groups to expeditious implementation of their remaining obligations.\n\nIt expresses deep concern over delays in implementation and stresses the need for tangible peace dividends to the population.\n\nThe Council welcomes the appointment of the Carter Center as Independent Observer to objectively evaluate progress towards implementation.\n\nIt underlines that engaging in hostilities in violation of the Agreement may lead to sanctions designations.\n\nThe Council expresses deep concern about the security situation in Mali, condemning terrorist attacks and activities.\n\nIt strongly condemns attacks against civilians, representatives, and security forces, including MINUSMA, French forces, and EUTM Mali.\n\nThe Council condemns terrorist organizations' activities in Mali and the Sahel region, including MUJAO, Al-Qaida, and associated groups.\nEmphasizing security and stability in Mali are linked to the Sahel, West Africa, Libya, and North Africa, and expressing deep concern over transnational threats from terrorism and organized crime. \n\nRecognizing MINUSMA and the Force conjointe du G5 Sahel (FC-G5S) can be mutually beneficial to restore peace and stability in Mali and the Sahel region. \n\nWelcoming French forces' continued action to deter terrorist threats in North Mali and commending EUTM Mali and EUCAP Sahel Mali's roles in providing training and advice.\n\nStrongly condemning human rights abuses and international humanitarian law violations, including extrajudicial executions, arbitrary arrests, and sexual violence, and calling for perpetrators to be held accountable.\n\nReiterating the importance of accountability for human rights abuses, noting the International Criminal Court's investigation into alleged crimes in Mali, and welcoming the transfer of Al-Hassan Ag Abdoul Aziz Ag Mohamed Ag Mahmoud to ICC custody.\n\nRecognizing the contribution of transitional justice mechanisms to promoting durable peace and accountability in Mali.\n\nTaking positive note of Mali's National Action Plan for implementing Security Council resolution 1325 and legislation requiring a 30% quota for women in national institutions.\n\nWelcoming the signing of an action plan to end and prevent recruitment and use of children and sexual violence against children by the Coordination armed group and the United Nations.\n\nEmphasizing the need for humanitarian assistance to be delivered on the basis of need and for all parties to uphold humanitarian principles.\n\nRemaining concerned over the food and humanitarian crisis in Mali, insecurity hindering humanitarian access, and the presence of armed groups and terrorist networks.\n\nRecognizing the adverse effects of climate change on Mali's stability and emphasizing the need for risk assessment and management strategies.\n\nCommending troop- and police-contributing countries to MINUSMA and strongly condemning attacks against peacekeepers.\n\nReiterating concern at MINUSMA's lack of key capabilities, stressing the need to fill gaps in military helicopters and mine-protected vehicles, and emphasizing the importance of improving logistics support.\n\nWelcoming progress in deploying a combat convoy battalion and quick reaction force, and urging Member States to fully deploy pledged units within announced time frames.\n\nRecalling the importance of properly trained and equipped MINUSMA contingents and requesting the Secretary-General to ensure data related to peacekeeping effectiveness is used to improve analytics and evaluation of mission operations.\nThe Security Council,\n\nNoting the publication of the report on “Improving Security of United Nations Peacekeepers”, \nWelcoming the initiative of the Secretary-General to conduct Special Investigations into performance issues,\n\nReiterating its strong support for the Special Representative of the Secretary-General for Mali and Head of MINUSMA,\n\nDetermining that the situation in Mali continues to constitute a threat to international peace and security,\n\nActing under Chapter VII of the Charter of the United Nations,\n\n**Implementation of the Agreement on Peace and Reconciliation in Mali**\n\n1. Welcomes recent positive steps in implementing the Agreement, including establishment of regions of Taoudénit and Ménaka, progress in operationalization of Operational Coordination Mechanisms, and cantonment and disarmament processes.\n\n2. Expresses deep frustration with parties stalling implementation, despite international support, and stresses urgency for Government of Mali and armed groups to take steps to deliver on remaining obligations.\n\n3. Intends to follow closely implementation of the Roadmap and respond with measures if parties do not implement commitments within the announced time frame.\n\n4. Urges Government of Mali and armed groups to take immediate action to implement key provisions, including:\n- Holding presidential elections in a peaceful environment\n- Progress in decentralization process\n- Operationalization of interim administrations\n- Progress in cantonment and disarmament processes\n- Full operationalization of mixed units of Operational Coordination Mechanism\n- Socioeconomic development of North of Mali\n\n5. Requests Secretary-General to conclude a “Pact for Peace” between Government of Mali and UN, with objectives to accelerate Agreement implementation, contribute to Mali's stabilization, and strengthen international efforts.\n\n6. Requests Secretary-General to report to Security Council on progress achieved in implementing measures and benchmarks, and expresses intent to examine progress and consider options for MINUSMA adaptation.\n\n7. Welcomes signatory armed groups' agreement on definitive cessation of hostilities and calls upon parties to abide by cessation of hostilities arrangements.\nHere is a summarized version of the Security Council document:\n\n**Demands and Urges**\n\n* Demands all armed groups in Mali put aside their arms, cease hostilities, and reject violence (para 8)\n* Urges all parties to cooperate with the SRSG and MINUSMA, ensuring their safety and freedom of movement (para 9)\n* Calls for programs to support community efforts to address stigma of sexual and gender-based violence (para 10)\n* Calls upon the Government of Mali to finalize its strategy for the development of the North of Mali and the national emergency plan (para 11)\n\n**Implementation of the Agreement**\n\n* Requests the SRSG to use his good offices to support the full implementation of the Agreement (para 12)\n* Calls on the members of the CSA and other international partners to increase their engagement in support of the Agreement's implementation (para 13)\n* Takes positive note of the Independent Observer's report and calls for regular reports (para 14)\n* Welcomes the establishment of an International Commission of Inquiry (para 15)\n\n**Situation in Central Mali**\n\n* Underlines the need for a fully integrated plan to stabilize the situation in Central Mali (para 17)\n* Welcomes measures taken by the Government of Mali to re-establish state presence in Central Mali (para 18)\n\n**Electoral Cycles**\n\n* Stresses the need for inclusive, free, fair, transparent, and credible elections (para 19)\n* Takes note of measures taken to prepare for the electoral process and encourages continued efforts (para 20)\n* Calls on the Government of Mali to ensure protection of the right to peaceful assembly (para 21)\n* Requests the SRSG to support the preparation, conduct, and conclusion of the upcoming electoral cycles (para 22)\n\n**MINUSMA's Mandate**\n\n* Decides to extend MINUSMA's mandate until 30 June 2019 (para 24)\n* Decides on MINUSMA's composition and requests the Secretary-General to expedite force and asset generation (para 25)\n* Decides on MINUSMA's strategic priority to support the implementation of the Agreement (para 26)\n* Requests MINUSMA to reprioritize its resources and efforts to focus on political tasks (para 27) \n* Requests MINUSMA to strengthen coordination between its civil, military, and police components (para 28)\nHere is a summarized version of the Security Council document:\n\n29. Encourages the Secretary-General to develop an integrated strategic framework for sustaining peace in Mali, ensuring efficient division of tasks and complementarity of efforts between MINUSMA and the UNCT.\n\n30. Requests enhanced cooperation and information sharing between MINUSMA, UNOWAS, sub-regional organizations, and Member States.\n\n31. Requests MINUSMA to enhance its awareness of financial sources of conflicts in Mali, including trafficking and smuggling.\n\n32. Authorizes MINUSMA to use necessary means to carry out its mandate.\n\n33. Requests MINUSMA to carry out its mandate with a proactive and robust posture.\n\n34. Requests MINUSMA to anticipate and deter threats, take robust steps to counter asymmetric attacks, and ensure prompt responses to threats of violence.\n\n35. Expresses concern over peacekeeper losses and requests MINUSMA to protect UN personnel, installations, and equipment.\n\n36. Encourages the Secretary-General to review the Mission concept, make operational adjustments, and reconfigure MINUSMA's posture.\n\n37. Underlines the importance of MINUSMA considering measures to reduce collateral damage among civilians.\n\n38. Decides MINUSMA's mandate includes:\n \n(a) Support to the implementation of the Agreement on Peace and Reconciliation in Mali:\n \n(i) Support to political and institutional reforms, and restoration of State authority.\n\n(ii) Support to defence and security measures:\n \n- Support, monitor and supervise the ceasefire.\n- Support joint security patrols.\n- Support cantonment, disarmament, demobilization, and reintegration.\n\n(iii) Support to reconciliation and justice measures.\nHere is a summarized version of the Security Council document:\n\nThe Security Council authorizes MINUSMA to perform the following tasks:\n\n**Support to the peace process and stability**\n\n* Support the implementation of the Agreement, including the Truth, Justice and Reconciliation Commission\n* Provide technical support to Malian judicial institutions regarding detention, investigation, and prosecution of individuals suspected of terrorism-related crimes\n* Support the conduct of inclusive, free, fair, transparent, and credible elections\n\n**Support to the restoration of State authority**\n\n* Support the redeployment of the MDSF in the Centre of Mali\n* Provide operational, logistical, and transportation support during coordinated operations\n\n**Good offices and reconciliation**\n\n* Exercise good offices to support dialogue and reconciliation\n* Support efforts to reduce intercommunal tensions\n* Encourage and support the full implementation of the Agreement\n\n**Protection of civilians and stabilization**\n\n* Protect civilians under threat of physical violence\n* Stabilize key population centres and areas where civilians are at risk\n* Enhance early warning and documentation of conflict impact\n* Take robust and active steps to protect civilians\n\n**Promotion and protection of human rights**\n\n* Assist Malian authorities in promoting and protecting human rights\n* Monitor, investigate, and report on human rights violations\n\n**Humanitarian assistance**\n\n* Contribute to a secure environment for humanitarian assistance\n* Support the voluntary return of internally displaced persons and refugees\n\n**Other tasks**\n\n* Assist in implementing projects for stabilization\n* Assist with weapons and ammunition management\n* Cooperate with Sanctions Committees and the Panel of experts.\nTo assist the 1267/1989/2253 ISIL (Da’esh) and Al-Qaida Sanctions Committee and the Analytical Support and Sanctions Monitoring Team.\n\nThe Security Council:\n \n40. Recognizes MINUSMA interacts with other security presences in Mali and the Sahel region to restore peace and stability, with each having specific mandates and postures.\n\n41. Requests the Secretary-General to ensure coordination and exchange of information between MINUSMA, MDSF, FC-G5S, French Forces and EU missions, and for MINUSMA to strengthen strategic communication with Malian stakeholders and local populations.\n\n42. Stresses security responses in Mali must be complemented by the full implementation of the Agreement, inclusive regional strategies, and conducted in compliance with international law.\n\nMalian Defence and Security Forces:\n\n43. Affirms the restoration and extension of State authority across Mali, particularly with reformed and reconstituted MDSF, would contribute significantly to stability.\n\n44. Strongly condemns terrorist attacks against MDSF, expresses concerns about alleged human rights and humanitarian law violations, and urges transparent investigations and accountability.\n\n45. Requests MINUSMA to ensure support to MDSF complies with the Human Rights Due Diligence Policy, and encourages partners to insist on respect for international law.\n\n46. Urges MINUSMA and the Government of Mali to implement the Memorandum of Understanding on support to MDSF redeployment.\n\n47. Encourages partners to increase support for MDSF redeployment to North Mali.\n\nForce conjointe du G5 Sahel:\n\n48. Stresses FC-G5S efforts will contribute to a more secure Sahel region.\n\n49. Welcomes the technical agreement for MINUSMA to provide operational and logistical support to FC-G5S.\n\n50. Requests the Secretary-General to enhance exchange of information between MINUSMA and G5 Sahel States.\n\n51. Recalls adherence to the compliance framework is essential for FC-G5S effectiveness.\n\n52. Requests MINUSMA to ensure support to FC-G5S complies with the Human Rights Due Diligence Policy.\n\nFrench forces:\n\n53. Authorizes French forces to use necessary means to intervene in support of MINUSMA elements under imminent threat, and to report to the Council.\nHere is a clear and concise summary of the Security Council document:\n\n**European Union's Role**\n\n* The European Union is called upon to coordinate closely with MINUSMA and bilateral partners of Mali to assist the Malian authorities in the Security Sector Reform (SSR).\n\n**MINUSMA's Capacities and Safety**\n\n* The Secretary-General is requested to take steps to enable MINUSMA to reach its full operational capacity.\n* Troop- and police-contributing countries are urged to expedite the procurement and deployment of necessary equipment.\n* Member States are urged to provide troops and police with adequate capabilities, training, and equipment.\n* The Secretary-General is requested to develop an integrated performance policy framework and apply it to MINUSMA.\n\n**Safety and Security of MINUSMA's Personnel**\n\n* The Secretary-General is requested to take measures to review and enhance the safety and security of MINUSMA's personnel.\n* Initiatives to improve security include:\n\t+ Improving intelligence and analysis capacities\n\t+ Providing training and equipment to counter explosive devices\n\t+ Improving logistics and securing supply routes\n\t+ Enhancing camps protection\n\t+ Implementing effective casualty and medical evacuation procedures\n\n**Logistical Support**\n\n* Member States are called upon to ensure the free, unhindered, and expeditious movement of MINUSMA personnel, equipment, and supplies.\n* The Secretary-General is requested to facilitate MINUSMA's logistical supply and consolidate supply routes.\n\n**Obligations under International Law**\n\n* The Malian authorities are urged to combat impunity and hold perpetrators of human rights abuses accountable.\n* All parties are urged to comply with international humanitarian law and protect humanitarian personnel and facilities.\n* The Malian authorities are urged to finalize and sign a joint communiqué with the UN on addressing sexual and gender-based violence in conflict.\n\n**Protection of Civilians**\n\n* The Malian authorities have primary responsibility to protect civilians in Mali.\n* MINUSMA and military forces in Mali are called upon to abide by international humanitarian, human rights, and refugee law.\n\n**Gender Considerations**\n\n* MINUSMA is requested to take fully into account gender considerations throughout its mandate.\n* The Malian authorities are urged to ensure the full and effective participation of women at all levels and at an early stage of the stabilization phase.\nHere is a summarized version of the Security Council document:\n\nThe Security Council:\n\n* Requests MINUSMA to assist parties to ensure women's full and active participation in the implementation of the Agreement and to report on this issue.\n* Requests the Secretary-General to ensure MINUSMA's compliance with the UN's zero-tolerance policy on sexual exploitation and abuse.\n* Requests MINUSMA to prioritize child protection throughout its mandate and assist Malian authorities in ensuring children's rights are protected.\n* Requests MINUSMA to consider environmental impacts of its operations and manage them accordingly.\n* Notes the importance of considering security implications of climate change and ecological changes.\n* Calls on Malian authorities, with MINUSMA's assistance, to address the proliferation and illicit trafficking of small arms and light weapons.\n* Requests the Secretary-General to report to the Security Council every three months on the implementation of this resolution, focusing on:\n\t+ Progress in implementing the Agreement and MINUSMA's efforts to support it.\n\t+ MINUSMA's performance and effectiveness.\n\t+ Coordination and mutual support between MINUSMA, MDSF, FC-G5S, French Forces, and EU missions.\n* Requests the Secretary-General to include an update on the integrated strategic framework every six months, including a transition plan, resource mobilization strategy, and possible exit strategy.\n* Decides to remain actively seized of the matter.",
  "url": "https://storage.googleapis.com/bluelines-rag-bucket/2018/S_RES_2423_2018_EN.pdf"
}