{
  "resolution_no": "2426",
  "year": "2018",
  "theme": [
    "Peacekeeping",
    "Middle East",
    "Syrian Arab Republic",
    "Israel"
  ],
  "chapter": "Chapter VI",
  "charter_articles": [
    "Article 24",
    "Article 25"
  ],
  "entities": [
    "UNDOF",
    "UN",
    "Syrian Arab Republic",
    "Israel"
  ],
  "reporting_cycle": "every 90 days",
  "operative_authority": "Chapter VI",
  "summary": "Here is a clear and concise summary of the Security Council document:\n\nThe Security Council,\n\n- Notes with concern the tense situation in the Middle East, which will persist unless a comprehensive settlement is reached.\n\n- Considers the report of the Secretary-General on UNDOF and reaffirms its resolution 1308 (2000).\n\n- Stresses that both Israel and the Syrian Arab Republic must abide by the 1974 Disengagement of Forces Agreement and observe the ceasefire.\n\n- Concurs with the Secretary-General that ongoing military activities in the area of separation may escalate tensions and pose a risk to civilians and UN personnel.\n\n- Expresses alarm at the escalation of violence in the Syrian Arab Republic and grave concern at violations of the Disengagement of Forces Agreement.\n\n- Calls on all parties to cease military actions in the UNDOF area and respect international humanitarian law.\n\n- Condemns the use of heavy weapons by both the Syrian armed forces and armed groups.\n\n- Reaffirms readiness to consider listing individuals and entities supporting ISIL or Al-Nusra Front.\n\n- Recognizes the need for UNDOF to adjust its posture to minimize security risks.\n\n- Emphasizes the importance of access to reports and information related to UNDOF's configuration.\n\n- Underscores the need for UNDOF to have necessary means and resources to carry out its mandate safely.\n\n- Expresses appreciation to UNDOF personnel and stresses the need for continued vigilance to ensure their safety.\n\n- Strongly condemns incidents threatening UN personnel's safety.\n\n- Welcomes efforts to reestablish UNDOF's headquarters and upgrade its positions.\n\n- Takes note of the Secretary-General's plan for UNDOF to return to vacated positions.\n\n- Recalls UNDOF's deployment and the 1974 Agreement are steps toward a just and durable peace.\n\n- Requests the Secretary-General to ensure data related to peacekeeping effectiveness is used to improve analytics and evaluation.\n\n- Recalls resolution 2242 (2015) and aspiration to increase women in peacekeeping operations.\n\n1. Calls on parties to implement resolution 338 (1973) immediately.\n\n2. Stresses the obligation on both parties to respect the 1974 Disengagement of Forces Agreement.\nHere is a concise summary of the Security Council document 2426 (2018) without any additional information:\n\nThe Security Council:\n \n1. Urges parties to exercise maximum restraint, prevent ceasefire breaches, and utilize UNDOF's liaison function to address concerns.\n\n2. & 3. Prohibits military activity by Syrian Armed Forces and armed opposition groups in the area of separation.\n\n4. Calls on groups to abandon UNDOF positions, return equipment, and vacate the Quneitra crossing point.\n\n5. Requests cooperation with UNDOF operations, respect for privileges and immunities, and secure access for personnel.\n\n6. Notes the temporary crossing point for UNDOF personnel and calls for constructive engagement to re-open the Quneitra crossing.\n\n7. Welcomes UNDOF's return to Camp Faouar and limited patrolling.\n\n8. Underscores the importance of deploying technology to ensure UNDOF personnel safety.\n\n9. Encourages parties to engage constructively for UNDOF's return to vacated positions.\n\n10. Welcomes efforts to standardize performance in UN peacekeeping and increase women's participation.\n\n11. Welcomes efforts to implement the zero-tolerance policy on sexual exploitation and abuse.\n\n12. Renews UNDOF's mandate for six months until 31 December 2018.\n\n13. Requests the Secretary-General to report every 90 days on developments and implementation of resolution 338 (1973).",
  "url": "https://storage.googleapis.com/bluelines-rag-bucket/2018/S_RES_2426_2018_EN.pdf"
}