{
  "resolution_no": "2431",
  "year": 2018,
  "theme": [
    "Peacekeeping",
    "Security Sector Reform",
    "Humanitarian",
    "WPS/CAAC",
    "Climate"
  ],
  "chapter": "Chapter VII",
  "charter_articles": [
    "Article 24",
    "Article 25",
    "Article 42"
  ],
  "entities": [
    "AMISOM",
    "UNSOM",
    "UNSOS",
    "AU",
    "UN"
  ],
  "reporting_cycle": "The Secretary-General reports every 120 days",
  "operative_authority": "Chapter VII",
  "summary": "The Security Council, recalling its previous resolutions and statements on Somalia, reaffirms its respect for Somalia's sovereignty, territorial integrity, and unity. It condemns Al Shabaab attacks, expresses concern at the ongoing threat posed by Al Shabaab, and underlines the need to preserve gains made by the African Union Mission in Somalia (AMISOM) and Somali security forces. The Council reiterates its determination to support efforts to reduce the threat posed by Al Shabaab and an inclusive Somali-led political peace and reconciliation process. \n\nThe Council welcomes the positive contributions of the UN Support Office in Somalia (UNSOS) and underscores the importance of an effective partnership between the UN, the African Union (AU), and Member States in Somalia. It recognises the Federal Government of Somalia's (FGS) primary responsibility to protect its citizens and build national security forces. \n\nThe Council commends AMISOM's contribution to lasting peace and stability in Somalia and notes its critical role in improving the security situation. It expresses appreciation for the continued commitment of troops, police, and equipment to AMISOM by several governments. The Council supports a transfer of security tasks from AMISOM to Somali security forces in a gradual and conditions-based manner. \n\nThe Council recalls its decision to reduce the level of uniformed AMISOM personnel by 30 October 2018, regrets the need to delay that reduction to 28 February 2019, and stresses that there should be no further delays. It encourages the AU to evaluate regularly AMISOM's performance, including through performance evaluation linked to clearly identified benchmarks and standards.\nHere is a concise summary of the Security Council document 2431 (2018):\n\nThe Security Council:\n\n* Welcomes the AU's investigation into allegations of sexual violence against AMISOM troops and emphasizes the importance of implementing recommendations and taking action to prevent further abuses.\n\n* Expresses concern over pro-Islamic State elements in Somalia and the security implications of the situation in Yemen for Somalia.\n\n* Expresses grave concern at the ongoing humanitarian situation and commends AMISOM's efforts to create conditions conducive to humanitarian assistance.\n\n* Recalls its Presidential statement on the adverse effects of climate change on Somalia's stability.\n\n* Determines that the situation in Somalia continues to constitute a threat to international peace and security.\n\n* Acting under Chapter VII, \n\n  * Emphasizes that the long-term objective for Somalia is for Somali security institutions to assume full responsibility for security, with AMISOM remaining critical during this transition.\n\n  * Agrees with the Secretary-General that conditions are not suitable for a UN peacekeeping mission and requests continuous review of deployment benchmarks.\n\n  * Underlines that increases in AMISOM's force strength were intended as short-term enhancements, with a decrease to be considered in light of progress.\n\n  * Welcomes the AU-UN Review's recommendation for gradual reduction and reorganization of AMISOM's personnel.\n\n* Decides to:\n \n  * Authorize the AU to maintain AMISOM's deployment until 31 May 2019, with a maximum level of 20,626 uniformed personnel by 28 February 2019.\n\n  * Authorize AMISOM to take necessary measures to carry out its mandate, in compliance with international law.\n\n  * Authorize AMISOM to pursue strategic objectives, including enabling the handing over of security responsibilities to Somali security forces, reducing the threat posed by Al Shabaab, and assisting Somali security forces.\n\n  * Authorize AMISOM to carry out priority tasks, including maintaining a presence in sectors, assisting Somali security forces, protecting personnel and facilities, conducting targeted operations, securing key supply routes, and mentoring and assisting Somali security forces.\nHere is a summarized version of the Security Council document:\n\nThe Security Council:\n\n Authorizes the African Union (AU) to:\n \n (g) Reconfigure AMISOM to support the transition plan and favor police personnel within the authorized personnel ceiling;\n\n (h) Receive defectors on a transitory basis, in coordination with the UN and the Federal Government of Somalia;\n\n Requests the AU to:\n\n * Keep the Security Council regularly informed on the implementation of AMISOM's mandate;\n * Report to the Council through oral updates and written reports every 120 days;\n * Develop a reconfiguration plan detailing the modalities of the reduction in uniformed personnel;\n\n Requests the AU and UN to:\n\n * Conduct a joint Operational Readiness Assessment of AMISOM by 15 September 2018;\n * Develop a new Concept of Operations for AMISOM by 1 November 2018;\n\n Stresses the importance of:\n\n * Sourcing fully functioning and mission-appropriate contingent-owned equipment;\n * AMISOM's civilian component being fully operational to support military and police tasks;\n\n Reiterates its request that AMISOM:\n\n * Support and assist the Federal Government of Somalia and Federal Member States in implementing the total ban on charcoal export;\n * Carry out its mandate in full compliance with international law, including human rights and humanitarian law;\n\n Welcomes progress made by AMISOM in:\n\n * Complying with human rights and international humanitarian law;\n * Implementing a zero-tolerance stance on sexual exploitation and abuse;\n\n Requests the Secretary-General to:\n\n * Ensure support provided to non-UN security forces is in strict compliance with the Human Rights Due Diligence Policy.\nHere is a concise summary of the Security Council document:\n\n23. The Secretary-General will conduct a technical assessment of AMISOM by 31 January 2019, reviewing its reconfiguration, progress towards strategic objectives, and capability to conduct priority tasks.\n\n24. The Council intends to consider further uniformed personnel reductions as security conditions and Somali capabilities allow, aiming for Somali security institutions to lead security responsibility by December 2021.\n\n25. The Secretary-General is requested to work closely with the AU to support the implementation of this resolution, enhancing coordination between UNSOM, UNSOS, and AMISOM.\n\n26. The Council stresses the importance of early and sustained coordination of joint operations and inclusive planning of stabilization activities in newly recovered areas.\n\n27. Effective joint planning and implementation of the transition of primary security responsibility to Somali security institutions is crucial.\n\n28. Oversight and accountability, particularly compliance with HRDDP, will be the cornerstone of the partnership between the UN, AU, FGS, and FMSs.\n\n29. The Council urges the full implementation of the Force Commander’s directive, particularly on protecting children’s rights.\n\n30. The Council welcomes international community support for peace and stability in Somalia and emphasizes the importance of new contributions to support AMISOM.\n\n31. The Council reiterates its call for new and existing donors to support AMISOM through additional funding and contributions.\n\n32. The Council stresses the need to enhance the predictability, sustainability, and flexibility of financing for AU-led peace support operations.\n\n33. The primary responsibility for security lies with the Somali people and institutions, and the Council welcomes the historical political agreement on the National Security Architecture.\n\n34. The Council underlines the importance of swift implementation of the National Security Architecture and security sector reform.\n\n35. The Council stresses the importance of the FGS and FMSs accelerating the strengthening and improved coordination of Somali security institutions.\n\n36. The Council welcomes efforts to implement the Operational Readiness Assessment of the SNA.\nHere is a concise summary of the Security Council document:\n\nThe Security Council:\n\n1. **Security Sector Reform**: Requests an assessment of Somali security forces outside the SNA to determine numbers, capacities, and compliance with international law, to hand over security tasks and identify areas for joint operations.\n\n2. **International Support**: Welcomes commitments from international partners to provide more effective support through the Comprehensive Approach to Security (CAS), and emphasizes the role of UNSOM in coordinating donor support.\n\n3. **Security Pact**: Urges international partners to align their efforts and implement commitments through the Security Pact, and calls for increased coordination among partners.\n\n4. **Military Operations and Governance**: Underlines the need for Somali efforts to establish governance structures and deliver basic services in recovered areas.\n\n5. **Counter-Terrorism**: Recognizes that military means alone will not defeat Al Shabaab, and encourages the FGS to implement a comprehensive approach to security and prevent and counter terrorism.\n\n6. **Policing Services**: Welcomes agreements to establish basic policing services across Somalia and requests UNSOM to support implementation.\n\n7. **Financial Management**: Commends the FGS and FMSs for their commitment to increase transparency and accountability of security sector financial management.\n\n8. **Protection of Women and Girls**: Calls on the FGS, FMSs, AMISOM, and UNSOM to protect women and girls from sexual and gender-based violence.\n\n**Logistical Support**\n\n9. **UNSOM and AMISOM**: Requests the Secretary-General to continue providing logistical support to UNSOM, AMISOM, and Somali security forces.\n\n10. **Accountability and Efficiency**: Stresses the need for responsive and effective field support and welcomes efforts to strengthen accountability and efficiency.\n\n**Somalia**\n\n11. **Universal Periodic Review**: Welcomes the FGS’s engagement with the Universal Periodic Review Process.\n\n12. **Human Rights**: Expresses concern at human rights violations and abuses, and underscores the need to end impunity and uphold human rights.\n\n13. **Refugees and IDPs**: Reiterates concern at the high number of refugees and internally displaced persons (IDPs) and expresses concern at ongoing forced evictions of IDPs.\nThe Security Council:\n\n* Stresses that any eviction of internally displaced persons (IDPs) should be consistent with national and international frameworks, and encourages the Federal Government of Somalia (FGS) to conclude ratification of the Kampala Convention and implement its provisions.\n\n* Urges the FGS and relevant actors to provide durable solutions for internal displacement and create conditions for the voluntary, safe, and dignified return of refugees and IDPs.\n\n* Expresses grave concern at the humanitarian crisis in Somalia, commends humanitarian efforts, and condemns attacks against humanitarian workers.\n\n* Calls on all parties to respect and protect humanitarian personnel, facilities, and assets, and to allow rapid, safe, and unimpeded access for aid delivery.\n\n* Underlines the importance of respect for international humanitarian law, protection of civilians, and relevant Security Council resolutions.\n\n* Reaffirms the role of women and youth in conflict prevention and peacebuilding, and stresses their full participation in peace and security efforts.\n\n* Strongly condemns violations against children in armed conflict, demands parties cease violations, and calls on the FGS to hold perpetrators accountable.\n\n* Requests the Secretary-General to regularly inform the Security Council on implementation of this resolution and on the status of Somali security forces.\n\n* Requests the AU to report on progress on the reconfiguration of AMISOM in support of the transition plan.\n\n* Decides to remain actively seized of the matter.",
  "url": "https://storage.googleapis.com/bluelines-rag-bucket/2018/S_RES_2431_2018_EN.pdf"
}