{
  "resolution_no": "2446",
  "year": "2018",
  "theme": [
    "Peacekeeping",
    "Central African Republic"
  ],
  "chapter": "Chapter VII",
  "charter_articles": [
    "Article 42"
  ],
  "entities": [
    "MINUSCA"
  ],
  "reporting_cycle": "",
  "operative_authority": "Chapter VII",
  "summary": "The Security Council, recalling its previous resolutions and statements on the Central African Republic (CAR), adopted Resolution 2446 (2018) on 15 November 2018. The Council noted the Secretary-General's report of 15 October 2018, which followed the independent strategic review of the UN Multidimensional Integrated Stabilization Mission in the CAR (MINUSCA). Determining the situation in the CAR remains a threat to international peace and security, the Council, acting under Chapter VII, decided to extend MINUSCA's mandate, as set out in resolution 2387 (2017), until 15 December 2018 and decided to remain actively seized of the matter.",
  "url": "https://storage.googleapis.com/bluelines-rag-bucket/2018/S_RES_2446_2018_EN.pdf"
}