{
  "resolution_no": "2554",
  "year": "2020",
  "theme": [
    "Piracy",
    "Armed Robbery",
    "Maritime Security",
    "Somalia"
  ],
  "chapter": "Chapter VII",
  "charter_articles": [
    "Article 39",
    "Article 41",
    "Article 42"
  ],
  "entities": [
    "UNODC",
    "IMO",
    "WFP",
    "EUNAVFOR Operation Atalanta",
    "Combined Maritime Forces",
    "African Union",
    "INTERPOL",
    "CGPCS"
  ],
  "reporting_cycle": "11 months",
  "operative_authority": "Chapter VII",
  "summary": "Here is a concise summary of the Security Council document:\n\nThe Security Council:\n\nRecalling previous resolutions on Somalia, welcomes the report of the Secretary-General on piracy and armed robbery at sea off Somalia's coast.\n\nReaffirms respect for Somalia's sovereignty, territorial integrity, and unity.\n\nNotes a decline in piracy attacks since 2011, but recognizes the ongoing threat.\n\nReaffirms international law, as reflected in the UN Convention on the Law of the Sea, sets out the legal framework for countering piracy.\n\nCommends efforts to investigate and prosecute piracy suspects, and reiterates concern over those released without facing justice.\n\nWelcomes the work of the Contact Group on Piracy off the Coast of Somalia (CGPCS) and the Law Enforcement Task Force (LETF).\n\nCommends international efforts to coordinate investigations and prosecutions, and collect and share information.\n\nWelcomes efforts to strengthen regional judicial and law enforcement capacity.\n\nCommends the efforts of EUNAVFOR Operation ATALANTA, EUCAP Somalia, and other States in suppressing piracy.\n\nCommends the CGPCS and Kenya, which assumed the Chair of the CGPCS for 2020-2022.\nHere is a concise summary of the Security Council document 2554 (2020):\n\nThe Security Council:\n- Underlines the importance of cooperation between the Federal Government of Somalia and Federal Member States to develop a coast guard.\n- Condemns acts of piracy and armed robbery at sea off Somalia's coast.\n- Expresses concern over inhumane conditions faced by hostages and the need for cooperation to prosecute suspected pirates.\n- Welcomes efforts to prevent and suppress piracy, including the Best Management Practices (BMP5).\n- Notes with concern reports of illegal fishing in Somalia's Exclusive Economic Zone (EEZ) and its link to piracy.\n- Emphasizes the need for peace, stability, and State institutions in Somalia to eradicate piracy.\n- Determines that piracy incidents off Somalia's coast threaten international peace and security.\n\n Acting under Chapter VII, the Council:\n1. Condemns and deplores all acts of piracy and armed robbery at sea off Somalia's coast.\n2. Recognizes piracy exacerbates instability in Somalia.\n3. Stresses the need for a comprehensive response to prevent and suppress piracy.\n4. Underlines Somali authorities' primary responsibility in the fight against piracy.\n5. Recognizes the need to investigate and prosecute those involved in piracy.\n6. Calls upon Somali authorities to interdict and prosecute pirates.\n7. Calls upon Somali authorities to bring to justice those using Somali territory for piracy.\n8. Encourages Somalia to accede to the UN Convention against Transnational Organized Crime.\n9. Calls upon States to cooperate on hostage-taking and prosecution of suspected pirates.\n10. Recognizes the need for exchanging evidence and information for anti-piracy law enforcement.\nHere is a concise summary of the Security Council document 2554 (2020):\n\nThe Security Council:\n\n1. Calls for prosecution and imprisonment of pirates and key figures involved in piracy off the coast of Somalia and considers applying targeted sanctions.\n\n2. Requests capacity building support for Somalia's national coast guard.\n\n3. Urges States and regional organizations to participate in the fight against piracy.\n\n4. Highlights coordination among Member States and international organizations to deter piracy.\n\n5. Renews authorizations for 12 months for States and regional organizations cooperating with Somalia.\n\n6. Exempts supplies of weapons and military equipment for use by authorized forces from the arms embargo.\n\n7. Calls on States to prevent illicit financing of piracy and launder its proceeds.\n\n8. Urges cooperation in determining jurisdiction and prosecuting pirates.\n\n9. Encourages establishment of specialized anti-piracy courts in Somalia.\n\n10. Urges cooperation in investigating and prosecuting those responsible for piracy.\n\n11. Ensures protection of women and children from exploitation.\n\n12. Urges information sharing with INTERPOL.\n\n13. Welcomes UNODC's Global Maritime Crime Programme.\n\n14. Implores regional authorities to honour transfer agreements.\n\n15. Urges States to implement obligations under The Convention and SUA Convention.\n\n16. Acknowledges IMO guidance on preventing and suppressing piracy.\n\n17. Encourages development of safety and security measures on board vessels.\nThe Security Council:\n\n* Calls for developing regulations for privately contracted armed security personnel (PCASP) on ships to prevent and suppress piracy off Somalia's coast through a consultative process.\n\n* Invites the IMO to continue contributing to preventing and suppressing piracy and armed robbery, coordinating with the UNODC, WFP, shipping industry, and other concerned parties.\n\n* Recognizes the IMO's role in privately contracted armed security personnel on ships in high-risk areas.\n\n* Notes the importance of securing WFP assistance delivery by sea and welcomes ongoing work by WFP, EUNAVFOR Operation Atalanta, and flag States on Vessel Protection Detachments.\n\n* Requests the Secretary-General to report to the Security Council within 11 months on the implementation of this resolution, the situation with respect to piracy and armed robbery off Somalia's coast, and National Coast Guard capabilities.\n\n* Expresses its intention to review the situation and consider renewing authorizations for additional periods upon Somali authority's request.\n\n* Decides to remain seized of the matter.",
  "url": "https://storage.googleapis.com/bluelines-rag-bucket/2020/S_RES_2554_2020_EN.pdf"
}