{
  "resolution_no": "2531",
  "year": 2020,
  "theme": [
    "Peacekeeping",
    "Security",
    "Humanitarian",
    "WPS/CAAC"
  ],
  "chapter": "Chapter VII",
  "charter_articles": [
    "Article 24",
    "Article 25",
    "Article 42"
  ],
  "entities": [
    "MINUSMA",
    "French Forces",
    "European Union",
    "G5 Sahel",
    "UNIFIL"
  ],
  "reporting_cycle": "every three months",
  "operative_authority": "Chapter VII",
  "summary": "Here is a summarized version of the Security Council document:\n\nThe Security Council:\n\n- Recalls previous resolutions and statements on the situation in Mali, reaffirming its commitment to Mali's sovereignty, unity, and territorial integrity.\n\n- Expresses grave concern over the deteriorating security and humanitarian situation in Mali, including terrorist attacks and intercommunal violence.\n\n- Strongly condemns attacks against civilians, institutions, and security forces, including the Malian Defence and Security Forces, MINUSMA, and French forces.\n\n- Emphasizes that security and stability in Mali are linked to the Sahel and West Africa, and that lasting peace requires a combination of political, security, and development efforts.\n\n- Welcomes the Pau Summit and the creation of a \"Coalition for the Sahel\" to fight terrorism and support development.\n\n- Recognizes progress in implementing the Agreement on Peace and Reconciliation in Mali, but expresses impatience with persistent delays.\n\n- Stresses the need for increased ownership and prioritization in implementing the Agreement, and that engaging in hostilities or obstructing the Agreement's implementation may lead to sanctions.\n\n- Notes the Malian authorities' strategy for stabilizing central Mali and stresses the need for simultaneous progress on security, governance, development, and human rights.\n\n- Welcomes the national inclusive dialogue and increased representation of women in the National Assembly.\nHere is a clear and concise summary of the Security Council document:\n\nThe Security Council strongly condemns all violations and abuses of international human rights law and humanitarian law in Mali, including extrajudicial killings, arbitrary arrests, and sexual violence. The Council reiterates the importance of holding accountable those responsible for such acts, which may amount to crimes under the Rome Statute.\n\nThe Council emphasizes the need for adequate risk assessment and management strategies to address ecological changes, natural disasters, and climate change, which affect Mali's security and stability.\n\nThe Council commends troop- and police-contributing countries to MINUSMA and pays tribute to peacekeepers who have lost their lives. It welcomes MINUSMA's efforts to implement its adaptation plan to improve its support to the implementation of the Agreement and protection of civilians.\n\nThe Council expresses concern over reports of training and capabilities shortfalls of MINUSMA units and emphasizes the importance of transparency and accountability.\n\nThe Council urges the Government of Mali and armed groups to accelerate the implementation of the Agreement on Peace and Reconciliation in Mali, through significant and irreversible measures. It calls for:\n\n* Completion of disarmament, demobilization, and reintegration of signatory armed groups\n* Operationalization of the reconstituted and reformed security forces\n* Completion of constitutional reform and institutional reforms\n* Establishment of a timeline for the transfer of decentralized State services and revenues to local authorities\n* Implementation of recommendations on women's participation in mechanisms established by the Agreement\n\nThe Council calls upon all parties to ensure full, effective, and meaningful participation of women in the mechanisms established by the Agreement. \n\nDetermining that the situation in Mali continues to constitute a threat to international peace and security, the Council acts under Chapter VII of the Charter of the United Nations.\nThe Security Council:\n\n1. Requests the Secretary-General to pay specific attention to implementation of resolution 1325 (2000) in regular reporting on MINUSMA.\n\n2. Encourages the panel of experts to identify parties responsible for lack of implementation of priority measures and expresses intent to respond with measures if these measures are not implemented.\n\n3. Calls upon all parties in Mali to abide by cessation of hostilities, reject violence, cut ties with terrorist organizations, prevent human rights abuses, and recognize the unity and territorial integrity of Mali.\n\n4. Urges all parties to cooperate with the Special Representative of the Secretary-General (SRSG) and MINUSMA.\n\n5. Calls for inclusion of programs to address stigma of sexual and gender-based violence and support victims and survivors.\n\n6. Urges more structured exchanges between Malian parties and acknowledges the role of the CSA.\n\n7. Calls upon the Independent Observer to make public regular reports and for all parties to cooperate with the Carter Center.\n\n8. Encourages UN agencies and partners to provide support for implementation of the Agreement.\n\n9. Urges Malian authorities to protect civilians, reduce intercommunal violence, and restore peaceful relations in Central Mali.\n\n10. Urges Malian authorities to fulfil priority measures, including re-establishing State presence and authority in Central Mali and fighting impunity.\n\n11. Decides to extend MINUSMA's mandate until 30 June 2021.\n\n12. Decides MINUSMA's composition and authorizes use of necessary means to carry out its mandate.\n\n13. Establishes MINUSMA's strategic priorities: supporting Agreement implementation and facilitating implementation of the Stratégie de stabilisation du centre du Mali.\n\n14. Requests the Secretary-General to reflect prioritization of tasks in MINUSMA's deployment and budgetary resources.\nThe Security Council:\n\nAffirms the need for priority support to the implementation of the Agreement on Peace and Reconciliation in Mali; \n\n Requests MINUSMA to carry out its mandate with a proactive, robust, flexible, and agile posture; \n\n Ensures the safety, security, and freedom of movement of UN personnel, protects installations and equipment; \n\n Supports the continuation of MINUSMA's adaptation plan and encourages Member States to contribute; \n\n Encourages coordination between MINUSMA's civil, military, and police components; \n\n Requests close coordination and information sharing between MINUSMA, UNOWAS, and sub-regional organizations; \n\n Requests MINUSMA to improve communication efforts to raise awareness on its mandate; \n\nDecides MINUSMA's mandate includes:\n\n(a) Support to the implementation of the Agreement on Peace and Reconciliation in Mali \n\n(i) Use good offices to encourage and support the full implementation of the Agreement; \n\n(ii) Support the implementation of political and institutional reforms; \n\n(iii) Support defence and security measures, including ceasefire monitoring and supervision; \n\n(iv) Support reconciliation and justice measures; \n\n(v) Encourage and support the full implementation of the Agreement by Malian parties and non-signatory actors; \n\nKey tasks under (a) include supporting the Agreement's implementation, particularly in areas such as:\n\n- Restoration and extension of State authority \n- Rule of law \n- Ceasefire \n- Disarmament \n- Demobilization \n- Reintegration \n- Reconciliation \n- Justice measures\nHere is a concise summary of the Security Council document 2531 (2020):\n\n**Support to Stabilization and Restoration of State Authority in the Centre**\n\n* Support Malian authorities in implementing the Stratégie de stabilisation du centre du Mali and meeting priority measures.\n* Facilitate the return of State presence, authority, and basic social services in the Centre.\n* Support the redeployment of the MDSF in the Centre.\n\n**Protection of Civilians**\n\n* Protect civilians under threat of physical violence.\n* Take active steps to anticipate, deter, and respond to threats to civilians.\n* Strengthen early warning mechanisms, community engagement, and protection mechanisms.\n* Set up a Mobile Task Force to protect civilians.\n\n**Good Offices and Reconciliation**\n\n* Exercise good offices to support dialogue and reconciliation.\n* Support efforts to reduce intercommunal tensions.\n* Support the holding of inclusive, free, fair, and credible elections.\n\n**Promotion and Protection of Human Rights**\n\n* Assist Malian authorities in promoting and protecting human rights.\n* Support efforts to bring to justice those responsible for serious human rights violations.\n\n**Humanitarian Assistance**\n\n* Contribute to a secure environment for humanitarian assistance.\n* Support the voluntary return, local integration, or resettlement of internally displaced persons and refugees.\n\n**Other Tasks**\n\n* Implement quick impact projects in support of the Agreement.\n* Cooperate with Sanctions Committees and provide information.\n* Assist the 1267/1989/2253 ISIL (Da’esh) and Al-Qaida Sanctions Committee.\nHere is a concise summary of the Security Council document:\n\n**Coordination and Support**\n\n* Requests the Secretary-General to ensure coordination, exchange of information, and support between MINUSMA, MDSF, FC-G5S, French Forces, and EU missions in Mali.\n* MINUSMA to convene regular meetings of the Instance de Coordination au Mali for coordination, exchange of information, and support.\n\n**Security Presence in Mali and Sahel Region**\n\n* Stresses that security responses must comply with international law and minimize harm to civilians.\n* Requests MINUSMA to ensure support to other security presences is provided in strict compliance with the Human Rights Due Diligence Policy (HRDDP).\n\n**Malian Defence and Security Forces (MDSF)**\n\n* Urges MINUSMA and the Government of Mali to implement the Memorandum of Understanding on support to MDSF redeployment.\n* Encourages partners to support MDSF redeployment, particularly with equipment and training.\n* Expresses concerns about MDSF human rights violations and urges the Government of Mali to investigate and hold accountable those responsible.\n\n**Force conjointe du G5 Sahel (FC-G5S)**\n\n* Welcomes increased autonomy of G5 Sahel Executive Secretariat and FC-G5S.\n* Encourages G5 Sahel States to scale up FC-G5S operations and develop its police component.\n* Stresses that MINUSMA's support to FC-G5S is temporary and calls on FC-G5S to develop its own capacity.\n\n**French Forces**\n\n* Authorizes French forces to use necessary means to intervene in support of MINUSMA elements under imminent threat.\n\n**European Union Contribution**\n\n* Encourages the European Union to continue supporting Malian authorities in Security Sector Reform and reestablishment of State authority.\nHere is a summarized version of the Security Council document:\n\nThe Security Council:\n\n* Enhances cooperation between MINUSMA, EUTM Mali, and EUCAP Sahel missions to develop complementarity and explore mutual support modalities.\n\n**Capacities of MINUSMA, safety and security of MINUSMA's personnel**\n\n* Stresses the importance of providing MINUSMA with necessary performance capacities to fulfill its mandate in a complex security environment.\n* Urges Member States to provide troops and police with adequate capabilities, including language skills, training, and equipment.\n* Requests the Secretary-General to seek to increase the number of women in MINUSMA and ensure their full participation in all aspects of operations.\n* Strongly condemns attacks against peacekeepers and calls on the Government of Mali to investigate and bring perpetrators to justice.\n* Requests the Secretary-General to ensure troop-contributing countries receive sufficient information on tactics, techniques, and procedures to reduce troop casualties.\n\n**Safety and Security of MINUSMA's personnel**\n\n* Requests the Secretary-General, Member States, and the Government of Mali to review and enhance MINUSMA's safety and security, including:\n\t+ Improving intelligence and analysis capacities.\n\t+ Providing training and equipment to counter explosive devices.\n\t+ Improving logistics and securing logistical supply routes.\n\t+ Enhancing camps protection.\n\t+ Implementing effective casualty and medical evacuation procedures.\n\n**Performance and Accountability**\n\n* Recognizes that effective implementation of peacekeeping mandates is the responsibility of all stakeholders.\n* Welcomes initiatives to standardize a culture of performance in UN peacekeeping and requests the Secretary-General to apply it to MINUSMA.\n\n**Obligations under international law, human rights law and related aspects**\n\n* Urges the Malian authorities to ensure accountability for crimes involving human rights violations and abuses.\n* Urges all parties to comply with obligations under international humanitarian law to respect and protect civilians, humanitarian personnel, and civilian objects.\nHere is a concise summary of the Security Council document:\n\n**Protection of Civilians and Humanitarian Assistance**\n\n* Ensure safe, immediate, and unimpeded access of humanitarian actors to deliver assistance to all people in need, respecting humanitarian principles and international law (para 52)\n* Malian authorities have primary responsibility to protect civilians; MINUSMA and military forces must abide by international humanitarian, human rights, and refugee law (para 53)\n\n**Women, Peace, and Security**\n\n* Malian authorities to ensure full, effective, and meaningful participation of women in implementation of the Agreement, including security sector reform and disarmament, demobilization, and reintegration processes (para 54)\n* All parties to prevent and eliminate sexual violence in conflict and post-conflict situations (para 56)\n\n**Children and Armed Conflict**\n\n* All parties to implement conclusions on Children and Armed Conflict in Mali adopted by the Security Council Working Group (para 55)\n* Government of Mali to strengthen legal framework on child protection and ensure protection of children's rights in disarmament, demobilization, and reintegration processes\n\n**Accountability and Misconduct**\n\n* Secretary-General to ensure full compliance in MINUSMA with the United Nations zero-tolerance policy on serious misconduct, sexual exploitation, and abuse (para 57)\n\n**Humanitarian Crisis and Environmental Issues**\n\n* Member States and international organizations to respond swiftly to the significant food and humanitarian crisis in Mali (para 58)\n* MINUSMA to consider environmental impacts of its operations and manage them in accordance with applicable General Assembly resolutions and United Nations rules and regulations (para 59)\n\n**Small Arms, Light Weapons, and Explosive Ordnance Threat Mitigation**\n\n* Malian authorities to address proliferation and illicit trafficking of small arms and light weapons (para 60)\n* Malian authorities to strengthen cooperation with the United Nations, regional and sub-regional organizations, civil society, and private sector to respond to explosive ordnance threat (para 61)\n\n**Reports by the Secretary-General**\n\n* Report to the Security Council every three months on implementation of this resolution (para 62)\n* Provide every six months a letter focusing on progress in mission operations, performance and rotations of uniformed personnel, and security challenges (para 63)\nThe Security Council:\n\nRequests the Secretary-General to develop an update on the implementation of the integrated strategic framework, including a transition plan to hand over tasks to the UNCT, a resource mobilization strategy, and a possible long-term exit strategy for the Mission.\n\nRequests the Secretary-General to develop a long-term roadmap assessing challenges to peace and security in Mali, focusing on measurable benchmarks and conditions, including progress in implementing the Agreement, redeployment of the reformed MDSF, and operationalization of the FC-G5S.\n\nThe roadmap is to be presented to the Security Council by 31 March 2021 and is to ensure a phased, coordinated, and deliberate transition of security responsibilities, potentially paving the way for a Mission exit strategy when conditions are met.\n\nDecides to remain actively seized of the matter.",
  "url": "https://storage.googleapis.com/bluelines-rag-bucket/2020/S_RES_2531_2020_EN.pdf"
}