{
  "resolution_no": "2459",
  "year": "2019",
  "theme": [
    "Peacekeeping",
    "Humanitarian",
    "WPS/CAAC",
    "Conflict Resolution"
  ],
  "chapter": "Chapter VII",
  "charter_articles": [
    "Article 24",
    "Article 25",
    "Article 42"
  ],
  "entities": [
    "UNMISS",
    "IGAD",
    "RJMEC",
    "CTSAMVM",
    "AU"
  ],
  "reporting_cycle": "90 days",
  "operative_authority": "Chapter VII",
  "summary": "Here is a concise summary of the Security Council document:\n\nThe Security Council:\n\nRecalling previous resolutions on South Sudan, reaffirms its commitment to the country's sovereignty, independence, and territorial integrity.\n\nExpresses grave alarm at the ongoing crisis, emphasizing there can be no military solution.\n\nCondemns fighting and violations of the 2017 Agreement on Cessation of Hostilities, welcoming rapid assessments by the Ceasefire and Transitional Security Arrangements Monitoring and Verification Mechanism (CTSAMVM).\n\nAppreciates IGAD's leadership in advancing the peace process and welcomes the 2018 Revitalised Agreement as a step towards sustainable peace.\n\nCalls on South Sudanese parties to demonstrate political will to peacefully resolve the conflict, stressing the importance of power-sharing and security arrangements.\n\nRecognizes the reduction in political violence and the upholding of the permanent ceasefire in most parts of the country.\n\nExpresses concern at the threat to peace and security from illicit small arms and light weapons.\n\nNotes measures adopted in resolution 2428 (2018) and recalls willingness to impose targeted sanctions on individuals responsible for actions that threaten peace, security, or stability.\n\nStresses the importance of effective implementation of the sanctions regime and cooperation from neighboring states and regional organizations.\n\nCommends the work of UNMISS and stresses the importance of effective engagement with local communities and humanitarian actors.\n\nRecognizes the dire humanitarian situation and high levels of food insecurity, noting UNMISS's contribution to creating conditions conducive to humanitarian assistance and the safe return of IDPs and refugees.\nHere is a clear and concise summary of the Security Council document:\n\nThe Security Council strongly condemns the obstruction of UNMISS by the Government of South Sudan (GoSS) and opposition groups, including restrictions on freedom of movement and assault on UNMISS personnel. The Council demands that all parties, particularly the GoSS and the SPLA-IO, end all obstructions to UNMISS.\n\nThe Council expresses grave concern at ongoing reports of sexual and gender-based violence, particularly against women and girls, and condemns all human rights violations and abuses, including extrajudicial killings, ethnically targeted violence, and recruitment and use of children. The Council emphasizes the need to hold accountable those responsible for violations of international humanitarian law and human rights.\n\nThe Council welcomes the GoSS's ratification of the Optional Protocol to the Convention on the Rights of the Child on the Involvement of Children in Armed Conflict and calls for its full and immediate implementation. The Council also expresses concern about the severe restriction of freedoms of opinion, expression, and association, and condemns the use of media to broadcast hate speech.\n\nThe Council reiterates the urgent need to end impunity in South Sudan and to hold accountable those responsible for violations of international humanitarian law and human rights. The Council expresses grave concern regarding the reports on the human rights situation in South Sudan and the dire situation of persons with disabilities.\n\nThe Council expresses serious and urgent concern over the nearly 4.3 million displaced persons and ongoing humanitarian crisis, and calls upon the international community to continue efforts to meet the growing humanitarian needs of the people of South Sudan.\nHere is a concise summary of the Security Council document:\n\nThe Security Council condemns obstructions to civilians' and humanitarian actors' movement in South Sudan, and expresses concern at taxes and fees hindering humanitarian assistance. It strongly condemns attacks on humanitarian personnel and facilities, which have resulted in 112 deaths since December 2013.\n\nThe Council appreciates the efforts of UNMISS peacekeepers and Troop- and Police-Contributing Countries, but notes with concern national caveats that may affect mandate implementation. It welcomes the Secretary-General's zero-tolerance policy on sexual exploitation and abuse, but expresses grave concern over allegations of such abuses by peacekeepers.\n\nThe Council recognizes the challenges faced by UNMISS in implementing its mandate and emphasizes the need to extend its presence to areas of displacement, return, and local integration. It welcomes the commitment to include women in the Revitalised Agreement, but calls on all parties to do more to ensure minimum commitments are achieved.\n\nThe Council expresses grave concern over threats to oil installations, petroleum companies, and their employees, and urges all parties to ensure their security. It strongly condemns attacks on United Nations and IGAD personnel and facilities, including the downing of a United Nations helicopter and attacks on UNMISS camps.\n\nThe Council determines that the situation in South Sudan continues to constitute a threat to international peace and security and, acting under Chapter VII, demands that all parties end fighting, engage in political dialogue, and implement the permanent ceasefire declared in the Revitalised Agreement. \n\nIt demands the GoSS comply with its obligations under the SOFA and cease obstructing UNMISS and humanitarian actors. The Council expresses its intention to consider measures against those who undermine the peace, stability, and security of South Sudan.\nHere is a summarized version of the Security Council document:\n\nThe Security Council:\n\n Notes that the steady re-supply of weapons and ammunition to South Sudan has directly affected the safety of UN personnel and UNMISS's ability to carry out its mandate.\n\n Commends the report by RJMEC Interim Chairperson on the status of implementation of the Revitalised Agreement, welcomes the gradual decrease in fighting, and calls on parties to take necessary steps to ensure pre-transitional institutions and mechanisms can be operational as soon as possible.\n\n Decides to extend the mandate of UNMISS until 15 March 2020.\n\n Decides to maintain the overall force levels of UNMISS with a troop ceiling of 17,000 troops and a police ceiling of 2,101 police personnel.\n\n Decides that the mandate of UNMISS shall be to:\n\n* Protect civilians under threat of physical violence\n* Deter violence against civilians, including foreign nationals\n* Implement a mission-wide early warning strategy\n* Maintain public safety and security of UNMISS protection of civilians sites\n* Deter and prevent sexual and gender-based violence\n* Exercise good offices, confidence-building, and facilitation in support of the mission's protection strategy\n* Foster a secure environment for the safe return or relocation of IDPs and refugees\n* Support the facilitation of the safe return or relocation of IDPs from UNMISS protection of civilians sites\n\n Authorizes UNMISS to use all necessary means to perform these tasks.\nHere is a concise summary of the Security Council document 2459 (2019):\n\n**Mandate of UNMISS**\n\n* Ensure security and freedom of movement of UN and associated personnel, and security of installations and equipment (para 7 (b))\n\n**Monitoring and Investigating Human Rights**\n\n* Monitor, investigate, verify, and report on abuses and violations of human rights and international humanitarian law (para 7 (c) (i))\n* Monitor and report on violations and abuses against children and women, including sexual and gender-based violence (para 7 (c) (ii))\n* Monitor and report on hate speech and incitement to violence (para 7 (c) (iii))\n\n**Supporting the Implementation of the Revitalised Agreement and the Peace Process**\n\n* Support the peace process through good offices, advice, and technical assistance (para 7 (d) (i))\n* Participate in and support the CTSAMVM and RJMEC (para 7 (d) (ii) and (iii))\n\n**Regional Protection Force (RPF)**\n\n* Continue to include an RPF with the responsibility of providing a secure environment in and around Juba and other parts of South Sudan (para 10)\n* Authorize the RPF to use all necessary means to accomplish its mandate (para 10)\n\n**Other Provisions**\n\n* Stress that the peace process only remains viable with full commitment by all parties and inclusion of civil society, women, and youth (para 8)\n* Express willingness to consider a review of the mandate and composition of the RPF (para 9)\n* Welcome efforts of IGAD, AU, and countries in the region to find durable solutions to peace and security challenges in South Sudan (para 11)\n* Affirm the critical importance of UNMISS's ability to use all its bases without restrictions (para 12)\n* Reaffirm the basic principles of peacekeeping, including consent of the parties, impartiality, and non-use of force (para 13)\n* Emphasize that protection of civilians must be given priority in decisions about the use of available capacity and resources (para 14)\nHere is a summarized version of the Security Council document 2459 (2019):\n\n16. The Special Representative of the Secretary-General is directed to lead UNMISS operations, coordinate UN system activities in South Sudan, and assist the RJMEC, AU, IGAD, and other actors in implementing the Revitalised Agreement.\n\n17. UNMISS is requested to strengthen its prevention and response activities on sexual and gender-based violence, including through data collection, threat analysis, and early warning systems.\n\n18. UNMISS is requested to intensify its presence and patrolling in high-risk areas, including areas of displacement, return, resettlement, and reintegration, to foster a secure environment for IDPs and refugees.\n\n19. The effective implementation of UNMISS' mandate relies on several critical factors, including well-defined mandates, political will, leadership, performance, and accountability; the Secretary-General is called upon to apply a comprehensive performance policy framework to UNMISS.\n\n20. The Secretary-General is requested to ensure full compliance of UNMISS with the UN's zero-tolerance policy on sexual exploitation and abuse.\n\n21. UNMISS is requested to provide support to non-UN security forces in strict compliance with the HRDDP.\n\n22. UNMISS is requested to assist the Committee and the Panel of Experts established pursuant to resolution 2206 (2015).\n\n23. The SC condemns attacks on and threats made to UNMISS personnel and facilities, and demands that all parties respect the inviolability of UN premises.\n\n24. The SC condemns the clashes in Malakal and Juba, and urges the UN to incorporate lessons learned to conduct reforms across UNMISS.\n\n25. The SC condemns attacks on and looting of humanitarian aid, and demands that all parties allow rapid, safe, and unhindered access of relief personnel, equipment, and supplies.\nHere is a summarized version of the Security Council document:\n\nThe Security Council:\n\n* Emphasizes that returns or durable solutions for IDPs or refugees must be voluntary, informed, dignified, and safe, and respects freedom of movement and right to seek asylum.\n\n* Demands all parties cease violence, human rights violations, and abuses, and hold those responsible accountable to break the cycle of impunity.\n\n* Condemns violations against children, urges parties to implement actions to protect children, and release those in their ranks, and requests the GoSS to develop a comprehensive action plan.\n\n* Urges parties to prevent sexual violence, implement commitments and action plans, and hold those responsible accountable.\n\n* Requests parties to demilitarize civilian areas, and stresses truth-seeking and reconciliation are essential for peace.\n\n* Takes note of steps towards setting up the Hybrid Court for South Sudan and requests technical assistance.\n\n* Calls on the GoSS to sign the Memorandum of Understanding for the Hybrid Court and move forward with investigations.\n\n* Requests the Secretary-General to report on protection of civilian sites, and provide a comprehensive written report on UNMISS mandate implementation.\n\n* Requests the Secretary-General to report on violations of the SOFA or obstructions to UNMISS on a monthly basis.\n\n* Requests a written report within 90 days on UNMISS mandate implementation, including progress on HRDDP, protection of civilians, and gender considerations.\nThe Security Council:\n \n Requests the Secretary-General to report on:\n  - steps to deter/prevent sexual and gender-based violence\n  - women's participation in peace processes\n  - steps to enhance UN personnel safety/security\n  - steps addressing performance concerns\n  - strengthened reporting on human rights issues in South Sudan\n  - recommendations on adapting UNMISS to the situation on the ground\n\n Requests the Secretary-General to report on technical assistance provided, \n Invites the African Union to share information on the Hybrid Court for South Sudan's establishment progress, \n Expects the Secretary-General to inform his report on the above, \n Intends to assess the Hybrid Court's establishment progress upon receiving the Secretary-General's reports, \n Decides to remain seized of the matter.",
  "url": "https://storage.googleapis.com/bluelines-rag-bucket/2019/S_RES_2459_2019_EN.pdf"
}