{
  "resolution_no": "2462",
  "year": "2019",
  "theme": [
    "Counter-Terrorism",
    "Terrorism Financing",
    "International Cooperation"
  ],
  "chapter": "Chapter VII",
  "charter_articles": [
    "Article 24",
    "Article 25"
  ],
  "entities": [
    "UN Office on Counter Terrorism (UNOCT)",
    "UNODC",
    "Financial Action Task Force (FATF)",
    "Counter-Terrorism Committee",
    "Analytical Support and Sanctions Monitoring Team"
  ],
  "reporting_cycle": "",
  "operative_authority": "Chapter VII",
  "summary": "Here is a summarized version of the Security Council document:\n\nThe Security Council:\n\nRecalling previous resolutions on terrorism, \nReaffirms terrorism is a serious threat to international peace and security;\n\nStresses Member States' primary responsibility to counter terrorist acts and prevent and suppress terrorist financing;\n\nCalls on States to become party to international counter-terrorism conventions and protocols;\n\nReminds States of their obligation to bring to justice those who participate in terrorist acts;\n\nReaffirms measures to counter terrorism must comply with international law, including human rights, refugee, and humanitarian law;\n\nNotes with concern terrorists raise funds through various means, including abuse of commercial enterprise, exploitation of natural resources, and proceeds of crime;\n\nExpresses concern that terrorists use financial institutions, legitimate businesses, and emerging payment methods to move and transfer funds;\n\nRecognizes the link between terrorism and transnational organized crime;\n\n Reiterates concern at terrorists' use of information and communications technologies to facilitate terrorist acts;\n\nRecognizes innovations in financial technologies may offer economic opportunities but also present a risk of terrorist financing;\n\nUnderscores the central role of the UN and the Financial Action Task Force (FATF) in combating terrorist financing;\n\nEncourages Member States to cooperate with FATF;\n\nCommits to supporting efforts to deny terrorist groups access to funding and financial services;\n\nWelcomes the adoption of the Addendum to the Madrid Guiding Principles on Foreign Terrorist Fighters;\n\nCommends efforts to foster international cooperation to prevent and suppress terrorist financing.\nThe Security Council:\n\nNoting the \"No Money for Terror\" conference in Paris (25-26 April 2018) and looking forward to the 2019 conference in Australia,\n\nReaffirming sanctions' importance in maintaining international peace and security, including countering terrorism and terrorism financing,\n\nConcerned that many Member States have not effectively prohibited providing financial or related services to terrorist organizations and individual terrorists,\n\nRecognizing the need to build and strengthen Member States' capacities to counter terrorism and terrorist financing,\n\nActing under Chapter VII of the UN Charter,\n\n1. Reaffirms resolution 1373 (2001) and its decisions on preventing and suppressing terrorist financing,\n2. Emphasizes criminalizing wilful provision or collection of funds for terrorist acts,\n3. Highlights the prohibition on making funds, financial assets, or services available for terrorist organizations or individuals,\n4. Urges States to implement the revised Forty FATF Recommendations on Combating Money Laundering and Terrorism Financing,\n5. Decides that States shall establish serious criminal offenses for wilful provision or collection of funds for terrorist organizations or individuals,\n6. Demands that measures to counter terrorism comply with international law, including humanitarian law, human rights law, and refugee law,\n7. Calls upon States to conduct financial investigations and address challenges in obtaining evidence,\n8. Urges States to investigate and prosecute terrorist financing cases and apply effective sanctions,\n9. Underscores the need for full compliance with sanctions imposed by resolution 2368 (2017),\n10. Stresses the need for effective asset freezing mechanisms,\n11. Calls on States to make publicly available their national or regional asset freezing lists,\n12. Stresses the need for robust implementation of resolution 2368 (2017) measures,\n13. Calls on States to invest resources in sanctions regimes and seizure of funds,\n14. Urges States to assess terrorist financing risks and identify vulnerable economic sectors,\n15. Urges States to establish operationally independent financial intelligence units,\n16. Calls upon States to reinforce access to information and terrorist financing analytical capacity,\n17. Urges States to establish or strengthen a framework for competent national authorities.\nHere is a concise summary of the Security Council document:\n\nThe Security Council:\n\n Encourages Member States to gather and share information on terrorism financing among intelligence units, law enforcement agencies, and judicial authorities.\n\n Encourages building capacity of financial oversight and regulatory systems to prevent terrorists from exploiting, raising, and moving funds.\n\n Calls on Member States to exchange operational information and financial intelligence on terrorists and terrorist networks, including Foreign Terrorist Fighters.\n\n Requests Member States to:\n \n- Ensure competent authorities use shared financial intelligence\n- Enhance integration of financial intelligence in terrorism cases\n- Use financial intelligence to detect terrorist networks\n- Establish mechanisms to obtain relevant information to detect terrorist assets\n\n Calls on all States to enhance transparency and traceability of financial transactions.\n\n Requests States to assess risks associated with:\n \n- Cash and bearer negotiable instruments\n- Virtual assets and new financial instruments\n\n Welcomes FATF's work on virtual assets and encourages Member States to apply risk-based regulations.\n\n Encourages partnerships between national authorities and the private sector.\n\n Recognizes the vital role of non-profit organizations and urges States to assess risks and prevent abuse.\n\n Urges States to consider the potential impact of measures on humanitarian activities.\n\n Encourages efforts to identify cases of trafficking in persons and cultural property that finance terrorism.\n\n Reiterates the call to prevent terrorists from benefiting from ransoms or political concessions.\n\n Urges States to adopt measures to criminalize the illegal trade of small arms and light weapons.\n\n Calls on Member States to strengthen international cooperation to prevent and counter terrorism financing.\nThe Security Council:\n\n Calls on States to enhance international cooperation to prevent and counter terrorist financing;\n\n Requests States to:\n- share information on terrorist financing with relevant authorities\n- Enhance cross-border cooperation among customs and tax authorities\n- Improve the quality of information shared between financial intelligence units\n\n Reaffirms that all States shall afford one another the greatest measure of assistance in connection with criminal investigations or proceedings relating to terrorist financing;\n\n Encourages:\n- Member States to help build the capacity of other States to address terrorist financing\n- States to utilize INTERPOL policing capabilities\n- Research and information collection on links between terrorism and transnational organized crime\n\n Requests:\n- United Nations entities to provide technical assistance and capacity-building\n- UNOCT to enhance coordination and deliver integrated technical assistance\n- CTED to strengthen its assessment process and provide a thematic summary assessment\n\n Calls upon:\n- UNOCT, UNODC, and other stakeholders to cooperate and provide assistance\n\n Requests:\n- Counter-Terrorism Committee and the Committee established pursuant to resolutions 1267, 1989, and 2253 to hold a joint special meeting\n- CTED and the Analytical Support and Sanctions Monitoring Team to prepare a report on actions taken by Member States to disrupt terrorist financing\n\n Decides to remain seized of this matter.",
  "url": "https://storage.googleapis.com/bluelines-rag-bucket/2019/S_RES_2462_2019_EN.pdf"
}