{
  "resolution_no": "2477",
  "year": "2019",
  "theme": [
    "Peacekeeping",
    "Middle East",
    "Syrian Arab Republic",
    "Israel"
  ],
  "chapter": "Chapter VI",
  "charter_articles": [
    "Article 24",
    "Article 25"
  ],
  "entities": [
    "UNDOF",
    "UN",
    "Syrian Arab Republic",
    "Israel"
  ],
  "reporting_cycle": "every 90 days",
  "operative_authority": "Chapter VI",
  "summary": "The Security Council,\n\nNoting with concern the tense situation in the Middle East, \nHaving considered the report of the Secretary-General on UNDOF of 3 June 2019, \nReaffirming resolution 1308 (2000) of 17 July 2000, \n\nRequires both parties to abide by the 1974 Disengagement of Forces Agreement and observe the ceasefire. \nExpress concern at ongoing military activities in the area of separation, which may escalate tensions between Israel and the Syrian Arab Republic. \nAlarm at violence in the Syrian Arab Republic risking a serious conflagration. \n Grave concern at all violations of the Disengagement of Forces Agreement. \n\nUnderscores that there should be no military forces, equipment, or personnel in the area of separation other than UNDOF. \nUrges all parties to cease military actions in the UNDOF area and respect international humanitarian law. \nCalls upon all parties to cease military actions throughout the country. \n\nNotes the threat to UN personnel from unexploded ordnance and emphasizes the need for demining. \nReaffirms readiness to consider listing individuals supporting ISIL or Al-Nusra Front. \nRecognizes the need for UNDOF to adjust its posture to minimize security risks. \n\nEmphasizes the importance of access to reports related to UNDOF’s redeployment configuration. \nUnderscores the need for UNDOF to have necessary means and resources to carry out its mandate. \nExpresses appreciation to UNDOF personnel and welcomes steps to enhance their safety. \n\nHonours the leadership of UNDOF Head of Mission and Force Commander Major General Francis Vib-Sanziri. \nCondemns incidents threatening UN personnel safety. \nAppreciates UNDOF’s progress in re-establishing presence at Camp Faouar. \nTakes note of the Secretary-General’s plan for UNDOF to return to the Bravo side. \nRecalls that UNDOF’s deployment and the 1974 Agreement are steps toward a just and durable peace.\nHere is a concise summary of the Security Council document 2477 (2019):\n\nThe Security Council:\n\n1. Calls on parties to implement resolution 338 (1973) immediately.\n\n2. Stresses the obligation of both parties to respect the 1974 Disengagement of Forces Agreement, calls for maximum restraint, and encourages liaison with UNDOF.\n\n3. Urges parties to prevent military activity in the area of separation and for armed opposition groups to halt activities that endanger UN peacekeepers.\n\n4. Calls on all groups to abandon UNDOF positions and return equipment.\n\n5. Calls on parties to cooperate with UNDOF operations, respect its privileges and immunities, and ensure freedom of movement.\n\n6. Calls on parties to support UNDOF's use of the Quneitra crossing.\n\n7. Welcomes UNDOF's efforts to consolidate its presence and intensify operations.\n\n8. Underscores the importance of deploying technology to ensure UNDOF personnel safety.\n\n9. Encourages parties to engage constructively to facilitate UNDOF's return to the area of separation.\n\n10. Encourages discussions on improving mission performance.\n\n11. Recalls provisions on a culture of performance in UN peacekeeping and reaffirms support for an integrated performance policy framework.\n\n12. Requests the Secretary-General to ensure compliance with the UN's zero-tolerance policy on sexual exploitation and abuse.\n\n13. Renews UNDOF's mandate for six months, until 31 December 2019.\n\n14. Requests the Secretary-General to report every 90 days on developments and implementation of resolution 338 (1973).",
  "url": "https://storage.googleapis.com/bluelines-rag-bucket/2019/S_RES_2477_2019_EN.pdf"
}