{
  "resolution_no": "1556",
  "year": "2004",
  "theme": [
    "Humanitarian",
    "Peacekeeping",
    "Human Rights"
  ],
  "chapter": "Chapter VII",
  "charter_articles": [
    "Article 41"
  ],
  "entities": [
    "African Union",
    "United Nations",
    "Government of Sudan",
    "Janjaweed"
  ],
  "reporting_cycle": "Secretary-General reports every 30 days",
  "operative_authority": "Chapter VII",
  "summary": "The Security Council,\nRecalling previous statements and resolutions on Sudan, welcomes the African Union's leadership role in addressing the situation in Darfur and its readiness to support these efforts. \nThe Council reaffirms its commitment to Sudan's sovereignty, unity, territorial integrity, and independence. \nIt reiterates grave concern at the humanitarian crisis, widespread human rights violations, and attacks on civilians, condemning all acts of violence and violations of human rights and international humanitarian law, particularly by the Janjaweed militia. \nThe Council urges all parties to prevent and end violations, underlining that there will be no impunity for violators. \nIt welcomes the Government of Sudan's commitment to investigate atrocities, prosecute those responsible, and disarm the Janjaweed militias. \nThe Council expresses concern at reports of ceasefire violations, stresses the need for urgent humanitarian assistance, and reminds donors of their commitments. \nIt determines that the situation in Sudan constitutes a threat to international peace and security and stability in the region, and decides to act under Chapter VII of the Charter of the United Nations.\nHere is a clear and concise summary of the Security Council document:\n\nThe Security Council:\n1. Calls on Sudan to immediately fulfill its July 3, 2004 commitments, including facilitating humanitarian aid, investigating human rights abuses, and resuming talks with rebel groups.\n\n2. Endorses the deployment of international monitors to Darfur under African Union leadership and urges international support.\n\n3. Urges member states to support the monitoring operation with personnel, financing, and supplies.\n\n4. Welcomes human rights observers sent to Sudan and calls on Sudan to cooperate.\n\n5. Urges parties to the N'Djamena Ceasefire Agreement to conclude a political agreement, and rebel groups to respect the ceasefire and engage in peace talks.\n\n6. Demands Sudan disarm Janjaweed militias, apprehend leaders who incited violence, and bring them to justice; requests the Secretary-General to report on progress.\n\n7. Imposes measures to prevent the sale or supply of arms and related materiel to non-governmental entities and individuals in North, South, and West Darfur.\n\n8. Prohibits providing technical training or assistance related to the provision, manufacture, maintenance, or use of items listed in paragraph 7.",
  "url": "https://storage.googleapis.com/bluelines-rag-bucket/2004/S_RES_1556_2004_EN.pdf"
}