{
  "resolution_no": "1542",
  "year": "2004",
  "theme": [
    "Peacekeeping",
    "Humanitarian",
    "WPS/CAAC"
  ],
  "chapter": "Chapter VII",
  "charter_articles": [
    "Article 42"
  ],
  "entities": [
    "MINUSTAH",
    "MIF",
    "OAS",
    "CARICOM",
    "UNHCR"
  ],
  "reporting_cycle": "Secretary-General reports prior to the expiration of the mandate",
  "operative_authority": "Chapter VII",
  "summary": "Here is a clear and concise summary of the Security Council document:\n\nThe Security Council adopted Resolution 1542 (2004) on April 30, 2004, recalling previous resolutions and welcoming the report of the Secretary-General. The Council:\n\n* Affirms its commitment to Haiti's sovereignty, independence, territorial integrity, and unity.\n* Deplores human rights violations and urges the Transitional Government to ensure the promotion and protection of human rights.\n* Welcomes efforts to sensitize peacekeeping personnel to HIV/AIDS and other communicable diseases.\n\nThe Council establishes the United Nations Stabilization Mission in Haiti (MINUSTAH) for an initial period of six months, with the intention to renew for further periods.\n\n* MINUSTAH will have a civilian and military component, consisting of up to 1,622 civilian police and 6,700 troops.\n* The military component will report directly to the Special Representative through the force commander.\n\nThe Council requests:\n\n* The Secretary-General to appoint a Special Representative with overall authority on the ground for the coordination and conduct of all UN activities in Haiti.\n* MINUSTAH to cooperate and coordinate with the OAS and CARICOM.\n\nUnder Chapter VII of the Charter, MINUSTAH's mandate includes:\n\n* Securing a stable environment to support the Transitional Government and constitutional process.\n* Assisting the Transitional Government in monitoring, restructuring, and reforming the Haitian National Police.\n* Assisting with disarmament, demobilization, and reintegration.\n\nThe Council also:\n* Supports the establishment of a Core Group to facilitate MINUSTAH's mandate and promote interaction with Haitian authorities.\n* Urges all parties to work towards a broad political consensus on the nature and duration of the political transition.\nThe Security Council, \nReaffirming its commitment to the sovereignty, independence, and territorial integrity of Haiti, \n1. Decides to establish a Multinational Interim Force (MIF) to facilitate the creation of a secure environment for the provision of humanitarian assistance and to assist in the maintenance of security in Haiti; \n\nII. Mandate \n\nThe mandate of MIF shall include \nDDR programmes \nweapons control \npublic security \nrule of law \nprotection of civilians \n\nIII. Tasks \n\n Tasks shall include \nsupport to Haitian National Police \nrestoration of public order \nprotection of UN personnel \npromotion of human rights \n\nIV. Additional Tasks",
  "url": "https://storage.googleapis.com/bluelines-rag-bucket/2004/S_RES_1542_2004_EN.pdf"
}