{
  "resolution_no": "1640",
  "year": "2005",
  "theme": [
    "Peacekeeping",
    "International Security"
  ],
  "chapter": "Chapter VII",
  "charter_articles": [
    "Article 41"
  ],
  "entities": [
    "UNMEE",
    "Eritrea-Ethiopia Boundary Commission"
  ],
  "reporting_cycle": "40 days",
  "operative_authority": "Chapter VII",
  "summary": "The Security Council:\nReaffirms previous resolutions and statements on Eritrea and Ethiopia, particularly resolution 1622 (2005) and the President's statement of 4 October 2005.\nExpresses grave concern at Eritrea's restrictions on UNMEE helicopter flights and freedom of movement, impacting the mission's ability to carry out its mandate.\nAlarmed by implications for peace and security, and UN Peacekeeping principles.\nReaffirms the Temporary Security Zone's (TSZ) integrity and objectives.\nStresses lasting peace requires border demarcation between parties.\nExpresses concern at Ethiopia's failure to accept the Eritrea-Ethiopia Boundary Commission's final decision.\nAppreciates Ambassador Kenzo Oshima's visit and report.\nConcerned by troop concentrations on both sides of the TSZ.\n \n1. Deeply deplores Eritrea's restrictions on UNMEE, demands reversal without delay or preconditions.\n2. Calls on both parties to show restraint, refrain from force, and return to 16 December 2004 deployment levels within 30 days.\n3. Requests the Secretary-General to monitor compliance and report within 40 days.\n4. Threatens further measures under Article 41 if parties fail to comply.\n5. Demands Ethiopia accept the Boundary Commission's decision and enable border demarcation without preconditions.\n6. Appreciates troop-contributing countries, appeals for continued support.\n7. Calls on parties to work diplomatically to break the stalemate.\n8. Decides to remain seized of the matter.",
  "url": "https://storage.googleapis.com/bluelines-rag-bucket/2005/S_RES_1640_2005_EN.pdf"
}